id,text,created_at,link,source,topic,engagement
"tag:blogger.com,1999:blog-2525761963252134386.post-8843535690759289308","TOP 11 AI MARKETING TOOLS YOU SHOULD USE (Updated 2022). &nbsp;&nbsp;&nbsp;The marketing industry is turning to artificial intelligence (AI) as a way to save time and execute smarter, more personalized campaigns. 61% of marketers say AI software is the most important aspect of their data strategy.&nbsp; If you’re late to the AI party, don’t worry. It’s easier than you think to start leveraging artificial intelligence tools in your marketing strategy. Here are 11 AI marketing tools every marketer should start using today.1.&nbsp;Jasper Ai(Formerly known as Jarvis)Jasper is a content writing and content generation tool that uses artificial intelligence to identify the best words and sentences for your writing style and medium in the most efficient, quick, and accessible way.Key Features&nbsp;It's trusted by 50,000+ marketers for creating engaging marketing campaigns, ad copy, blog posts, and articles within minutes which would traditionally take hours or days. Special Features:Blog posts have been optimized for search engines and rank high on Google and other search engines. This is a huge plus for online businesses that want to generate traffic to their website through content marketing.99.9% Original Content and guarantees that all content it generates will be original, so businesses can focus on their online reputation rather than worrying about penalties from Google for duplicate content.Long-Form Article Writing – Jasper.ai is also useful for long-form writing, allowing users to create articles of up to 10,000 words without any difficulty. This is ideal for businesses that want to produce in-depth content that will capture their audience’s attention.Wait!&nbsp;I've got a pretty sweet deal for you. Sign up through the link below, and you'll get&nbsp;(10k Free Credits)Also Read:&nbsp;Top 10 AI Content Generator &amp; Writer Tools in 20222. Personalize&nbsp;Personalize is an AI-powered technology that helps you identify and produce highly targeted sales and marketing campaigns by tracking the products and services your contacts are most interested in at any given time. The platform uses an algorithm to identify each contact’s top three interests, which are updated in real-time based on recent site activity.Key FeaturesIdentifies&nbsp; top three interests based on metrics like time on page, recency, and frequency of each contactWorks with every ESP and CRMEasy to get up and running in daysEnterprise-grade technology at a low cost for SMBs3. Seventh Sense&nbsp; Seventh Sense provides behavioral analytics that helps you win attention in your customers’ overcrowded email inboxes. Choosing the best day and time to send an email is always a gamble. And while some days of the week generally get higher open rates than others, you’ll never be able to nail down a time that’s best for every customer. Seventh Sense eases your stress of having to figure out the perfect send-time and day for your email campaigns. The AI-based platform figures out the best timing and email frequency for each contact based on when they’re opening emails. The tool is primarily geared toward HubSpot and Marketo customers&nbsp;Key Features&nbsp;AI determines the best send-time and email frequency for each contactConnects with HubSpot and Marketo4. Phrasee&nbsp; Phrasee uses artificial intelligence to help you write more effective subject lines. With its AI-based Natural Language Generation system, Phrasee uses data-driven insights to generate millions of natural-sounding copy variants that match your brand voice. The model is end-to-end, meaning when you feed the results back to Phrasee, the prediction model rebuilds so it can continuously learn from your audience.Key Features&nbsp;Instantly generates millions of human-sounding, brand-compliant copy variantsCreates tailored language models for every customerLearns what your audience responds to and rebuilds the prediction model every time5. Hubspot Seo&nbsp; HubSpot Search Engine Optimization (SEO) is an integral tool for the Human Content team. It uses machine learning to determine how search engines understand and categorize your content. HubSpot SEO helps you improve your search engine rankings and outrank your competitors. Search engines reward websites that organize their content around core subjects, or topic clusters. HubSpot SEO helps you discover and rank for the topics that matter to your business and customers.Key Features&nbsp;Helps you discover and rank topics that people are searching forProvides suggestions for your topic clusters and related subjectsIntegrates with all other HubSpot content tools to help you create a well-rounded content strategyAlso Read:&nbsp;Top 10 AI Content Generator &amp; Writer Tools in 2022&nbsp;6. Evolve AI &nbsp; When you’re limited to testing two variables against each other at a time, it can take months to get the results you’re looking for. Evolv AI lets you test all your ideas at once. It uses advanced algorithms to identify the top-performing concepts, combine them with each other, and repeat the proc",2025-12-02 14:17:18.214992+00:00,https://techncruncher.blogspot.com/2022/07/top-10-ai-marketing-tools-you-should-use.html,techcrunch,war & foreign policy,0
"tag:blogger.com,1999:blog-2525761963252134386.post-3876471029672017808","Most Frequently Asked Questions About Affiliate Marketing. There are lots of questions floating around about how affiliate marketing works, what to do and what not to do when it comes to setting up a business. With so much uncertainty surrounding both personal and business aspects of affiliate marketing. In this post, we will answer the most frequently asked question about affiliate marketing1. What is affiliate marketing?&nbsp;Affiliate marketing is a way to make money by promoting the products and services of other people and companies. You don't need to create your product or service, just promote existing ones. That's why it's so easy to get started with affiliate marketing. You can even get started with no budget at all!2. What is an affiliate program?&nbsp;An affiliate program is a package of information you create for your product, which is then made available to potential publishers. The program will typically include details about the product and its retail value, commission levels, and promotional materials. Many affiliate programs are managed via an affiliate network like ShareASale, which acts as a platform to connect publishers and advertisers, but it is also possible to offer your program directly.3. What is an affiliate network and how do affiliate networks make money?&nbsp;&nbsp;Affiliate networks connect publishers to advertisers.&nbsp; Affiliate networks make money by charging fees to the merchants who advertise with them; these merchants are known as advertisers. The percentage of each sale that the advertiser pays is negotiated between the merchant and the affiliate network.4. What's the difference between affiliate marketing and dropshipping?&nbsp;Dropshipping is a method of selling that allows you to run an online store without having to stock products. You advertise the products as if you owned them, but when someone makes an order, you create a duplicate order with the distributor at a reduced price. The distributor takes care of the post and packaging on your behalf. As affiliate marketing is based on referrals and this type of drop shipping requires no investment in inventory when a customer buys through the affiliate link, no money exchanges hands.&nbsp;5. Can affiliate marketing and performance marketing be considered the same thing? &nbsp;Performance marketing is a method of marketing that pays for performance, like when a sale is made or an ad is clicked This can include methods like PPC (pay-per-click) or display advertising. Affiliate marketing is one form of performance marketing where commissions are paid out to affiliates on a performance basis when they click on their affiliate link and make a purchase or action.&nbsp;6. Is it possible to promote affiliate offers on mobile devices?&nbsp;Smartphones are essentially miniature computers, so publishers can display the same websites and offers that are available on a PC. But mobiles also offer specific tools not available on computers, and these can be used to good effect for publishers. Publishers can optimize their ads for mobile users by making them easy to access by this audience. Publishers can also make good use of text and instant messaging to promote their offers. As the mobile market is predicted to make up 80% of traffic in the future, publishers who do not promote on mobile devices are missing out on a big opportunity.7. Where do I find qualified publishers?&nbsp;The best way to find affiliate publishers is on reputable networks like ShareASale Cj(Commission Junction), Awin, and Impact radius. These networks have a strict application process and compliance checks, which means that all affiliates are trustworthy.8. What is an affiliate disclosure statement?&nbsp;An affiliate disclosure statement discloses to the reader that there may be affiliate links on a website, for which a commission may be paid to the publisher if visitors follow these links and make purchases.&nbsp;9. Does social media activity play a significant role in affiliate marketing?&nbsp;Publishers promote their programs through a variety of means, including blogs, websites, email marketing, and pay-per-click ads. Social media has a huge interactive audience, making this platform a good source of potential traffic.10. What is a super affiliate?&nbsp;A super affiliate is an affiliate partner who consistently drives a large majority of sales from any program they promote, compared to other affiliate partners involved in that program.&nbsp; Affiliates make a lot of money from affiliate marketing Pat Flynn earned more than $50000 in 2013 from affiliate marketing.11. How do we track publisher sales activity?&nbsp;Publishers can be identified by their publisher ID, which is used in tracking cookies to determine which publishers generate sales. The activity is then viewed within a network's dashboard.&nbsp;12. Could we set up an affiliate program in multiple countries?&nbsp;Because the Internet is so widespread, affiliate programs can be promoted in any country. Affiliate strategies that are set internationally need",2025-12-02 14:17:18.214992+00:00,https://techncruncher.blogspot.com/2022/06/most-frequently-asked-questions-about.html,techcrunch,technology & ai,0
"tag:blogger.com,1999:blog-2525761963252134386.post-4109465143659836541","ProWritingAid VS Grammarly: Which Grammar Checker is Better in (2022) ?. ProWritingAid VS Grammarly:&nbsp;&nbsp;When it comes to English grammar, there are two Big Players that everyone knows of: the Grammarly and ProWritingAid. but you are wondering which one to choose so here we write a detail article which will help you to choose the best one for you so Let's startWhat is Grammarly?Grammarly is a tool that checks for grammatical errors, spelling, and punctuation.it gives you comprehensive feedback on your writing. You can use this tool to proofread and edit articles, blog posts, emails, etc.Grammarly also detects all types of mistakes, including sentence structure issues and misused words. It also gives you suggestions on style changes, punctuation, spelling, and grammar all are in real-time. The free version covers the basics like identifying grammar and spelling mistakeswhereas the Premium version offers a lot more functionality, it detects plagiarism in your content, suggests word choice, or adds fluency to it.Features of GrammarlySpelling and Word Suggestion: Grammarly detects basic to advance grammatical errors and also help you why this is an error and suggest to you how you can improve itCreate a Personal Dictionary: The Grammarly app allows you to add words to your personal dictionary so that the same mistake isn't highlighted every time you run Grammarly.Different English Style: Check to spell for American, British, Canadian, and Australian English.Plagiarism: This feature helps you detect if a text has been plagiarized by comparing it with over eight billion web pages. Wordiness: This tool will help you check your writing for long and hard-to-read sentences. It also shows you how to shorten sentences so that they are more concise.Passive Voice: The program also notifies users when passive voice is used too frequently in a document.Punctuations: This feature flags all incorrect and missing punctuation.Repetition: The tool provides recommendations for replacing the repeated word.Proposition: Grammarly identifies misplaced and confused prepositions. Plugins: It offers Microsoft Word, Microsoft Outlook, and Google Chrome plugins.What is ProWritingAid?ProWritingAid is a style and grammar checker for content creators and writers. It helps to optimize word choice, punctuation errors, and common grammar mistakes, providing detailed reports to help you improve your writing.&nbsp;ProWritingAid can be used as an add-on to WordPress, Gmail, and Google Docs. The software also offers helpful articles, videos, quizzes, and explanations to help improve your writing.Features of ProWriting AidHere are some key features of ProWriting Aid:Grammar checker and spell checker: This tool helps you to find all grammatical and spelling errors.Find repeated words:&nbsp; The tool also allows you to search for repeated words and phrases in your content.Context-sensitive style suggestions:&nbsp; You can find the exact style of writing you intend and suggest if it flows well in your writing.Check the readability of your content: Pro Writing Aid helps you identify the strengths and weaknesses of your article by pointing out difficult sentences and paragraphs.Sentence Length: It also indicates the length of your sentences.Check Grammatical error: It also checks your work for any grammatical errors or typos, as well.Overused words: As a writer, you might find yourself using the same word repeatedly. ProWritingAid's overused words checker helps you avoid this lazy writing mistake.Consistency: Check your work for inconsistent usage of open and closed quotation marks.Echoes: Check your writing for uniformly repetitive words and phrases.Difference between Grammarly and Pro-Writing AidGrammarly and ProWritingAid are well-known grammar-checking software. However, if you're like most people who can't decide which to use, here are some different points that may be helpful in your decision.Grammarly vs ProWritingAidGrammarly is a writing enhancement tool that offers suggestions for grammar, vocabulary, and syntax whereas ProWritingAid offers world-class grammar and style checking, as well as advanced reports to help you strengthen your writing.Grammarly provides Android and IOS apps whereas ProWritingAid doesn't have a mobile or IOS app.Grammarly offers important suggestions about mistakes you've made whereas ProWritingAid&nbsp; shows more suggestions than Grammarly but all recommendations are not accurateGrammarly has a more friendly UI/UX whereas the ProWritingAid interface is not friendly as Grammarly.Grammarly is an accurate grammar checker for non-fiction writing whereas ProWritingAid is an accurate grammar checker for fiction writers.Grammarly finds grammar and punctuation mistakes, whereas ProWritingAid identifies run-on sentences and fragments.Grammarly provides 24/7 support via submitting a ticket and sending emails. ProWritingAid’s support team is available via email, though the response time is approximately 48 hours.Grammarly offers many features in its free plan, whereas ProWritingAid offers some",2025-12-02 14:17:18.214992+00:00,https://techncruncher.blogspot.com/2022/03/prowritingaid-vs-grammarly-which.html,techcrunch,war & foreign policy,0
"tag:blogger.com,1999:blog-2525761963252134386.post-2614342552940509599","What is Blockchain: Everything You Need to Know (2022). If you want to pay online, you need to register an account and provide credit card information. If you don't have a credit card, you can pay with bank transfer. With the rise of cryptocurrencies, these methods may become old.Imagine a world in which you can do transactions and many other things without having to give your personal information. A world in which you don’t need to rely on banks or governments anymore. Sounds amazing, right? That’s exactly what blockchain technology allows us to do.It’s like your computer’s hard drive. blockchain is a technology that lets you store data in digital blocks, which are connected together like links in a chain.&nbsp;Blockchain technology was originally invented in 1991 by two mathematicians, Stuart Haber and W. Scot Stornetta. They first proposed the system to ensure that timestamps could not be tampered with.A few years later, in 1998, software developer Nick Szabo proposed using a similar kind of technology to secure a digital payments system he called “Bit Gold.” However, this innovation was not adopted until Satoshi Nakamoto claimed to have invented the first Blockchain and Bitcoin.So, What is Blockchain?A blockchain is a distributed database shared between the nodes of a computer network. It saves information in digital format. Many people first heard of blockchain technology when they started to look up information about bitcoin.Blockchain is used in cryptocurrency systems to ensure secure, decentralized records of transactions.Blockchain allowed people to guarantee the fidelity and security of a record of data without the need for a third party to ensure accuracy.To understand how a blockchain works, Consider these basic steps:Blockchain collects information in “blocks”.A block has a storage capacity, and once it's used up, it can be closed and linked to a previously served block.Blocks form chains, which are called “Blockchains.”More information will be added to the block with the most content until its capacity is full. The process repeats itself.Each block in the chain has an exact timestamp and can't be changed.Let’s get to know more about the blockchain.How does blockchain work?Blockchain records digital information and distributes it across the network without changing it. The information is distributed among many users and stored in an immutable, permanent ledger that can't be changed or destroyed. That's why blockchain is also called ""Distributed Ledger Technology"" or DLT.Here’s how it works:Someone or a computer will transactsThe transaction is transmitted throughout the network.A network of computers can confirm the transaction.When it is confirmed a transaction is added to a blockThe blocks are linked together to create a history. And that’s the beauty of it! The process may seem complicated, but it’s done in minutes with modern technology. And because technology is advancing rapidly, I expect things to move even more quickly than ever.A new transaction is added to the system. It is then relayed to a network of computers located around the world. The computers then solve equations to ensure the authenticity of the transaction.Once a transaction is confirmed, it is placed in a block after the confirmation. All of the blocks are chained together to create a permanent history of every transaction.How are Blockchains used?Even though blockchain is integral to cryptocurrency, it has other applications. For example, blockchain can be used for storing reliable data about transactions. Many people confuse blockchain with cryptocurrencies like bitcoin and ethereum.Blockchain already being adopted by some big-name companies, such as Walmart, AIG, Siemens, Pfizer, and Unilever. For example, IBM's Food Trust uses blockchain to track food's journey before reaching its final destination.Although some of you may consider this practice excessive, food suppliers and manufacturers adhere to the policy of tracing their products because bacteria such as E. coli and Salmonella have been found in packaged foods. In addition, there have been isolated cases where dangerous allergens such as peanuts have accidentally been introduced into certain products.Tracing and identifying the sources of an outbreak is a challenging task that can take months or years. Thanks to the Blockchain, however, companies now know exactly where their food has been—so they can trace its location and prevent future outbreaks.Blockchain technology allows systems to react much faster in the event of a hazard. It also has many other uses in the modern world.What is Blockchain Decentralization?Blockchain technology is safe, even if it’s public. People can access the technology using an internet connection.Have you ever been in a situation where you had all your data stored at one place and that one secure place got compromised? Wouldn't it be great if there was a way to prevent your data from leaking out even when the security of your storage systems is compromised?Blockchain technology provides a wa",2025-12-02 14:17:18.214992+00:00,https://techncruncher.blogspot.com/2022/04/what-is-blockchain-everything-you-need.html,techcrunch,war & foreign policy,0
US-EN-47170683,"Kiffin ready to make LSU nation's 'best program'. A day after flying out of Oxford, Mississippi, Lane Kiffin was introduced as LSU coach Monday, promising to restore the Tigers to being ""the best program in all of college football,"" while detailing his excruciating decision to leave Ole Miss.",2025-12-02 14:17:17.811129+00:00,https://www.espn.com/college-football/story/_/id/47170683/set-make-tigers-nation-best-kiffin-introduced-lsu,espn,technology & ai,0
US-EN-47169944,"George Pickens, C.J. Stroud and a career day for a Jets WR highlight Next Gen Week 13. Pickens was a monster on slant routes while Stroud made the Colts pay for blitzing. Here are the highlights.",2025-12-02 14:17:17.811129+00:00,https://www.espn.com/nfl/story/_/id/47169944/george-pickens-cj-stroud-jameson-williams-next-gen-stars,espn,other,0
US-EN-47171872,Giants bench Carter again at start of MNF loss. Giants first-round pick Abdul Carter didn't start or play early in Monday night's matchup with the Patriots because of a coach's decision.,2025-12-02 14:17:17.811129+00:00,https://www.espn.com/nfl/story/_/id/47171872/giants-rookie-abdul-carter-benched-again-start-game,espn,technology & ai,0
US-EN-47166190,"Ranking the top 25 MLB offseason trade candidates -- and finding their best fits. From All-Star outfielders to elite aces, here are the big names your team could be targeting this winter.",2025-12-02 14:17:17.811129+00:00,https://www.espn.com/mlb/story/_/id/47166190/mlb-offseason-2025-2026-trade-candidate-player-rankings-skubal-marte-buxton-peralta,espn,sports,0
US-EN-46994593,MLB offseason grades: Reliever Devin Williams joins Mets after rough season with Yankees. We've got you covered with grades and analysis on every winter signing and big offseason trade.,2025-12-02 14:17:17.811129+00:00,https://www.espn.com/mlb/story/_/id/46994593/2025-26-mlb-offseason-grades-free-agency-trade-analysis,espn,other,0
US-EN-47169164,"From bed rest to champion: Inside Chet Holmgren's comeback. Holmgren was sidelined for three months last season because of a fractured pelvis and is ""chasing for more"" this season.",2025-12-02 14:17:17.811129+00:00,https://www.espn.com/nba/story/_/id/47169164/chet-holmgren-ready-show-nba-why-best-yet-come,espn,other,0
US-EN-47168526,All-Star predictions: Which stars will we see in USA vs. the World?. Who's on the bubble and who could miss out on another All-Star appearance.,2025-12-02 14:17:17.811129+00:00,https://www.espn.com/nba/story/_/id/47168526/nba-all-star-2025-2026-eastern-western-conference-roster-predictions,espn,technology & ai,0
US-EN-47100067,"Two vulnerable NFL sack records: Tracking pace for Myles Garrett (19!), Broncos' D (51!). The Browns vet and Denver are on pace to rewrite the single-season sacks record book. Here's how they got here.",2025-12-02 14:17:17.811129+00:00,https://www.espn.com/nfl/story/_/id/47100067/tracking-sacks-record-cleveland-browns-myles-garrett-denver-broncos-pace-nfl-single-season-player-team,espn,other,0
US-EN-47172027,Will Brandon Aiyuk return for the 49ers this season? Answering five top questions. San Francisco voided the WR's contract guarantees for next year. What does that mean for this season and beyond?,2025-12-02 14:17:17.811129+00:00,https://www.espn.com/nfl/story/_/id/47172027/will-brandon-aiyuk-return-san-francisco-49ers-season-faq,espn,technology & ai,0
US-EN-47108752,"Will there be baseball in 2027? Is a salary cap coming? What you need to know about MLB's looming labor battle﻿. With the CBA set to expire one year from today, we answer baseball's burning questions.",2025-12-02 14:17:17.811129+00:00,https://www.espn.com/mlb/story/_/id/47108752/mlb-labor-battle-cba-salary-cap-owners-players-union-mlbpa-faq-manfred,espn,labor & work,0
US-EN-47109557,How a bald coach solved volleyball's ponytail predicament. The NCAA volleyball tournament will feature dozens of stars wearing a hair-tie solution invented by none other than three-time champion Jerritt Elliott.,2025-12-02 14:17:17.811129+00:00,https://www.espn.com/college-sports/story/_/id/47109557/2025-ncaa-volleyball-tournament-players-hair-band-tiy-brand-jerritt-elliott,espn,technology & ai,0
US-EN-47149801,"The NHL's best this week: Kyle Palmieri, 'hockey guy'. The Islanders forward tore his ACL -- then made a brilliant pass to set up a goal. Plus, what to watch this week.",2025-12-02 14:17:17.811129+00:00,https://www.espn.com/nhl/story/_/id/47149801/nhl-2025-26-best-games-week-kyle-palmieri-acl-injury-hockey-guy,espn,war & foreign policy,0
