id,text,created_at,link,source,topic,engagement
t3_1laej21,Scientists develop plastic that dissolves in seawater. &#32; submitted by &#32; /u/Regular_Eggplant_248 [link] &#32; [comments],2025-12-01 03:46:37.014030+00:00,https://www.reddit.com/r/UpliftingNews/comments/1laej21/scientists_develop_plastic_that_dissolves_in/,reddit_uplifting_news,other,0
t3_1lejgtc,"‘HIV-ending’ drug could be made for just $25 per patient a year, say researchers. &#32; submitted by &#32; /u/ahothabeth [link] &#32; [comments]",2025-12-01 03:46:37.014030+00:00,https://www.reddit.com/r/UpliftingNews/comments/1lejgtc/hivending_drug_could_be_made_for_just_25_per/,reddit_uplifting_news,other,0
"tag:blogger.com,1999:blog-2525761963252134386.post-2465929187257267845","Top 10 Best PLR(Private Label Rights) Websites | Which One You Should Join in 2022?. Content creation is one of the biggest struggles for many marketers and business owners. It often requires both time and financial resources, especially if you plan to hire a writer.Today, we have a fantastic opportunity to use other people's products by purchasing Private Label Rights.To find a good PLR website, first, determine the type of products you want to acquire. One way to do this is to choose among membership sites or PLR product stores. Following are 10 great sites that offer products in both categories.What are PLR websites?Private Label Rights (PLR) products are digital products that can be in the form of an ebook, software, online course videos, value-packed articles, etc. You can use these products with some adjustments to sell as your own under your own brand and keep all the money and profit yourself without wasting your time on product creation.The truth is that locating the best website for PLR materials can be a time-consuming and expensive exercise. That’s why we have researched, analyzed, and ranked the best 10 websites:1. PLR.me&nbsp;PLR.me is of the best places to get PLR content in 2021-2022. It offers a content marketing system that comes with courses, brandable tools, and more. It is the most trusted PLR website, among other PLR sites. The PLR.me platform features smart digital caching PLR tools for health and wellness professionals. The PLR.me platform, which was built on advanced caching technology, has been well-received by big brands such as Toronto Sun and Entrepreneur. The best thing about this website is its content marketing automation tools.PricingPay-as-you-go Plan – $22100 Monthly Plan – $99/month400 Annual Plan – $379/year800 Annual Plan – $579/year2500 Annual Plan – $990/yearProsAccess over 15,940+ ready-to-use PLR coaching resources.Content marketing and sliding tools are provided by the site.You can create courses, products, webinars, emails, and nearly anything else you can dream of.You can cancel your subscription anytime.ConsCompared to other top PLR sites, this one is a bit more expensive.2. InDigitalWorksInDigitalWorks is a leading private label rights membership website established in 2008. As of now, it has more than 100,000 members from around the globe have joined the platform. The site offers thousands of ready-to-be-sold digital products for online businesses in every single niche possible. InDigitalWorks features hundreds of electronic books, software applications, templates, graphics, videos that you can sell right away.Pricing:3 Months Plan – $391 Year Plan – $69Lifetime Plan – $79ProsIndigitalWorks promotes new authors by providing them with 200 free products for download.Largest and most reputable private label rights membership site.&nbsp;20000+ digital products137 training videos provided by experts to help beginners set up and grow their online presence for free.10 GB of web hosting will be available on a reliable server.ConsFewer people are experiencing the frustration of not getting the help they need.3. BuyQualityPLRBuyQualityPLR’s website is a Top PLR of 2021-2022! It's a source for major Internet Marketing Products and Resources. Whether you’re an Affiliate Marketer, Product Creator, Course Seller,&nbsp; BuyQualityPLR can assist you in the right direction. You will find several eBooks and digital products related to the Health and Fitness niche, along with a series of Security-based products. If you search for digital products, Resell Rights Products, Private Label Rights Products, or Internet Marketing Products, BuyQualityPLR is among the best websites for your needs.PricingFree PLR articles packs, ebooks, and other digital products are availablePrice ranges from 3.99$ to 99.9$ProsEverything on this site is written by professionalsThe quick download features availableDoesn't provide membership.Offers thousand of PLR content in many nichesValuable courses availableConsYou can't buy all content because it doesn't provide membership4. IDPLRThe IDPLR website has helped thousands of internet marketers since 2008. This website follows a membership approach and allows you to gain access to thousands of PLR products in different niches. The best thing about this site is the quality of the products, which is extremely impressive.This is the best PLR website of 2021-2022, offering over 200k+ high-quality articles. It also gives you graphics, templates, ebooks, and audio.Pricing3 Months ACCESS: $391 YEAR ACCESS: $69LIFETIME ACCESS: $79ProsYou will have access to over 12,590 PLR products.You will get access to training tutorials and Courses in a Gold membership. 10 GB of web hosting will be available on a reliable server.You will receive 3D eCover SoftwareIt offers an unlimited download limitMost important, you will get a 30 day money-back guaranteeCons:A few products are available for free membership.5. PLRMinesPLRmines is a leading digital product library for private label rights products. The site provides useful information on products that you can",2025-12-01 03:46:35.632058+00:00,https://techncruncher.blogspot.com/2022/02/top-10-best-plrprivate-label-rights.html,techcrunch,war & foreign policy,0
"tag:blogger.com,1999:blog-2525761963252134386.post-3540326599808924672","Top 9 Free AI Tools That Make Your Life Easier. Copy.aiPhoto:- Copy.aiFirst one on the list is copy.ai. It is an AI based copy writer tool. Basically&nbsp; what a copywriter tool does is, it gives you content that you can post on your blog or video&nbsp; when you give it a few descriptions about the topic you want content on.So copy ai can help you write instagram captions gives you blog idea, product descriptions,&nbsp; facebook content, startup ideas, viral ideas, a lot of things it can do, you just make an account&nbsp; in this website, then select a tool and fill in&nbsp;the necessary description and the AI will generate&nbsp; content on what you ask for.For tutorials go to their official Youtube&nbsp; channel .An awesome tool that is going to be really handy in the future.Hotpot.aiHotpot.ai offers a collection of&nbsp; AI tools for designers, as well as for anyone,&nbsp;it has an “AI picture restorer” which removes&nbsp; scratches ,and basically restores your old photo&nbsp;into amazing pictures and makes it look brand new.&nbsp;&nbsp;Ai picture colorizer , turns your black and&nbsp;white photo into color. And there is a background&nbsp; remover tool, picture enlarger and a lot more for designers, check it out,and explore all the tools.Deep-nostalgiaDeep-nostalgia became&nbsp; very popular on the internet when people started&nbsp;making reaction videos of their parents reacting&nbsp; to animated pictures of their grandparents. So&nbsp;deep - nostalgia is a very cool app, that will&nbsp; animate any photo of a person.&nbsp;So what makes it&nbsp;really cool is that fact that you can upload an&nbsp; old photo of your family and see them animate&nbsp;and living. Which is pretty cool and creepy at&nbsp; the same time if they are dead already.. Really&nbsp;amazing service from myheritage, I created a&nbsp; lot of cool animations with my old photos as&nbsp;well as with the photos of my grandparents.Pfpmaker.comHaving a nice&nbsp; looking profile picture is really important if you want that professional feel in your socials.&nbsp; Whether in linkedin or twitter having a&nbsp;distinct and catchy profile picture can make&nbsp; all the difference. So that's where pfpmaker&nbsp;comes in. it a free online tool to create amazing professional profile pictures that fits&nbsp;you. It generates a lot of profile pictures&nbsp; and you can also make small changes to already&nbsp;created profile pictures if you want to,as well.Brandmark.io Speaking of brands, getting a&nbsp; good logo for your brand is the most frustrating&nbsp;thing ever, so brandmark.io makes it super easy.&nbsp; It will create a logo for your brand within&nbsp;2 clicks. So you goto this website. Type in your brand name and slogan if you have any, and&nbsp;give BRAND KEYWORDS that relate to your brand,&nbsp; then pick a color style and done, the ai will&nbsp;generate amazing logos for you.&nbsp;You can also make&nbsp; minor edits to the suggested logos to better fit your needs as well. But to get that png you need&nbsp; to pay a hefty price, but if you are looking for some logo ideas, this is a great place to start.Deep-image.aiEven in the previous websites, some&nbsp; had picture enlarger tools. This deep-image.ai is&nbsp;a dedicated image enlarger, which supports upto 4x&nbsp; enlargement for free. The UI is pretty good and the tool is pretty fast with amazing results.Bigjpg Bigjpg does the same as&nbsp; deep-image.ai , but this service offers a little bit more options like if your photo is an artwork&nbsp; it scales image differently than normal photos and it supports upto 4x enlargement for free&nbsp; and you can also set noise reduction options. Very good tool,Lumen5Lumen5 is an&nbsp; online marketing video maker that makes it really easy to create branding or informational videos&nbsp; within a couple of clicks. They have really great templates and various aspect ratios for various&nbsp; social media platforms.&nbsp;You can also edit each element of the video if you don't like the preset,&nbsp; and the best part is, they have a ton of , I mean a ton of free stock photos and videos.You can also&nbsp; upload your own videos or any type of media. Definitely a good tool if you don't know how&nbsp; to work with complex tools like after effects, but want to create a sick video for your brand.NamelixIf you are struggling to find&nbsp; good names for your brand or youtube channel, give&nbsp;namelix a try. It's an ai based name generator&nbsp; that will suggest good names for your brand&nbsp;depending on the keyword that you give..&nbsp; Also logo for your brand. Pretty cool and an amazing piece of tool. So that's been it , those are my favourite free AI based tools that you can use right now,Which one You like the most Let me know in the Comments below.&nbsp;&nbsp;",2025-12-01 03:46:35.632058+00:00,https://techncruncher.blogspot.com/2022/01/top-9-free-ai-tools-that-make-your-life.html,techcrunch,technology & ai,0
"tag:blogger.com,1999:blog-2525761963252134386.post-7535332462149609558","7 Free Websites Every Content Creator Needs to Know. Do you have the desire to become a content creator, but not have the money to start? Here are 7 free websites every content creator needs to know.1.Exploding Topics (Trending Topics)(Photo Credit:- Exploding Topics)If you're a content creator, you might be wondering what better way to find new topic ideas than to see what people are searching for? This tool gives you this data without anyone else's explanation. It provides related hashtags and tips on how to use them effectively in your posts. It's a great tool for anyone who wants to keep up to date with what's most relevant in their niche. You can also see the most popular hashtags by country, making it easier to understand cross-border and demographic trends. This site makes your search for content easier than ever! There are countless ways to use explosive topics to your advantage as a content creator.&nbsp;Some examples can be:Use the most popular hashtags and keywords to get inspiration for ideas.&nbsp;Find out what people are talking about in real-time.&nbsp;Find new audiences you may not have known were interested in your topic.There’s no excuse not to try this website — it’s free and easy to use!Visit Exploding Topics From Here2. Headline Studio (Headline Grader)(Photo Credit:-Headline Studio)Headline Studio allows you to create catchy headlines for your content.&nbsp;After writing a title there is data on how often people view articles with similar titles and why they are involved with them.This is a valuable tool when creating new blog posts because it generates catchy headlines for your blog post to catch a reader’s attention.Visit Headline Studio From Here3. Answer the public(Photo Credit:- Answer The Public)Answer The public is an excellent tool for content creators. It gives you insight into what people are asking on social media sites and communities and lets you guess about topics that matter to your audience. Answer the public allows you to enter a keyword or topic related to your niche and it will show results with popular questions and keywords related to your topic. It's an amazing way to get insights into what people are searching online and allows you to identify topics driven by new blog posts or social media content on platforms like Facebook, Instagram, Youtube, and Twitter as well as the types of questions they ask and&nbsp; also want answers.Visit&nbsp;Answer The Public From Here 4. Surfer Seo (SEO Ranking)(Photo Credit:-Surfer Seo)With this tool, content creators can quickly and easily check the ranking of their websites and those of other competitors. This tool allows you to see how your website compares to others in different categories, including:&nbsp;Rank PotentialOrganic Search RankingSurfer Seo is free and the interface is very friendly. It's a great tool for anyone who wants to do quick competitor research or check their site's rankings at any time.Visit SurferSeo From Here5. Canva (Templates/Graphics)(Photo Credit:- Canva)Canva is a free graphic design platform that makes it easy to create invitations, business cards, mobile videos, Instagram posts, Instagram stories, flyers, and more with professionally designed templates. You can even upload your photos and drag and drop them into Canva templates. It's like having a basic version of Photoshop. You can also remove background from images with one click.Canva offers thousands of free, professionally designed templates that can be customized with just a few clicks. Simply upload your photos to Canva, drag them into the template of your choice, and save the file to your computer.It is free to use for basic use but if you want access to different fonts or more features, then you need to buy a premium plan.Visit Canva From Here6. Facebook Audience Insights (Audience Research)(Photo Credit:- Facebook Audience InsightsFacebook Audience Insights is a powerful tool for content creators when researching their target market. This can help you understand the demographics, interests, and behaviors of your target audience. This information helps determine the direction of your content so that it resonates with them. The most important tools to consider in Facebook Audience Insights are Demographics and Behavior. These two sections provide you with valuable information about your target market, such as their age and from where they belong, how much time they spend on social media per day, what devices they use to access it, etc. There is another section of Facebook Audits that is very helpful. This will let you know the interests, hobbies, and activities that people in your target market are most interested in. You can use this information to create content for them about things they will be about as opposed to topics they may not be so keen on.Visit&nbsp;Facebook Audience Insights From Here7. Pexels (Images)(Photo Credit: PixelPexels is a warehouse for any content creator with millions of free royalty images who wants to find high-quality images that can be used freely without having",2025-12-01 03:46:35.632058+00:00,https://techncruncher.blogspot.com/2022/01/7-free-websites-every-content-creator.html,techcrunch,war & foreign policy,0
"tag:blogger.com,1999:blog-2525761963252134386.post-4705741174433838580","Most Frequently Asked Questions About Email Marketing. 1. Why is email marketing important?Email is the marketing tool that helps you&nbsp; create a seamless, connected, frictionless buyer journey. More importantly, email marketing allows you to build relationships with prospects, customers, and past customers. It's your chance to speak&nbsp; to them right in their inbox, at a time that suits them. Along with the right message, email can become one of your most powerful marketing channels.2. What is benefits of email marketing?Email marketing is best way for creating long term relationship with your clients, and increasing sales in our company.Benefits of email marketing for bussiness:Better brand recognitionStatistics of what works bestMore salesTargeted audienceMore traffic to your products/services/newsletterBuild credibilityMost&nbsp; bussinesses are using email marketing and making tons of money with email marketing.3. What is the simplest day and time to send my marketing emails?Again, the answer to this question varies from company to company. And again, testing is the way to find out what works best. Typically, weekends and mornings seem to be&nbsp; times when multiple emails are opened, but since your audience may have different habits, it's best to experiment and then use your&nbsp; data to decide.&nbsp;4. Which metrics should I be looking at?The two most important metrics for email marketing are&nbsp; open rate and click-through rate. If your emails aren't opened, subscribers will never see your full marketing message, and if they open them but don't click through to your site, your emails won't convert.5. How do I write a decent subject line?The best subject lines are short and to the point, accurately describing&nbsp; the content of the email, but also catchy and intriguing, so the reader wants to know more. Once Again, this is the perfect place for&nbsp; A/B testing, to see what types of subject lines work best with your audience. Your call to action should be clear and&nbsp; simple. It should be somewhere at the top of your email for those who haven't finished reading the entire email,&nbsp; then repeated&nbsp; at the end for those reading all the way through. It should state exactly what you want subscribers to do, for example ""Click here to download the premium theme for free. 6. Is email marketing still effective?Email marketing is one of the most effective ways for a business to reach its customers directly. Think about it. You don't post something on your site&nbsp; hoping people will visit it. You don't even post something on a social media page and hope fans&nbsp; see it. You're sending something straight to each person's inbox, where they'll definitely&nbsp; see it! Even if they don't open it, they'll still see your subject line and business name every time you send an email, so you're still communicating directly with your audience. 7. However do I grow my email subscribers list? Should i buy an email list or build it myself?Buying an email list is&nbsp; waste of time &amp; money. These email accounts are unverified and not interested in your brand. The mailing list is useless if your subscribers do not open your emails. There are different ways to grow your mailing list.&nbsp;Give them a free ebook and host it on a landing page where they have to enter the email to download the file and also create a forum page on your website, asks your visitors what questions they might have about your business, and collects email addresses to follow up with them. 8. How do I prevent audience from unsubscribing?If the&nbsp; subject line of the email is irrelevant to&nbsp; customers, they will ignore it multiple times. But, if it keeps repeating, they are intercepted and unsubscribed from your emails. So, send relevant emails for the benefit of the customer. Don't send emails that often only focus&nbsp; on sales, offers and discounts.&nbsp;Submit information about your business and offers so you can connect with customers. You can also update them on recent trends in your industry. The basic role of an email is first and foremost to&nbsp; connect with customers, get the most out of this tool.9. What is the difference between a cold email and a spam email?Cold emails are mostly sales emails that are sent with content align to the needs of the recipient. It is usually personalized and includes a business perspective. However, it is still an unsolicited email. And all unsolicited emails are marked as SPAM.&nbsp;Regularly receiving this type of unsolicited email in your users' inboxes, chances are&nbsp; your emails will soon be diverted to&nbsp; spam or junk folders. The most important thing to prevent this from happening is to respect your recipients' choice to opt-out of receiving emails from you. You can add the links to easily unsubscribe. You must be familiar with the CAN-SPAM Act and its regulations.10. Where can I find email template?Almost all email campaign tools provide you with ready-made templates. Whether you use MailChimp or Pardot, you'll ge",2025-12-01 03:46:35.632058+00:00,https://techncruncher.blogspot.com/2022/01/most-frequently-asked-questions-about.html,techcrunch,technology & ai,0
