id,text,created_at,link,source,topic,engagement
t3_1laej21,Scientists develop plastic that dissolves in seawater. &#32; submitted by &#32; /u/Regular_Eggplant_248 [link] &#32; [comments],2025-12-02 14:17:19.459675+00:00,https://www.reddit.com/r/UpliftingNews/comments/1laej21/scientists_develop_plastic_that_dissolves_in/,reddit_uplifting_news,other,0
t3_1lejgtc,"‘HIV-ending’ drug could be made for just $25 per patient a year, say researchers. &#32; submitted by &#32; /u/ahothabeth [link] &#32; [comments]",2025-12-02 14:17:19.459675+00:00,https://www.reddit.com/r/UpliftingNews/comments/1lejgtc/hivending_drug_could_be_made_for_just_25_per/,reddit_uplifting_news,other,0
"tag:blogger.com,1999:blog-2525761963252134386.post-5284932877922393798","Top 10 AI Tools in 2023 That Will Make Your Life Easier. &nbsp;In this article, we explore the top 10 AI tools that are driving innovation and efficiency in various industries. These tools are designed to automate repetitive tasks, improve workflow, and increase productivity. The tools included in our list are some of the most advanced and widely used in the market, and are suitable for a variety of applications. Some of the tools focus on natural language processing, such as ChatGPT and Grammarly, while others focus on image and video generation, such as DALL-E and Lumen5. Other tools such as OpenAI Codex, Tabnine, Canva, Jasper AI,, and Surfer SEO are designed to help with specific tasks such as code understanding content writing and website optimization. This list is a great starting point for anyone looking to explore the possibilities of AI and how it can be applied to their business or project. So let’s dive into 1. ChatGPT ChatGPT is a large language model that generates human-like responses to a variety of prompts. It can be used for tasks such as language translation, question answering, and text completion. It can handle a wide range of topics and styles of writing, and generates coherent and fluent text, but should be used with care as it may generate text that is biased, offensive, or factually incorrect. Pros: Generates human-like responses to a variety of prompts Can be fine-tuned for specific tasks such as language translation, question answering, and text completion Can handle a wide range of topics and styles of writing Can generate coherent and fluent text, even when completing a given text prompt. Cons: May generate text that is biased or offensive Can generate text that is not accurate or factually correct May require large amounts of computational resources to run The model can sometimes generate text that is not coherent or fluent, depending on the prompt given. Overall, ChatGPT is a powerful tool for natural language processing, but it should be used with care and with an understanding of its limitations. 2. DALL-E DALL-E is a generative model developed by OpenAI that is capable of generating images from text prompts. It is based on the GPT-3 architecture, which is a transformer-based neural network language model that has been trained on a massive dataset of text. DALL-E can generate images that are similar to a training dataset and it can generate high-resolution images that are suitable for commercial use. Pros: Generates high-resolution images Can generate images from text prompts It can be fine-tuned for specific tasks such as generating images of a certain style or category Cons: May generate images that are not entirely original and could be influenced by the training data May require significant computational resources to run The quality of the generated images may vary depending on the specific prompt Overall, DALL-E is a powerful AI-based tool for generating images, it can be used for a variety of applications such as creating images for commercial use, gaming, and other creative projects. It is important to note that the generated images should be reviewed and used with care, as they may not be entirely original and could be influenced by the training data. 3. Lumen5 Lumen5 is a content creation platform that uses AI to help users create videos, social media posts, and other types of content. It has several features that make it useful for content creation and marketing, including: Pros: Automatically summarizes text from a blog post, article, or another source into a script for a video or social media post Offers a library of royalty-free videos, images, and music to use in content Has a drag-and-drop interface for easy content creation Can create videos in multiple languages Has a built-in analytics tool to track the performance of created content. Cons: The quality of the generated content may vary depending on the source material The automatic summarization feature may not always capture the main points of the source material The library of videos, images, and music is limited. The analytics feature is basic Overall, Lumen5 is a useful tool for creating content quickly and easily, it can help automate the process of creating videos, social media posts, and other types of content. However, the quality of the generated content may vary depending on the source material and it is important to review and edit the content before publishing it. 4. Grammarly Grammarly is a writing-enhancement platform that uses AI to check for grammar, punctuation, and spelling errors in the text. It also provides suggestions for improving the clarity, concision, and readability of the text. It has several features that make it useful for improving writing, including: Pros: Checks for grammar, punctuation, and spelling errors in the text Provides suggestions for improving clarity, concision, and readability Can be integrated with various apps and platforms such as Microsoft Office, Google Docs, and social media platforms Offers a browser extension an",2025-12-02 14:17:18.214992+00:00,https://techncruncher.blogspot.com/2023/01/top-10-ai-tools-in-2023-that-will-make.html,techcrunch,technology & ai,0
"tag:blogger.com,1999:blog-2525761963252134386.post-3560174651575689239","Ahrefs vs SEMrush: Which SEO Tool Should You Use?. SEMrush and Ahrefs are among the most popular tools in the SEO industry. Both companies have been in business for years and have thousands of customers per month. If you're a professional SEO or trying to do digital marketing on your own, at some point you'll likely consider using a tool to help with your efforts. Ahrefs and SEMrush are two names that will likely appear on your shortlist. In this guide, I'm going to help you learn more about these SEO tools and how to choose the one that's best for your purposes.What is SEMrush? SEMrush is a popular SEO tool with a wide range of features—it's the leading competitor research service for online marketers. SEMrush's SEO Keyword Magic tool offers over 20 billion Google-approved keywords, which are constantly updated and it's the largest keyword database. The program was developed in 2007 as SeoQuake is a small Firefox extension Features Most accurate keyword data: Accurate keyword search volume data is crucial for SEO and PPC campaigns by allowing you to identify what keywords are most likely to bring in big sales from ad clicks. SEMrush constantly updates its databases and provides the most accurate data.Largest Keyword database: SEMrush's Keyword Magic Tool now features 20-billion keywords, providing marketers and SEO professionals the largest database of keywords. All SEMrush users receive daily ranking data, mobile volume information, and the option to buy additional keywords by default with no additional payment or add-ons neededMost accurate position tracking tool: This tool provides all subscribers with basic tracking capabilities, making it suitable for SEO professionals. Plus, the Position Tracking tool provides local-level data to everyone who uses the tool.SEO Data Management: SEMrush makes managing your online data easy by allowing you to create visually appealing custom PDF reports, including Branded and White Label reports, report scheduling, and integration with GA, GMB, and GSC.Toxic link monitoring and penalty recovery: With SEMrush, you can make a detailed analysis of toxic backlinks, toxic scores, toxic markers, and outreach to those sites.Content Optimization and Creation Tools: SEMrush offers content optimization and creation tools that let you create SEO-friendly content. Some features include the SEO Writing Assistant, On-Page SEO Check, er/SEO Content Template, Content Audit, Post Tracking, Brand Monitoring. Ahrefs Ahrefs is a leading SEO platform that offers a set of tools to grow your search traffic, research your competitors, and monitor your niche. The company was founded in 2010, and it has become a popular choice among SEO tools. Ahrefs has a keyword index of over 10.3 billion keywords and offers accurate and extensive backlink data updated every 15-30 minutes and it is the world's most extensive backlink index database. Features Backlink alerts data and new keywords: Get an alert when your site is linked to or discussed in blogs, forums, comments, or when new keywords are added to a blog posting about you.Intuitive interface: The intuitive design of the widget helps you see the overall health of your website and search engine ranking at a glance.Site Explorer: The Site Explorer will give you an in-depth look at your site's search traffic.Domain ComparisonReports with charts and graphsJavaScript rendering and a site audit can identify SEO issues.A question explorer that provides well-crafted topic suggestions Direct Comparisons: Ahrefs vs SEMrush Now that you know a little more about each tool, let's take a look at how they compare. I'll analyze each tool to see how they differ in interfaces, keyword research resources, rank tracking, and competitor analysis. User Interface Ahrefs and SEMrush both offer comprehensive information and quick metrics regarding your website's SEO performance. However, Ahrefs takes a bit more of a hands-on approach to getting your account fully set up, whereas SEMrush's simpler dashboard can give you access to the data you need quickly. In this section, we provide a brief overview of the elements found on each dashboard and highlight the ease with which you can complete tasks. AHREFS The Ahrefs dashboard is less cluttered than that of SEMrush, and its primary menu is at the very top of the page, with a search bar designed only for entering URLs. Additional features of the Ahrefs platform include: You can see analytics from the dashboard, including search engine rankings to domain ratings, referring domains, and backlinkJumping from one tool to another is easy. You can use the Keyword Explorer to find a keyword to target and then directly track your ranking with one click.The website offers a tooltip helper tool that allows you to hover your mouse over something that isn't clear and get an in-depth explanation. SEMRUSH When you log into the SEMrush Tool, you will find four main modules. These include information about your domains, organic keyword analysis, ad keyword, and site traffic. You'll also find s",2025-12-02 14:17:18.214992+00:00,https://techncruncher.blogspot.com/2022/03/ahrefs-vs-semrush-which-seo-tool-should.html,techcrunch,technology & ai,0
"tag:blogger.com,1999:blog-2525761963252134386.post-3540326599808924672","Top 9 Free AI Tools That Make Your Life Easier. Copy.aiPhoto:- Copy.aiFirst one on the list is copy.ai. It is an AI based copy writer tool. Basically&nbsp; what a copywriter tool does is, it gives you content that you can post on your blog or video&nbsp; when you give it a few descriptions about the topic you want content on.So copy ai can help you write instagram captions gives you blog idea, product descriptions,&nbsp; facebook content, startup ideas, viral ideas, a lot of things it can do, you just make an account&nbsp; in this website, then select a tool and fill in&nbsp;the necessary description and the AI will generate&nbsp; content on what you ask for.For tutorials go to their official Youtube&nbsp; channel .An awesome tool that is going to be really handy in the future.Hotpot.aiHotpot.ai offers a collection of&nbsp; AI tools for designers, as well as for anyone,&nbsp;it has an “AI picture restorer” which removes&nbsp; scratches ,and basically restores your old photo&nbsp;into amazing pictures and makes it look brand new.&nbsp;&nbsp;Ai picture colorizer , turns your black and&nbsp;white photo into color. And there is a background&nbsp; remover tool, picture enlarger and a lot more for designers, check it out,and explore all the tools.Deep-nostalgiaDeep-nostalgia became&nbsp; very popular on the internet when people started&nbsp;making reaction videos of their parents reacting&nbsp; to animated pictures of their grandparents. So&nbsp;deep - nostalgia is a very cool app, that will&nbsp; animate any photo of a person.&nbsp;So what makes it&nbsp;really cool is that fact that you can upload an&nbsp; old photo of your family and see them animate&nbsp;and living. Which is pretty cool and creepy at&nbsp; the same time if they are dead already.. Really&nbsp;amazing service from myheritage, I created a&nbsp; lot of cool animations with my old photos as&nbsp;well as with the photos of my grandparents.Pfpmaker.comHaving a nice&nbsp; looking profile picture is really important if you want that professional feel in your socials.&nbsp; Whether in linkedin or twitter having a&nbsp;distinct and catchy profile picture can make&nbsp; all the difference. So that's where pfpmaker&nbsp;comes in. it a free online tool to create amazing professional profile pictures that fits&nbsp;you. It generates a lot of profile pictures&nbsp; and you can also make small changes to already&nbsp;created profile pictures if you want to,as well.Brandmark.io Speaking of brands, getting a&nbsp; good logo for your brand is the most frustrating&nbsp;thing ever, so brandmark.io makes it super easy.&nbsp; It will create a logo for your brand within&nbsp;2 clicks. So you goto this website. Type in your brand name and slogan if you have any, and&nbsp;give BRAND KEYWORDS that relate to your brand,&nbsp; then pick a color style and done, the ai will&nbsp;generate amazing logos for you.&nbsp;You can also make&nbsp; minor edits to the suggested logos to better fit your needs as well. But to get that png you need&nbsp; to pay a hefty price, but if you are looking for some logo ideas, this is a great place to start.Deep-image.aiEven in the previous websites, some&nbsp; had picture enlarger tools. This deep-image.ai is&nbsp;a dedicated image enlarger, which supports upto 4x&nbsp; enlargement for free. The UI is pretty good and the tool is pretty fast with amazing results.Bigjpg Bigjpg does the same as&nbsp; deep-image.ai , but this service offers a little bit more options like if your photo is an artwork&nbsp; it scales image differently than normal photos and it supports upto 4x enlargement for free&nbsp; and you can also set noise reduction options. Very good tool,Lumen5Lumen5 is an&nbsp; online marketing video maker that makes it really easy to create branding or informational videos&nbsp; within a couple of clicks. They have really great templates and various aspect ratios for various&nbsp; social media platforms.&nbsp;You can also edit each element of the video if you don't like the preset,&nbsp; and the best part is, they have a ton of , I mean a ton of free stock photos and videos.You can also&nbsp; upload your own videos or any type of media. Definitely a good tool if you don't know how&nbsp; to work with complex tools like after effects, but want to create a sick video for your brand.NamelixIf you are struggling to find&nbsp; good names for your brand or youtube channel, give&nbsp;namelix a try. It's an ai based name generator&nbsp; that will suggest good names for your brand&nbsp;depending on the keyword that you give..&nbsp; Also logo for your brand. Pretty cool and an amazing piece of tool. So that's been it , those are my favourite free AI based tools that you can use right now,Which one You like the most Let me know in the Comments below.&nbsp;&nbsp;",2025-12-02 14:17:18.214992+00:00,https://techncruncher.blogspot.com/2022/01/top-9-free-ai-tools-that-make-your-life.html,techcrunch,technology & ai,0
"tag:blogger.com,1999:blog-2525761963252134386.post-7535332462149609558","7 Free Websites Every Content Creator Needs to Know. Do you have the desire to become a content creator, but not have the money to start? Here are 7 free websites every content creator needs to know.1.Exploding Topics (Trending Topics)(Photo Credit:- Exploding Topics)If you're a content creator, you might be wondering what better way to find new topic ideas than to see what people are searching for? This tool gives you this data without anyone else's explanation. It provides related hashtags and tips on how to use them effectively in your posts. It's a great tool for anyone who wants to keep up to date with what's most relevant in their niche. You can also see the most popular hashtags by country, making it easier to understand cross-border and demographic trends. This site makes your search for content easier than ever! There are countless ways to use explosive topics to your advantage as a content creator.&nbsp;Some examples can be:Use the most popular hashtags and keywords to get inspiration for ideas.&nbsp;Find out what people are talking about in real-time.&nbsp;Find new audiences you may not have known were interested in your topic.There’s no excuse not to try this website — it’s free and easy to use!Visit Exploding Topics From Here2. Headline Studio (Headline Grader)(Photo Credit:-Headline Studio)Headline Studio allows you to create catchy headlines for your content.&nbsp;After writing a title there is data on how often people view articles with similar titles and why they are involved with them.This is a valuable tool when creating new blog posts because it generates catchy headlines for your blog post to catch a reader’s attention.Visit Headline Studio From Here3. Answer the public(Photo Credit:- Answer The Public)Answer The public is an excellent tool for content creators. It gives you insight into what people are asking on social media sites and communities and lets you guess about topics that matter to your audience. Answer the public allows you to enter a keyword or topic related to your niche and it will show results with popular questions and keywords related to your topic. It's an amazing way to get insights into what people are searching online and allows you to identify topics driven by new blog posts or social media content on platforms like Facebook, Instagram, Youtube, and Twitter as well as the types of questions they ask and&nbsp; also want answers.Visit&nbsp;Answer The Public From Here 4. Surfer Seo (SEO Ranking)(Photo Credit:-Surfer Seo)With this tool, content creators can quickly and easily check the ranking of their websites and those of other competitors. This tool allows you to see how your website compares to others in different categories, including:&nbsp;Rank PotentialOrganic Search RankingSurfer Seo is free and the interface is very friendly. It's a great tool for anyone who wants to do quick competitor research or check their site's rankings at any time.Visit SurferSeo From Here5. Canva (Templates/Graphics)(Photo Credit:- Canva)Canva is a free graphic design platform that makes it easy to create invitations, business cards, mobile videos, Instagram posts, Instagram stories, flyers, and more with professionally designed templates. You can even upload your photos and drag and drop them into Canva templates. It's like having a basic version of Photoshop. You can also remove background from images with one click.Canva offers thousands of free, professionally designed templates that can be customized with just a few clicks. Simply upload your photos to Canva, drag them into the template of your choice, and save the file to your computer.It is free to use for basic use but if you want access to different fonts or more features, then you need to buy a premium plan.Visit Canva From Here6. Facebook Audience Insights (Audience Research)(Photo Credit:- Facebook Audience InsightsFacebook Audience Insights is a powerful tool for content creators when researching their target market. This can help you understand the demographics, interests, and behaviors of your target audience. This information helps determine the direction of your content so that it resonates with them. The most important tools to consider in Facebook Audience Insights are Demographics and Behavior. These two sections provide you with valuable information about your target market, such as their age and from where they belong, how much time they spend on social media per day, what devices they use to access it, etc. There is another section of Facebook Audits that is very helpful. This will let you know the interests, hobbies, and activities that people in your target market are most interested in. You can use this information to create content for them about things they will be about as opposed to topics they may not be so keen on.Visit&nbsp;Facebook Audience Insights From Here7. Pexels (Images)(Photo Credit: PixelPexels is a warehouse for any content creator with millions of free royalty images who wants to find high-quality images that can be used freely without having",2025-12-02 14:17:18.214992+00:00,https://techncruncher.blogspot.com/2022/01/7-free-websites-every-content-creator.html,techcrunch,war & foreign policy,0
