id,text,created_at,link,source,topic,engagement
https://www.theguardian.com/business/2025/dec/02/gina-rinehart-helipad-company-headquarters-perth-council-vote-ntwnfb,"Bid by Gina Rinehart’s company to build helipad set to be blocked by City of Perth. Hancock says facility is ‘modern necessity’ but opponents argue the noise would disrupt local businesses Get our breaking news email, free app or daily news podcastGina Rinehart’s company has claimed helicopter pads are a necessity of modern business as it fights to install one at its new headquarters in West Perth.The City of Perth on Tuesday recommended councillors block the request from Hancock Iron Ore to install a helipad as it redevelops its offices. Continue reading...",2025-12-02 12:08:42+00:00,https://www.theguardian.com/business/2025/dec/02/gina-rinehart-helipad-company-headquarters-perth-council-vote-ntwnfb,guardian_world,technology & ai,0
https://www.bbc.com/news/articles/c8jwe311y37o#0,"Friends to leave Netflix in UK at the end of the year. The comedy, which is one of the streamer's most popular shows, will leave the platform on 30 December.",2025-12-02 12:07:22+00:00,https://www.bbc.com/news/articles/c8jwe311y37o?at_medium=RSS&at_campaign=rss,bbc_entertainment,other,0
https://www.bbc.com/news/articles/cjezwzw088jo#0,Bulgaria ditches budget plan after tens of thousands join protests. Demonstrators said the plan - the country's first in euros - attempted to hide widespread government corruption.,2025-12-02 12:04:00+00:00,https://www.bbc.com/news/articles/cjezwzw088jo?at_medium=RSS&at_campaign=rss,bbc_world,technology & ai,0
https://www.bbc.com/news/articles/c8e9py8g2yyo#0,"Twelve more prisoners released in error, with two still missing, says Lammy. The releases happened in the past three weeks, coming on top of 91 prisoners who were freed by mistake between April and October.",2025-12-02 12:03:03+00:00,https://www.bbc.com/news/articles/c8e9py8g2yyo?at_medium=RSS&at_campaign=rss,bbc_politics,technology & ai,0
https://www.japantimes.co.jp/article/634525/,"'Mischievous hands': Indonesians blame deforestation for devastating floods. Landslides buried homes and crippled rescue and relief efforts, while floodwaters washed ashore dozens of logs.",2025-12-02 21:01:00+09:00,https://www.japantimes.co.jp/environment/2025/12/02/climate-change/indonesia-floods-deforestation/,japan_times,climate & environment,0
https://www.aljazeera.com/?t=1764676281,"Video: Protesters clash with police at anti-government march in Bulgaria. Bulgaria’s government says it is withdrawing a planned budget after a major protest in the capital Sofia,",2025-12-02 11:56:10+00:00,https://www.aljazeera.com/video/newsfeed/2025/12/2/video-protesters-clash-with-police-at-anti-government-march-in-bulgaria?traffic_source=rss,al_jazeera,crime & safety,0
https://www.japantimes.co.jp/article/634524/,Soaring unemployment challenges Finnish welfare model. Figures from the European statistics agency Eurostat showed Finland's seasonally adjusted unemployment rate hit 9.6% in September.,2025-12-02 20:50:00+09:00,https://www.japantimes.co.jp/business/2025/12/02/economy/finland-unemployment-welfare-model/,japan_times,labor & work,0
https://www.aljazeera.com/?t=1764664791,Russian tanker struck off Turkiye as Ukraine targets ‘shadow fleet’. The reported attack on the Midvolga-2 comes days after Ukraine hit two other Russian-flagged ships in the Black Sea.,2025-12-02 11:46:35+00:00,https://www.aljazeera.com/news/2025/12/2/russian-tanker-struck-off-turkiye-as-ukraine-targets-shadow-fleet?traffic_source=rss,al_jazeera,war & foreign policy,0
https://www.bbc.com/news/articles/c14vxlxv4kko#0,Police consider corporate manslaughter charges in Post Office scandal. The move comes as police continue to investigate what has been called the UK's most widespread miscarriage of justice.,2025-12-02 11:46:30+00:00,https://www.bbc.com/news/articles/c14vxlxv4kko?at_medium=RSS&at_campaign=rss,bbc_business,crime & safety,0
https://www.aljazeera.com/?t=1764668106,"‘Corruption is a hydra’: Ukraine rocked by another high-profile sacking. Although Yermak was Zelenskyy&#039;s right-hand man, observers say his downfall could benefit the president in short term.",2025-12-02 11:42:31+00:00,https://www.aljazeera.com/news/2025/12/2/what-will-the-sacking-of-zelenskyys-no-2-change-for-ukraine?traffic_source=rss,al_jazeera,war & foreign policy,0
https://www.theverge.com/?p=836212,"OpenAI declares ‘code red’ as Google catches up in AI race. The tides are turning in the AI race, and the pressure is getting to OpenAI. Chief executive Sam Altman reportedly declared a “code red” on Monday, urging staff to improve its flagship product ChatGPT, an indicator that the startup’s once-unassailable lead is eroding as competitors like Google and Anthropic close in.&#160;&#160; In the memo, reported [&#8230;]",2025-12-02 06:40:07-05:00,https://www.theverge.com/news/836212/openai-code-red-chatgpt,the_verge,technology & ai,0
https://www.theguardian.com/politics/2025/dec/02/david-lammy-traumatic-racial-abuse-nigel-farage-allegations,"David Lammy tells of ‘traumatic’ racial abuse in youth after Farage allegations. Deputy PM contrasts apologies from former classmates to Reform UK leader’s response to claims against himDavid Lammy has spoken of his own “traumatic” experience of being racially abused at school as he called on Nigel Farage to apologise for comments he allegedly made while a teenager.Lammy, the deputy prime minister and justice secretary, said the testimony of more than 20 of the Reform leader’s school contemporaries of his racist and antisemitic behaviour was “deeply troubling”. Continue reading...",2025-12-02 11:38:52+00:00,https://www.theguardian.com/politics/2025/dec/02/david-lammy-traumatic-racial-abuse-nigel-farage-allegations,guardian_politics,technology & ai,0
https://www.aljazeera.com/?t=1764675353,Netanyahu requesting pardon is him “getting into election mode”. &quot;By asking for the pardon he&#039;s dividing the country even more.”,2025-12-02 11:37:39+00:00,https://www.aljazeera.com/video/quotable/2025/12/2/netanyahu-requesting-pardon-is-him-getting-into-election?traffic_source=rss,al_jazeera,politics,0
https://www.theverge.com/?p=836199,"Microsoft&#8217;s latest Windows 11 update improves and breaks dark mode. You can’t make this up. Microsoft shipped a Windows 11 update yesterday that is supposed to make dark mode more consistent, with dialogs in File Explorer finally getting a dark mode for actions like copying, moving, or deleting files and folders. You get all that, but Microsoft will also treat you with a giant white [&#8230;]",2025-12-02 06:34:44-05:00,https://www.theverge.com/news/836199/microsoft-windows-11-file-explorer-white-screen-flash-bug,the_verge,other,0
https://www.bbc.com/news/articles/c5yd91y2250o#1,South African radio DJ among five charged over Russia recruitment plot. The group has been charged under a law which prohibits people from joining foreign armies.,2025-12-02 11:33:54+00:00,https://www.bbc.com/news/articles/c5yd91y2250o?at_medium=RSS&at_campaign=rss,bbc_world,war & foreign policy,0
https://www.theguardian.com/world/2025/dec/02/spanish-swine-fever-outbreak-pork-industry-boar-food,"Spanish swine fever outbreak may be linked to food eaten by boar, say officials. Hundreds of police, rangers and military personnel deployed to tackle virus threatening pork export industrySpanish authorities have deployed hundreds of police officers, wildlife rangers and military personnel in an effort to contain an outbreak of highly infectious African swine fever (ASF) outside Barcelona before it becomes a major threat to the country’s €8.8bn-a-year pork export industry.Officials believe the virus, detected in the municipality of Bellaterra, may have begun to circulate after a wild boar ate contaminated food that had been brought in from outside Spain. Continue reading...",2025-12-02 11:26:48+00:00,https://www.theguardian.com/world/2025/dec/02/spanish-swine-fever-outbreak-pork-industry-boar-food,guardian_world,war & foreign policy,0
https://www.bbc.com/news/articles/c5yqpq7d844o#0,'Scotland qualifying for the World Cup put me in hospital'. The BBC's entertainment correspondent Colin Paterson needed surgery after a mishap ahead of Scotland's World Cup qualifying game.,2025-12-02 11:24:47+00:00,https://www.bbc.com/news/articles/c5yqpq7d844o?at_medium=RSS&at_campaign=rss,bbc_entertainment,technology & ai,0
t3_1pc5yuf,"US authorised second deadly Venezuela boat strike, White House says. &#32; submitted by &#32; /u/Fearless-Ambition934 [link] &#32; [comments]",2025-12-02 11:21:12+00:00,https://www.reddit.com/r/worldnews/comments/1pc5yuf/us_authorised_second_deadly_venezuela_boat_strike/,reddit_world_news,government,0
https://www.aljazeera.com/?t=1764674256,Record Asia floods proof “we need to wake up” on climate. “The world needs to wake up. We need to adapt.”,2025-12-02 11:21:01+00:00,https://www.aljazeera.com/video/quotable/2025/12/2/aje-onl-qt-fredolin-tangang-021225?traffic_source=rss,al_jazeera,climate & environment,0
https://www.theguardian.com/business/2025/dec/02/obr-treasury-budget-leaks-mps-press,"OBR complained to Treasury before budget about leaks spreading ‘misconceptions’. Official tells MPs there was lots of information appearing in the press that ‘wasn’t particularly helpful’Politics live – latest updatesBusiness live – latest updatesThe Office for Budget Responsibility complained to senior Treasury officials in the run-up to the budget about a flurry of leaks that it said spread “misconceptions” about its forecasts, it has emerged.Prof David Miles of the OBR’s budget responsibility committee told MPs on the Treasury select committee on Tuesday that the watchdog had raised the issue of leaks with the department before the chancellor’s statement last week. Continue reading...",2025-12-02 11:20:47+00:00,https://www.theguardian.com/business/2025/dec/02/obr-treasury-budget-leaks-mps-press,guardian_politics,technology & ai,0
https://www.theguardian.com/world/2025/dec/02/witkoff-in-moscow-for-talks-as-putin-claims-to-have-taken-key-ukrainian-city,"Witkoff in Moscow for talks as Putin claims to have taken key Ukrainian city. Trump envoy lands in Russia as Putin hails ‘important’ capture of Pokrovsk, although claim is disputed by KyivRussia-Ukraine war – latest news updatesVladimir Putin has claimed Russian forces have taken control of the strategic city of Pokrovsk in Ukraine, as he sought to project confidence before a key meeting on Tuesday with a US delegation to discuss a possible peace deal to end the war.Dressed in military fatigues during a visit to a command centre on Monday evening, the Russian president hailed what he called the “important” capture of Pokrovsk – once a major logistical hub for the Ukrainian army – though Ukrainian officials later disputed the claim. Continue reading...",2025-12-02 11:08:56+00:00,https://www.theguardian.com/world/2025/dec/02/witkoff-in-moscow-for-talks-as-putin-claims-to-have-taken-key-ukrainian-city,guardian_world,war & foreign policy,0
https://www.theguardian.com/australia-news/2025/dec/02/australian-children-moving-to-new-social-app-lemon8-but-owner-expected-to-restrict-users-to-over-16s,"Australian children moving to new social app Lemon8 but owner expected to restrict users to over-16s. Australia’s under-16s social media ban might take weeks to work but all platforms are on notice, government saysGet our breaking news email, free app or daily news podcastThe government’s plans to bar under-16s from social media might take “days or even weeks” to properly take effect, communications minister Anika Wells has conceded, saying the world-leading scheme won’t work perfectly from day one.Lemon8, a newer social media app that has experienced a surge in interest recently because it is not included in the ban, will restrict its users to over-16s from next week, Guardian Australia can reveal. The eSafety Commission had previously warned it was closely monitoring the app for possible inclusion in the ban. Continue reading...",2025-12-02 11:00:54+00:00,https://www.theguardian.com/australia-news/2025/dec/02/australian-children-moving-to-new-social-app-lemon8-but-owner-expected-to-restrict-users-to-over-16s,guardian_world,war & foreign policy,0
https://www.aljazeera.com/?t=1764669960,Russia-Ukraine war live: Trump’s envoy Witkoff to meet Putin. Talks to take place in Moscow amid renewed diplomatic push to end long-running war.,2025-12-02 11:00:00+00:00,https://www.aljazeera.com/news/liveblog/2025/12/2/russia-ukraine-war-live-trumps-envoy-witkoff-to-meet-putin?traffic_source=rss,al_jazeera,war & foreign policy,0
t3_1pc5fzz,Fourth Russia-Linked Tanker Hit in a Week. &#32; submitted by &#32; /u/serenacharming [link] &#32; [comments],2025-12-02 10:50:35+00:00,https://www.reddit.com/r/worldnews/comments/1pc5fzz/fourth_russialinked_tanker_hit_in_a_week/,reddit_world_news,war & foreign policy,0
https://www.bbc.com/news/articles/cr5zdeyd1eeo#0,"Tax rises and tighter spending to hold back UK growth, OECD says. Growth in the UK economy is expected to slow next year, an influential global policy group predicts.",2025-12-02 10:42:21+00:00,https://www.bbc.com/news/articles/cr5zdeyd1eeo?at_medium=RSS&at_campaign=rss,bbc_business,government,0
https://www.bbc.com/news/articles/c1m8e8l1mp2o#0,"Iranian director given jail sentence while on trip to collect US awards. Jafar Panahi gets a one-year sentence in his absence for ""propaganda activities"" against the Iranian system.",2025-12-02 10:40:12+00:00,https://www.bbc.com/news/articles/c1m8e8l1mp2o?at_medium=RSS&at_campaign=rss,bbc_entertainment,war & foreign policy,0
https://www.aljazeera.com/?t=1764662583,"Sudan army refutes claim that RSF has seized key city of Babnusa. Army refutes fall of the city, a gateway to western Sudan&#039;s Darfur region, over which the RSF recently seized control.",2025-12-02 10:37:29+00:00,https://www.aljazeera.com/news/2025/12/2/sudan-army-refutes-claim-that-rsf-has-seized-key-city-of-babnusa?traffic_source=rss,al_jazeera,technology & ai,0
https://www.theguardian.com/society/2025/dec/02/bma-chair-tom-dolphin-junior-doctors-strikes-nhs-political-career,"BMA chair denies using junior doctors’ strikes to progress political career. Tom Dolphin, who applied to be Labour candidate in 2024, says political career not relevant as he defends strikes The head of the doctors’ union has denied he is pursuing further strike action to progress his own political career after the Labour party overlooked him as a prospective candidate for parliament.The British Medical Association has announced that resident doctors – formerly known as junior doctors – in England will stage another five-day strike from 7am on 17 December until 7am on 22 December. Continue reading...",2025-12-02 10:07:22+00:00,https://www.theguardian.com/society/2025/dec/02/bma-chair-tom-dolphin-junior-doctors-strikes-nhs-political-career,guardian_politics,technology & ai,0
https://www.aljazeera.com/?t=1764668784,Glenn Maxwell withdraws from IPL 2026 auctions. The Australian all-rounder ends a 13-year association with the world&#039;s most popular and richest T20 cricket league.,2025-12-02 10:02:34+00:00,https://www.aljazeera.com/sports/2025/12/2/glenn-maxwell-withdraws-from-ipl-2026-auctions?traffic_source=rss,al_jazeera,other,0
https://www.bbc.com/news/articles/c23e0k41kxeo#0,"'First of its kind' scanner to study blast trauma. It will be able to monitor changes in brain function just minutes after weapon use, scientists say.",2025-12-02 10:01:33+00:00,https://www.bbc.com/news/articles/c23e0k41kxeo?at_medium=RSS&at_campaign=rss,bbc_technology,technology & ai,0
https://www.bbc.com/news/articles/cedxyvx74p4o#0,India tells smartphone makers to put state-run cyber safety app on new devices. India wants all smartphone makers to pre-install new devices with a state-owned cyber security app.,2025-12-02 10:01:18+00:00,https://www.bbc.com/news/articles/cedxyvx74p4o?at_medium=RSS&at_campaign=rss,bbc_world,technology & ai,0
https://www.aljazeera.com/?t=1764624980,"At least 1,250 people dead: What caused the devastating Asia floods?. Climate advocates say it&#039;s time to move to accountability for climate change, as people in Asia are living the evidence.",2025-12-02 09:58:34+00:00,https://www.aljazeera.com/news/2025/12/2/at-least-1250-people-dead-what-caused-the-devastating-asia-floods?traffic_source=rss,al_jazeera,climate & environment,0
https://www.bbc.com/news/articles/cj69588eewyo#2,"'Hung by my wrists and beaten': Israeli-Russian woman says Iraqi militants tortured her in captivity. Elizabeth Tsurkov, who was freed in September, tells the BBC that her two years in captivity left her physically and mentally scarred.",2025-12-02 09:53:16+00:00,https://www.bbc.com/news/articles/cj69588eewyo?at_medium=RSS&at_campaign=rss,bbc_world,war & foreign policy,0
https://www.bbc.com/news/articles/c2lvzeyk21vo#1,"Shein and Temu face calls for investigation over claims of stealing US designs. Two senior US politicians accuse the platforms of malpractice, including intellectual property theft.",2025-12-02 09:52:28+00:00,https://www.bbc.com/news/articles/c2lvzeyk21vo?at_medium=RSS&at_campaign=rss,bbc_business,technology & ai,0
https://www.theguardian.com/society/2025/dec/02/more-prisoners-released-in-error-england-wales-lammy,"Twelve more prisoners in England and Wales released in error in last month. Justice secretary David Lammy says two are still at large and overall ‘trend is downwards’Prisoners continue to be released mistakenly with a further 12 inmates let out of jail in error since November, the UK justice secretary has revealed.David Lammy told BBC Breakfast that despite the latest figures the “trend is downwards” after improvements to the system were put in place. Continue reading...",2025-12-02 09:49:09+00:00,https://www.theguardian.com/society/2025/dec/02/more-prisoners-released-in-error-england-wales-lammy,guardian_politics,war & foreign policy,0
t3_1pc4gry,Russia's top general again fabricates supposed 'successes' on front. &#32; submitted by &#32; /u/Neptun_11 [link] &#32; [comments],2025-12-02 09:48:24+00:00,https://www.reddit.com/r/worldnews/comments/1pc4gry/russias_top_general_again_fabricates_supposed/,reddit_world_news,war & foreign policy,0
https://www.japantimes.co.jp/article/634519/,"In winter, spring chrysanthemum greens hit their peak. A favorite ingredient in savory pancakes and sukiyaki, these leafy vegetables offer a flavorful edge as well as a dose of antioxidants.",2025-12-02 18:45:00+09:00,https://www.japantimes.co.jp/life/2025/12/02/food-drink/spring-chrysanthemums-recipe/,japan_times,other,0
https://www.theguardian.com/politics/2025/dec/02/angela-rayner-to-lay-amendment-to-speed-up-workers-rights-bill,"Angela Rayner to lay amendment to speed up workers’ rights bill. Exclusive: Former deputy PM understood to have accepted compromise on day-one rights, after ‘considerable anger’ over Lords interventionThe former deputy prime minister Angela Rayner will lay an amendment on Wednesday to speed up the workers rights’ bill, after “considerable anger” that unelected Lords forced the watering down of day-one rights.The amendment would mean the new shorter qualifying period is in place by early next year. Continue reading...",2025-12-02 09:21:32+00:00,https://www.theguardian.com/politics/2025/dec/02/angela-rayner-to-lay-amendment-to-speed-up-workers-rights-bill,guardian_politics,government,0
https://www.aljazeera.com/?t=1764579479,"FIFA World Cup 2026 draw: Teams, pots, how to watch and all to know. The group classification of the 48 teams at next year&#039;s World Cup finals will be determined at the FIFA draw in the US.",2025-12-02 09:15:53+00:00,https://www.aljazeera.com/sports/2025/12/2/fifa-world-cup-2026-draw-teams-pots-how-to-watch-and-all-to-know?traffic_source=rss,al_jazeera,sports,0
https://www.aljazeera.com/?t=1764665630,Video: Moment Palestinian prisoner’s home is blown up by Israeli forces. Palestinian prisoner Abdulkarim Sanobar’s home in the occupied West Bank was blown up by the Israeli military.,2025-12-02 09:10:35+00:00,https://www.aljazeera.com/video/newsfeed/2025/12/2/video-moment-palestinian-prisoners-home-is-blown-up-by-israeli-forces?traffic_source=rss,al_jazeera,war & foreign policy,0
t3_1pc3sn1,"Apple refuses India’s order to preload state cyber safety app Sanchar Saathi, cites privacy risks. &#32; submitted by &#32; /u/one_brown_jedi [link] &#32; [comments]",2025-12-02 09:04:30+00:00,https://www.reddit.com/r/worldnews/comments/1pc3sn1/apple_refuses_indias_order_to_preload_state_cyber/,reddit_world_news,technology & ai,0
https://www.aljazeera.com/?t=1764642100,"Hegseth or Admiral Bradley: Who approved the second Venezuela boat strike?. The US defence secretary and White House have defended the second strike, but Trump said he would not have wanted it.",2025-12-02 09:01:47+00:00,https://www.aljazeera.com/news/2025/12/2/hegseth-or-admiral-bradley-who-approved-the-second-venezuela-boat-strike?traffic_source=rss,al_jazeera,technology & ai,0
https://www.japantimes.co.jp/article/634517/,"Japan’s flu season comes early as new variant spreads. The risk of developing severe symptoms from ""Subclade K"" is no higher than other strains, but its continued spread is expected.",2025-12-02 17:52:00+09:00,https://www.japantimes.co.jp/news/2025/12/02/japan/science-health/flu-season/,japan_times,technology & ai,0
https://www.theguardian.com/law/2025/dec/02/david-lammy-proposals-jury-trials,"David Lammy expected to water down plans to scrap most jury trials. Justice secretary suggests he will stick to Leveson’s recommended three-year sentence threshold in England and Wales, after ‘cabinet feedback’UK politics live – latest updatesDavid Lammy is expected to back down from removing jury trials in England and Wales for all but the most serious charges of murder, manslaughter and rape, but trial by jury will still be radically reduced for more minor offences.The UK government’s justice secretary said there had been “cabinet feedback” on the plans and suggested on Tuesday he was minded to follow the recommendation in a report by the retired senior judge Sir Brian Leveson that “either-way” offences likely to result in a sentence of three years or less should be dealt with by the magistrates courts or a new judge-only division. Continue reading...",2025-12-02 08:49:41+00:00,https://www.theguardian.com/law/2025/dec/02/david-lammy-proposals-jury-trials,guardian_politics,technology & ai,0
https://www.bbc.com/news/articles/c0r95q9kv1go#0,"US Navy admiral ordered second deadly Venezuela boat strike, White House says. The strikes, authorised by Defence Secretary Pete Hegseth, have raised fresh legality questions - but the White House says laws have been followed.",2025-12-02 08:44:44+00:00,https://www.bbc.com/news/articles/c0r95q9kv1go?at_medium=RSS&at_campaign=rss,bbc_world,technology & ai,0
https://www.aljazeera.com/?t=1764656956,"US envoys headed to Moscow to discuss Ukraine peace plan with Putin. White House &#039;optimistic&#039; about a deal, but Ukraine still wary that plan is based on Russian demands.",2025-12-02 08:43:15+00:00,https://www.aljazeera.com/news/2025/12/2/us-envoys-headed-to-moscow-to-discuss-ukraine-peace-plan-with-putin?traffic_source=rss,al_jazeera,war & foreign policy,0
https://www.japantimes.co.jp/article/634518/,"Japan eyes cap on deductions for furusato nо̄zei donations. Since the system is seen as favorable for higher-income earners, lawmakers of the ruling bloc have called for a review to bring the system back in line with its original purpose.",2025-12-02 17:38:00+09:00,https://www.japantimes.co.jp/business/2025/12/02/furusato-nozei-cap-deductions/,japan_times,other,0
https://www.theguardian.com/news/2025/dec/02/hong-kong-fire-response-contrast-mainland-china,"Hong Kong responds to disaster differently from Beijing – but the gulf is narrowing. Independent inquiry into fire and media questions to leader would not happen in mainland China, but crackdown on dissent has begunAs Hong Kong mourns the victims of its worst fire in decades, the response to the disaster reveals the ways in which the semi-autonomous city retains differences from mainland China – and how some of those differences are being eroded.Hong Kong’s leader, John Lee, announced on Tuesday the creation of an “independent committee” to investigate the blaze, which killed 151 people at the Wang Fuk Court apartment complex in Hong Kong’s New Territories. Continue reading...",2025-12-02 08:36:04+00:00,https://www.theguardian.com/news/2025/dec/02/hong-kong-fire-response-contrast-mainland-china,guardian_world,technology & ai,0
https://www.japantimes.co.jp/article/634523/,How an unfree press stoked the flames of Hong Kong’s deadly blaze. Many of the people who lived in the housing complex knew about problems in the renovation project that saw building towers wrapped in plastic netting and windows filled with foam.,2025-12-02 17:27:00+09:00,https://www.japantimes.co.jp/commentary/2025/12/02/world/unfree-press-and-hong-kongs-deadly-blaze/,japan_times,technology & ai,0
https://www.bbc.com/news/articles/cwyvjyvn83go#1,"Fashion house Valentino criticised over 'disturbing' AI handbag ads. Social media users have called the luxury Italian fashion brand's artificial intelligence-made adverts ""cheap"" and ""lazy"".",2025-12-02 08:26:01+00:00,https://www.bbc.com/news/articles/cwyvjyvn83go?at_medium=RSS&at_campaign=rss,bbc_business,technology & ai,0
