id,text,created_at,link,source,topic,engagement
https://www.theguardian.com/media/2025/dec/01/mansplaining-contender-word-of-the-year-rage-bait,"‘Mansplaining’ was once a contender for word of the year. Here’s why we should stop using it. ‘Rage bait’ is Oxford word of the year in 2025. But I think we should be able to decommission words that have brought more trouble than they’re worth, starting with the 2015 runner-upThe Oxford word of the year has been chosen, and it’s “rage bait”. It was a close-run contest with “aura farming” – that just means charisma, for which a number of perfectly fine words already exist – and “biohack”, a non-specific lifestyle improvement in which you’ve somehow got into the mainframe of time itself, and made some aspect of your body immune to its ravages. Since “aura farming” is extraneous and “biohacks” are almost all bollocks, the competition can’t have been that close, but the neologism isn’t necessarily welcome.Rage bait, as you probably already know, is the publication, usually online, of material designed to make people angry. It’s not a made-up phenomenon; we’ve known for some time that online engagement is most strongly driven by out-group animosity, but nor is it a cute feature of modern life, like iced matcha lattes and Labubus. It creates intellectual silos, drives deep social divisions, and ultimately corrodes trust in institutions and reason itself, as people feel so alienated from any but their own tribe that they cease to believe anything except word of mouth. I’d argue that it’s a bit like making “ethnic cleansing” your word of 1992, during the Bosnian war. Yes, people were using it a lot, but that didn’t make it a fun answer for a quiz. Turns out it was named Un-Word of the year by the GfdS (society for spoken German), which deplored its euphemistic nature. And that is fair. Anyway, good luck in the dictionary business, Oxford, if you collude to make rage bait all the rage. Your alphabetical list of meanings isn’t going to get anyone’s dander up.Do you have an opinion on the issues raised in this article? If you would like to submit a response of up to 300 words by email to be considered for publication in our letters section, please click here. Continue reading...",2025-12-01 17:33:10+00:00,https://www.theguardian.com/media/2025/dec/01/mansplaining-contender-word-of-the-year-rage-bait,guardian_politics,war & foreign policy,0
https://www.bbc.com/news/articles/cx2dw7l158po#0,Doctors to stage five-day strike before Christmas. Walkout in England begins on 17 December and will be 14th strike in pay dispute.,2025-12-01 17:25:09+00:00,https://www.bbc.com/news/articles/cx2dw7l158po?at_medium=RSS&at_campaign=rss,bbc_politics,healthcare & wellbeing,0
https://www.bbc.com/news/articles/c79x3w1pwg5o#0,Starmer says he is proud of Budget as he denies misleading public. The Tories have accused the government of lying about the state of the public finances ahead of the Budget.,2025-12-01 17:18:27+00:00,https://www.bbc.com/news/articles/c79x3w1pwg5o?at_medium=RSS&at_campaign=rss,bbc_politics,government,0
t3_1pbi7ya,"UK Special Forces (UKSF) tried to cover up Special Air Service (SAS) war crimes (killings of civilians including children) in Afghanistan, whistleblower alleges.. &#32; submitted by &#32; /u/WeTheSummerKid [link] &#32; [comments]",2025-12-01 17:02:55+00:00,https://www.reddit.com/r/news/comments/1pbi7ya/uk_special_forces_uksf_tried_to_cover_up_special/,reddit_news,war & foreign policy,0
https://www.bbc.com/news/articles/cn0k520v4xro#1,US and UK agree zero tariffs deal on pharmaceuticals. The deal follows threats of tariffs as high as 100% on branded drug imports.,2025-12-01 16:58:35+00:00,https://www.bbc.com/news/articles/cn0k520v4xro?at_medium=RSS&at_campaign=rss,bbc_business,branding & advertising,0
t3_1pbhxw2,India orders smartphone makers to preload state-owned cyber safety app. &#32; submitted by &#32; /u/lordatlas [link] &#32; [comments],2025-12-01 16:52:53+00:00,https://www.reddit.com/r/news/comments/1pbhxw2/india_orders_smartphone_makers_to_preload/,reddit_news,technology & ai,0
https://www.bbc.com/news/articles/cy7v08zkk10o#1,Regulator backtracks on 'ghost train' plan. Plans to ban passengers from the peak train service between Manchester and London are abandoned.,2025-12-01 16:49:31+00:00,https://www.bbc.com/news/articles/cy7v08zkk10o?at_medium=RSS&at_campaign=rss,bbc_business,technology & ai,0
https://www.theguardian.com/world/2025/dec/01/italian-canadian-volunteers-beaten-robbed-israeli-settlers-west-bank,"Israeli settlers attack and rob Italian and Canadian volunteers in West Bank. Group beaten in early hours of morning in village where they volunteered to help protect Palestinians from settler violenceItaly and Canada have raised concerns about the treatment of their citizens who were beaten and robbed by Israeli settlers in the occupied West Bank.Three Italians and a Canadian were attacked early on Sunday morning in the village of Ein al-Duyuk, near Jericho, where they had volunteered to help protect the Palestinian population from intensifying settler violence. Continue reading...",2025-12-01 16:40:20+00:00,https://www.theguardian.com/world/2025/dec/01/italian-canadian-volunteers-beaten-robbed-israeli-settlers-west-bank,guardian_world,war & foreign policy,0
t3_1pbgv6c,A man has unexpectedly been cured of HIV after receiving a transplant of non-HIV-resistant stem cells. &#32; submitted by &#32; /u/New_Scientist_Mag [link] &#32; [comments],2025-12-01 16:12:48+00:00,https://www.reddit.com/r/UpliftingNews/comments/1pbgv6c/a_man_has_unexpectedly_been_cured_of_hiv_after/,reddit_uplifting_news,gender & sexuality,0
t3_1pbgu3b,A man has unexpectedly been cured of HIV after receiving a transplant of non-HIV resistant stem cells. &#32; submitted by &#32; /u/New_Scientist_Mag [link] &#32; [comments],2025-12-01 16:11:43+00:00,https://www.reddit.com/r/worldnews/comments/1pbgu3b/a_man_has_unexpectedly_been_cured_of_hiv_after/,reddit_world_news,gender & sexuality,0
https://www.bbc.com/news/articles/cj38xm5nmd7o#1,"Tulip Siddiq says Bangladesh jail term is 'unfair'. The MP, and niece of Bangladesh's ousted former leader, received a two-year sentence in her absence over corruption allegations.",2025-12-01 16:02:05+00:00,https://www.bbc.com/news/articles/cj38xm5nmd7o?at_medium=RSS&at_campaign=rss,bbc_politics,technology & ai,0
https://www.theguardian.com/world/2025/dec/01/asia-flood-sri-lanka-indonesia-deploy-military,"Sri Lanka and Indonesia deploy militaries as Asia floods death toll passes 1,100. Millions of people affected by torrential rainfall in Sri Lanka and large parts of Indonesia’s Sumatra, southern Thailand and northern MalaysiaHow cyclones and monsoon rains combined to devastate parts of Asia – visual guideSri Lanka and Indonesia have deployed military personnel as they race to help victims of devastating flooding that has killed more than 1,100 people across four countries in Asia.Millions of people have been affected by a combination of tropical cyclones and heavy monsoon rains in Sri Lanka, parts of Indonesia’s Sumatra, Thailand and Malaysia in recent days. Continue reading...",2025-12-01 15:57:51+00:00,https://www.theguardian.com/world/2025/dec/01/asia-flood-sri-lanka-indonesia-deploy-military,guardian_world,war & foreign policy,0
t3_1pbgb2z,"Luigi Mangione fights to exclude gun, notes as anniversary of UnitedHealthcare CEO’s killing nears. &#32; submitted by &#32; /u/AudibleNod [link] &#32; [comments]",2025-12-01 15:52:05+00:00,https://www.reddit.com/r/news/comments/1pbgb2z/luigi_mangione_fights_to_exclude_gun_notes_as/,reddit_news,healthcare & wellbeing,0
t3_1pbg382,"Third Russia-Linked Oil Tanker Suffers Explosions at Sea | An oil tanker carrying diesel suffered four external explosions near Dakar, Senegal, its manager said. &#32; submitted by &#32; /u/bloomberg [link] &#32; [comments]",2025-12-01 15:43:47+00:00,https://www.reddit.com/r/worldnews/comments/1pbg382/third_russialinked_oil_tanker_suffers_explosions/,reddit_world_news,war & foreign policy,0
t3_1pbg29o,"Why Youth Storytelling Matters - and How Photography Opens New Pathways for Growth. 100cameras is a non-profit organization who works with youth ages 10–18 around the world, equipping them with photography and storytelling tools to process their world, connect with others, and thrive. Their programs turn photography into more than creativity — it becomes a pathway to well-being, resilience, and self-confidence. Please click to read more. &#32; submitted by &#32; /u/mykm20 [link] &#32; [comments]",2025-12-01 15:42:47+00:00,https://www.reddit.com/r/UpliftingNews/comments/1pbg29o/why_youth_storytelling_matters_and_how/,reddit_uplifting_news,business & corporate,0
t3_1pbew5a,How to watch the last supermoon of the year. &#32; submitted by &#32; /u/iwantUineedUohBBohBB [link] &#32; [comments],2025-12-01 14:58:17+00:00,https://www.reddit.com/r/UpliftingNews/comments/1pbew5a/how_to_watch_the_last_supermoon_of_the_year/,reddit_uplifting_news,other,0
t3_1pbes3c,Grandma Wanda Dench and Jamal Hinton Mark 10th Thanksgiving Together. &#32; submitted by &#32; /u/AdSpecialist6598 [link] &#32; [comments],2025-12-01 14:53:43+00:00,https://www.reddit.com/r/UpliftingNews/comments/1pbes3c/grandma_wanda_dench_and_jamal_hinton_mark_10th/,reddit_uplifting_news,other,0
t3_1pbelsy,Looks like PlayStation have removed PS5 Disc Drive internet connection requirement with new PS5 model CFI-2116. &#32; submitted by &#32; /u/SpiritGaming28 [link] &#32; [comments],2025-12-01 14:46:28+00:00,https://www.reddit.com/r/UpliftingNews/comments/1pbelsy/looks_like_playstation_have_removed_ps5_disc/,reddit_uplifting_news,other,0
https://www.theguardian.com/world/2025/dec/01/south-africans-court-alleged-recruitment-russia-war-ukraine,"Five South Africans in court over alleged recruitment for Russia’s war in Ukraine. Suspects arrested after tipoff over accusation that 17 South Africans were tricked on to frontlines of the conflictFive South Africans have appeared in court on charges relating to recruitment and fighting for Russia in its war with Ukraine, amid allegations that 17 South Africans had been tricked on to the frontlines of the conflict.A female suspect was arrested on Thursday on her return to South Africa at OR Tambo international airport outside Johannesburg, police said. Three suspects were arrested at the airport on Friday and another on Saturday. Continue reading...",2025-12-01 14:43:19+00:00,https://www.theguardian.com/world/2025/dec/01/south-africans-court-alleged-recruitment-russia-war-ukraine,guardian_world,war & foreign policy,0
t3_1pbeitm,"NATO may get 'more aggressive' in countering Russia’s hybrid attacks, top military official says. &#32; submitted by &#32; /u/AdSpecialist6598 [link] &#32; [comments]",2025-12-01 14:43:10+00:00,https://www.reddit.com/r/worldnews/comments/1pbeitm/nato_may_get_more_aggressive_in_countering/,reddit_world_news,war & foreign policy,0
t3_1pbe7uv,"Former Trump lawyer Alina Habba disqualified as New Jersey prosecutor, US appeals court rules. &#32; submitted by &#32; /u/igetproteinfartsHELP [link] &#32; [comments]",2025-12-01 14:30:28+00:00,https://www.reddit.com/r/news/comments/1pbe7uv/former_trump_lawyer_alina_habba_disqualified_as/,reddit_news,technology & ai,0
US-EN-47156518,"How Mike Vrabel galvanized Patriots to top of AFC in a year. Vrabel had a clear vision of the Patriots' future when hired in January. Now, they are competing again.",2025-12-01 14:16:32.724086+00:00,https://www.espn.com/nfl/story/_/id/47156518/how-mike-vrabel-patriots-top-afc-standings-one-year,espn,technology & ai,0
US-EN-47159529,"Kentucky fires football coach Mark Stoops. Kentucky has fired football coach Mark Stoops, who had just completed his 13th season with a 5-7 record.",2025-12-01 14:16:32.724086+00:00,https://www.espn.com/college-football/story/_/id/47159529/kentucky-expected-fire-football-coach-mark-stoops,espn,sports,0
US-EN-47111234,"10 key games to watch in December. National champions facing off, the nastiest rivalry in college basketball and more are up this month.",2025-12-01 14:16:32.724086+00:00,https://www.espn.com/mens-college-basketball/story/_/id/47111234/mens-college-basketball-10-key-nonconference-games-watch-december-florida-duke-uconn,espn,education,0
US-EN-47154291,"Giants see success for Jaxson Dart if he can avoid injury. After his latest concussion, teammates and coaches are urging the prized rookie to protect himself.",2025-12-01 14:16:32.724086+00:00,https://www.espn.com/nfl/story/_/id/47154291/new-york-giants-success-jaxson-dart-stay-healthy-2025,espn,sports,0
US-EN-47120390,AP Week 14 poll reaction: What's next for each Top 25 team. A look at the new Top 25 after Week 14.,2025-12-01 14:16:32.724086+00:00,https://www.espn.com/college-football/story/_/id/47120390/ap-college-football-week-14-poll-reaction,espn,sports,0
US-EN-mondaytakeaways120125,"Takeaways: A chaotic tiebreaker in the ACC, plus surprising wins. Our college football experts break down key storylines and performances.",2025-12-01 14:16:32.724086+00:00,https://www.espn.com/college-football/story/_/page/mondaytakeaways120125/2025-college-football-week-14-takeaways-texas-duke,espn,education,0
US-EN-47157887,"Sources: Spartans target Fitzgerald as new coach. Pat Fitzgerald, 50, has emerged as the target of Michigan State's coaching search, sources told ESPN's Pete Thamel on Sunday night, confirming a report, and the sides are working toward a deal, which is expected to be finalized in the near future.",2025-12-01 14:16:32.724086+00:00,https://www.espn.com/college-football/story/_/id/47157887/michigan-state-targets-pat-fitzgerald-new-coach,espn,war & foreign policy,0
US-EN-47159531,"QB Rodgers calls out WRs after 'boo-worthy' loss. After an injured Aaron Rodgers finished one of the worst passing games of his career, the Steelers QB said he hopes his wide receivers show up during the next film sessions and run the right routes.",2025-12-01 14:16:32.724086+00:00,https://www.espn.com/nfl/story/_/id/47159531/aaron-rodgers-calls-wrs-says-steelers-earned-fans-boos,espn,technology & ai,0
US-EN-47161839,"Bonitto seals win after Broncos switch up call on D. After the Broncos tweaked their defensive call during a timeout, linebacker Nick Bonitto swatted away Marcus Mariota's pass on a 2-point conversion attempt to preserve Denver's 27-26 overtime win against Washington on Sunday night.",2025-12-01 14:16:32.724086+00:00,https://www.espn.com/nfl/story/_/id/47161839/nik-bonitto-preserves-broncos-ot-win-swatting-away-commanders-qb-marcus-mariota-2-point-try,espn,technology & ai,0
US-EN-47152847,Sorting five overreactions to Week 13: NFC South battle? Cowboys to the playoffs?. Could we see a Tampa-Carolina championship tilt? Are last year's Super Bowl teams cooked?,2025-12-01 14:16:32.724086+00:00,https://www.espn.com/nfl/story/_/id/47152847/nfl-week-13-overreactions-fantasy-nfc-south-eagles-chiefs-lamar-jackson-cowboys,espn,sports,0
US-EN-47154312,"Kiffin takes LSU job, won't finish year with Rebels. Lane Kiffin is the new coach at LSU, and he will not continue with Ole Miss on its College Football Playoff run as the Rebels promoted Pete Golding to head coach.",2025-12-01 14:16:32.724086+00:00,https://www.espn.com/college-football/story/_/id/47154312/lane-kiffin-hired-lsu-coach-finish-season-ole-miss,espn,education,0
US-EN-47160523,"76ers' Embiid returns in chaotic 2OT loss to Hawks. Joel Embiid, Paul George and Tyrese Maxey shared the court for the first time this season Sunday night, but that became a footnote in a chaotic double-overtime loss to the Hawks.",2025-12-01 14:16:32.724086+00:00,https://www.espn.com/nba/story/_/id/47160523/joel-embiid-returns-76ers-lose-chaotic-game-hawks-double-over,espn,other,0
US-EN-47159241,"Titans' Chestnut says Jags punter threatened him. Titans running back Julius Chestnut alleged that Jaguars punter Logan Cooke threatened to kill him during Sunday's game. ""I was just trying to play hard, and he came up to me and said he was going to kill me,"" Chestnut said.",2025-12-01 14:16:32.724086+00:00,https://www.espn.com/nfl/story/_/id/47159241/titans-chestnut-alleges-jaguars-cooke-threatened-him,espn,technology & ai,0
t3_1pbdilq,Englewood woman prepares unreal Thanksgiving spread for her backyard squirrels: ‘Want them to feel special’. &#32; submitted by &#32; /u/Dependent_Cap_456 [link] &#32; [comments],2025-12-01 14:01:09+00:00,https://www.reddit.com/r/UpliftingNews/comments/1pbdilq/englewood_woman_prepares_unreal_thanksgiving/,reddit_uplifting_news,other,0
https://www.bbc.com/news/articles/ceq1j474j29o#1,'Revolutionary' LBC and BBC radio host Brian Hayes dies at 87. The Australian helped to transform radio phone-ins with his conversational and confrontational style.,2025-12-01 13:43:27+00:00,https://www.bbc.com/news/articles/ceq1j474j29o?at_medium=RSS&at_campaign=rss,bbc_entertainment,gender & sexuality,0
t3_1pbcys6,"Over 120,000 home cameras hacked in South Korea for ‘sexploitation’ footage. &#32; submitted by &#32; /u/JackThaBongRipper [link] &#32; [comments]",2025-12-01 13:37:08+00:00,https://www.reddit.com/r/news/comments/1pbcys6/over_120000_home_cameras_hacked_in_south_korea/,reddit_news,other,0
https://www.bbc.com/news/articles/c1kpj910pr4o#1,Charli XCX and Raye to headline Reading and Leeds Festival 2026. It is the first time in 25 years the top of the festival bill will be exclusively British and Irish acts.,2025-12-01 13:16:20+00:00,https://www.bbc.com/news/articles/c1kpj910pr4o?at_medium=RSS&at_campaign=rss,bbc_entertainment,media & journalism,0
https://www.bbc.com/news/articles/cwyvjye18e9o#0,Jorja Smith's record label hits out at 'AI clone' song. The label claims Haven's dance hit I Run was made using AI trained on the award-winning singer's voice.,2025-12-01 13:12:08+00:00,https://www.bbc.com/news/articles/cwyvjye18e9o?at_medium=RSS&at_campaign=rss,bbc_technology,war & foreign policy,0
https://www.bbc.com/news/articles/ce8qv9319zlo#1,Virgin Media fined £24m for leaving vulnerable customers 'at risk of harm'. Ofcom has fined Virgin Media after an investigation found it had left thousands of vulnerable telecare customers at risk.,2025-12-01 12:57:53+00:00,https://www.bbc.com/news/articles/ce8qv9319zlo?at_medium=RSS&at_campaign=rss,bbc_business,media & journalism,0
t3_1pbbyoe,Trump reportedly gave Maduro ultimatum to relinquish power in Venezuela. &#32; submitted by &#32; /u/Brennenstein [link] &#32; [comments],2025-12-01 12:51:22+00:00,https://www.reddit.com/r/worldnews/comments/1pbbyoe/trump_reportedly_gave_maduro_ultimatum_to/,reddit_world_news,other,0
https://www.bbc.com/news/articles/ckg98544k55o#1,'Sweeter than a marmalade sandwich' - Paddington musical declared a hit by critics. The beloved bear stars in a new stage adaptation with songs written by McFly's Tom Fletcher.,2025-12-01 12:27:50+00:00,https://www.bbc.com/news/articles/ckg98544k55o?at_medium=RSS&at_campaign=rss,bbc_entertainment,entertainment,0
https://www.bbc.com/news/articles/c1dz4d64qqpo#1,Oil and gas firm plans to cut 100 offshore jobs. Harbour Energy has already reduced its onshore workforce by about 600 since 2023.,2025-12-01 12:00:10+00:00,https://www.bbc.com/news/articles/c1dz4d64qqpo?at_medium=RSS&at_campaign=rss,bbc_business,labor & work,0
t3_1pbawsb,"14-Year-Old Wins Prize For Origami That Can Hold 10,000 Times Its Own Weight. &#32; submitted by &#32; /u/sparki_black [link] &#32; [comments]",2025-12-01 11:58:08+00:00,https://www.reddit.com/r/UpliftingNews/comments/1pbawsb/14yearold_wins_prize_for_origami_that_can_hold/,reddit_uplifting_news,race & ethnicity,0
t3_1pbalsn,"Bangladesh’s ex-leader Hasina and niece, British lawmaker Tulip Siddiq, found guilty of corruption. &#32; submitted by &#32; /u/AudibleNod [link] &#32; [comments]",2025-12-01 11:40:52+00:00,https://www.reddit.com/r/news/comments/1pbalsn/bangladeshs_exleader_hasina_and_niece_british/,reddit_news,other,0
https://www.theguardian.com/environment/2025/dec/01/sri-lanka-braced-for-more-damage-after-torrential-rain-floods-kills-hundreds-across-asia,"Sri Lanka braced for more damage after torrential rain kills hundreds across Asia. Meanwhile, Iran grapples with one of worst droughts and temperatures fall 10C below normal in USMore heavy rainfall is expected in Sri Lanka in the coming days, likely resulting in further damage across the country. It comes after torrential rainfall in south-east Asia triggered catastrophic flash floods and landslides that have affected millions, killing more than 300 people in Indonesia and 160 in Thailand, with hundreds more still missing.Parts of North Sumatra, Indonesia, were hit with rainfall totals of 800mm over four days, with other areas also experiencing heavy rainfall. Continue reading...",2025-12-01 11:32:54+00:00,https://www.theguardian.com/environment/2025/dec/01/sri-lanka-braced-for-more-damage-after-torrential-rain-floods-kills-hundreds-across-asia,guardian_world,climate & environment,0
https://www.bbc.com/news/articles/c79x8285n29o#1,Pastor and new bride abducted in latest Nigeria attacks. A church is raided in central Nigeria and a wedding party in the mostly Muslim north.,2025-12-01 10:42:21+00:00,https://www.bbc.com/news/articles/c79x8285n29o?at_medium=RSS&at_campaign=rss,bbc_world,war & foreign policy,0
t3_1pb9dlu,EU tells Trump: You can’t pardon Putin for war crimes in Ukraine. &#32; submitted by &#32; /u/HydrolicKrane [link] &#32; [comments],2025-12-01 10:28:07+00:00,https://www.reddit.com/r/worldnews/comments/1pb9dlu/eu_tells_trump_you_cant_pardon_putin_for_war/,reddit_world_news,war & foreign policy,0
https://www.bbc.com/news/articles/c997n2zlegzo#1,Japanese 'One Piece' singer stopped mid-show after China-Japan feud. The sudden cancellation of Japanese events in Shanghai have sparked criticism and fanned nationalist sentiment.,2025-12-01 08:17:32+00:00,https://www.bbc.com/news/articles/c997n2zlegzo?at_medium=RSS&at_campaign=rss,bbc_world,technology & ai,0
https://www.bbc.com/news/articles/c62vk0p5dn5o#1,"Vapes still causing rubbish fires despite disposable ban, major waste firm says. Six months after disposable vape ban, waste firm calls for stronger measures to control them being disposed of incorrectly.",2025-12-01 06:53:48+00:00,https://www.bbc.com/news/articles/c62vk0p5dn5o?at_medium=RSS&at_campaign=rss,bbc_business,other,0
https://www.bbc.com/news/articles/cj01q6p7ndlo#1,"More than 120,000 home cameras hacked for 'sexploitation' footage. The cameras were located in private homes, karaoke rooms, a Pilates studio and a gynaecologist's clinic.",2025-12-01 06:04:53+00:00,https://www.bbc.com/news/articles/cj01q6p7ndlo?at_medium=RSS&at_campaign=rss,bbc_world,other,0
https://www.theguardian.com/global-development/2025/dec/01/global-health-hiv-aids-funding-cuts-infections-prevention,"Aid cuts have shaken HIV/Aids care to its core – and will mean millions more infections ahead. Reports highlight devastating impact of slashed funding, especially in parts of Africa, that could lead to 3.3m new HIV infections by 2030In Mozambique, a teenage rape victim sought care at a health clinic only to find it closed. In Zimbabwe, Aids-related deaths have risen for the first time in five years. In Ethiopia and the Democratic Republic of the Congo (DRC), patients with suspected HIV went undiagnosed due to test-kit stocks running out.Stories of the devastating impact of US, British and wider European aid cuts on the fight against HIV – particularly in sub-Saharan Africa – continue to mount as 2025 comes to an end, and are set out in a series of reports released in the past week. Continue reading...",2025-12-01 06:00:27+00:00,https://www.theguardian.com/global-development/2025/dec/01/global-health-hiv-aids-funding-cuts-infections-prevention,guardian_world,technology & ai,0
https://www.theguardian.com/world/2025/dec/01/i-have-been-defeated-hundreds-of-palestinians-face-eviction-from-east-jerusalem,"‘I have been defeated’: hundreds of Palestinians face eviction from East Jerusalem. Residents in Batn al-Hawa have all but given up hope and blame the Gaza war which, they say, has created ‘an atmosphere of hate’ towards themThe dome of the al-Aqsa mosque gleamed in the late afternoon autumnal sun as Zohair Rajabi looked out from his balcony towards the skyline of Jerusalem’s Old City. Christian pilgrims spilled out of buses, while observant Jewish worshippers gathered outside the gate to the Western Wall.New flags now fly a few metres from Rajabi’s home. Blue and white and bearing the Star of David, they mark where residents were evicted recently from their homes by Israeli police. After more than 20 years of activism, Rajabi knows his days in Batn al-Hawa, a predominantly Palestinian neighbourhood less than a mile south of the Old City, are almost certainly numbered. Continue reading...",2025-12-01 06:00:27+00:00,https://www.theguardian.com/world/2025/dec/01/i-have-been-defeated-hundreds-of-palestinians-face-eviction-from-east-jerusalem,guardian_world,war & foreign policy,0
t3_1pb42hq,"Investigators plead for tips after 3 children, 1 adult killed in shooting at child's birthday party. &#32; submitted by &#32; /u/igetproteinfartsHELP [link] &#32; [comments]",2025-12-01 05:05:43+00:00,https://www.reddit.com/r/news/comments/1pb42hq/investigators_plead_for_tips_after_3_children_1/,reddit_news,crime & safety,0
