id,text,created_at,link,source,topic,engagement
t3_1lejgtc,"‘HIV-ending’ drug could be made for just $25 per patient a year, say researchers. &#32; submitted by &#32; /u/ahothabeth [link] &#32; [comments]",2025-12-02 03:14:58.151071+00:00,https://www.reddit.com/r/UpliftingNews/comments/1lejgtc/hivending_drug_could_be_made_for_just_25_per/,reddit_uplifting_news,other,0
t3_1laej21,Scientists develop plastic that dissolves in seawater. &#32; submitted by &#32; /u/Regular_Eggplant_248 [link] &#32; [comments],2025-12-02 03:14:58.151071+00:00,https://www.reddit.com/r/UpliftingNews/comments/1laej21/scientists_develop_plastic_that_dissolves_in/,reddit_uplifting_news,other,0
"tag:blogger.com,1999:blog-2525761963252134386.post-2614342552940509599","What is Blockchain: Everything You Need to Know (2022). If you want to pay online, you need to register an account and provide credit card information. If you don't have a credit card, you can pay with bank transfer. With the rise of cryptocurrencies, these methods may become old.Imagine a world in which you can do transactions and many other things without having to give your personal information. A world in which you don’t need to rely on banks or governments anymore. Sounds amazing, right? That’s exactly what blockchain technology allows us to do.It’s like your computer’s hard drive. blockchain is a technology that lets you store data in digital blocks, which are connected together like links in a chain.&nbsp;Blockchain technology was originally invented in 1991 by two mathematicians, Stuart Haber and W. Scot Stornetta. They first proposed the system to ensure that timestamps could not be tampered with.A few years later, in 1998, software developer Nick Szabo proposed using a similar kind of technology to secure a digital payments system he called “Bit Gold.” However, this innovation was not adopted until Satoshi Nakamoto claimed to have invented the first Blockchain and Bitcoin.So, What is Blockchain?A blockchain is a distributed database shared between the nodes of a computer network. It saves information in digital format. Many people first heard of blockchain technology when they started to look up information about bitcoin.Blockchain is used in cryptocurrency systems to ensure secure, decentralized records of transactions.Blockchain allowed people to guarantee the fidelity and security of a record of data without the need for a third party to ensure accuracy.To understand how a blockchain works, Consider these basic steps:Blockchain collects information in “blocks”.A block has a storage capacity, and once it's used up, it can be closed and linked to a previously served block.Blocks form chains, which are called “Blockchains.”More information will be added to the block with the most content until its capacity is full. The process repeats itself.Each block in the chain has an exact timestamp and can't be changed.Let’s get to know more about the blockchain.How does blockchain work?Blockchain records digital information and distributes it across the network without changing it. The information is distributed among many users and stored in an immutable, permanent ledger that can't be changed or destroyed. That's why blockchain is also called ""Distributed Ledger Technology"" or DLT.Here’s how it works:Someone or a computer will transactsThe transaction is transmitted throughout the network.A network of computers can confirm the transaction.When it is confirmed a transaction is added to a blockThe blocks are linked together to create a history. And that’s the beauty of it! The process may seem complicated, but it’s done in minutes with modern technology. And because technology is advancing rapidly, I expect things to move even more quickly than ever.A new transaction is added to the system. It is then relayed to a network of computers located around the world. The computers then solve equations to ensure the authenticity of the transaction.Once a transaction is confirmed, it is placed in a block after the confirmation. All of the blocks are chained together to create a permanent history of every transaction.How are Blockchains used?Even though blockchain is integral to cryptocurrency, it has other applications. For example, blockchain can be used for storing reliable data about transactions. Many people confuse blockchain with cryptocurrencies like bitcoin and ethereum.Blockchain already being adopted by some big-name companies, such as Walmart, AIG, Siemens, Pfizer, and Unilever. For example, IBM's Food Trust uses blockchain to track food's journey before reaching its final destination.Although some of you may consider this practice excessive, food suppliers and manufacturers adhere to the policy of tracing their products because bacteria such as E. coli and Salmonella have been found in packaged foods. In addition, there have been isolated cases where dangerous allergens such as peanuts have accidentally been introduced into certain products.Tracing and identifying the sources of an outbreak is a challenging task that can take months or years. Thanks to the Blockchain, however, companies now know exactly where their food has been—so they can trace its location and prevent future outbreaks.Blockchain technology allows systems to react much faster in the event of a hazard. It also has many other uses in the modern world.What is Blockchain Decentralization?Blockchain technology is safe, even if it’s public. People can access the technology using an internet connection.Have you ever been in a situation where you had all your data stored at one place and that one secure place got compromised? Wouldn't it be great if there was a way to prevent your data from leaking out even when the security of your storage systems is compromised?Blockchain technology provides a wa",2025-12-02 03:14:56.580874+00:00,https://techncruncher.blogspot.com/2022/04/what-is-blockchain-everything-you-need.html,techcrunch,war & foreign policy,0
"tag:blogger.com,1999:blog-2525761963252134386.post-6302203471093077113","Ginger VS Grammarly: Which Grammar Checker is Better in (2022) ?. Ginger VS Grammarly: When it comes to grammar checkers, Ginger and Grammarly are two of the most popular choices on the market. This article aims to highlight the specifics of each one so that you can make a more informed decision about the one you'll use.What is Grammarly?If you are a writer, you must have heard of&nbsp; Grammarly before. Grammarly has over 10M users across the globe, it's probably the most popular AI writing enhancement tool, without a doubt. That's why there's a high chance that you already know about Grammarly.But today we are going to do a comparison between Ginger and Grammarly, So let's define Grammarly here. Like Ginger, Grammarly is an AI writing assistant that checks for grammatical errors, spellings, and punctuation. The free version covers the basics like identifying grammar and spelling mistakesWhile the Premium version offers a lot more functionality, it detects plagiarism in your content, suggests word choice, or adds fluency to it.Features of GrammarlyGrammarly detects basic to advance grammatical errors and also help you why this is an error and suggest to you how you can improve itCreate a personal dictionary&nbsp;Check to spell for American, British, Canadian, and Australian English.Understand inconsistencies.&nbsp;Detect unclear structure.&nbsp;Detect Plagiarism.Explore overuse of words and wordiness.&nbsp;Get to know about the improper tones.&nbsp;Discover the insensitive language aligns with your intent, audience, style, emotion, and more.What is Ginger&nbsp;Ginger is a writing enhancement tool that not only catches typos and grammatical mistakes but also suggests content improvements. As you type, it picks up on errors then shows you what’s wrong, and suggests a fix. It also provides you with synonyms and definitions of words and allows you to translate your text into dozens of languages.Ginger Software: Features &amp; BenefitsGinger's software helps you identify and correct common grammatical mistakes, such as consecutive nouns, or contextual spelling correction.The sentence rephrasing feature can help you convey your meaning perfectly.Ginger acts like a personal coach that helps you practice certain exercises based on your mistakes.The dictionary feature helps users understand the meanings of words.In addition, the program provides a text reader, so you can gauge your writing’s conversational tone.Ginger vs GrammarlyGrammarly and Ginger are two popular grammar checker software brands that help you to become a better writer. But if you’re undecided about which software to use, consider these differences:Grammarly only supports the English language while Ginger supports 40+ languages.Grammarly offers a wordiness feature while Ginger lacks a Wordiness feature.Grammarly shows an accuracy score while Ginger lacks an accuracy score feature.Grammarly has a plagiarism checker while ginger doesn't have such a feature.Grammarly can recognize an incorrect use of numbers while Ginger can’t recognize an incorrect use of numbers.Grammarly and Ginger both have mobile apps.Ginger and Grammarly offer monthly, quarterly, and annual plans.Grammarly allows you to check uploaded documents. while Ginger doesn't check uploaded documents.Grammarly Offers a tone suggestion feature while Ginger doesn't offer a tone suggestion feature.Ginger helps to translate documents into 40+ languages while Grammarly doesn't have a translation feature.Ginger Offers text to speech features while Grammarly doesn't have such features.Grammarly Score: 7/10Ginger:4/10So Grammarly&nbsp; wins here.Ginger VS Grammarly: Pricing DifferenceGinger offers a Premium subscription for 13.99$/month. it comes at $11.19/month for quarterly and $7.49/month for an annual subscription with 40$ off.On the other hand,&nbsp; Grammarly offers a Premium subscription for $30/month for a monthly plan&nbsp; $20/month for quarterly, and $12/month for an annual subscription.For companies with three or more employees, the Business plan costs $12.50/month for each member of your team.&nbsp;Ginger Wins HereGinger vs Grammarly – Pros and ConsGrammarly ProsOffers&nbsp; free versionAll-in-one tool (grammar checker + spell checker + punctuation checker)Allows you to edit a document without affecting the formatting.Style checker (paid version) Active and passive voice checkerPersonal dictionary&nbsp;Plagiarism checker (paid version)Available on all major devices and platformsFree mobile apps&nbsp;User-friendly interfaceBrowser extensions and MS word add-onsCan upload and download documentsGrammarly ConsSupports only English&nbsp;Customer support only via emailLimits to 150,000 wordsSubscription plans can be a bit pricey&nbsp;Doesn’t offer a free trialNo refund policyGinger ProsOffers free versionAll-in-one tool (grammar checker + spell checker + punctuation checker)Affordable Subscription plans (Additionals discounts are available)Active and passive voice changerTranslates documents in 40+ languages&nbsp;Personal dictionaryBrowser extension ava",2025-12-02 03:14:56.580874+00:00,https://techncruncher.blogspot.com/2022/02/ginger-vs-grammarly-which-grammar.html,techcrunch,war & foreign policy,0
"tag:blogger.com,1999:blog-2525761963252134386.post-1378858638659089188","Top 10 AI Tools That Will Transform Your Content Creation in 2025. Looking to level up your content creation game in 2025? You're in the right place! The digital landscape has evolved dramatically, and AI tools have become essential for creators who want to stay ahead of the curve. In this guide, I'll show you the top 10 AI tools that are revolutionizing content creation and making creators' lives easier.Why You Need These AI Tools in 2025Content creation has become more demanding than ever. Whether you're a social media influencer, marketer, or business owner, keeping up with the constant need for fresh, engaging content can be overwhelming. That's where AI tools come in – they're not just fancy tech, they're your secret weapon for creating better content faster.Let's Dive Into the Top 10 AI Tools for 20251. ChatGPT: Content Ideation and ScriptwritingWhat Makes It Special: ChatGPT has evolved into a comprehensive content creation assistant by combining advanced language understanding with specialized content optimization features. Its ability to generate, edit, and optimize content while maintaining brand voice and industry expertise makes it an essential tool for creators who need to produce high-quality written content at scale.Key Features:Advanced content generationSEO optimizationBrand voice maintenanceResearch capabilitiesMulti-format adaptationPricing:Free tier availablePlus: $20/monthPro: $200/monthPerfect For: Content writers, marketers, and businesses needing consistent, high-quality written content.2. Canva Magic Studio: Visual Design and Social Media Content CreationWhat Makes It Special: Canva Magic Studio has transformed the graphic design landscape by combining its user-friendly interface with powerful AI capabilities. The platform's ability to understand design principles and automatically generate on-brand content while maintaining professional aesthetics makes it accessible for beginners while providing enough sophistication for professional designers.Key Features:AI design generationBrand kit integrationMagic resizeAnimation toolsTemplate libraryPricing:Free tier availablePro: $6.50/user/monthTeams: $5/user/monthPerfect For: Small businesses, social media managers, and anyone needing quick, professional-looking designs.3. RunwayML : AI Video GeneratorWhat Makes It Special: RunwayML stands out as the ultimate video creation powerhouse by combining professional-grade effects with user-friendly AI technology. Its game-changing ability to manipulate video content – from changing weather effects with a text prompt to removing objects seamlessly in real-time – makes it indispensable for creators who want to produce high-quality video content without getting bogged down by technical complexities.Key Features:Advanced video generation &amp; editingReal-time visual effectsSmart motion trackingGreen screen effects without actual green screenAI-powered editing suitePricing:Free tier availableStandard: $12/monthPro: $28/monthUnlimited: $76/monthEnterprise: Custom PricePerfect For: Video creators, YouTubers, and social media managers who want to create professional-quality videos quickly. 4. MidJourney: AI Art GenerationWhat Makes It Special: Midjourney V6 has redefined AI image generation by mastering the nuances of professional photography and artistic style. Its ability to understand and execute complex creative directions – from specific lighting conditions to branded visual styles – while maintaining consistent quality across multiple generations makes it the go-to tool for creators who need stunning visuals that align perfectly with their brand identity.Key Features:Photorealistic image generationAdvanced style controlQuick generation timeCommercial usage rightsStrong community supportPricing:Basic: $10/monthStandard: $30/monthPro: $60/monthMega:&nbsp;$120/monthPerfect For: Social media managers, digital marketers, and anyone needing professional-quality visuals consistently.5. Synthesia: AI Avatar-Based Video CreationWhat Makes It Special: Synthesia has transformed video creation by making it possible to create professional-looking AI avatar videos in minutes. Its ability to generate natural-looking presentations in multiple languages with synchronized lip movements and gestures makes it invaluable for creators who need to produce video content at scale without the traditional filming process.Key Features:AI avatar Video creationMulti-language supportCustom avatar optionsProfessional templatesScript to video conversionPricing:Free tier availableStarter: $18/monthCreator: $64/monthEnterprise: Custom pricingPerfect For: Businesses and educators creating training videos, presentations, and multilingual content.6. Descript: Podcast and Video Editing with Transcription FeaturesWhat Makes It Special: Descript has transformed audio and video editing by making it as simple as editing a text document. Its innovative approach to media editing, combined with powerful AI features like automatic transcription and filler word removal, makes professional-quality editing acc",2025-12-02 03:14:56.580874+00:00,https://techncruncher.blogspot.com/2025/01/top-10-ai-tools-that-will-transform.html,techcrunch,climate & environment,0
"tag:blogger.com,1999:blog-2525761963252134386.post-8678580919580467236","LimeWire AI Studio Review 2023: Details, Pricing & Features. &nbsp;In the rapidly advancing landscape of AI technology and innovation, LimeWire emerges as a unique platform in the realm of generative AI tools. This platform not only stands out from the multitude of existing AI tools but also brings a fresh approach to content generation. LimeWire not only empowers users to create AI content but also provides creators with creative ways to share and monetize their creations.As we explore LimeWire, our aim is to uncover its features, benefits for creators, and the exciting possibilities it offers for AI content generation. This platform presents an opportunity for users to harness the power of AI in image creation, all while enjoying the advantages of a free and accessible service.Let's unravel the distinctive features that set LimeWire apart in the dynamic landscape of AI-powered tools, understanding how creators can leverage its capabilities to craft unique and engaging AI-generated images.IntroductionLimeWire, a name once associated with the notorious file-sharing tool from the 2000s, has undergone a significant transformation. The LimeWire we discuss today is not the file-sharing application of the past but has re-emerged as an entirely new entity—a cutting-edge AI content publishing platform.This revamped LimeWire invites users to register and unleash their creativity by crafting original AI content, which can then be shared and showcased on the LimeWire Studio. Notably, even acclaimed artists and musicians, such as Deadmau5, Soulja Boy, and Sean Kingston, have embraced this platform to publish their content in the form of NFT music, videos, and images.Beyond providing a space for content creation and sharing, LimeWire introduces monetization models to empower users to earn revenue from their creations. This includes avenues such as earning ad revenue and participating in the burgeoning market of Non-Fungible Tokens (NFTs). As we delve further, we'll explore these monetization strategies in more detail to provide a comprehensive understanding of LimeWire's innovative approach to content creation and distribution.LimeWire Studio welcomes content creators into its fold, providing a space to craft personalized AI-focused content for sharing with fans and followers. Within this creative hub, every piece of content generated becomes not just a creation but a unique asset—ownable and tradable. Fans have the opportunity to subscribe to creators' pages, immersing themselves in the creative journey and gaining ownership of digital collectibles that hold tradeable value within the LimeWire community. Notably, creators earn a 2.5% royalty each time their content is traded, adding a rewarding element to the creative process.The platform's flexibility is evident in its content publication options. Creators can choose to share their work freely with the public or opt for a premium subscription model, granting exclusive access to specialized content for subscribers.LimeWire AI StudioAs of the present moment, LimeWire focuses on AI Image Generation, offering a spectrum of creative possibilities to its user base. The platform, however, has ambitious plans on the horizon, aiming to broaden its offerings by introducing AI music and video generation tools in the near future. This strategic expansion promises creators even more avenues for expression and engagement with their audience, positioning LimeWire Studio as a dynamic and evolving platform within the realm of AI-powered content creation.AI Image Generation ToolsThe LimeWire AI image generation tool presents a versatile platform for both the creation and editing of images. Supporting advanced models such as Stable Diffusion 2.1, Stable Diffusion XL, and DALL-E 2, LimeWire offers a sophisticated toolkit for users to delve into the realm of generative AI art.Much like other tools in the generative AI landscape, LimeWire provides a range of options catering to various levels of complexity in image creation. Users can initiate the creative process with prompts as simple as a few words or opt for more intricate instructions, tailoring the output to their artistic vision. What sets LimeWire apart is its seamless integration of different AI models and design styles. Users have the flexibility to effortlessly switch between various AI models, exploring diverse design styles such as cinematic, digital art, pixel art, anime, analog film, and more. Each style imparts a distinctive visual identity to the generated AI art, enabling users to explore a broad spectrum of creative possibilities.The platform also offers additional features, including samplers, allowing users to fine-tune the quality and detail levels of their creations. Customization options and prompt guidance further enhance the user experience, providing a user-friendly interface for both novice and experienced creators. Excitingly, LimeWire is actively developing its proprietary AI model, signaling ongoing innovation and enhancements to its image generation capabilities. Thi",2025-12-02 03:14:56.580874+00:00,https://techncruncher.blogspot.com/2023/12/limewire-ai-studio-review-2023-details.html,techcrunch,war & foreign policy,0
