id,text,created_at,link,source,topic,engagement
https://www.theverge.com/?post_type=vm_stream&p=835433,"The Luigi Mangione legal saga. One year after the shooting of UnitedHealthcare CEO Brian Thompson in Manhattan, his alleged shooter, Luigi Mangione, faces charges of first and second degree murder, criminal possession of a weapon, stalking, forgery, and others.&#160; Mangione has become a folk hero to many online, amid debates over wealth inequality, healthcare affordability, and even content moderation. His [&#8230;]",2025-12-01 18:34:15-05:00,https://www.theverge.com/news/835433/the-luigi-mangione-legal-saga,the_verge,healthcare & wellbeing,0
https://www.theguardian.com/australia-news/2025/dec/02/nsw-conto-halve-power-and-top-speed-of-ebikes-as-rider-dies-in-collision-with-garbage-truck,"NSW considering plan to halve power and top speed of ebikes as rider dies in collision with garbage truck. Police plead with parents to buy only safe, unmodified ebikes as Christmas presentsFollow our Australia news live blog for latest updatesGet our breaking news email, free app or daily news podcastNew South Wales is considering a plan to halve the maximum power and top speed of ebikes, after a rider died in a collision with a garbage truck in central Sydney.NSW police also issued a plea for parents who were considering buying an ebike for their child as a Christmas present to stick to legal bikes rather than more powerful and dangerous models. Continue reading...",2025-12-01 23:27:58+00:00,https://www.theguardian.com/australia-news/2025/dec/02/nsw-conto-halve-power-and-top-speed-of-ebikes-as-rider-dies-in-collision-with-garbage-truck,guardian_world,technology & ai,0
t3_1pbsc38,Canada reaches deal to join EU military procurement fund. &#32; submitted by &#32; /u/Street_Anon [link] &#32; [comments],2025-12-01 23:23:57+00:00,https://www.reddit.com/r/worldnews/comments/1pbsc38/canada_reaches_deal_to_join_eu_military/,reddit_world_news,war & foreign policy,0
https://www.bbc.com/news/articles/c4gpr04mkd0o#0,"British Fashion Awards: Baby bumps and Traitors stars. Designers, models and celebrities gathered at the Royal Albert Hall for the glitzy ceremony.",2025-12-01 23:15:00+00:00,https://www.bbc.com/news/articles/c4gpr04mkd0o?at_medium=RSS&at_campaign=rss,bbc_entertainment,war & foreign policy,0
https://www.theverge.com/?p=835453,"OpenAI just made another circular deal. OpenAI announced an ownership stake in the private equity investment firm Thrive Holdings, whose parent company, Thrive Capital, is one of the main investors in, you guessed it, OpenAI. While OpenAI did not spend money on the ownership stake, according to an anonymous source cited by The Financial Times, the company announced it would provide [&#8230;]",2025-12-01 18:12:24-05:00,https://www.theverge.com/news/835453/openai-ownership-thrive-holdings,the_verge,technology & ai,0
https://www.japantimes.co.jp/article/634475/,Hong Kong finds 'substandard' netting around complex contributed to deadly blaze. The staggering death toll has prompted outpourings of grief across the Chinese finance hub.,2025-12-02 08:00:00+09:00,https://www.japantimes.co.jp/news/2025/12/02/asia-pacific/crime-legal/hong-kong-suspects-fire-death/,japan_times,economics,0
https://www.theverge.com/?p=835403,"Here are 25 great laptop deals you can still grab before Cyber Monday ends. We’re well into Cyber Monday, and many of the same laptop deals that impressed us during Black Friday and the following weekend are still here. In fact, not only can you still save hundreds on great notebooks from Microsoft, Apple, Razer, HP, and more, but we’ve got some new accessory deals worth checking out. If [&#8230;]",2025-12-01 17:56:00-05:00,https://www.theverge.com/gadgets/835403/cyber-monday-laptop-deals-macbook-chromebook-surface-2025,the_verge,technology & ai,0
https://www.japantimes.co.jp/article/634480/,Luigi Mangione tries to toss gun and manifesto evidence from murder case. The 27-year-old is accused of shooting and killing UnitedHealth Group executive Brian Thompson outside a Manhattan hotel one year ago this week.,2025-12-02 07:56:00+09:00,https://www.japantimes.co.jp/news/2025/12/02/world/crime-legal/luigi-mangione-gun-manifesto-murder/,japan_times,crime & safety,0
https://www.bbc.com/news/articles/c7vmn61l75ro#1,Trump releases fraudster executive days into prison sentence. The former investment manager was convicted of defrauding thousands of investors.,2025-12-01 22:51:58+00:00,https://www.bbc.com/news/articles/c7vmn61l75ro?at_medium=RSS&at_campaign=rss,bbc_world,other,0
https://www.aljazeera.com/?t=1764624761,"Zelenskyy says territorial concessions remain Ukraine’s ‘biggest challenge’. US special envoy Steve Witkoff will meet Russian President Vladimir Putin on Tuesday, the Kremlin has confirmed.",2025-12-01 22:50:36+00:00,https://www.aljazeera.com/news/2025/12/1/zelenskyy-says-territorial-concessions-remain-ukraines-biggest-challenge?traffic_source=rss,al_jazeera,war & foreign policy,0
https://www.theguardian.com/uk-news/2025/dec/01/children-reaching-uk-by-small-boat-face-sim-card-mouth-searches,Children reaching UK by small boat face sim card mouth searches. Home Office accused of putting criminality before dignity with rule seeking intelligence on people-smugglersChildren who arrive in the UK on small boats could be searched to check if they are concealing phone sim cards in their mouths under new Home Office rules.New measures will allow immigration enforcement officials to seize phones at the border if it is believed they contain useful intelligence about people-smugglers. Continue reading...,2025-12-01 22:30:09+00:00,https://www.theguardian.com/uk-news/2025/dec/01/children-reaching-uk-by-small-boat-face-sim-card-mouth-searches,guardian_politics,technology & ai,0
t3_1pbqwcd,Son of senior Hamas official Ghazi Hamad killed fleeing Rafah tunnel - report. &#32; submitted by &#32; /u/barsik_ [link] &#32; [comments],2025-12-01 22:25:05+00:00,https://www.reddit.com/r/worldnews/comments/1pbqwcd/son_of_senior_hamas_official_ghazi_hamad_killed/,reddit_world_news,other,0
https://www.bbc.com/news/articles/ckgz28zyp8vo#1,Drug lord El Chapo's son pleads guilty in US drug trafficking case. Joaquín Guzmán López's guilty plea comes after US prosecutors pledged last May to not pursue the death penalty against him.,2025-12-01 22:18:26+00:00,https://www.bbc.com/news/articles/ckgz28zyp8vo?at_medium=RSS&at_campaign=rss,bbc_world,technology & ai,0
https://www.bbc.com/news/articles/cx2dgp8mvmno#0,"Honduras presidential candidates locked in 'technical tie', official says. Right-wing candidate Nasry Asfura leads former TV host Salvador Nasralla by just 515 votes, according to country's electoral authority.",2025-12-01 22:15:45+00:00,https://www.bbc.com/news/articles/cx2dgp8mvmno?at_medium=RSS&at_campaign=rss,bbc_world,technology & ai,0
https://www.aljazeera.com/?t=1764626300,What does Netanyahu’s pardon request mean for Israel’s future?. There are divided reactions to the Israeli prime minister&#039;s pardon request to President Isaac Herzog.,2025-12-01 22:15:42+00:00,https://www.aljazeera.com/video/inside-story/2025/12/1/what-does-netanyahus-pardon-request-mean-for-israels-future?traffic_source=rss,al_jazeera,war & foreign policy,0
https://www.aljazeera.com/?t=1764624574,"US Senator Chuck Schumer receives bomb threats at three offices in New York. Threatening emails say &#039;2020 election was rigged&#039;, echoing Trump&#039;s false claims about the vote.",2025-12-01 22:14:54+00:00,https://www.aljazeera.com/news/2025/12/1/senator-chuck-schumer-receives-bomb-threats-at-three-regional-offices-in-ny?traffic_source=rss,al_jazeera,technology & ai,0
https://www.theguardian.com/world/2025/dec/01/trump-maduro-ultimatum-relinquish-power-venezuela,"Trump reportedly gave Maduro ultimatum to relinquish power in Venezuela. US president sent a ‘blunt message’ to his South American counterpart, sources sayAnalysis: Trump’s pardon of Honduras’s ex-president shows counter-drug effort is ‘based on lies and hypocrisy’How US campaign against Venezuela has unfoldedUS politics – live updatesDonald Trump reportedly gave Nicolás Maduro an ultimatum to relinquish power immediately during their recent call – but Venezuela’s authoritarian leader declined, demanding a “global amnesty” for himself and allies.On Sunday, the US president confirmed the call had taken place, telling reporters: “I wouldn’t say it went well or badly, it was a phone call.” Continue reading...",2025-12-01 22:00:25+00:00,https://www.theguardian.com/world/2025/dec/01/trump-maduro-ultimatum-relinquish-power-venezuela,guardian_world,technology & ai,0
https://www.bbc.com/news/articles/c33mz477p4po#0,"Mangione in court as lawyers seek to rule out notebook, gun and other key evidence. A legal expert explains how the defence could stand to gain even if their longshot bid fails this week.",2025-12-01 21:56:30+00:00,https://www.bbc.com/news/articles/c33mz477p4po?at_medium=RSS&at_campaign=rss,bbc_world,technology & ai,0
t3_1pbpvwy,Pope Leo Tells Students 'Don't Ask AI to Do Your Homework' During Virtual Appearance at Youth Conference. &#32; submitted by &#32; /u/ubcstaffer123 [link] &#32; [comments],2025-12-01 21:45:55+00:00,https://www.reddit.com/r/worldnews/comments/1pbpvwy/pope_leo_tells_students_dont_ask_ai_to_do_your/,reddit_world_news,technology & ai,0
https://www.bbc.com/news/articles/cp8zv1gr0z9o#0,"Car-sharing company ZipCar to end UK operations. ZipCar, which has more than 600,000 UK members, temporarily suspends new bookings on its platform.",2025-12-01 21:40:41+00:00,https://www.bbc.com/news/articles/cp8zv1gr0z9o?at_medium=RSS&at_campaign=rss,bbc_business,business & corporate,0
https://www.aljazeera.com/?t=1764619727,Pope Leo urges unity on day two of Lebanon visit. Martyrs’ Square became the symbolic backdrop for interfaith solidarity amid the country’s political paralysis.,2025-12-01 21:31:33+00:00,https://www.aljazeera.com/news/2025/12/1/pope-leo-urges-unity-on-day-two-of-lebanon-visit?traffic_source=rss,al_jazeera,technology & ai,0
https://www.aljazeera.com/?t=1764617772,"Trump to host Rwanda, DRC leaders at White House to sign peace agreement. Meeting to build on earlier agreements to end fighting in eastern DRC, which has persisted throughout talks.",2025-12-01 21:25:11+00:00,https://www.aljazeera.com/news/2025/12/1/trump-to-host-rwanda-drc-leaders-at-white-house-to-sign-peace-agreement?traffic_source=rss,al_jazeera,government,0
t3_1pboew6,Son of drug kingpin ‘El Chapo’ pleads guilty in US drug trafficking case in deal with prosecutors. &#32; submitted by &#32; /u/Immediate-Link490 [link] &#32; [comments],2025-12-01 20:49:50+00:00,https://www.reddit.com/r/news/comments/1pboew6/son_of_drug_kingpin_el_chapo_pleads_guilty_in_us/,reddit_news,media & journalism,0
https://www.aljazeera.com/?t=1764621469,Hong Kong says deficient netting spread deadly Wang Fuk blaze. Police say substandard fire-resistant netting was responsible for spreading the fire at Hong Kong’s Wang Fuk Court.,2025-12-01 20:40:57+00:00,https://www.aljazeera.com/video/newsfeed/2025/12/1/hong-kong-says-deficient-netting-spread-deadly-wang-fuk-blaze?traffic_source=rss,al_jazeera,crime & safety,0
https://www.bbc.com/news/articles/c1m8nmx75evo#0,"Zelensky says Ukraine territory 'most difficult' issue, as US envoy prepares to meet Putin. US envoy Steve Witkoff and Donald Trump's adviser and son-in-law Jared Kushner will meet Vladimir Putin on Tuesday.",2025-12-01 20:29:23+00:00,https://www.bbc.com/news/articles/c1m8nmx75evo?at_medium=RSS&at_campaign=rss,bbc_world,war & foreign policy,0
https://www.bbc.com/news/articles/c5yd91y2250o#1,South African radio DJ among five charged over Russia recruitment plot. The group has been charged under a law which prohibits people from joining foreign armies.,2025-12-01 20:20:47+00:00,https://www.bbc.com/news/articles/c5yd91y2250o?at_medium=RSS&at_campaign=rss,bbc_world,war & foreign policy,0
t3_1pbnn9l,Federal review finds 44% of US trucking schools don't comply with government rules. &#32; submitted by &#32; /u/Immediate-Link490 [link] &#32; [comments],2025-12-01 20:20:37+00:00,https://www.reddit.com/r/news/comments/1pbnn9l/federal_review_finds_44_of_us_trucking_schools/,reddit_news,government,0
t3_1pbnmoo,Canadian air passenger traffic to U.S. down for 9th consecutive month. &#32; submitted by &#32; /u/Immediate-Link490 [link] &#32; [comments],2025-12-01 20:20:01+00:00,https://www.reddit.com/r/worldnews/comments/1pbnmoo/canadian_air_passenger_traffic_to_us_down_for_9th/,reddit_world_news,technology & ai,0
https://www.aljazeera.com/?t=1764608679,"The illusion of Western peacemaking. When peacemaking ignores truth, it risks turning war crimes into opinion and genocide into a story with two sides.",2025-12-01 20:09:34+00:00,https://www.aljazeera.com/opinions/2025/12/1/the-illusion-of-western-peacemaking?traffic_source=rss,al_jazeera,war & foreign policy,0
https://www.aljazeera.com/?t=1764612627,Cameroon’s opposition leader Anicet Ekane dies in military detention. Veteran politician Anicet Ekane&#039;s death sparks accusations of medical neglect and intensifies post-election crisis.,2025-12-01 20:08:19+00:00,https://www.aljazeera.com/news/2025/12/1/cameroons-opposition-leader-anicet-ekane-dies-in-military-detention?traffic_source=rss,al_jazeera,war & foreign policy,0
https://www.bbc.com/news/videos/clyk1g9e144o#2,"Is the US preparing for war with Venezuela?. BBC Verify has tracked US assets in the Caribbean Sea, after military strikes on suspected Venezuelan drug boats.",2025-12-01 20:07:42+00:00,https://www.bbc.com/news/videos/clyk1g9e144o?at_medium=RSS&at_campaign=rss,bbc_world,war & foreign policy,0
https://www.theguardian.com/australia-news/2025/dec/02/scathing-jobs-for-mates-review-finds-appointments-to-government-boards-routinely-abused,"Scathing ‘jobs for mates’ review finds appointments to government boards routinely abused. A report by Lynelle Briggs says placements ‘look like nepotism’ and are undermining confidence in governmentFollow our Australia news live blog for latest updatesGet our breaking news email, free app or daily news podcastThe major parties have abused appointments to government boards so routinely that the public fears being lumped with “overpaid political hacks” who cannot do important jobs properly, a scathing report to the Albanese government has found.But Labor is set to eschew a series of recommendations from former public service commissioner Lynelle Briggs’ long-anticipated jobs for mates review – finally set to be released on Tuesday, 18 months after it was completed. Continue reading...",2025-12-01 20:00:04+00:00,https://www.theguardian.com/australia-news/2025/dec/02/scathing-jobs-for-mates-review-finds-appointments-to-government-boards-routinely-abused,guardian_world,technology & ai,0
https://www.theguardian.com/world/2025/dec/01/iran-sentences-award-winning-director-prison-jafar-panahi,"Iran sentences award-winning director Jafar Panahi to year in prison for ‘propaganda activities’. Iranian film-maker won Cannes film festival’s Palme D’Or prize earlier this year for It Was Just an AccidentIran has sentenced the Palme d’Or-winning film-maker Jafar Panahi in absentia to one year in prison and a travel ban over “propaganda activities” against the country.The sentence includes a two-year ban on leaving Iran and prohibition of Panahi from membership of any political or social groups, his lawyer Mostafa Nili said, adding that they would file an appeal. Continue reading...",2025-12-01 19:59:59+00:00,https://www.theguardian.com/world/2025/dec/01/iran-sentences-award-winning-director-prison-jafar-panahi,guardian_world,war & foreign policy,0
https://www.bbc.com/news/articles/cvg81p61dnmo#1,"Three children among four killed in shooting at children's birthday party in California. Officials say 11 others are injured in what they believe is a ""targeted"" shooting at a children's birthday party.",2025-12-01 19:56:53+00:00,https://www.bbc.com/news/articles/cvg81p61dnmo?at_medium=RSS&at_campaign=rss,bbc_world,crime & safety,0
https://www.aljazeera.com/?t=1764617862,Zelenskyy says US peace plan ‘looks better’ with new revisions. Ukrainian President Volodymyr Zelenskyy spoke optimistically about revising the plan to end its war with Russia.,2025-12-01 19:56:22+00:00,https://www.aljazeera.com/video/newsfeed/2025/12/1/zelenskyy-says-us-peace-plan-looks-better-with-new-revisions?traffic_source=rss,al_jazeera,war & foreign policy,0
https://www.theguardian.com/business/2025/dec/01/obr-chair-inquiry-early-release-rachel-reeves-budget-richard-hughes,"OBR chair quits after inquiry into early release of budget document. Richard Hughes takes ‘full responsibility’ for watchdog error as Starmer attempts to secure chancellor’s positionThe chair of the Office for Budget Responsibility has resigned after a damning internal inquiry into the leak that threw Rachel Reeves’s budget into chaos described it as the “worst failure” in the institution’s history.The departure of Richard Hughes, who said he took “full responsibility” for the watchdog’s failure to handle sensitive information, dragged the rolling recriminations over the budget into a fifth day. Continue reading...",2025-12-01 19:48:57+00:00,https://www.theguardian.com/business/2025/dec/01/obr-chair-inquiry-early-release-rachel-reeves-budget-richard-hughes,guardian_politics,technology & ai,0
t3_1pbmj6f,New German tribunal launched for Nazi-looted art cases. &#32; submitted by &#32; /u/AudibleNod [link] &#32; [comments],2025-12-01 19:38:47+00:00,https://www.reddit.com/r/news/comments/1pbmj6f/new_german_tribunal_launched_for_nazilooted_art/,reddit_news,other,0
https://www.bbc.com/news/articles/cd74v35p77jo#0,OBR head resigns over Budget day publishing error. The government's official forecaster inadvertently published a crucial Budget document early.,2025-12-01 19:38:33+00:00,https://www.bbc.com/news/articles/cd74v35p77jo?at_medium=RSS&at_campaign=rss,bbc_politics,government,0
https://www.theguardian.com/education/2025/dec/01/uk-agreement-rejoin-erasmus-eu-student-exchange-scheme-brexit,"UK aims to secure agreement to rejoin Erasmus student exchange scheme. Britain quit EU programme after Brexit, when Boris Johnson claimed it did not offer good value for moneyThe UK is hoping to secure an agreement within weeks to rejoin the EU’s flagship student mobility programme, as part of a drive to pursue closer relations with Brussels after a setback on defence.Negotiators are aiming to finalise a deal by January that would allow the UK to participate in Erasmus from 2027 onwards, according to two UK and EU officials. Continue reading...",2025-12-01 19:37:48+00:00,https://www.theguardian.com/education/2025/dec/01/uk-agreement-rejoin-erasmus-eu-student-exchange-scheme-brexit,guardian_world,war & foreign policy,0
https://www.aljazeera.com/?t=1764617209,Palestine wins first match over Qatar at FIFA Arab Cup. Palestine defeated host nation Qatar 1-0 in the team’s first match of the 2025 Arab Cup.,2025-12-01 19:33:36+00:00,https://www.aljazeera.com/video/newsfeed/2025/12/1/palestine-wins-first-match-over-qatar-at-fifa-arab-cup?traffic_source=rss,al_jazeera,sports,0
https://www.bbc.com/news/articles/c98ng15qmy9o#0,Maccabi fan ban evidence 'changed to fit decision'. West Midlands Police chiefs are providing evidence to MPs about the decision to ban Israeli fans.,2025-12-01 19:30:54+00:00,https://www.bbc.com/news/articles/c98ng15qmy9o?at_medium=RSS&at_campaign=rss,bbc_politics,war & foreign policy,0
https://www.aljazeera.com/?t=1764616659,How Ukraine turned into the world’s drone testing lab. The use of drones in the Russia-Ukraine war has revolutionised an industry of death and destruction.,2025-12-01 19:20:22+00:00,https://www.aljazeera.com/video/the-take-2/2025/12/1/aje-onl-aj_tt_ukr_futuredronewars_av_v1-011225?traffic_source=rss,al_jazeera,war & foreign policy,0
https://www.bbc.com/news/articles/cewjg272dq9o#0,"Appeals court disqualifies ex-Trump lawyer Alina Habba as New Jersey prosecutor. An appeals court disqualified Alina Habba, Trump's former personal attorney, from serving as US Attorney for New Jersey.",2025-12-01 19:15:59+00:00,https://www.bbc.com/news/articles/cewjg272dq9o?at_medium=RSS&at_campaign=rss,bbc_world,technology & ai,0
https://www.bbc.com/news/articles/cz0n1rm95yxo#1,"Dozens missing as deadly landslide hits two boats in Peru. Rescue efforts in Peru's central Ucayali region are being hindered by strong currents on the river, one official said.",2025-12-01 19:13:10+00:00,https://www.bbc.com/news/articles/cz0n1rm95yxo?at_medium=RSS&at_campaign=rss,bbc_world,technology & ai,0
https://www.aljazeera.com/?t=1764609127,"ECOWAS delegation visits Guinea-Bissau for talks after military coup. Nigeria authorises protection for Guinea-Bissau opposition leader Dias da Costa, citing &#039;imminent threat to his life&#039;.",2025-12-01 19:13:09+00:00,https://www.aljazeera.com/news/2025/12/1/ecowas-delegation-visits-guinea-bissau-for-talks-after-military-coup?traffic_source=rss,al_jazeera,war & foreign policy,0
https://www.theguardian.com/politics/2025/dec/01/attorney-general-urges-nigel-farage-to-apologise-to-classmates-over-alleged-racism-and-antisemitism,"Attorney general urges Nigel Farage to apologise over alleged racism and antisemitism. Exclusive: Richard Hermer, a senior Jewish minister, says Reform leader ‘clearly deeply hurt’ many people with his alleged behaviourThe UK’s top law officer, one of the most senior Jewish government ministers, has urged Nigel Farage to apologise to school contemporaries who claim the Reform UK leader racially abused them while at school.The attorney general, Richard Hermer, said Farage had “clearly deeply hurt” many people judging by their descriptions of his behaviour, and that his “constantly changing” denials had been unconvincing. Continue reading...",2025-12-01 19:07:43+00:00,https://www.theguardian.com/politics/2025/dec/01/attorney-general-urges-nigel-farage-to-apologise-to-classmates-over-alleged-racism-and-antisemitism,guardian_politics,technology & ai,0
https://www.aljazeera.com/?t=1764599463,Trump administration discusses Venezuela amid military build-up concerns. US military build-up near Venezuela raises fear of invasion; White House defends kill order of alleged drug smugglers.,2025-12-01 19:06:58+00:00,https://www.aljazeera.com/news/2025/12/1/trump-administration-discusses-venezuela-amid-military-build-up-concerns?traffic_source=rss,al_jazeera,war & foreign policy,0
t3_1pblih7,Canada clinches deal to join Europe’s €150B defense scheme. &#32; submitted by &#32; /u/OkFix4074 [link] &#32; [comments],2025-12-01 19:01:24+00:00,https://www.reddit.com/r/worldnews/comments/1pblih7/canada_clinches_deal_to_join_europes_150b_defense/,reddit_world_news,other,0
https://www.bbc.com/news/videos/cwyvgq7224go#2,Australia's social media ban explained... in 60 seconds. Australia is banning social media for everyone under the age 16 - but will it actually work? Here's everything you need to know.,2025-12-01 19:00:30+00:00,https://www.bbc.com/news/videos/cwyvgq7224go?at_medium=RSS&at_campaign=rss,bbc_world,technology & ai,0
https://www.theguardian.com/commentisfree/2025/dec/01/the-guardian-view-on-obr-v-the-treasury-ministers-have-embraced-the-theatre-of-errors,"The Guardian view on OBR v the Treasury: ministers have embraced the theatre of errors | Editorial. The government is trapped between Labour’s instincts and bond traders’ demands. Sensible fixes exist, but require imagination ministers have yet shownThe confected frenzy splashed across the morning front pages from the Telegraph to the Mail is remarkable mostly for its absurdity. An outrage machine has decided that a forecast of a few billion pounds in a model that makes projections about trillions of pounds of taxes and spending is the lie of the century. We can’t predict the weather next year, but apparently the public finances in 2029 can be judged with pinpoint accuracy. That’s why the headlines about “holes” and “sleaze probes” are a joke. It is theatre, but it is bad theatre.The Office for Budget Responsibility (OBR) possesses no great moral or predictive authority. Yet many of its accusers and defenders treat it as an all‑seeing oracle. In fact, the OBR, to its credit, admits that its medium-term projections are frequently wrong. It often wrongly estimates inflation and productivity, and has had its assumptions upended by unforeseen events. The OBR’s 2019 five-year forecast undershot actual GDP growth by £200bn. Given this degree of error, treating a projected current budget balance of £20bn in 2029-30 as a hard fact is deeply unserious.Do you have an opinion on the issues raised in this article? If you would like to submit a response of up to 300 words by email to be considered for publication in our letters section, please click here. Continue reading...",2025-12-01 18:56:32+00:00,https://www.theguardian.com/commentisfree/2025/dec/01/the-guardian-view-on-obr-v-the-treasury-ministers-have-embraced-the-theatre-of-errors,guardian_politics,climate & environment,0
