id,text,created_at,link,source,topic,engagement
t3_1pauem4,"Russia must be ‘part of the equation,’ Rubio says, after US-Ukraine talks on plan to end war. &#32; submitted by &#32; /u/GeneReddit123 [link] &#32; [comments]",2025-11-30 21:43:50+00:00,https://www.reddit.com/r/worldnews/comments/1pauem4/russia_must_be_part_of_the_equation_rubio_says/,reddit_world_news,war & foreign policy,0
https://www.theguardian.com/world/2025/nov/30/african-leaders-push-for-recognition-of-colonial-crimes-and-reparations,"African leaders push for recognition of colonial crimes and reparations. Algerian foreign minister says African countries and peoples continue to pay a heavy price for colonialismAfrican leaders are pushing to have colonial-era crimes recognised, criminalised and addressed through reparations.At a conference in the Algerian capital, Algiers, diplomats and leaders convened to advance an African Union resolution passed at a meeting earlier this year calling for justice and reparations for victims of colonialism. Continue reading...",2025-11-30 21:40:48+00:00,https://www.theguardian.com/world/2025/nov/30/african-leaders-push-for-recognition-of-colonial-crimes-and-reparations,guardian_world,crime & safety,0
https://www.bbc.com/news/articles/c79x8x82gy4o#1,"Dignitas founder dies by assisted suicide aged 92, group says. Ludwig Minelli founded the group in 1998, which has since helped thousands of people to die.",2025-11-30 21:18:34+00:00,https://www.bbc.com/news/articles/c79x8x82gy4o?at_medium=RSS&at_campaign=rss,bbc_world,other,0
t3_1patfm7,Jacob Zuma’s daughter resigns amid claims South Africans tricked to fight for Russia. &#32; submitted by &#32; /u/AudibleNod [link] &#32; [comments],2025-11-30 21:04:12+00:00,https://www.reddit.com/r/news/comments/1patfm7/jacob_zumas_daughter_resigns_amid_claims_south/,reddit_news,war & foreign policy,0
https://www.japantimes.co.jp/article/634431/,"Yumi Matsutoya’s human touch in an AI age. Even as she experiments with AI, Yumi Matsutoya returns to the craft, memories and instincts that shaped her long career.",2025-12-01 06:00:00+09:00,https://www.japantimes.co.jp/culture/2025/12/01/music/yumi-matsutoya-ai-music/,japan_times,technology & ai,0
t3_1pasvug,17 S. Koreans nabbed in Cambodia in joint crackdown on no-show scam ring. &#32; submitted by &#32; /u/Anforatioi [link] &#32; [comments],2025-11-30 20:42:05+00:00,https://www.reddit.com/r/worldnews/comments/1pasvug/17_s_koreans_nabbed_in_cambodia_in_joint/,reddit_world_news,other,0
https://www.theverge.com/?p=834064,"This Cyber Monday deal on smart glasses was too good for my husband to pass up. The last thing I need is a new Amazon Echo smart speaker. As The Verge’s smart home reviewer, I currently have a dozen scattered around my home for testing. But when Amazon’s Echo Frames smart glasses went on sale for $115 for Cyber Monday, down from $300, it was an offer my husband couldn’t refuse. [&#8230;]",2025-11-30 15:00:00-05:00,https://www.theverge.com/gadgets/834064/echo-frames-cyber-monday-deal-echo-spot,the_verge,housing,0
t3_1parpdk,Kazakhstan Tells Ukraine To Stop Attacking Terminal After Oil Exports Halted. &#32; submitted by &#32; /u/Human-Entrepreneur77 [link] &#32; [comments],2025-11-30 19:55:05+00:00,https://www.reddit.com/r/worldnews/comments/1parpdk/kazakhstan_tells_ukraine_to_stop_attacking/,reddit_world_news,war & foreign policy,0
t3_1paqwby,The Washington Post: Trump administration to increase pressure on Zelenskyy next week to reach a deal on the war. &#32; submitted by &#32; /u/archi-mature [link] &#32; [comments],2025-11-30 19:22:57+00:00,https://www.reddit.com/r/worldnews/comments/1paqwby/the_washington_post_trump_administration_to/,reddit_world_news,war & foreign policy,0
https://www.theverge.com/?p=834099,"My favorite snore-blocking sleepbuds are down to a new low price for Cyber Monday. Anker’s seriously small Soundcore Sleep A20 sleepbuds can be nabbed for $108 right now at Amazon, their best price since they launched on Kickstarter at $90 last year. They normally sell for $179.99, making this a standout deal for a pair of ultra-tiny sleep buds that I barely notice as I drift off to the [&#8230;]",2025-11-30 14:18:09-05:00,https://www.theverge.com/gadgets/834099/anker-soundcore-sleep-a20-snore-blocking-earbuds-lowest-price-cyber-monday,the_verge,technology & ai,0
t3_1paqog9,"National Guard shooting suspect radicalized in US, homeland secretary says. &#32; submitted by &#32; /u/PinkoMarxistCommie [link] &#32; [comments]",2025-11-30 19:14:08+00:00,https://www.reddit.com/r/news/comments/1paqog9/national_guard_shooting_suspect_radicalized_in_us/,reddit_news,crime & safety,0
https://www.bbc.com/news/articles/cvg81p61dnmo#1,"Three children among four killed in shooting at 'birthday party' in California. Officials say 11 others are injured in what they believe is a ""targeted"" shooting at a children's birthday party.",2025-11-30 19:10:41+00:00,https://www.bbc.com/news/articles/cvg81p61dnmo?at_medium=RSS&at_campaign=rss,bbc_world,crime & safety,0
t3_1paqhlg,Jeffrey Bostic sworn in as the second President of Barbados. &#32; submitted by &#32; /u/GavinGenius [link] &#32; [comments],2025-11-30 19:06:34+00:00,https://www.reddit.com/r/news/comments/1paqhlg/jeffrey_bostic_sworn_in_as_the_second_president/,reddit_news,politics,0
https://www.theguardian.com/commentisfree/picture/2025/nov/30/ella-baron-your-party-conference-name-cartoon,Ella Baron on infighting at the Your Party conference – cartoon. Continue reading...,2025-11-30 19:03:40+00:00,https://www.theguardian.com/commentisfree/picture/2025/nov/30/ella-baron-your-party-conference-name-cartoon,guardian_politics,other,0
https://www.theguardian.com/politics/2025/nov/30/your-party-members-vote-to-make-name-permanent-at-tense-first-conference,"Your Party members vote to make name permanent at tense first conference. Liverpool gathering lays bare bitter divisions within new party founded by Jeremy Corbyn and Zarah SultanaThe new leftwing party founded by Jeremy Corbyn and Zarah Sultana will be called Your Party after a vote by members, but its weekend conference laid bare bitter divisions.Just over 37% of members voted for the name Your Party, provisionally adopted when it was launched earlier this year, to become permanent. The votes for others on the shortlist were 25.23% to be called For The Many, 25.23% for Popular Alliance and 14.19% for Our Party. Continue reading...",2025-11-30 19:01:04+00:00,https://www.theguardian.com/politics/2025/nov/30/your-party-members-vote-to-make-name-permanent-at-tense-first-conference,guardian_politics,technology & ai,0
t3_1paqcef,Oil terminal in Russia's Novorossiysk halts operations after sea drone attack. &#32; submitted by &#32; /u/DoremusJessup [link] &#32; [comments],2025-11-30 19:00:57+00:00,https://www.reddit.com/r/worldnews/comments/1paqcef/oil_terminal_in_russias_novorossiysk_halts/,reddit_world_news,war & foreign policy,0
https://www.aljazeera.com/?t=1764527742,Merino strikes to earn Arsenal bruising 1-1 draw against 10-man Chelsea. Mikel Merino cancels out Trevoh Chalobah&#039;s opener to spare the Premier League leaders&#039; blushes at Stamford Bridge.,2025-11-30 18:56:03+00:00,https://www.aljazeera.com/sports/2025/11/30/merino-strikes-to-earn-arsenal-bruising-1-1-draw-at-10-man-chelsea?traffic_source=rss,al_jazeera,technology & ai,0
t3_1paq4zo,"Private US–Russia Plan for Ukraine ‘Like Nord Stream but Times a Hundred’, Warns Sikorski. &#32; submitted by &#32; /u/jackytheblade [link] &#32; [comments]",2025-11-30 18:52:53+00:00,https://www.reddit.com/r/worldnews/comments/1paq4zo/private_usrussia_plan_for_ukraine_like_nord/,reddit_world_news,war & foreign policy,0
https://www.theguardian.com/world/2025/nov/30/indonesia-thailand-floods,"Death toll passes 900 in Indonesia, Thailand and Sri Lanka floods. Officials in Indonesia say more than 442 people have died, while Sri Lanka suffers worst natural disaster since 2004 tsunami Authorities in Sri Lanka, Indonesia and Thailand are racing to clear debris and find hundreds of missing people after more than 900 died in devastating floods and landslides across the south of Asia.In the latest example of the impact of the climate crisis on storm patterns and extreme weather, heavy monsoon rains, exacerbated by a tropical storm, have overwhelmed parts of south-east Asia in recent days, leaving thousands of people stranded without shelter or critical supplies. Continue reading...",2025-11-30 18:37:29+00:00,https://www.theguardian.com/world/2025/nov/30/indonesia-thailand-floods,guardian_world,climate & environment,0
https://www.aljazeera.com/?t=1764520531,Verstappen wins Qatar GP to keep F1 world championship alive with Norris. Reigning F1 champion Max Verstappen closed to within 12 points of leader Lando Norris heading into final round in UAE.,2025-11-30 18:35:43+00:00,https://www.aljazeera.com/sports/2025/11/30/verstappen-wins-qatar-gp-to-keep-f1-world-championship-alive-with-norris?traffic_source=rss,al_jazeera,technology & ai,0
https://www.theguardian.com/politics/live/2025/nov/30/rachel-reeves-defend-budget-deficit-claims-keir-starmer-your-party-uk-politics-live,"Your Party is voted to be called … Your Party, Jeremy Corbyn announces – UK politics as it happened. Former Labour leader announces official name at conference in Liverpool after vote by members Kemi Badenoch has reiterated her calls for the chancellor to resign on the BBC’s Sunday with Laura Kuenssberg programme, after accusing Rachel Reeves of breaking promises not to raise taxes.In this year’s budget, Reeves froze tax thresholds for three years longer than previously planned, meaning that as wages rise more people will have to start paying income tax.The chancellor called an emergency press conference telling everyone about how terrible the state of the finances were and now we have seen that the OBR had told her the complete opposite. She was raising taxes to pay for welfare.The only thing that was unfunded was the welfare payments which she has made and she’s doing it on the backs of a lot of people out there who are working very hard and getting poorer. And because of that, I believe she should resign.The shadow chancellor, Mel Stride, has written to the FCA (the Financial Conduct Authority). Hopefully there will be an investigation, because it looks like what she was doing was trying to pitch-roll her budget – tell everyone how awful it would be and then they wouldn’t be as upset when she finally announced it – and still sneak in those tax rises to pay for welfare. That’s not how we should be running this process. Continue reading...",2025-11-30 18:33:07+00:00,https://www.theguardian.com/politics/live/2025/nov/30/rachel-reeves-defend-budget-deficit-claims-keir-starmer-your-party-uk-politics-live,guardian_politics,technology & ai,0
https://www.theguardian.com/world/2025/nov/30/ukrainian-and-us-officials-talks-florida-russia-war,"Ukrainian and US officials meet in Florida to discuss proposals to end Russia’s war. Marco Rubio, Steve Witkoff and Jared Kushner meet Kyiv delegation amid more deadly Russian attacks in UkraineUkrainian negotiators have met US officials in Florida to thrash out details of Washington’s proposed framework to end Russia’s war in Ukraine, as Kyiv faces pressure on military and political fronts.The secretary of state, Marco Rubio; the special envoy, Steve Witkoff; and Jared Kushner, Donald Trump’s son-in-law; sat down with a Ukrainian delegation on Sunday before planned US talks this week in Moscow with Vladimir Putin. Continue reading...",2025-11-30 18:20:51+00:00,https://www.theguardian.com/world/2025/nov/30/ukrainian-and-us-officials-talks-florida-russia-war,guardian_world,war & foreign policy,0
https://www.theguardian.com/world/2025/nov/30/pope-leo-urges-lebanese-leaders-make-peace-highest-priority,"Pope Leo urges Lebanese leaders to make peace highest priority. Pontiff tells politicians and religious heads they must persevere with peace efforts despite facing ‘highly complex, conflictual’ situationPope Leo has urged political leaders in Lebanon to make peace their highest priority in a forceful appeal as he is visiting the country, which remains a target of Israeli airstrikes, on the second leg of his first overseas trip as Catholic leader.Leo, the first US pope, arrived in Beirut on Sunday from a four-day visit to Turkey where he said that humanity’s future was at risk because of the world’s unusual number of bloody conflicts, and condemned violence in the name of religion. Continue reading...",2025-11-30 18:09:12+00:00,https://www.theguardian.com/world/2025/nov/30/pope-leo-urges-lebanese-leaders-make-peace-highest-priority,guardian_world,war & foreign policy,0
https://www.aljazeera.com/?t=1764516516,Rubio says US-Ukraine talks on ending war ‘productive’ but ‘complicated’. Delegations meet in Florida to ‘create pathway’ for sovereign Ukraine ahead of US special envoy Witkoff’s Moscow trip.,2025-11-30 17:53:29+00:00,https://www.aljazeera.com/news/2025/11/30/us-ukraine-negotiators-meet-as-trump-pushes-to-bring-war-to-an-end?traffic_source=rss,al_jazeera,war & foreign policy,0
t3_1paoj8t,Thousands of Spaniards take part in antigovernment protests. &#32; submitted by &#32; /u/ChiefFun [link] &#32; [comments],2025-11-30 17:50:04+00:00,https://www.reddit.com/r/worldnews/comments/1paoj8t/thousands_of_spaniards_take_part_in/,reddit_world_news,government,0
https://www.theguardian.com/commentisfree/2025/nov/30/the-guardian-view-on-the-send-crisis-bridget-phillipson-must-be-tough-with-the-treasury-so-children-arent-penalised,"The Guardian view on the Send crisis: Bridget Phillipson must be tough with the Treasury so children aren’t penalised | Editorial. Tory special needs reforms upended council finances, but Labour’s plan to rebuild public provision won’t come cheap if it’s done properlyThe crisis over special educational needs and disabilities in England is not just a question of cash. Children and parents spend months and years battling for support to which the law entitles them, schools lack the funding to meet needs, and specialist provision is inadequate. An adversarial system shunts families towards tribunals that councils almost invariably lose.Tory reforms created obligations for local authorities but did not adequately fund them – allowing ministers to duck responsibility. The result has been financial chaos, with the overall overspend on special educational needs and disabilities (Send) predicted to reach £6.6bn by next March, and keep rising. Taking responsibility for funding away from councils and handing it to the Department for Education is the right move. But the most important questions about Send go beyond accounting. A white paper on reform was postponed in October. Bridget Phillipson, the education secretary, told MPs that she would consult further before deciding on the future of education, health and care plans, which set out entitlements for individual children, and the tribunals where parents can challenge council decisions.Do you have an opinion on the issues raised in this article? If you would like to submit a response of up to 300 words by email to be considered for publication in our letters section, please click here. Continue reading...",2025-11-30 17:48:01+00:00,https://www.theguardian.com/commentisfree/2025/nov/30/the-guardian-view-on-the-send-crisis-bridget-phillipson-must-be-tough-with-the-treasury-so-children-arent-penalised,guardian_politics,war & foreign policy,0
https://www.bbc.com/news/articles/c4g9x5k73zro#0,New party founded by Corbyn and Sultana adopts Your Party as name. Your Party delegates also vote to be led by a panel of members - avoiding a potentially explosive leadership race.,2025-11-30 17:30:27+00:00,https://www.bbc.com/news/articles/c4g9x5k73zro?at_medium=RSS&at_campaign=rss,bbc_politics,politics,0
https://www.aljazeera.com/?t=1764520932,Isak scores first goal as Liverpool defeat West Ham in Premier League. Alexander Isak scored his maiden goal for Liverpool as the Reds ended their two-game EPL losing streak at West Ham.,2025-11-30 17:22:03+00:00,https://www.aljazeera.com/sports/2025/11/30/isak-scores-first-goal-as-liverpool-defeat-west-ham-in-premier-league?traffic_source=rss,al_jazeera,technology & ai,0
https://www.theguardian.com/society/2025/nov/30/dignitas-founder-ludwig-minelli-assisted-death,"Dignitas founder ends his own life through assisted death. Ludwig Minelli, whose work had lasting influence on Swiss law, dies just days before his 93rd birthdayThe head of the Swiss right-to-die organisation Dignitas has ended his life through an assisted death, the group has said.Ludwig Minelli, who founded the group in 1998, died on Saturday, days before his 93rd birthday, Dignitas said. It added: “Right up to the end of his life, he continued to search for further ways to help people to exercise their right to freedom of choice and self-determination in their ‘final matters’ – and he often found them.” Continue reading...",2025-11-30 16:08:51+00:00,https://www.theguardian.com/society/2025/nov/30/dignitas-founder-ludwig-minelli-assisted-death,guardian_world,technology & ai,0
https://www.aljazeera.com/?t=1764510812,Pope Leo insists on two-state solution to resolve Israel-Palestine conflict. Crowds welcome Pope Leo in Beirut as he calls for an end to violence and promotes interfaith understanding.,2025-11-30 16:07:36+00:00,https://www.aljazeera.com/news/2025/11/30/pope-leo-insists-on-2-state-solution-to-resolve-israel-palestine-conflict?traffic_source=rss,al_jazeera,war & foreign policy,0
https://www.bbc.com/news/articles/clyz82z7p8zo#0,"Indonesia searches for hundreds missing in deadly floods. The death toll on the island of Sumatra has risen to more than 440, the government says.",2025-11-30 16:06:28+00:00,https://www.bbc.com/news/articles/clyz82z7p8zo?at_medium=RSS&at_campaign=rss,bbc_world,climate & environment,0
https://www.aljazeera.com/?t=1764502005,Is US President Donald Trump preparing to strike Venezuela?. Venezuela slams Trump&#039;s warning that its airspace should be considered closed amid rising tensions.,2025-11-30 16:04:40+00:00,https://www.aljazeera.com/news/2025/11/30/is-us-president-donald-trump-preparing-to-strike-venezuela?traffic_source=rss,al_jazeera,war & foreign policy,0
t3_1palezm,"A Metallica Scholarship, to be precise, part of the more than $10 million the band's charity All Within My Hands has donated to workforce education, mostly in the form of grants through trade schools and community colleges.. &#32; submitted by &#32; /u/Edm_vanhalen1981 [link] &#32; [comments]",2025-11-30 15:46:19+00:00,https://www.reddit.com/r/UpliftingNews/comments/1palezm/a_metallica_scholarship_to_be_precise_part_of_the/,reddit_uplifting_news,education,0
t3_1pal0li,Swiss voters reject proposed tax on super rich. &#32; submitted by &#32; /u/etfvxus [link] &#32; [comments],2025-11-30 15:29:48+00:00,https://www.reddit.com/r/worldnews/comments/1pal0li/swiss_voters_reject_proposed_tax_on_super_rich/,reddit_world_news,politics,0
t3_1pal0l8,Top South Korean e-commerce firm Coupang apologises over massive data breach. &#32; submitted by &#32; /u/IdinDoIt [link] &#32; [comments],2025-11-30 15:29:48+00:00,https://www.reddit.com/r/news/comments/1pal0l8/top_south_korean_ecommerce_firm_coupang/,reddit_news,other,0
t3_1pakocp,Polish President cancels meeting with Orban following his visit to Putin. &#32; submitted by &#32; /u/Neptun_11 [link] &#32; [comments],2025-11-30 15:15:43+00:00,https://www.reddit.com/r/worldnews/comments/1pakocp/polish_president_cancels_meeting_with_orban/,reddit_world_news,politics,0
https://www.theguardian.com/world/2025/nov/30/thousands-rally-in-madrid-to-demand-pm-resign-over-corruption-allegations,"Thousands rally in Madrid to demand snap election over corruption allegations. Pressure grows on Pedro Sánchez amid series of claims involving his family, party and administrationTens of thousands of people have attended an anti-government demonstration in Madrid to demand a snap general election as the country’s socialist prime minister, Pedro Sánchez, tries to weather a series of corruption allegations involving his family, his party and his administration.Sunday’s protest, called by Spain’s conservative People’s party (PP) under the slogan, “This is it: mafia or democracy?”, was held three days after one of Sánchez’s closest erstwhile allies, the former transport minister José Luis Ábalos, was remanded in custody by a judge investigating an alleged kickbacks-for-contracts scheme. Continue reading...",2025-11-30 15:15:27+00:00,https://www.theguardian.com/world/2025/nov/30/thousands-rally-in-madrid-to-demand-pm-resign-over-corruption-allegations,guardian_world,climate & environment,0
t3_1paklu9,Swiss voters reject mandatory national service for women. &#32; submitted by &#32; /u/Silly-avocatoe [link] &#32; [comments],2025-11-30 15:12:48+00:00,https://www.reddit.com/r/worldnews/comments/1paklu9/swiss_voters_reject_mandatory_national_service/,reddit_world_news,politics,0
t3_1paka4j,"Nonprofit using service dogs to curb veteran suicides celebrates 300th pairing -- The dogs train for the specific needs of the person they’re working with, but are all taught to disrupt panic attacks and help veterans feel safer in stressful situations.. &#32; submitted by &#32; /u/guanaco55 [link] &#32; [comments]",2025-11-30 14:59:29+00:00,https://www.reddit.com/r/UpliftingNews/comments/1paka4j/nonprofit_using_service_dogs_to_curb_veteran/,reddit_uplifting_news,war & foreign policy,0
t3_1pak90c,Daughter of former South African president resigns from parliament amid investigation into Russian military recruitment scheme. &#32; submitted by &#32; /u/AdSpecialist6598 [link] &#32; [comments],2025-11-30 14:58:08+00:00,https://www.reddit.com/r/worldnews/comments/1pak90c/daughter_of_former_south_african_president/,reddit_world_news,war & foreign policy,0
https://www.aljazeera.com/?t=1764508459,"Israel attacks on Syria: What happened, who did Israel claim it was after?. Israel killed 13 people, including two children, in Syria on Friday after locals resisted an incursion by its army.",2025-11-30 14:54:00+00:00,https://www.aljazeera.com/news/2025/11/30/israel-attacks-on-syria-what-happened-who-did-israel-claim-it-was-after?traffic_source=rss,al_jazeera,war & foreign policy,0
t3_1pak395,Model-based evaluation of the impact of a potential HIV cure on HIV transmission dynamics. &#32; submitted by &#32; /u/AdSpecialist6598 [link] &#32; [comments],2025-11-30 14:51:10+00:00,https://www.reddit.com/r/UpliftingNews/comments/1pak395/modelbased_evaluation_of_the_impact_of_a/,reddit_uplifting_news,gender & sexuality,0
https://www.bbc.com/news/articles/c075zd0j2j3o#1,Husband and wife accused of using spycam and earpieces to win almost £600k at Australian casino. The husband and wife are alleged to have used a range of devices - including earpieces - to cheat card games over a number of weeks.,2025-11-30 14:42:53+00:00,https://www.bbc.com/news/articles/c075zd0j2j3o?at_medium=RSS&at_campaign=rss,bbc_world,sports,0
https://www.aljazeera.com/?t=1764507974,"Honduras votes for new president in poll overshadowed by Trump’s threats. The vote is taking place in a highly polarised climate, with the US backing the right-wing candidate, Nasry Asfura.",2025-11-30 14:35:40+00:00,https://www.aljazeera.com/news/2025/11/30/polls-open-in-honduras-presidential-election-marked-by-fraud-accusations?traffic_source=rss,al_jazeera,climate & environment,0
https://www.aljazeera.com/?t=1764512929,Ukrainian Official “very transparent” about investigation. “[Ukrainian chief of staff] Andriy Yermak said that he will be very open and transparent...&quot;,2025-11-30 14:33:10+00:00,https://www.aljazeera.com/video/quotable/2025/11/30/ukrainian-official-very-transparent-about-investigation?traffic_source=rss,al_jazeera,technology & ai,0
https://www.theguardian.com/world/2025/nov/30/honduras-vote-election-trump-threat-cut-aid-if-nasry-tito-asfura-loses,"Hondurans vote amid Trump threat to cut aid if his preferred candidate loses. US president favours Nasry ‘Tito’ Asfura of rightwing National party, as polls show three candidates are neck-and-neckHondurans have begun voting in an election held amid threats by Donald Trump to cut aid to the country if his preferred candidate loses.Honduras could be the next country in Latin America, after Argentina and Bolivia, to swing right after years of leftwing rule. Continue reading...",2025-11-30 14:31:59+00:00,https://www.theguardian.com/world/2025/nov/30/honduras-vote-election-trump-threat-cut-aid-if-nasry-tito-asfura-loses,guardian_world,technology & ai,0
t3_1pajfkj,India freedom struggle: The hidden heroines found in long-lost photographs. &#32; submitted by &#32; /u/Dr_Neurol [link] &#32; [comments],2025-11-30 14:21:51+00:00,https://www.reddit.com/r/UpliftingNews/comments/1pajfkj/india_freedom_struggle_the_hidden_heroines_found/,reddit_uplifting_news,other,0
t3_1paj97v,Benjamin Netanyahu asks Israel’s president for pardon in corruption case | Benjamin Netanyahu. &#32; submitted by &#32; /u/RisingRusherff [link] &#32; [comments],2025-11-30 14:13:45+00:00,https://www.reddit.com/r/worldnews/comments/1paj97v/benjamin_netanyahu_asks_israels_president_for/,reddit_world_news,war & foreign policy,0
US-EN-47124987,"Oregon, Ole Miss and Virginia headline best Week 14 uniforms in college football. Oregon has a typically colorful look while Virginia will be donning throwbacks.",2025-11-30 14:13:36.825750+00:00,https://www.espn.com/college-football/story/_/id/47124987/oregon-ole-miss-virginia-best-week-14-uniforms-college-football,espn,education,0
