id,text,created_at,link,source,topic,engagement
"tag:blogger.com,1999:blog-2525761963252134386.post-4705741174433838580","Most Frequently Asked Questions About Email Marketing. 1. Why is email marketing important?Email is the marketing tool that helps you&nbsp; create a seamless, connected, frictionless buyer journey. More importantly, email marketing allows you to build relationships with prospects, customers, and past customers. It's your chance to speak&nbsp; to them right in their inbox, at a time that suits them. Along with the right message, email can become one of your most powerful marketing channels.2. What is benefits of email marketing?Email marketing is best way for creating long term relationship with your clients, and increasing sales in our company.Benefits of email marketing for bussiness:Better brand recognitionStatistics of what works bestMore salesTargeted audienceMore traffic to your products/services/newsletterBuild credibilityMost&nbsp; bussinesses are using email marketing and making tons of money with email marketing.3. What is the simplest day and time to send my marketing emails?Again, the answer to this question varies from company to company. And again, testing is the way to find out what works best. Typically, weekends and mornings seem to be&nbsp; times when multiple emails are opened, but since your audience may have different habits, it's best to experiment and then use your&nbsp; data to decide.&nbsp;4. Which metrics should I be looking at?The two most important metrics for email marketing are&nbsp; open rate and click-through rate. If your emails aren't opened, subscribers will never see your full marketing message, and if they open them but don't click through to your site, your emails won't convert.5. How do I write a decent subject line?The best subject lines are short and to the point, accurately describing&nbsp; the content of the email, but also catchy and intriguing, so the reader wants to know more. Once Again, this is the perfect place for&nbsp; A/B testing, to see what types of subject lines work best with your audience. Your call to action should be clear and&nbsp; simple. It should be somewhere at the top of your email for those who haven't finished reading the entire email,&nbsp; then repeated&nbsp; at the end for those reading all the way through. It should state exactly what you want subscribers to do, for example ""Click here to download the premium theme for free. 6. Is email marketing still effective?Email marketing is one of the most effective ways for a business to reach its customers directly. Think about it. You don't post something on your site&nbsp; hoping people will visit it. You don't even post something on a social media page and hope fans&nbsp; see it. You're sending something straight to each person's inbox, where they'll definitely&nbsp; see it! Even if they don't open it, they'll still see your subject line and business name every time you send an email, so you're still communicating directly with your audience. 7. However do I grow my email subscribers list? Should i buy an email list or build it myself?Buying an email list is&nbsp; waste of time &amp; money. These email accounts are unverified and not interested in your brand. The mailing list is useless if your subscribers do not open your emails. There are different ways to grow your mailing list.&nbsp;Give them a free ebook and host it on a landing page where they have to enter the email to download the file and also create a forum page on your website, asks your visitors what questions they might have about your business, and collects email addresses to follow up with them. 8. How do I prevent audience from unsubscribing?If the&nbsp; subject line of the email is irrelevant to&nbsp; customers, they will ignore it multiple times. But, if it keeps repeating, they are intercepted and unsubscribed from your emails. So, send relevant emails for the benefit of the customer. Don't send emails that often only focus&nbsp; on sales, offers and discounts.&nbsp;Submit information about your business and offers so you can connect with customers. You can also update them on recent trends in your industry. The basic role of an email is first and foremost to&nbsp; connect with customers, get the most out of this tool.9. What is the difference between a cold email and a spam email?Cold emails are mostly sales emails that are sent with content align to the needs of the recipient. It is usually personalized and includes a business perspective. However, it is still an unsolicited email. And all unsolicited emails are marked as SPAM.&nbsp;Regularly receiving this type of unsolicited email in your users' inboxes, chances are&nbsp; your emails will soon be diverted to&nbsp; spam or junk folders. The most important thing to prevent this from happening is to respect your recipients' choice to opt-out of receiving emails from you. You can add the links to easily unsubscribe. You must be familiar with the CAN-SPAM Act and its regulations.10. Where can I find email template?Almost all email campaign tools provide you with ready-made templates. Whether you use MailChimp or Pardot, you'll ge",2025-12-02 03:14:56.580874+00:00,https://techncruncher.blogspot.com/2022/01/most-frequently-asked-questions-about.html,techcrunch,technology & ai,0
"tag:blogger.com,1999:blog-2525761963252134386.post-8563727018976767958","10 Best Chrome Extensions That Are Perfect for Everyone. Are you a great Chrome user? That’s nice to hear. But first, consider whether or not there are any essential Chrome extensions you are currently missing from your browsing life, so here we're going to share with you 10 Best Chrome Extensions That Are Perfect for Everyone. So Let's Start.1. LastPassWhen you have too several passwords to remember, LastPass remembers them for you.This chrome extension is an easy way to save you time and increase security. It’s a single password manager that will log you into all of your accounts. you simply ought to bear in mind one word: your LastPass password to log in to all or any your accounts.FeaturesSave usernames and passwords and LastPasswill&nbsp; log you&nbsp; in&nbsp; automatically.Fill the forms quickly to save your addresses, credit card numbers and more.2. MozBarMozBar is an SEO toolbar extension that makes it easy for you to analyze your web pages' SEO while you surf. You can customize your search so that you see data for a particular region or for all regions. You get data such as website and domain authority and link profile. The status column tells you whether there are any no-followed links to the page.You can also compare link metrics. There is a pro version of MozBar, too.3. GrammerlyGrammarly is a real-time grammar checking and spelling&nbsp; tool for online writing. It checks spelling, grammar, and punctuation as you type, and has a dictionary feature that suggests related words. if you use mobile phones for writing than&nbsp; Grammerly also have a mobile keyboard app.4. VidlQVidIQ is a SaaS product and Chrome Extension that makes it easier to manage and optimize your YouTube channels. It keeps you informed about your channel's performance with real-time analytics and powerful insights.FeaturesLearn more about insights and statistics beyond YouTube AnalyticsFind great videos with the Trending tab.You can check out any video’s YouTube rankings and see how your own video is doing on the charts.Keep track&nbsp; the&nbsp; history of the keyword to determine when a keyword is rising or down&nbsp; in popularity over time.Quickly find out which videos are performing the best on YouTube right now.Let this tool suggest keywords for you to use in your title, description and tags.5. ColorZillaColorZilla is a browser extension that allows you to find out the exact color of any object in your web browser. This is especially useful when you want to match elements on your page to the color of an image.Features&nbsp;&nbsp;Advanced Color Picker (similar to Photoshop's)Ultimate CSS Gradient GeneratorThe ""Webpage Color Analyzer"" site helps you determine the palette of colors used in a particular website.Palette Viewer with 7 pre-installed palettesEyedropper - sample the color of any pixel on the pageColor History of recently picked colorsDisplays some info about the element, including the tag name, class, id and size.Auto copy picked colors to clipboardGet colors of dynamic hover elements&nbsp;Pick colors from Flash objectsPick colors at any zoom level 6. HoneyHoney is a chrome extension with which you&nbsp; save each product from the website and notify it when it is available at&nbsp; low price it's one among the highest extensions for Chrome that finds coupon codes whenever you look online.FeaturesBest for finding exclusive prices on Amazon.A free reward program called Honey Gold.Searches and filters the simplest value fitting your demand. Instant notifications.7. GMass: Powerful Chrome Extension for Gmail MarketersGMass (or Gmail Mass) permits users to compose and send mass emails using Gmail. it is a great tool as a result of you'll use it as a replacement for a third-party email sending platform. you will love GMass to spice up your emailing functionality on the platform.8. Notion Web Clipper: Chrome Extension for GeeksIt's a Chrome extension for geeks that enables you to highlight and save what you see on the web.It's been designed by Notion, that could be a Google space different that helps groups craft higher ideas and collaborate effectively.FeaturesSave anything online with just one click&nbsp;&nbsp;Use it on any deviceOrganize your saved clips quicklyTag, share and comment on the clipsIf you are someone who works online, you need to surf the internet to get your business done. And often there is no time to read or analyze something. But it's important that you&nbsp; do it. Notion Web Clipper will help you with that.9. WhatFont: Chrome Extension for identifying Any Site FontsWhatFont is a Chrome extension that allows web designers to easily identify and compare different fonts on a page. The first time you use it on any page, WhatFont will copy the selected page.It&nbsp; Uses this page to find out what fonts are present and generate an image that shows all those fonts in different sizes. Besides the apparent websites like Google or Amazon,&nbsp; you'll conjointly use it on sites wherever embedded fonts ar used.&nbsp;10. SimilarWeb: Traffic Rank &amp; Website Ana",2025-12-02 03:14:56.580874+00:00,https://techncruncher.blogspot.com/2022/01/10-best-chrome-extensions-that-are.html,techcrunch,war & foreign policy,0
"tag:blogger.com,1999:blog-2525761963252134386.post-4109465143659836541","ProWritingAid VS Grammarly: Which Grammar Checker is Better in (2022) ?. ProWritingAid VS Grammarly:&nbsp;&nbsp;When it comes to English grammar, there are two Big Players that everyone knows of: the Grammarly and ProWritingAid. but you are wondering which one to choose so here we write a detail article which will help you to choose the best one for you so Let's startWhat is Grammarly?Grammarly is a tool that checks for grammatical errors, spelling, and punctuation.it gives you comprehensive feedback on your writing. You can use this tool to proofread and edit articles, blog posts, emails, etc.Grammarly also detects all types of mistakes, including sentence structure issues and misused words. It also gives you suggestions on style changes, punctuation, spelling, and grammar all are in real-time. The free version covers the basics like identifying grammar and spelling mistakeswhereas the Premium version offers a lot more functionality, it detects plagiarism in your content, suggests word choice, or adds fluency to it.Features of GrammarlySpelling and Word Suggestion: Grammarly detects basic to advance grammatical errors and also help you why this is an error and suggest to you how you can improve itCreate a Personal Dictionary: The Grammarly app allows you to add words to your personal dictionary so that the same mistake isn't highlighted every time you run Grammarly.Different English Style: Check to spell for American, British, Canadian, and Australian English.Plagiarism: This feature helps you detect if a text has been plagiarized by comparing it with over eight billion web pages. Wordiness: This tool will help you check your writing for long and hard-to-read sentences. It also shows you how to shorten sentences so that they are more concise.Passive Voice: The program also notifies users when passive voice is used too frequently in a document.Punctuations: This feature flags all incorrect and missing punctuation.Repetition: The tool provides recommendations for replacing the repeated word.Proposition: Grammarly identifies misplaced and confused prepositions. Plugins: It offers Microsoft Word, Microsoft Outlook, and Google Chrome plugins.What is ProWritingAid?ProWritingAid is a style and grammar checker for content creators and writers. It helps to optimize word choice, punctuation errors, and common grammar mistakes, providing detailed reports to help you improve your writing.&nbsp;ProWritingAid can be used as an add-on to WordPress, Gmail, and Google Docs. The software also offers helpful articles, videos, quizzes, and explanations to help improve your writing.Features of ProWriting AidHere are some key features of ProWriting Aid:Grammar checker and spell checker: This tool helps you to find all grammatical and spelling errors.Find repeated words:&nbsp; The tool also allows you to search for repeated words and phrases in your content.Context-sensitive style suggestions:&nbsp; You can find the exact style of writing you intend and suggest if it flows well in your writing.Check the readability of your content: Pro Writing Aid helps you identify the strengths and weaknesses of your article by pointing out difficult sentences and paragraphs.Sentence Length: It also indicates the length of your sentences.Check Grammatical error: It also checks your work for any grammatical errors or typos, as well.Overused words: As a writer, you might find yourself using the same word repeatedly. ProWritingAid's overused words checker helps you avoid this lazy writing mistake.Consistency: Check your work for inconsistent usage of open and closed quotation marks.Echoes: Check your writing for uniformly repetitive words and phrases.Difference between Grammarly and Pro-Writing AidGrammarly and ProWritingAid are well-known grammar-checking software. However, if you're like most people who can't decide which to use, here are some different points that may be helpful in your decision.Grammarly vs ProWritingAidGrammarly is a writing enhancement tool that offers suggestions for grammar, vocabulary, and syntax whereas ProWritingAid offers world-class grammar and style checking, as well as advanced reports to help you strengthen your writing.Grammarly provides Android and IOS apps whereas ProWritingAid doesn't have a mobile or IOS app.Grammarly offers important suggestions about mistakes you've made whereas ProWritingAid&nbsp; shows more suggestions than Grammarly but all recommendations are not accurateGrammarly has a more friendly UI/UX whereas the ProWritingAid interface is not friendly as Grammarly.Grammarly is an accurate grammar checker for non-fiction writing whereas ProWritingAid is an accurate grammar checker for fiction writers.Grammarly finds grammar and punctuation mistakes, whereas ProWritingAid identifies run-on sentences and fragments.Grammarly provides 24/7 support via submitting a ticket and sending emails. ProWritingAid’s support team is available via email, though the response time is approximately 48 hours.Grammarly offers many features in its free plan, whereas ProWritingAid offers some",2025-12-02 03:14:56.580874+00:00,https://techncruncher.blogspot.com/2022/03/prowritingaid-vs-grammarly-which.html,techcrunch,war & foreign policy,0
"tag:blogger.com,1999:blog-2525761963252134386.post-5077419905984021446","Most Frequently Asked Questions About NFTs(Non-Fungible Tokens). &nbsp;Non-fungible tokens (NFTs) are the most popular digital assets today, capturing the attention of cryptocurrency investors, whales and people from around the world. People find it amazing that some users spend thousands or millions of dollars on a single NFT-based image of a monkey or other token, but you can simply take a screenshot for free. So here we share some freuently asked question about NFTs.1) What is an NFT?NFT stands for non-fungible&nbsp; token, which is a cryptographic token on a blockchain with unique identification codes that distinguish it from other tokens. NFTs are unique and not interchangeable, which means no two NFTs are the same. NFTs can be a unique artwork, GIF, Images, videos, Audio album. in-game items, collectibles etc.2) What is Blockchain?A blockchain is a distributed digital ledger that allows for the secure storage of data. By recording any kind of information—such as bank account transactions, the ownership of Non-Fungible Tokens (NFTs), or Decentralized Finance (DeFi) smart contracts—in one place, and distributing it to many different computers, blockchains ensure that data can’t be manipulated without everyone in the system being aware.3) What makes an NFT valuable? The value of an NFT comes from its ability to be traded freely and securely on the blockchain, which is not possible with other current digital ownership solutionsThe NFT points to its location on the blockchain, but doesn’t necessarily contain the digital property. For example, if you replace one bitcoin with another, you will still have the same thing. If you buy a non-fungible item, such as a movie ticket, it is impossible to replace it with any other movie ticket because each ticket is unique to a specific time and place.4) How do NFTs work?One of the unique characteristics of non-fungible tokens (NFTs) is that they can be tokenised to create a digital certificate of ownership that can be bought, sold and traded on the blockchain.&nbsp;As with crypto-currency, records of who owns what are stored on a ledger that is maintained by thousands of computers around the world. These records can’t be forged because the whole system operates on an open-source network.&nbsp;NFTs also contain smart contracts—small computer programs that run on the blockchain—that give the artist, for example, a cut of any future sale of the token.5) What’s the connection between NFTs and cryptocurrency?Non-fungible tokens (NFTs) aren't cryptocurrencies, but they do use blockchain technology. Many NFTs are based on Ethereum, where the blockchain serves as a ledger for all the transactions related to said NFT and the properties it represents.5) How to make an NFT?Anyone can create an NFT. All you need is a digital wallet, some ethereum tokens and a connection to an NFT marketplace where you’ll be able to upload and sell your creations6) How to validate the authencity of an NFT?When you purchase a stock in NFT, that purchase is recorded on the blockchain—the bitcoin ledger of transactions—and that entry acts as your proof of ownership.7) How is an NFT valued? What are the most expensive NFTs?The value of an NFT varies a lot based on the digital asset up for grabs. People use NFTs to trade and sell digital art, so when creating an NFT, you should consider the popularity of your digital artwork along with historical statistics.In the year 2021, a digital artist called Pak created an artwork called The Merge. It was sold on the Nifty Gateway NFT market for $91.8 million.8) Can NFTs be used as an investment?Non-fungible tokens can be used in investment opportunities. One can purchase an NFT and resell it at a profit. Certain NFT marketplaces let sellers of NFTs keep a percentage of the profits from sales of the assets they create.9) Will NFTs be the future of art and collectibles?Many people want to buy NFTs because it lets them support the arts and own something cool from their favorite musicians, brands, and celebrities. NFTs also give artists an opportunity to program in continual royalties if someone buys their work. Galleries see this as a way to reach new buyers interested in art.10) How do we buy an NFTs?There are many places to buy digital assets, like opensea and their policies vary. On top shot, for instance, you sign up for a waitlist that can be thousands of people long. When a digital asset goes on sale, you are occasionally chosen to purchase it.11) Can i mint NFT for free?To mint an NFT token, you must pay some amount of gas fee to process the transaction on the Etherum blockchain, but you can mint your NFT on a different blockchain called Polygon to avoid paying gas fees. This option is available on OpenSea and this simply denotes that your NFT will only be able to trade using Polygon's blockchain and not Etherum's blockchain. Mintable allows you to mint NFTs for free without paying any gas fees.12) Do i own an NFT if i screenshot it? The answer is no. Non-Fungible Tokens are minted on the blockchain using cryptocurrencie",2025-12-02 03:14:56.580874+00:00,https://techncruncher.blogspot.com/2022/02/most-frequently-asked-questions-about.html,techcrunch,war & foreign policy,0
US-EN-46639347,Where Kentucky ranks among the open Power 4 jobs. It's already a busy coaching carousel. Here are the jobs we think are best and why.,2025-12-02 03:14:56.148676+00:00,https://www.espn.com/college-football/story/_/id/46639347/college-football-coaching-carousel-ranking-every-job,espn,labor & work,0
US-EN-47108752,"Will there be baseball in 2027? Is a salary cap coming? What you need to know about MLB's looming labor battle﻿. With the CBA set to expire one year from today, we answer baseball's burning questions.",2025-12-02 03:14:56.148676+00:00,https://www.espn.com/mlb/story/_/id/47108752/mlb-labor-battle-cba-salary-cap-owners-players-union-mlbpa-faq-manfred,espn,labor & work,0
US-EN-47171060,"Sources: BYU coach Sitake focus of PSU search. The Penn State coaching search, which has gone quiet the past few weeks, has focused in on BYU coach Kalani Sitake, sources told ESPN, confirming a report by On3.",2025-12-02 03:14:56.148676+00:00,https://www.espn.com/college-football/story/_/id/47171060/byu-football-coach-kalani-sitake-focus-penn-state-head-coaching-search,espn,other,0
US-EN-47172127,"Sources: D. Williams lands 3-year deal from Mets. After the 31-year-old veteran pitched for the Yankees last season, free-agent reliever Devin Williams and the New York Mets agreed on a three-year contract that guarantees more than $50 million, sources told ESPN's Jeff Passan Monday, confirming a report.",2025-12-02 03:14:56.148676+00:00,https://www.espn.com/mlb/story/_/id/47172127/devin-williams-new-york-mets-agree-3-year-deal,espn,other,0
US-EN-47170683,"Kiffin ready to make LSU nation's 'best program'. A day after flying out of Oxford, Mississippi, Lane Kiffin was introduced as LSU coach Monday, promising to restore the Tigers to being ""the best program in all of college football,"" while detailing his excruciating decision to leave Ole Miss.",2025-12-02 03:14:56.148676+00:00,https://www.espn.com/college-football/story/_/id/47170683/set-make-tigers-nation-best-kiffin-introduced-lsu,espn,technology & ai,0
US-EN-47170877,"Sources: Kentucky targeting Oregon OC Stein. Oregon offensive coordinator Will Stein is Kentucky's target to be their next head coach and the sides are working toward a deal, sources told ESPN.",2025-12-02 03:14:56.148676+00:00,https://www.espn.com/college-football/story/_/id/47170877/kentucky-targets-oregon-oc-stein-coaching-job,espn,war & foreign policy,0
US-EN-47169082,"Michigan State hires Fitzgerald, touts 'new era'. Former Northwestern coach Pat Fitzgerald was hired Monday as the new football coach at Michigan State. Sources told ESPN that it's a five-year deal.",2025-12-02 03:14:56.148676+00:00,https://www.espn.com/college-football/story/_/id/47169082/sources-michigan-state-hires-pat-fitzgerald-new-football-coach,espn,sports,0
US-EN-47169591,"Sources: WNBA offering max salary base of $1M. The WNBA's latest proposal to the players' union includes a maximum salary base of $1 million, sources told ESPN's Alexa Philippou. The new offer reflects incremental increases from the league's previous proposal.",2025-12-02 03:14:56.148676+00:00,https://www.espn.com/wnba/story/_/id/47169591/wnba-proposal-ups-max-salary-base-1m-sources-say,espn,labor & work,0
US-EN-47170001,"Eagles OC's house gets egged after loss to Bears. The New Jersey home of Eagles offensive coordinator Kevin Patullo was vandalized with eggs early Saturday morning, following the team's loss to the Bears, police said.",2025-12-02 03:14:56.148676+00:00,https://www.espn.com/nfl/story/_/id/47170001/home-eagles-offensive-coordinator-vandalized-loss,espn,technology & ai,0
US-EN-47170981,"Miami AD: ACC should revisit tiebreaker system. A four-game winning streak might not be enough for 10-2 Miami to make the College Football Playoff, and Hurricanes athletic director Dan Radakovich told ESPN the ACC should revisit its tiebreaker system to ensure the league ""puts its best foot forward.""",2025-12-02 03:14:56.148676+00:00,https://www.espn.com/nhl/story/_/id/47170981/acc-revisit-tiebreakers-miami-ad-dan-radakovich-says,espn,war & foreign policy,0
US-EN-47153885,🏈 CFB Power Rankings: Texas Tech into top five. What were the biggest surprises from each top 25 team this season?,2025-12-02 03:14:56.148676+00:00,https://www.espn.com/college-football/story/_/id/47153885/2025-college-football-week-14-power-rankings-top-25,espn,technology & ai,0
