id,text,created_at,link,source,topic,engagement
https://www.bbc.com/news/articles/cvgj85x380do#0,"'Business rates changes will cost me £62,000'. Pub bosses have warned they face a sharp rise in business rates bills despite government support.",2025-11-29 18:07:57+00:00,https://www.bbc.com/news/articles/cvgj85x380do?at_medium=RSS&at_campaign=rss,bbc_business,war & foreign policy,0
https://www.bbc.com/news/articles/c035je2y608o#0,Sir Tom Stoppard: Witty and playful writer who took ideas seriously. He was an award-winning playwright whose works delighted generations.,2025-11-29 17:48:02+00:00,https://www.bbc.com/news/articles/c035je2y608o?at_medium=RSS&at_campaign=rss,bbc_entertainment,war & foreign policy,0
https://www.theguardian.com/us-news/2025/nov/29/pete-hegseth-denies-ordering-deaths-narco-boat,"Pete Hegseth denies he gave orders to ‘kill everybody’ on alleged ‘narco-boat’. Defense secretary called reports about his role in strike as ‘fake news’ intended to discredit US militaryThe US defense secretary, Pete Hegseth, has declared recent reporting that he may have illegally ordered all people to be killed in a military strike in the Caribbean as “fake news” on Friday evening, adding that the series of strikes of people on boats had been “lawful under both US and international law”.Hegseth lambasted reports about his role in the strike as “fabricated, inflammatory and derogatory reporting to discredit our incredible warriors fighting to protect the homeland”. Continue reading...",2025-11-29 17:27:08+00:00,https://www.theguardian.com/us-news/2025/nov/29/pete-hegseth-denies-ordering-deaths-narco-boat,guardian_world,war & foreign policy,0
t3_1p9uhlc,"Sir Tom Stoppard, Oscar-winning playwright known for Shakespeare In Love, dies aged 88. &#32; submitted by &#32; /u/Relevant-Box5774 [link] &#32; [comments]",2025-11-29 17:25:28+00:00,https://www.reddit.com/r/news/comments/1p9uhlc/sir_tom_stoppard_oscarwinning_playwright_known/,reddit_news,other,0
t3_1p9u6os,Trump tells airlines Venezuelan airspace should be considered closed. &#32; submitted by &#32; /u/BadahBingBadahBoom [link] &#32; [comments],2025-11-29 17:12:51+00:00,https://www.reddit.com/r/news/comments/1p9u6os/trump_tells_airlines_venezuelan_airspace_should/,reddit_news,technology & ai,0
https://www.bbc.com/news/articles/cpq4l0rn3y1o#0,Sultana claims new Corbyn party carrying out 'witch hunt' against activists. Zarah Sultana boycotts the first day of Your Party's founding conference after several members were expelled.,2025-11-29 16:36:40+00:00,https://www.bbc.com/news/articles/cpq4l0rn3y1o?at_medium=RSS&at_campaign=rss,bbc_politics,technology & ai,0
t3_1p9ta95,"Woman notices dog acting strange, next day she gets life-changing diagnosis. Your dogs figured out she had an aneurysm! &#32; submitted by &#32; /u/National-Dragonfly35 [link] &#32; [comments]",2025-11-29 16:36:30+00:00,https://www.reddit.com/r/UpliftingNews/comments/1p9ta95/woman_notices_dog_acting_strange_next_day_she/,reddit_uplifting_news,other,0
t3_1p9t257,German far-right party sets up its new youth wing as thousands protest. &#32; submitted by &#32; /u/JackThaBongRipper [link] &#32; [comments],2025-11-29 16:27:11+00:00,https://www.reddit.com/r/news/comments/1p9t257/german_farright_party_sets_up_its_new_youth_wing/,reddit_news,other,0
t3_1p9ss1m,"Pucklechurch Wood is the first part of a new UK gov supported national forest called the Western Forest that crosses from Bristol in the west into Somerset, Gloucestershire and Wiltshire. This first 30 hectares (75 acres) will be planted with 22k native trees this winter with another 22k the next.. &#32; submitted by &#32; /u/whatatwit [link] &#32; [comments]",2025-11-29 16:15:43+00:00,https://www.reddit.com/r/UpliftingNews/comments/1p9ss1m/pucklechurch_wood_is_the_first_part_of_a_new_uk/,reddit_uplifting_news,religion & values,0
https://www.theguardian.com/uk-news/2025/nov/29/rachel-reeves-mansion-tax-wealth,"Radical Reeves? The chancellor’s mansion tax is a small but brave step forward | Phillip Inman. The high-value council tax surcharge may only raise £400m but it’s the best opportunity for a bigger, fairer tax on wealthRachel Reeves won little credit last week for lifting the lid on one of the most heated tax debates of the past three decades.Who in their right mind would consider engaging in the fight that would inevitably lead to some of the richest people in the land calling for your head? Continue reading...",2025-11-29 16:00:40+00:00,https://www.theguardian.com/uk-news/2025/nov/29/rachel-reeves-mansion-tax-wealth,guardian_politics,war & foreign policy,0
https://www.bbc.com/news/articles/c4gp917zr8no#1,Pope Leo visits Istanbul's Blue Mosque. It is the first time Leo has attended a Muslim place of worship since he took up the papacy in May.,2025-11-29 15:37:57+00:00,https://www.bbc.com/news/articles/c4gp917zr8no?at_medium=RSS&at_campaign=rss,bbc_world,religion & values,0
US-EN-47133507,"Bears' win in Philly sends message: 'We're for real'. The Bears' 24-15 win over the Eagles went a long way toward legitimizing their surprising run this season, with several players saying they are ""changing the culture"" after winning nine of their past 10 games.",2025-11-29 14:13:29.891313+00:00,https://www.espn.com/nfl/story/_/id/47133507/real,espn,war & foreign policy,0
US-EN-47123840,"Inside weird and wonderful college football rivalry trophies. What do an axe, skillet and a gold boot have in common? Meet the iconic rivalry trophies of college football.",2025-11-29 14:13:29.891313+00:00,https://www.espn.com/college-football/story/_/id/47123840/usc-stanford-cal-arizona-michigan-college-football-rivalry-trophy,espn,education,0
US-EN-47119613,"Conference finals preview: Can Müller lead the Caps to MLS Cup?. The MLS postseason is down to four teams, with Lionel Messi and Thomas Müller providing plenty of star power, but will it be enough to get to MLS Cup?",2025-11-29 14:13:29.891313+00:00,https://www.espn.com/soccer/story/_/id/47119613/2025-mls-playoffs-conference-finals-preview-thomas-muller-lead-vancouver-whitecaps-mls-cup,espn,sports,0
US-EN-47114476,How Tyrese Maxey went from the hardwood to the 2025 National Dog Show. Maxey recently ran two dogs through the Purina Pro Plan Incredible Dog Challenge Agility Show in Philadelphia.,2025-11-29 14:13:29.891313+00:00,https://www.espn.com/nba/story/_/id/47114476/tyrese-maxey-philadelphia-76ers-national-dog-show-agility-course,espn,other,0
US-EN-47103210,"The key numbers behind Ryan Day's struggles against Michigan. Ryan Day, with a national title and 81-10 record, is one of the best coaches in college football. He also hasn't beaten Michigan in ""The Game"" in six years.",2025-11-29 14:13:29.891313+00:00,https://www.espn.com/college-football/story/_/id/47103210/ryan-day-ohio-state-struggles-key-numbers-michigan,espn,technology & ai,0
US-EN-47110202,"Chaos on the field and off: Headlines, top memories from Vanderbilt's last win at Neyland. Vanderbilt's 2017 win over Tennessee was memorable on the field, but soon after came one of the more remarkable coaching carousel sagas in recent memory.",2025-11-29 14:13:29.891313+00:00,https://www.espn.com/college-football/story/_/id/47110202/vanderbilt-commodores-football-win-neyland-stadium,espn,media & journalism,0
US-EN-47136782,"Sources: Ohio State WRs Smith, Tate to return. Ohio State is getting back a pair of star wide receivers, as Jeremiah Smith and Carnell Tate are expected to play against Michigan, sources told ESPN.",2025-11-29 14:13:29.891313+00:00,https://www.espn.com/college-football/story/_/id/47136782/sources-ohio-state-wrs-smith-tate-set-play-vs-michigan,espn,technology & ai,0
US-EN-47133925,"LSU scores 100 for record 7th straight game. No. 5 LSU set an NCAA record with its seventh consecutive 100-point game Friday night, routing Marist 113-53 at the Paradise Jam tournament.",2025-11-29 14:13:29.891313+00:00,https://www.espn.com/womens-college-basketball/story/_/id/47133925/no-5-lsu-sets-ncaa-record-7th-straight-100-point-game,espn,technology & ai,0
US-EN-47097892,How Friday's results affect the CFP: Texas A&M might no longer get a bye. Take a look at who moved closer to a playoff berth during Rivalry Week.,2025-11-29 14:13:29.891313+00:00,https://www.espn.com/college-football/story/_/id/47097892/friday-college-football-results-affect-cfp-ole-miss-indiana-georgia-tech-texas-am,espn,other,0
US-EN-47110960,"'Not just waiting around for Paul and Joel': NBA scouts, execs on what's next in Philly. What is the 76ers' ceiling? How good is the Maxey-Edgecombe duo? We talked to league insiders about the new era in Philly.",2025-11-29 14:13:29.891313+00:00,https://www.espn.com/nba/story/_/id/47110960/nba-intel-hearing-maxey-edgecombe-embiid-george-76ers-future,espn,technology & ai,0
US-EN-47131383,"Kiffin to make 'hard decision' on future Saturday. Lane Kiffin said he'll decide Saturday whether he will return as Ole Miss' coach in 2026 or take another job, presumably at LSU.",2025-11-29 14:13:29.891313+00:00,https://www.espn.com/college-football/story/_/id/47131383/lane-kiffin-undecided-future-decide-saturday,espn,technology & ai,0
US-EN-47135477,"AD outshined by Doncic, Reaves in return to L.A.. Anthony Davis received loud applause in his return to Los Angeles but was largely held in check by an aggressive Lakers defense as the Mavericks fell 129-119.",2025-11-29 14:13:29.891313+00:00,https://www.espn.com/nba/story/_/id/47135477/mavs-davis-outshined-doncic-reaves-return-la,espn,technology & ai,0
US-EN-47134425,"Hoosiers roll to 12-0, seal Big Ten title game spot. Despite Fernando Mendoza's struggles, No. 2 Indiana rolled to a 56-3 win over rival Purdue, completing the first perfect regular season in school history and clinching a spot in the Big Ten title game.",2025-11-29 14:13:29.891313+00:00,https://www.espn.com/college-football/story/_/id/47134425/indiana-rolls-12-0-seals-spot-big-ten-title-game,espn,education,0
US-EN-47132601,"UGA tops Tech, clinches SEC title berth hours later. Georgia coach Kirby Smart said his team would welcome a potential SEC title game berth after the Bulldogs finished the regular season with a win over Georgia Tech.",2025-11-29 14:13:29.891313+00:00,https://www.espn.com/college-football/story/_/id/47132601/georgia-holds-georgia-tech-later-earns-sec-title-berth,espn,technology & ai,0
US-EN-gamedaykickoff112625,"Week 14 preview: Rivalry Week stakes, plus conference championship scenarios. Our college football experts break down the stakes of the week's biggest matchups.",2025-11-29 14:13:29.891313+00:00,https://www.espn.com/college-football/story/_/page/gamedaykickoff112625/2025-college-football-gameday-kickoff-week-14-rivalry-week-stakes-clinching-scenarios,espn,education,0
US-EN-47134221,"Horns state CFP case with 'pretty dominant win'. Trailing at the half, No. 16 Texas, backed by a standout effort from quarterback Arch Manning, rallied to defeat rival Texas A&amp;M 27-17, spoiling the No. 3 Aggies' undefeated season and SEC title game hopes.",2025-11-29 14:13:29.891313+00:00,https://www.espn.com/college-football/story/_/id/47134221/arch-manning-rallies-texas-hands-texas-first-loss,espn,technology & ai,0
US-EN-47110986,"WWE Survivor Series: Key stats and info to know before WarGames. As we approach Saturday's WWE premium live event, let's catch up on some notes and stats for each match.",2025-11-29 14:13:29.891313+00:00,https://www.espn.com/wwe/story/_/id/47110986/wwe-survivor-series-wargames-john-cena-roman-reigns-aj-lee,espn,war & foreign policy,0
US-EN-47132267,"'SmackDown' highlights: The Survivor Series elimination tag team match made sense. Friday's ""SmackDown"" had it all. A Survivor Series elimination tag team match and more.",2025-11-29 14:13:29.891313+00:00,https://www.espn.com/wwe/story/_/id/47132267/wwe-smackdown-highlights-survivor-series-elimination-tag-team-match-charlotte-flair-wargames,espn,sports,0
US-EN-47129838,"Bears beat Eagles in Philly, boos rain down on Lincoln Financial. This pivotal NFC showdown ended in close fashion with the Bears recording their fifth straight win.",2025-11-29 14:13:29.891313+00:00,https://www.espn.com/nfl/story/_/id/47129838/chicago-bears-defeat-philadelphia-eagles-week-12,espn,technology & ai,0
https://www.theguardian.com/world/2025/nov/29/israel-has-de-facto-state-policy-of-organised-torture-says-un-report,"Israel has ‘de facto state policy’ of organised torture, says UN report. Committee highlights allegations including dog attacks and sexual violence, raising concern about impunity for war crimesIsrael has “a de facto state policy of organised and widespread torture”, according to a UN report covering the past two years, which also raised concerns about the impunity of Israeli security forces for war crimes.The UN committee on torture expressed “deep concern over allegations of repeated severe beatings, dog attacks, electrocution, waterboarding, use of prolonged stress positions [and] sexual violence”. Continue reading...",2025-11-29 13:18:04+00:00,https://www.theguardian.com/world/2025/nov/29/israel-has-de-facto-state-policy-of-organised-torture-says-un-report,guardian_world,war & foreign policy,0
t3_1p9oc94,Quebec to ban public prayer in sweeping new secularism law. &#32; submitted by &#32; /u/JackThaBongRipper [link] &#32; [comments],2025-11-29 12:57:36+00:00,https://www.reddit.com/r/news/comments/1p9oc94/quebec_to_ban_public_prayer_in_sweeping_new/,reddit_news,other,0
https://www.bbc.com/news/articles/c4gp9d28p74o#1,"Flights returning to normal after Airbus warning grounded planes. Around 6,000 planes were affected after an issue that could corrupt data was discovered.",2025-11-29 12:37:29+00:00,https://www.bbc.com/news/articles/c4gp9d28p74o?at_medium=RSS&at_campaign=rss,bbc_world,war & foreign policy,0
https://www.bbc.com/news/articles/cx2gylngx7go#1,"Russian strikes cause power outages for more than 600,000 in Ukraine. The overnight attack kills at least three and injures dozens more.",2025-11-29 12:32:03+00:00,https://www.bbc.com/news/articles/cx2gylngx7go?at_medium=RSS&at_campaign=rss,bbc_world,war & foreign policy,0
t3_1p9n08i,AI for good: Japan's reforestation drones plant forests ten times faster than humans. &#32; submitted by &#32; /u/Bitter-Lengthiness-2 [link] &#32; [comments],2025-11-29 11:45:10+00:00,https://www.reddit.com/r/UpliftingNews/comments/1p9n08i/ai_for_good_japans_reforestation_drones_plant/,reddit_uplifting_news,technology & ai,0
https://www.bbc.com/news/articles/cz0nljm4y74o#2,"Fall of Zelensky's top aide - reboot for Kyiv or costly shake-up?. A widening corruption scandal forced Ukraine's second most powerful person, Andriy Yermak, to resign.",2025-11-29 11:29:35+00:00,https://www.bbc.com/news/articles/cz0nljm4y74o?at_medium=RSS&at_campaign=rss,bbc_world,war & foreign policy,0
https://www.bbc.com/news/articles/ce865kpdzz8o#1,"Australian prime minister becomes first to wed in office. Anthony Albanese weds Jodie Haydon, after the couple became engaged on Valentine's Day last year.",2025-11-29 11:02:47+00:00,https://www.bbc.com/news/articles/ce865kpdzz8o?at_medium=RSS&at_campaign=rss,bbc_world,government,0
https://www.theguardian.com/world/2025/nov/29/convincing-evidence-israel-backed-aid-convoy-looters-in-gaza-historian-says,"Convincing evidence Israel backed aid convoy looters in Gaza, historian says. Account of visit to Gaza by French professor describes Israeli military attacks on security personnel protecting convoysA historian who spent more than a month in Gaza at the turn of the year says he saw “utterly convincing” evidence that Israel supported looters who attacked aid convoys during the conflict.Jean-Pierre Filiu, a professor of Middle East studies at France’s prestigious Sciences Po university, entered Gaza in December where he was hosted by an international humanitarian organisation in the southern coastal zone of al-Mawasi. Continue reading...",2025-11-29 10:00:35+00:00,https://www.theguardian.com/world/2025/nov/29/convincing-evidence-israel-backed-aid-convoy-looters-in-gaza-historian-says,guardian_world,war & foreign policy,0
https://www.bbc.com/news/articles/cvgj9dd983xo#1,Nigeria blames jihadist groups for wave of kidnappings but others accuse criminal gangs. Analysts instead blame criminal gangs for the kidnapping of more than 250 schoolchildren last week.,2025-11-29 09:34:57+00:00,https://www.bbc.com/news/articles/cvgj9dd983xo?at_medium=RSS&at_campaign=rss,bbc_world,technology & ai,0
https://www.theguardian.com/world/2025/nov/29/uk-mps-extra-aid-humanitarian-visas-jamaica-hurricane-melissa-dawn-butler,"UK MPs push for extra aid and visas as Jamaica reels from Hurricane Melissa. Dawn Butler leads calls for humanitarian visas and fee waivers for vulnerable relatives of UK nationals affected by stormBritish MPs have joined campaigners calling for more aid and humanitarian visas for Jamaicans to enter the UK after Hurricane Melissa demolished parts of the country, plunging hundreds of thousands of people into a humanitarian crisis.The UK has pledged £7.5m emergency funds to Jamaica and other islands affected by the hurricane, but many argue that the country has a moral obligation to do more for former Caribbean colonies. Continue reading...",2025-11-29 07:00:31+00:00,https://www.theguardian.com/world/2025/nov/29/uk-mps-extra-aid-humanitarian-visas-jamaica-hurricane-melissa-dawn-butler,guardian_world,climate & environment,0
https://www.theguardian.com/world/2025/nov/29/how-motability-cuts-went-from-a-rightwing-online-campaign-to-rachel-reevess-budget,"How Motability cuts went from a rightwing online campaign to Rachel Reeves’s budget. Car lease scheme for people with mobility problems portrayed as ‘free’ but is funded by benefits and their own contributionsA decade ago, Rachel Reeves was pictured with a disabled constituent, congratulating him on being given the “keys to freedom” afforded by a Motability vehicle.Since then, Reeves – now Britain’s chancellor – has barely mentioned the scheme that leases 300,000 cars a year to people with mobility problems, aside from criticising Tory cuts affecting its users. Continue reading...",2025-11-29 06:00:33+00:00,https://www.theguardian.com/world/2025/nov/29/how-motability-cuts-went-from-a-rightwing-online-campaign-to-rachel-reevess-budget,guardian_politics,technology & ai,0
https://www.bbc.com/news/articles/c4gex225p5jo#1,"No 10 denies Reeves misled public in run-up to Budget. The Conservatives say she was overly gloomy about the public finances as a ""smokescreen"" to raise tax.",2025-11-29 04:40:57+00:00,https://www.bbc.com/news/articles/c4gex225p5jo?at_medium=RSS&at_campaign=rss,bbc_politics,technology & ai,0
t3_1p9e6yy,"Rescuing Dammit, the hard-luck loon. &#32; submitted by &#32; /u/CheezTips [link] &#32; [comments]",2025-11-29 03:14:54+00:00,https://www.reddit.com/r/UpliftingNews/comments/1p9e6yy/rescuing_dammit_the_hardluck_loon/,reddit_uplifting_news,other,0
US-EN-47096100,"Week 13 buzz: What we're hearing on the struggling Bucs, Pickens' next deal, more. Are the Bucs worried about their losing streak? Will the Cowboys extend George Pickens? Here's the latest intel.",2025-11-29 03:07:50.374346+00:00,https://www.espn.com/nfl/story/_/id/47096100/nfl-week-13-buzz-news-updates-fantasy-intel-questions-predictions,espn,other,0
US-EN-47101795,"Preview: Can the teams coexist?. Breaking down the biggest storylines at Survivor Series: WarGames, including John Cena's final PLE match.",2025-11-29 03:07:50.374346+00:00,https://www.espn.com/wwe/story/_/id/47101795/wwe-survivor-series-war-games-preview-john-cena-final-ple-match,espn,war & foreign policy,0
US-EN-47106564,Will Kiffin go to LSU? Or will he stay at Ole Miss? Here's the case for each team. Kiffin is expected to announce his decision Saturday. Here's what he might be weighing.,2025-11-29 03:07:50.374346+00:00,https://www.espn.com/college-football/story/_/id/47106564/lane-kiffin-decision-lsu-florida-ole-miss,espn,sports,0
US-EN-47097079,Which NFL players are the best (and worst) locker room DJs? What music do they play?. The key to a good DJ is understanding the room's vibe and being versatile -- and not always playing NBA YoungBoy.,2025-11-29 03:07:50.374346+00:00,https://www.espn.com/nfl/story/_/id/47097079/team-djs-nba-youngboy-lions-jets-breece-hall-49ers-jets-bills-josh-allen,espn,sports,0
US-EN-47131809,"Surtain thrilled to return for 1st-place Broncos. Denver Broncos cornerback Pat Surtain II, a two-time first-team All-Pro and the reigning Defensive Player of the Year, said he feels a little ""anxious,"" but is more than ready to return to the lineup for Sunday's contest against the Washington Commanders.",2025-11-29 03:07:50.374346+00:00,https://www.espn.com/nfl/story/_/id/47131809/pat-surtain-ii-set-return-broncos-played-lights-out,espn,technology & ai,0
US-EN-47130452,"Stanford names ex-QB Pritchard new head coach. Stanford hired Tavita Pritchard as the school's next head coach, the school announced Friday.",2025-11-29 03:07:50.374346+00:00,https://www.espn.com/college-football/story/_/id/47130452/stanford-hiring-tavita-pritchard-head-coach,espn,education,0
US-EN-47132763,"Eagles to 'evaluate everything' after home loss. Coach Nick Sirianni stood by offensive coordinator Kevin Patullo on Friday, saying he will not change playcallers after another disappointing performance for the group that factored into the Philadelphia Eagles' 24-15 home loss to the Chicago Bears.",2025-11-29 03:07:50.374346+00:00,https://www.espn.com/nfl/story/_/id/47132763/philadelphia-eagles-change-playcallers-home-loss,espn,technology & ai,0
US-EN-46314212,"With Lane Kiffin out of the running, who are the top candidates for Florida?. The Florida job is open. Would another offensive coach make sense, and could that coach hang on to the Gators' loaded roster?",2025-11-29 03:07:50.374346+00:00,https://www.espn.com/college-football/story/_/id/46314212/florida-gators-fire-billy-napier-candidates-lane-kiffin-dj-lagway,espn,labor & work,0
US-EN-47131992,Giannis returns for Bucks' Cup game vs. Knicks. Giannis Antetokounmpo returned to the lineup for the Bucks in an NBA Cup game against the Knicks on Friday night after missing four games because of a groin strain.,2025-11-29 03:07:50.374346+00:00,https://www.espn.com/nba/story/_/id/47131992/bucks-antetokounmpo-returns-strained-groin-vs-knicks,espn,technology & ai,0
US-EN-47130570,"Giants' Dart to start MNF; 'been waiting' to play. After missing the past two games while in concussion protocol, rookie Jaxson Dart has reclaimed his spot as the Giants' QB1 and will return to face the Patriots on Monday night.",2025-11-29 03:07:50.374346+00:00,https://www.espn.com/nfl/story/_/id/47130570/jaxson-dart-concussion-start-giants-mnf-game-vs-pats,espn,technology & ai,0
US-EN-47132416,Darnold grateful to Vikes but focused on Seahawks. Seahawks quarterback Sam Darnold wasn't in an overly reflective mood while answering questions about facing his former team but expressed gratitude for his resurgent season in Minnesota.,2025-11-29 03:07:50.374346+00:00,https://www.espn.com/nfl/story/_/id/47132416/darnold-grateful-vikings-focused-leading-seahawks,espn,media & journalism,0
US-EN-47096942,"37 games with postseason implications to fill your Rivalry Week menu. As if the intensity of rival games weren't enough, there are high stakes everywhere you look this weekend.",2025-11-29 03:07:50.374346+00:00,https://www.espn.com/college-football/story/_/id/47096942/college-football-rivalry-week-preview-ohio-state-michigan-texas-texas,espn,sports,0
t3_1p9989n,"College freshman is deported flying home for Thanksgiving surprise, despite court order. &#32; submitted by &#32; /u/NeighbourNoNeighbor [link] &#32; [comments]",2025-11-28 23:19:10+00:00,https://www.reddit.com/r/news/comments/1p9989n/college_freshman_is_deported_flying_home_for/,reddit_news,education,0
t3_1p936ya,"Plastic can be programmed to have a lifespan of days, months or years. &#32; submitted by &#32; /u/rmuktader [link] &#32; [comments]",2025-11-28 19:06:07+00:00,https://www.reddit.com/r/UpliftingNews/comments/1p936ya/plastic_can_be_programmed_to_have_a_lifespan_of/,reddit_uplifting_news,other,0
t3_1p92ko8,"Homeless veteran living in a car with his 250-lb pig and dog gets life-changing help from Portland firefighters. I photographed Tony James, 44, a veteran who spent months living in his car in Portland with a 250-pound pig named Roscoe and a dog named Elvis. Portland Fire &amp; Rescue’s outreach team stepped in, and now Tony and Elvis are heading to Chicago to stay with family while Roscoe starts a new life at Lighthouse Farm Sanctuary in Scio, Oregon. Their goodbye was rough, but Roscoe now has 54 acres, mud wallows and other pigs to meet. The full story’s in the links — and yes, the page views help us keep doing this kind of work. The latest: &#32; submitted by &#32; /u/markgravesdesign [link] &#32; [comments]",2025-11-28 18:41:53+00:00,https://www.reddit.com/r/UpliftingNews/comments/1p92ko8/homeless_veteran_living_in_a_car_with_his_250lb/,reddit_uplifting_news,creative & design,0
https://www.bbc.com/news/articles/c4g67p9ng2qo#1,Badenoch doesn't rule out Tory-Reform deal in Wales. Polls ahead of next year's Senedd election suggest Reform and Plaid Cymru are competing to be the largest party.,2025-11-28 18:24:49+00:00,https://www.bbc.com/news/articles/c4g67p9ng2qo?at_medium=RSS&at_campaign=rss,bbc_politics,technology & ai,0
