id,text,created_at,link,source,topic,engagement
"tag:blogger.com,1999:blog-2525761963252134386.post-3876471029672017808","Most Frequently Asked Questions About Affiliate Marketing. There are lots of questions floating around about how affiliate marketing works, what to do and what not to do when it comes to setting up a business. With so much uncertainty surrounding both personal and business aspects of affiliate marketing. In this post, we will answer the most frequently asked question about affiliate marketing1. What is affiliate marketing?&nbsp;Affiliate marketing is a way to make money by promoting the products and services of other people and companies. You don't need to create your product or service, just promote existing ones. That's why it's so easy to get started with affiliate marketing. You can even get started with no budget at all!2. What is an affiliate program?&nbsp;An affiliate program is a package of information you create for your product, which is then made available to potential publishers. The program will typically include details about the product and its retail value, commission levels, and promotional materials. Many affiliate programs are managed via an affiliate network like ShareASale, which acts as a platform to connect publishers and advertisers, but it is also possible to offer your program directly.3. What is an affiliate network and how do affiliate networks make money?&nbsp;&nbsp;Affiliate networks connect publishers to advertisers.&nbsp; Affiliate networks make money by charging fees to the merchants who advertise with them; these merchants are known as advertisers. The percentage of each sale that the advertiser pays is negotiated between the merchant and the affiliate network.4. What's the difference between affiliate marketing and dropshipping?&nbsp;Dropshipping is a method of selling that allows you to run an online store without having to stock products. You advertise the products as if you owned them, but when someone makes an order, you create a duplicate order with the distributor at a reduced price. The distributor takes care of the post and packaging on your behalf. As affiliate marketing is based on referrals and this type of drop shipping requires no investment in inventory when a customer buys through the affiliate link, no money exchanges hands.&nbsp;5. Can affiliate marketing and performance marketing be considered the same thing? &nbsp;Performance marketing is a method of marketing that pays for performance, like when a sale is made or an ad is clicked This can include methods like PPC (pay-per-click) or display advertising. Affiliate marketing is one form of performance marketing where commissions are paid out to affiliates on a performance basis when they click on their affiliate link and make a purchase or action.&nbsp;6. Is it possible to promote affiliate offers on mobile devices?&nbsp;Smartphones are essentially miniature computers, so publishers can display the same websites and offers that are available on a PC. But mobiles also offer specific tools not available on computers, and these can be used to good effect for publishers. Publishers can optimize their ads for mobile users by making them easy to access by this audience. Publishers can also make good use of text and instant messaging to promote their offers. As the mobile market is predicted to make up 80% of traffic in the future, publishers who do not promote on mobile devices are missing out on a big opportunity.7. Where do I find qualified publishers?&nbsp;The best way to find affiliate publishers is on reputable networks like ShareASale Cj(Commission Junction), Awin, and Impact radius. These networks have a strict application process and compliance checks, which means that all affiliates are trustworthy.8. What is an affiliate disclosure statement?&nbsp;An affiliate disclosure statement discloses to the reader that there may be affiliate links on a website, for which a commission may be paid to the publisher if visitors follow these links and make purchases.&nbsp;9. Does social media activity play a significant role in affiliate marketing?&nbsp;Publishers promote their programs through a variety of means, including blogs, websites, email marketing, and pay-per-click ads. Social media has a huge interactive audience, making this platform a good source of potential traffic.10. What is a super affiliate?&nbsp;A super affiliate is an affiliate partner who consistently drives a large majority of sales from any program they promote, compared to other affiliate partners involved in that program.&nbsp; Affiliates make a lot of money from affiliate marketing Pat Flynn earned more than $50000 in 2013 from affiliate marketing.11. How do we track publisher sales activity?&nbsp;Publishers can be identified by their publisher ID, which is used in tracking cookies to determine which publishers generate sales. The activity is then viewed within a network's dashboard.&nbsp;12. Could we set up an affiliate program in multiple countries?&nbsp;Because the Internet is so widespread, affiliate programs can be promoted in any country. Affiliate strategies that are set internationally need",2025-12-01 03:46:35.632058+00:00,https://techncruncher.blogspot.com/2022/06/most-frequently-asked-questions-about.html,techcrunch,technology & ai,0
"tag:blogger.com,1999:blog-2525761963252134386.post-2614342552940509599","What is Blockchain: Everything You Need to Know (2022). If you want to pay online, you need to register an account and provide credit card information. If you don't have a credit card, you can pay with bank transfer. With the rise of cryptocurrencies, these methods may become old.Imagine a world in which you can do transactions and many other things without having to give your personal information. A world in which you don’t need to rely on banks or governments anymore. Sounds amazing, right? That’s exactly what blockchain technology allows us to do.It’s like your computer’s hard drive. blockchain is a technology that lets you store data in digital blocks, which are connected together like links in a chain.&nbsp;Blockchain technology was originally invented in 1991 by two mathematicians, Stuart Haber and W. Scot Stornetta. They first proposed the system to ensure that timestamps could not be tampered with.A few years later, in 1998, software developer Nick Szabo proposed using a similar kind of technology to secure a digital payments system he called “Bit Gold.” However, this innovation was not adopted until Satoshi Nakamoto claimed to have invented the first Blockchain and Bitcoin.So, What is Blockchain?A blockchain is a distributed database shared between the nodes of a computer network. It saves information in digital format. Many people first heard of blockchain technology when they started to look up information about bitcoin.Blockchain is used in cryptocurrency systems to ensure secure, decentralized records of transactions.Blockchain allowed people to guarantee the fidelity and security of a record of data without the need for a third party to ensure accuracy.To understand how a blockchain works, Consider these basic steps:Blockchain collects information in “blocks”.A block has a storage capacity, and once it's used up, it can be closed and linked to a previously served block.Blocks form chains, which are called “Blockchains.”More information will be added to the block with the most content until its capacity is full. The process repeats itself.Each block in the chain has an exact timestamp and can't be changed.Let’s get to know more about the blockchain.How does blockchain work?Blockchain records digital information and distributes it across the network without changing it. The information is distributed among many users and stored in an immutable, permanent ledger that can't be changed or destroyed. That's why blockchain is also called ""Distributed Ledger Technology"" or DLT.Here’s how it works:Someone or a computer will transactsThe transaction is transmitted throughout the network.A network of computers can confirm the transaction.When it is confirmed a transaction is added to a blockThe blocks are linked together to create a history. And that’s the beauty of it! The process may seem complicated, but it’s done in minutes with modern technology. And because technology is advancing rapidly, I expect things to move even more quickly than ever.A new transaction is added to the system. It is then relayed to a network of computers located around the world. The computers then solve equations to ensure the authenticity of the transaction.Once a transaction is confirmed, it is placed in a block after the confirmation. All of the blocks are chained together to create a permanent history of every transaction.How are Blockchains used?Even though blockchain is integral to cryptocurrency, it has other applications. For example, blockchain can be used for storing reliable data about transactions. Many people confuse blockchain with cryptocurrencies like bitcoin and ethereum.Blockchain already being adopted by some big-name companies, such as Walmart, AIG, Siemens, Pfizer, and Unilever. For example, IBM's Food Trust uses blockchain to track food's journey before reaching its final destination.Although some of you may consider this practice excessive, food suppliers and manufacturers adhere to the policy of tracing their products because bacteria such as E. coli and Salmonella have been found in packaged foods. In addition, there have been isolated cases where dangerous allergens such as peanuts have accidentally been introduced into certain products.Tracing and identifying the sources of an outbreak is a challenging task that can take months or years. Thanks to the Blockchain, however, companies now know exactly where their food has been—so they can trace its location and prevent future outbreaks.Blockchain technology allows systems to react much faster in the event of a hazard. It also has many other uses in the modern world.What is Blockchain Decentralization?Blockchain technology is safe, even if it’s public. People can access the technology using an internet connection.Have you ever been in a situation where you had all your data stored at one place and that one secure place got compromised? Wouldn't it be great if there was a way to prevent your data from leaking out even when the security of your storage systems is compromised?Blockchain technology provides a wa",2025-12-01 03:46:35.632058+00:00,https://techncruncher.blogspot.com/2022/04/what-is-blockchain-everything-you-need.html,techcrunch,war & foreign policy,0
"tag:blogger.com,1999:blog-2525761963252134386.post-4109465143659836541","ProWritingAid VS Grammarly: Which Grammar Checker is Better in (2022) ?. ProWritingAid VS Grammarly:&nbsp;&nbsp;When it comes to English grammar, there are two Big Players that everyone knows of: the Grammarly and ProWritingAid. but you are wondering which one to choose so here we write a detail article which will help you to choose the best one for you so Let's startWhat is Grammarly?Grammarly is a tool that checks for grammatical errors, spelling, and punctuation.it gives you comprehensive feedback on your writing. You can use this tool to proofread and edit articles, blog posts, emails, etc.Grammarly also detects all types of mistakes, including sentence structure issues and misused words. It also gives you suggestions on style changes, punctuation, spelling, and grammar all are in real-time. The free version covers the basics like identifying grammar and spelling mistakeswhereas the Premium version offers a lot more functionality, it detects plagiarism in your content, suggests word choice, or adds fluency to it.Features of GrammarlySpelling and Word Suggestion: Grammarly detects basic to advance grammatical errors and also help you why this is an error and suggest to you how you can improve itCreate a Personal Dictionary: The Grammarly app allows you to add words to your personal dictionary so that the same mistake isn't highlighted every time you run Grammarly.Different English Style: Check to spell for American, British, Canadian, and Australian English.Plagiarism: This feature helps you detect if a text has been plagiarized by comparing it with over eight billion web pages. Wordiness: This tool will help you check your writing for long and hard-to-read sentences. It also shows you how to shorten sentences so that they are more concise.Passive Voice: The program also notifies users when passive voice is used too frequently in a document.Punctuations: This feature flags all incorrect and missing punctuation.Repetition: The tool provides recommendations for replacing the repeated word.Proposition: Grammarly identifies misplaced and confused prepositions. Plugins: It offers Microsoft Word, Microsoft Outlook, and Google Chrome plugins.What is ProWritingAid?ProWritingAid is a style and grammar checker for content creators and writers. It helps to optimize word choice, punctuation errors, and common grammar mistakes, providing detailed reports to help you improve your writing.&nbsp;ProWritingAid can be used as an add-on to WordPress, Gmail, and Google Docs. The software also offers helpful articles, videos, quizzes, and explanations to help improve your writing.Features of ProWriting AidHere are some key features of ProWriting Aid:Grammar checker and spell checker: This tool helps you to find all grammatical and spelling errors.Find repeated words:&nbsp; The tool also allows you to search for repeated words and phrases in your content.Context-sensitive style suggestions:&nbsp; You can find the exact style of writing you intend and suggest if it flows well in your writing.Check the readability of your content: Pro Writing Aid helps you identify the strengths and weaknesses of your article by pointing out difficult sentences and paragraphs.Sentence Length: It also indicates the length of your sentences.Check Grammatical error: It also checks your work for any grammatical errors or typos, as well.Overused words: As a writer, you might find yourself using the same word repeatedly. ProWritingAid's overused words checker helps you avoid this lazy writing mistake.Consistency: Check your work for inconsistent usage of open and closed quotation marks.Echoes: Check your writing for uniformly repetitive words and phrases.Difference between Grammarly and Pro-Writing AidGrammarly and ProWritingAid are well-known grammar-checking software. However, if you're like most people who can't decide which to use, here are some different points that may be helpful in your decision.Grammarly vs ProWritingAidGrammarly is a writing enhancement tool that offers suggestions for grammar, vocabulary, and syntax whereas ProWritingAid offers world-class grammar and style checking, as well as advanced reports to help you strengthen your writing.Grammarly provides Android and IOS apps whereas ProWritingAid doesn't have a mobile or IOS app.Grammarly offers important suggestions about mistakes you've made whereas ProWritingAid&nbsp; shows more suggestions than Grammarly but all recommendations are not accurateGrammarly has a more friendly UI/UX whereas the ProWritingAid interface is not friendly as Grammarly.Grammarly is an accurate grammar checker for non-fiction writing whereas ProWritingAid is an accurate grammar checker for fiction writers.Grammarly finds grammar and punctuation mistakes, whereas ProWritingAid identifies run-on sentences and fragments.Grammarly provides 24/7 support via submitting a ticket and sending emails. ProWritingAid’s support team is available via email, though the response time is approximately 48 hours.Grammarly offers many features in its free plan, whereas ProWritingAid offers some",2025-12-01 03:46:35.632058+00:00,https://techncruncher.blogspot.com/2022/03/prowritingaid-vs-grammarly-which.html,techcrunch,war & foreign policy,0
"tag:blogger.com,1999:blog-2525761963252134386.post-1378858638659089188","Top 10 AI Tools That Will Transform Your Content Creation in 2025. Looking to level up your content creation game in 2025? You're in the right place! The digital landscape has evolved dramatically, and AI tools have become essential for creators who want to stay ahead of the curve. In this guide, I'll show you the top 10 AI tools that are revolutionizing content creation and making creators' lives easier.Why You Need These AI Tools in 2025Content creation has become more demanding than ever. Whether you're a social media influencer, marketer, or business owner, keeping up with the constant need for fresh, engaging content can be overwhelming. That's where AI tools come in – they're not just fancy tech, they're your secret weapon for creating better content faster.Let's Dive Into the Top 10 AI Tools for 20251. ChatGPT: Content Ideation and ScriptwritingWhat Makes It Special: ChatGPT has evolved into a comprehensive content creation assistant by combining advanced language understanding with specialized content optimization features. Its ability to generate, edit, and optimize content while maintaining brand voice and industry expertise makes it an essential tool for creators who need to produce high-quality written content at scale.Key Features:Advanced content generationSEO optimizationBrand voice maintenanceResearch capabilitiesMulti-format adaptationPricing:Free tier availablePlus: $20/monthPro: $200/monthPerfect For: Content writers, marketers, and businesses needing consistent, high-quality written content.2. Canva Magic Studio: Visual Design and Social Media Content CreationWhat Makes It Special: Canva Magic Studio has transformed the graphic design landscape by combining its user-friendly interface with powerful AI capabilities. The platform's ability to understand design principles and automatically generate on-brand content while maintaining professional aesthetics makes it accessible for beginners while providing enough sophistication for professional designers.Key Features:AI design generationBrand kit integrationMagic resizeAnimation toolsTemplate libraryPricing:Free tier availablePro: $6.50/user/monthTeams: $5/user/monthPerfect For: Small businesses, social media managers, and anyone needing quick, professional-looking designs.3. RunwayML : AI Video GeneratorWhat Makes It Special: RunwayML stands out as the ultimate video creation powerhouse by combining professional-grade effects with user-friendly AI technology. Its game-changing ability to manipulate video content – from changing weather effects with a text prompt to removing objects seamlessly in real-time – makes it indispensable for creators who want to produce high-quality video content without getting bogged down by technical complexities.Key Features:Advanced video generation &amp; editingReal-time visual effectsSmart motion trackingGreen screen effects without actual green screenAI-powered editing suitePricing:Free tier availableStandard: $12/monthPro: $28/monthUnlimited: $76/monthEnterprise: Custom PricePerfect For: Video creators, YouTubers, and social media managers who want to create professional-quality videos quickly. 4. MidJourney: AI Art GenerationWhat Makes It Special: Midjourney V6 has redefined AI image generation by mastering the nuances of professional photography and artistic style. Its ability to understand and execute complex creative directions – from specific lighting conditions to branded visual styles – while maintaining consistent quality across multiple generations makes it the go-to tool for creators who need stunning visuals that align perfectly with their brand identity.Key Features:Photorealistic image generationAdvanced style controlQuick generation timeCommercial usage rightsStrong community supportPricing:Basic: $10/monthStandard: $30/monthPro: $60/monthMega:&nbsp;$120/monthPerfect For: Social media managers, digital marketers, and anyone needing professional-quality visuals consistently.5. Synthesia: AI Avatar-Based Video CreationWhat Makes It Special: Synthesia has transformed video creation by making it possible to create professional-looking AI avatar videos in minutes. Its ability to generate natural-looking presentations in multiple languages with synchronized lip movements and gestures makes it invaluable for creators who need to produce video content at scale without the traditional filming process.Key Features:AI avatar Video creationMulti-language supportCustom avatar optionsProfessional templatesScript to video conversionPricing:Free tier availableStarter: $18/monthCreator: $64/monthEnterprise: Custom pricingPerfect For: Businesses and educators creating training videos, presentations, and multilingual content.6. Descript: Podcast and Video Editing with Transcription FeaturesWhat Makes It Special: Descript has transformed audio and video editing by making it as simple as editing a text document. Its innovative approach to media editing, combined with powerful AI features like automatic transcription and filler word removal, makes professional-quality editing acc",2025-12-01 03:46:35.632058+00:00,https://techncruncher.blogspot.com/2025/01/top-10-ai-tools-that-will-transform.html,techcrunch,climate & environment,0
US-EN-47149761,"Awful in first half, magic in second: Joshua Zirkzee leads Man United comeback. Man United and Joshua Zirkzee had a poor first half vs. Crystal Palace, but one moment of magic turned everything around.",2025-12-01 03:46:35.189522+00:00,https://www.espn.com/soccer/story/_/id/47149761/zirkzee-leads-man-united-comeback-game-two-halves-vs-palace,espn,other,0
US-EN-47147849,"Transfer rumors, news: Man United to move for Real Madrid's Valverde. Manchester United are exploring a move for Real Madrid midfielder Federico Valverde. Transfer Talk has the latest news and rumors.",2025-12-01 03:46:35.189522+00:00,https://www.espn.com/soccer/story/_/id/47147849/transfer-rumors-news-man-united-move-real-madrid-valverde,espn,gender & sexuality,0
US-EN-47096983,"23XI vs. NASCAR trial: Why Michael Jordan & Co. want to tear up stock car racing. The antitrust suit against NASCAR goes to court on Monday, in a trial that could tear at the fabric of stock car racing as we know it.",2025-12-01 03:46:35.189522+00:00,https://www.espn.com/racing/nascar/story/_/id/47096983/23xi-front-row-vs-nascar-trial-why-michael-jordan-denny-hamlin-want-tear-stock-car-racing,espn,technology & ai,0
US-EN-47011671,WNBA CBA negotiations: What happens if there's no deal at the end of the 30 days?. How far apart are the two sides and what if a deal isn't in place by the Sunday WNBA deadline for a new CBA?,2025-12-01 03:46:35.189522+00:00,https://www.espn.com/wnba/story/_/id/47011671/wnba-cba-negotiations-wnbpa-updates-latest-news,espn,technology & ai,0
US-EN-47158563,"McLaren's Qatar blunder has it on the brink of a 2007 rerun. In 2007, McLaren refused to favor either of its drivers, costing the team a title. After another botched call in Qatar, is history repeating itself?",2025-12-01 03:46:35.189522+00:00,https://www.espn.com/racing/f1/story/_/id/47158563/mclaren-qatar-oscar-piastri-lando-norris-blunder-the-brink-2007-rerun,espn,sports,0
US-EN-45531306,"NFL draft risers, questions and notes: Can T.J. Parker climb back up the board?. We have NFL draft notes through CFB Week 14, including what to make of T.J. Parker's three-sack game and Trevor Goosby's rise.",2025-12-01 03:46:35.189522+00:00,https://www.espn.com/nfl/draft2026/story/_/id/45531306/2026-nfl-draft-notebook-questions-latest-updates-risers-cfb-prospects,espn,sports,0
US-EN-47145657,"Survivor Series WarGames: Who is the masked man who attacked CM Punk?. The men's WarGames match was interrupted by a mystery man, and the theories are already flying.",2025-12-01 03:46:35.189522+00:00,https://www.espn.com/wwe/story/_/id/47145657/survivor-series-wargames-actually-attacked-cm-punk,espn,war & foreign policy,0
US-EN-40699880,"Fantasy Football Buzz: Meyers leads Jags WRs again; Bucs' Irving solid in return. Jakobi Meyers keeps producing for the Jaguars, and Bucky Irving looked good in his return in Week 14",2025-12-01 03:46:35.189522+00:00,https://www.espn.com/fantasy/football/story/_/id/40699880/fantasy-football-injuries-position-battles-nfl-news-analysis,espn,technology & ai,0
US-EN-FFSundayHighLows-47154022,"Week 13 winners and losers: Bijan Robinson runs wild, Davante Adams makes history. Bijan Robinson, A.J. Brown and Patrick Mahomes led the way with big Week 13 performances, while Lamar Jackson, Saquon Barkley and Jaxon Smith-Njigba were among the biggest disappointments.",2025-12-01 03:46:35.189522+00:00,https://www.espn.com/fantasy/football/story/_/page/FFSundayHighLows-47154022/nfl-week-13-fantasy-football-winners-losers-injuries-rankings-more,espn,technology & ai,0
US-EN-47151008,"Liverpool needed Isak, Wirtz to ease pressure on Slot, and they did. A fine performance from Florian Wirtz and a first goal for Alexander Isak eased some pressure on Liverpool.",2025-12-01 03:46:35.189522+00:00,https://www.espn.com/soccer/story/_/id/47151008/liverpool-needed-isak-wirtz-ease-pressure-slot-did,espn,media & journalism,0
US-EN-47011600,"Women's Feast Week guide: Crooks' 47 points push Iowa State to 9-0. Big performances from Texas, LSU and Iowa State headline the most significant results from Feast Week.",2025-12-01 03:46:35.189522+00:00,https://www.espn.com/womens-college-basketball/story/_/id/47011600/womens-college-basketball-2025-thanksgiving-tournament-feast-week-schedule-viewer-guide,espn,media & journalism,0
US-EN-47158223,Huskers earn top overall seed in volleyball tourney. Undefeated Nebraska earned the No. 1 overall seed in the NCAA women's volleyball tournament bracket released Sunday.,2025-12-01 03:46:35.189522+00:00,https://www.espn.com/college-sports/story/_/id/47158223/undefeated-nebraska-earns-top-overall-seed-ncaa-women-volleyball-tournament,espn,gender & sexuality,0
