id,text,created_at,link,source,topic,engagement
https://www.theguardian.com/world/2025/dec/01/i-have-been-defeated-hundreds-of-palestinians-face-eviction-from-east-jerusalem,"‘I have been defeated’: hundreds of Palestinians face eviction from East Jerusalem. Residents in Batn al-Hawa have all but given up hope and blame the Gaza war which, they say, has created ‘an atmosphere of hate’ towards themThe dome of the al-Aqsa mosque gleamed in the late afternoon autumnal sun as Zohair Rajabi looked out from his balcony towards the skyline of Jerusalem’s Old City. Christian pilgrims spilled out of buses, while observant Jewish worshippers gathered outside the gate to the Western Wall.New flags now fly a few metres from Rajabi’s home. Blue and white and bearing the Star of David, they mark where residents were evicted recently from their homes by Israeli police. After more than 20 years of activism, Rajabi knows his days in Batn al-Hawa, a predominantly Palestinian neighbourhood less than a mile south of the Old City, are almost certainly numbered. Continue reading...",2025-12-01 06:00:27+00:00,https://www.theguardian.com/world/2025/dec/01/i-have-been-defeated-hundreds-of-palestinians-face-eviction-from-east-jerusalem,guardian_world,war & foreign policy,0
https://www.theguardian.com/global-development/2025/dec/01/global-health-hiv-aids-funding-cuts-infections-prevention,"Aid cuts have shaken HIV/Aids care to its core – and will mean millions more infections ahead. Reports highlight devastating impact of slashed funding, especially in parts of Africa, that could lead to 3.3m new HIV infections by 2030In Mozambique, a teenage rape victim sought care at a health clinic only to find it closed. In Zimbabwe, Aids-related deaths have risen for the first time in five years. In Ethiopia and the Democratic Republic of the Congo (DRC), patients with suspected HIV went undiagnosed due to test-kit stocks running out.Stories of the devastating impact of US, British and wider European aid cuts on the fight against HIV – particularly in sub-Saharan Africa – continue to mount as 2025 comes to an end, and are set out in a series of reports released in the past week. Continue reading...",2025-12-01 06:00:27+00:00,https://www.theguardian.com/global-development/2025/dec/01/global-health-hiv-aids-funding-cuts-infections-prevention,guardian_world,technology & ai,0
https://www.bbc.com/news/articles/cpvd4exxlpzo#1,"Sir Andreas Whittam Smith, co-founder of the Independent, dies aged 88. The Independent was the first paper not to have a permanent allegiance to a political party.",2025-12-01 05:48:34+00:00,https://www.bbc.com/news/articles/cpvd4exxlpzo?at_medium=RSS&at_campaign=rss,bbc_entertainment,politics,0
t3_1pb42hq,"Investigators plead for tips after 3 children, 1 adult killed in shooting at child's birthday party. &#32; submitted by &#32; /u/igetproteinfartsHELP [link] &#32; [comments]",2025-12-01 05:05:43+00:00,https://www.reddit.com/r/news/comments/1pb42hq/investigators_plead_for_tips_after_3_children_1/,reddit_news,crime & safety,0
https://www.theguardian.com/society/ng-interactive/2025/dec/01/it-was-extremely-pornographic-cara-hunter-on-the-deepfake-video-that-nearly-ended-her-political-career,"‘It was extremely pornographic’: Cara Hunter on the deepfake video that nearly ended her political career. The Irish politician was targeted in 2022, in the final weeks of her run for office. She has never found out who made the malicious deepfake, but knew immediately she had to try to stop this happening to other womenWhen Cara Hunter, the Irish politician, looks back on the moment she found out she had been deepfaked, she says it is “like watching a horror movie”. The setting is her grandmother’s rural home in the west of Tyrone on her 90th birthday, April 2022. “Everyone was there,” she says. “I was sitting with all my closest family members and family friends when I got a notification through Facebook Messenger.” It was from a stranger. “Is that you in the video … the one going round on WhatsApp?” he asked.Hunter made videos all the time, especially then, less than three weeks before elections for the Northern Ireland assembly. She was defending her East Londonderry seat, campaigning, canvassing, debating. Yet, as a woman, this message from a man she didn’t know was enough to put her on alert. “I replied that I wasn’t sure which video he was talking about,” Hunter says. “So he asked, did I want to see it?” Then he sent it over. Continue reading...",2025-12-01 05:00:25+00:00,https://www.theguardian.com/society/ng-interactive/2025/dec/01/it-was-extremely-pornographic-cara-hunter-on-the-deepfake-video-that-nearly-ended-her-political-career,guardian_politics,technology & ai,0
https://www.bbc.com/news/articles/c36zwywll02o#1,E-commerce platform breach exposes nearly 34 million customers' data. Retail giant Coupang is often described as South Korea's equivalent of Amazon.com.,2025-12-01 04:08:47+00:00,https://www.bbc.com/news/articles/c36zwywll02o?at_medium=RSS&at_campaign=rss,bbc_business,technology & ai,0
t3_1pb2thm,"/r/WorldNews Live Thread: Russian Invasion of Ukraine Day 1376, Part 1 (Thread #1523). &#32; submitted by &#32; /u/WorldNewsMods [link] &#32; [comments]",2025-12-01 04:02:29+00:00,https://www.reddit.com/r/worldnews/comments/1pb2thm/rworldnews_live_thread_russian_invasion_of/,reddit_world_news,war & foreign policy,0
US-EN-47157861,Bills' Allen sets NFL record for rushing TDs by QB. Buffalo's Josh Allen scored on an 8-yard run against the Steelers on Sunday to set the NFL's all-time record for regular-season rushing touchdowns by a quarterback (76).,2025-12-01 03:46:35.189522+00:00,https://www.espn.com/nfl/story/_/id/47157861/bills-josh-allen-sets-nfl-record-rushing-tds-quarterback,espn,technology & ai,0
US-EN-47158223,Huskers earn top overall seed in volleyball tourney. Undefeated Nebraska earned the No. 1 overall seed in the NCAA women's volleyball tournament bracket released Sunday.,2025-12-01 03:46:35.189522+00:00,https://www.espn.com/college-sports/story/_/id/47158223/undefeated-nebraska-earns-top-overall-seed-ncaa-women-volleyball-tournament,espn,gender & sexuality,0
US-EN-47145657,"Survivor Series WarGames: Who is the masked man who attacked CM Punk?. The men's WarGames match was interrupted by a mystery man, and the theories are already flying.",2025-12-01 03:46:35.189522+00:00,https://www.espn.com/wwe/story/_/id/47145657/survivor-series-wargames-actually-attacked-cm-punk,espn,war & foreign policy,0
US-EN-40699880,"Fantasy Football Buzz: Meyers leads Jags WRs again; Bucs' Irving solid in return. Jakobi Meyers keeps producing for the Jaguars, and Bucky Irving looked good in his return in Week 14",2025-12-01 03:46:35.189522+00:00,https://www.espn.com/fantasy/football/story/_/id/40699880/fantasy-football-injuries-position-battles-nfl-news-analysis,espn,technology & ai,0
US-EN-47150118,"Follow live: Broncos, Commanders trade incredible touchdowns. null",2025-12-01 03:46:35.189522+00:00,https://www.espn.com/nfl/story/_/id/47150118/week-13-nfl-highlights-plays-moments-touchdowns,espn,other,0
US-EN-47158915,"Herbert injures hand, doesn't expect to miss time. Los Angeles Chargers quarterback Justin Herbert on Sunday suffered a break in his left hand during his team's 31-14 win over the Las Vegas Raiders, and though it will require surgery, he expects to play in his next game Dec. 8.",2025-12-01 03:46:35.189522+00:00,https://www.espn.com/nfl/story/_/id/47158915/justin-herbert-suffers-break-left-hand-chargers-win,espn,technology & ai,0
US-EN-47157090,Browns defenders rip WR Jennings for comments. Multiple Browns defenders had sharp criticism of 49ers wide receiver Jauan Jennings for comments they said crossed the line during Sunday's game between the teams.,2025-12-01 03:46:35.189522+00:00,https://www.espn.com/nfl/story/_/id/47157090/browns-defenders-say-49ers-jennings-crossed-line-comments,espn,technology & ai,0
US-EN-47002863,"Grading coaching hires: Kiffin to LSU, Sumrall to Florida and more. As the coaching carousel continues to spin, we grade every major hire.",2025-12-01 03:46:35.189522+00:00,https://www.espn.com/college-football/story/_/id/47002863/grading-2025-college-football-head-coaching-hires,espn,other,0
US-EN-47149761,"Awful in first half, magic in second: Joshua Zirkzee leads Man United comeback. Man United and Joshua Zirkzee had a poor first half vs. Crystal Palace, but one moment of magic turned everything around.",2025-12-01 03:46:35.189522+00:00,https://www.espn.com/soccer/story/_/id/47149761/zirkzee-leads-man-united-comeback-game-two-halves-vs-palace,espn,other,0
US-EN-47151008,"Liverpool needed Isak, Wirtz to ease pressure on Slot, and they did. A fine performance from Florian Wirtz and a first goal for Alexander Isak eased some pressure on Liverpool.",2025-12-01 03:46:35.189522+00:00,https://www.espn.com/soccer/story/_/id/47151008/liverpool-needed-isak-wirtz-ease-pressure-slot-did,espn,media & journalism,0
US-EN-47147849,"Transfer rumors, news: Man United to move for Real Madrid's Valverde. Manchester United are exploring a move for Real Madrid midfielder Federico Valverde. Transfer Talk has the latest news and rumors.",2025-12-01 03:46:35.189522+00:00,https://www.espn.com/soccer/story/_/id/47147849/transfer-rumors-news-man-united-move-real-madrid-valverde,espn,gender & sexuality,0
US-EN-47011671,WNBA CBA negotiations: What happens if there's no deal at the end of the 30 days?. How far apart are the two sides and what if a deal isn't in place by the Sunday WNBA deadline for a new CBA?,2025-12-01 03:46:35.189522+00:00,https://www.espn.com/wnba/story/_/id/47011671/wnba-cba-negotiations-wnbpa-updates-latest-news,espn,technology & ai,0
US-EN-47156250,📷 Week 13 trolls: Panthers jab Rams after upset. NFL teams didn't take the holiday week off from being petty at their opponents after big wins.,2025-12-01 03:46:35.189522+00:00,https://www.espn.com/nfl/story/_/id/47156250/nfl-week-13-trolls,espn,sports,0
US-EN-FFSundayHighLows-47154022,"Week 13 winners and losers: Bijan Robinson runs wild, Davante Adams makes history. Bijan Robinson, A.J. Brown and Patrick Mahomes led the way with big Week 13 performances, while Lamar Jackson, Saquon Barkley and Jaxon Smith-Njigba were among the biggest disappointments.",2025-12-01 03:46:35.189522+00:00,https://www.espn.com/fantasy/football/story/_/page/FFSundayHighLows-47154022/nfl-week-13-fantasy-football-winners-losers-injuries-rankings-more,espn,technology & ai,0
US-EN-47096983,"23XI vs. NASCAR trial: Why Michael Jordan & Co. want to tear up stock car racing. The antitrust suit against NASCAR goes to court on Monday, in a trial that could tear at the fabric of stock car racing as we know it.",2025-12-01 03:46:35.189522+00:00,https://www.espn.com/racing/nascar/story/_/id/47096983/23xi-front-row-vs-nascar-trial-why-michael-jordan-denny-hamlin-want-tear-stock-car-racing,espn,technology & ai,0
US-EN-47158563,"McLaren's Qatar blunder has it on the brink of a 2007 rerun. In 2007, McLaren refused to favor either of its drivers, costing the team a title. After another botched call in Qatar, is history repeating itself?",2025-12-01 03:46:35.189522+00:00,https://www.espn.com/racing/f1/story/_/id/47158563/mclaren-qatar-oscar-piastri-lando-norris-blunder-the-brink-2007-rerun,espn,sports,0
t3_1pb013t,Report says world's biggest arms producers increased revenue by 5.9% last year to record level. &#32; submitted by &#32; /u/CHolland8776 [link] &#32; [comments],2025-12-01 01:50:04+00:00,https://www.reddit.com/r/news/comments/1pb013t/report_says_worlds_biggest_arms_producers/,reddit_news,business & corporate,0
t3_1pazypr,"WW1 toxic compound sprayed on Georgian protesters, BBC evidence suggests. &#32; submitted by &#32; /u/Whatever-you-bastard [link] &#32; [comments]",2025-12-01 01:46:52+00:00,https://www.reddit.com/r/worldnews/comments/1pazypr/ww1_toxic_compound_sprayed_on_georgian_protesters/,reddit_world_news,other,0
https://www.bbc.com/news/articles/clyx2zjd8qvo#2,"Feuds, boycotts and the birth of Your Party. The path to this weekend's founding conference has been overshadowed by splits in the party.",2025-12-01 00:39:12+00:00,https://www.bbc.com/news/articles/clyx2zjd8qvo?at_medium=RSS&at_campaign=rss,bbc_politics,other,0
https://www.bbc.com/news/articles/czrk7g50e1po#0,"WW1 toxic compound sprayed on Georgian protesters, BBC evidence suggests. Anti-government demonstrators are likely to have been targeted with camite, our investigation finds.",2025-12-01 00:19:04+00:00,https://www.bbc.com/news/articles/czrk7g50e1po?at_medium=RSS&at_campaign=rss,bbc_world,government,0
https://www.bbc.com/news/articles/cgex9d0212xo#2,Greek sheep and goat cull raises fears of feta cheese shortage. Livestock is being culled across the country due to an infectious disease outbreak.,2025-12-01 00:10:14+00:00,https://www.bbc.com/news/articles/cgex9d0212xo?at_medium=RSS&at_campaign=rss,bbc_business,technology & ai,0
https://www.theguardian.com/commentisfree/2025/nov/30/labour-economic-renewal-budget-left-right-economy,"There are those on the left and right who offer only grievance: Labour is getting on with the job of economic renewal | Keir Starmer. Judge last week’s budget in the light of our bold plans to sweep away red tape, tackle inactivity among young people and pursue a closer trading relationship with the EUKeir Starmer is the prime minister of the United KingdomReport: Labour’s economic plan will take years to deliver, Starmer saysAt the budget last week, we made the right choices for Britain, cutting the cost of energy with £150 off bills, protecting the NHS and tackling the scourge of child poverty by removing the two-child limit. We also ensured that the revenue we raised through taxes was done fairly, with everyone contributing but those with the broadest shoulders contributing their fair share. As a result of the choices we made, the budget created a more stable economic environment, driving down inflation and government bond yields. This is vital for protecting our public services, when £1 in every £10 spent by government goes on debt interest.The budget builds on the action we have already taken to improve the economy: providing £120bn in extra capital investment in such things as roads, rail and energy; enacting the biggest planning reforms in a generation to back builders, not blockers; supporting the expansion of Heathrow and Gatwick; and signing trade deals with the EU, India and the US. Taken together, these have allowed us to exceed our growth forecasts.Keir Starmer is the prime minister of the United KingdomDo you have an opinion on the issues raised in this article? If you would like to submit a response of up to 300 words by email to be considered for publication in our letters section, please click here. Continue reading...",2025-11-30 22:30:18+00:00,https://www.theguardian.com/commentisfree/2025/nov/30/labour-economic-renewal-budget-left-right-economy,guardian_politics,climate & environment,0
https://www.theguardian.com/uk-news/2025/nov/30/starmer-leads-fightback-as-budget-row-rumbles-on-for-reeves,"Starmer leads fightback as budget row rumbles on for Reeves. The prime minister is keen to change the conversation after the Tories called his chancellor’s ethics into questionThe political fates of Keir Starmer and Rachel Reeves are intertwined. Allies say that if one goes, the other is likely to follow.This is why, in the wake of the budget, the Conservatives have attempted to focus their response on the chancellor’s personal ethics, accusing Reeves of lying about the rationale behind her record-breaking tax rises. Continue reading...",2025-11-30 22:30:17+00:00,https://www.theguardian.com/uk-news/2025/nov/30/starmer-leads-fightback-as-budget-row-rumbles-on-for-reeves,guardian_politics,politics,0
https://www.bbc.com/news/articles/clyd38gp00eo#1,Reeves denies she misled public over UK's finances in run-up to Budget. Conservative leader Kemi Badenoch says she's not satisfied with the chancellor's denial of lying and called on her to resign.,2025-11-30 22:23:47+00:00,https://www.bbc.com/news/articles/clyd38gp00eo?at_medium=RSS&at_campaign=rss,bbc_business,economics,0
t3_1pav925,Lithuania capital airport closes again over balloons. &#32; submitted by &#32; /u/VectorChing101 [link] &#32; [comments],2025-11-30 22:18:51+00:00,https://www.reddit.com/r/news/comments/1pav925/lithuania_capital_airport_closes_again_over/,reddit_news,technology & ai,0
t3_1pauzhs,Rage bait named word of the year 2025 by Oxford University Press. &#32; submitted by &#32; /u/Majestic-Collar-2675 [link] &#32; [comments],2025-11-30 22:07:46+00:00,https://www.reddit.com/r/news/comments/1pauzhs/rage_bait_named_word_of_the_year_2025_by_oxford/,reddit_news,technology & ai,0
https://www.bbc.com/news/articles/cpvdn8pmmd1o#2,'I saw them driving over injured people' - the terrifying escape from war in Sudan. The BBC visits a camp where people are taking refuge after the fall of el-Fasher city.,2025-11-30 22:02:43+00:00,https://www.bbc.com/news/articles/cpvdn8pmmd1o?at_medium=RSS&at_campaign=rss,bbc_world,war & foreign policy,0
https://www.bbc.com/news/articles/cewjxqvqzgyo#1,'Rage bait' named Oxford word of the year 2025. The phrase - meaning to get angry scrolling through social media - beats aura farming and biohack to the title.,2025-11-30 22:01:40+00:00,https://www.bbc.com/news/articles/cewjxqvqzgyo?at_medium=RSS&at_campaign=rss,bbc_entertainment,technology & ai,0
https://www.bbc.com/news/articles/c1kpjwee3g7o#1,"Tories urge financial regulator to investigate Reeves and Treasury over Budget build-up. Shadow chancellor Mel Stride calls for the financial regulator to investigate ""possible market abuse"" over briefings in the run-up to the Budget.",2025-11-30 22:00:01+00:00,https://www.bbc.com/news/articles/c1kpjwee3g7o?at_medium=RSS&at_campaign=rss,bbc_politics,other,0
t3_1paui7l,Trump grants clemency to executive convicted in fraud scheme – report. &#32; submitted by &#32; /u/Out_For_Eh_Rip [link] &#32; [comments],2025-11-30 21:48:07+00:00,https://www.reddit.com/r/news/comments/1paui7l/trump_grants_clemency_to_executive_convicted_in/,reddit_news,other,0
https://www.theguardian.com/world/2025/nov/30/african-leaders-push-for-recognition-of-colonial-crimes-and-reparations,"African leaders push for recognition of colonial crimes and reparations. Algerian foreign minister says African countries and peoples continue to pay a heavy price for colonialismAfrican leaders are pushing to have colonial-era crimes recognised, criminalised and addressed through reparations.At a conference in the Algerian capital, Algiers, diplomats and leaders convened to advance an African Union resolution passed at a meeting earlier this year calling for justice and reparations for victims of colonialism. Continue reading...",2025-11-30 21:40:48+00:00,https://www.theguardian.com/world/2025/nov/30/african-leaders-push-for-recognition-of-colonial-crimes-and-reparations,guardian_world,crime & safety,0
https://www.bbc.com/news/articles/c79x8x82gy4o#1,"Dignitas founder dies by assisted suicide aged 92, group says. Ludwig Minelli founded the group in 1998, which has since helped thousands of people to die.",2025-11-30 21:18:34+00:00,https://www.bbc.com/news/articles/c79x8x82gy4o?at_medium=RSS&at_campaign=rss,bbc_world,other,0
t3_1patfm7,Jacob Zuma’s daughter resigns amid claims South Africans tricked to fight for Russia. &#32; submitted by &#32; /u/AudibleNod [link] &#32; [comments],2025-11-30 21:04:12+00:00,https://www.reddit.com/r/news/comments/1patfm7/jacob_zumas_daughter_resigns_amid_claims_south/,reddit_news,war & foreign policy,0
t3_1paqog9,"National Guard shooting suspect radicalized in US, homeland secretary says. &#32; submitted by &#32; /u/PinkoMarxistCommie [link] &#32; [comments]",2025-11-30 19:14:08+00:00,https://www.reddit.com/r/news/comments/1paqog9/national_guard_shooting_suspect_radicalized_in_us/,reddit_news,crime & safety,0
t3_1paqhlg,Jeffrey Bostic sworn in as the second President of Barbados. &#32; submitted by &#32; /u/GavinGenius [link] &#32; [comments],2025-11-30 19:06:34+00:00,https://www.reddit.com/r/news/comments/1paqhlg/jeffrey_bostic_sworn_in_as_the_second_president/,reddit_news,politics,0
https://www.theguardian.com/commentisfree/picture/2025/nov/30/ella-baron-your-party-conference-name-cartoon,Ella Baron on infighting at the Your Party conference – cartoon. Continue reading...,2025-11-30 19:03:40+00:00,https://www.theguardian.com/commentisfree/picture/2025/nov/30/ella-baron-your-party-conference-name-cartoon,guardian_politics,other,0
https://www.theguardian.com/world/2025/nov/30/indonesia-thailand-floods,"Death toll passes 900 in Indonesia, Thailand and Sri Lanka floods. Officials in Indonesia say more than 442 people have died, while Sri Lanka suffers worst natural disaster since 2004 tsunami Authorities in Sri Lanka, Indonesia and Thailand are racing to clear debris and find hundreds of missing people after more than 900 died in devastating floods and landslides across the south of Asia.In the latest example of the impact of the climate crisis on storm patterns and extreme weather, heavy monsoon rains, exacerbated by a tropical storm, have overwhelmed parts of south-east Asia in recent days, leaving thousands of people stranded without shelter or critical supplies. Continue reading...",2025-11-30 18:37:29+00:00,https://www.theguardian.com/world/2025/nov/30/indonesia-thailand-floods,guardian_world,climate & environment,0
https://www.theguardian.com/world/2025/nov/30/pope-leo-urges-lebanese-leaders-make-peace-highest-priority,"Pope Leo urges Lebanese leaders to make peace highest priority. Pontiff tells politicians and religious heads they must persevere with peace efforts despite facing ‘highly complex, conflictual’ situationPope Leo has urged political leaders in Lebanon to make peace their highest priority in a forceful appeal as he is visiting the country, which remains a target of Israeli airstrikes, on the second leg of his first overseas trip as Catholic leader.Leo, the first US pope, arrived in Beirut on Sunday from a four-day visit to Turkey where he said that humanity’s future was at risk because of the world’s unusual number of bloody conflicts, and condemned violence in the name of religion. Continue reading...",2025-11-30 18:09:12+00:00,https://www.theguardian.com/world/2025/nov/30/pope-leo-urges-lebanese-leaders-make-peace-highest-priority,guardian_world,war & foreign policy,0
https://www.theguardian.com/commentisfree/2025/nov/30/the-guardian-view-on-the-send-crisis-bridget-phillipson-must-be-tough-with-the-treasury-so-children-arent-penalised,"The Guardian view on the Send crisis: Bridget Phillipson must be tough with the Treasury so children aren’t penalised | Editorial. Tory special needs reforms upended council finances, but Labour’s plan to rebuild public provision won’t come cheap if it’s done properlyThe crisis over special educational needs and disabilities in England is not just a question of cash. Children and parents spend months and years battling for support to which the law entitles them, schools lack the funding to meet needs, and specialist provision is inadequate. An adversarial system shunts families towards tribunals that councils almost invariably lose.Tory reforms created obligations for local authorities but did not adequately fund them – allowing ministers to duck responsibility. The result has been financial chaos, with the overall overspend on special educational needs and disabilities (Send) predicted to reach £6.6bn by next March, and keep rising. Taking responsibility for funding away from councils and handing it to the Department for Education is the right move. But the most important questions about Send go beyond accounting. A white paper on reform was postponed in October. Bridget Phillipson, the education secretary, told MPs that she would consult further before deciding on the future of education, health and care plans, which set out entitlements for individual children, and the tribunals where parents can challenge council decisions.Do you have an opinion on the issues raised in this article? If you would like to submit a response of up to 300 words by email to be considered for publication in our letters section, please click here. Continue reading...",2025-11-30 17:48:01+00:00,https://www.theguardian.com/commentisfree/2025/nov/30/the-guardian-view-on-the-send-crisis-bridget-phillipson-must-be-tough-with-the-treasury-so-children-arent-penalised,guardian_politics,war & foreign policy,0
https://www.bbc.com/news/articles/c4g9x5k73zro#1,New party founded by Corbyn and Sultana adopts Your Party as name. Your Party delegates also vote to be led by a panel of members - avoiding a potentially explosive leadership race.,2025-11-30 17:30:27+00:00,https://www.bbc.com/news/articles/c4g9x5k73zro?at_medium=RSS&at_campaign=rss,bbc_politics,politics,0
t3_1palezm,"A Metallica Scholarship, to be precise, part of the more than $10 million the band's charity All Within My Hands has donated to workforce education, mostly in the form of grants through trade schools and community colleges.. &#32; submitted by &#32; /u/Edm_vanhalen1981 [link] &#32; [comments]",2025-11-30 15:46:19+00:00,https://www.reddit.com/r/UpliftingNews/comments/1palezm/a_metallica_scholarship_to_be_precise_part_of_the/,reddit_uplifting_news,education,0
