id,text,created_at,author_id,like_count,reply_count,repost_count,quote_count,engagement,topic,source,country,intensity
https://biztoc.com/x/454626bef6dd3192,"Two-thirds of companies will slow entry-level hiring due to AI. Two-thirds of global organizations expect to slow entry-level hiring in the coming years, according to new research, marking another clear sign that artificial intelligence is reshaping the foundations of the labor market.
The findings come from IDC’s new Inf…",2025-11-18T11:16:15+0000,Biztoc.com,0,0,0,0,0,technology & ai,biztoc.com,Unknown,1.0
https://pypi.org/project/skypilot-nightly/1.0.0.dev20251118/,"skypilot-nightly 1.0.0.dev20251118. SkyPilot: Run AI on Any Infra — Unified, Faster, Cheaper.",2025-11-18T12:32:27+0000,Pypi.org,0,0,0,0,0,technology & ai,pypi.org,Unknown,1.0
https://www.itnews.com.au/news/nsw-dphis-latest-digital-transformation-driven-by-housing-reforms-621668,NSW DPHI's latest digital transformation driven by housing reforms. Upgrades core technology and looks to AI for efficiency gains.,2025-11-19T19:51:21+0000,iTnews,0,0,0,0,0,technology & ai,itnews,Unknown,1.0
https://www.foxnews.com/politics/nc-senate-candidate-says-ice-charlotte-ops-result-ex-gov-opponent-repeatedly-blunting-cooperation,NC Senate candidate says ICE Charlotte ops the result of ex-gov opponent repeatedly blunting cooperation. ICE arrests 120+ in North Carolina as Republican Michael Whatley criticizes Democratic former governor's opposition to immigration enforcement bills.,2025-11-19T19:51:49+0000,Fox News,0,0,0,0,0,crime & safety,fox_news,Unknown,1.0
https://www.globenewswire.com/news-release/2025/11/19/3191381/0/en/VitaMotion-Reports-Surge-in-Corporate-Wellness-Adoption-as-Remote-Work-Drives-Widespread-Musculoskeletal-Health-Concerns-in-2025.html,VitaMotion Reports Surge in Corporate Wellness Adoption as Remote Work Drives Widespread Musculoskeletal Health Concerns in 2025. Kinesiologist Rick Kaselj's Dual-System Approach Gains Traction Among Employers Addressing Musculoskeletal Health Costs and Worker Productivity Challenges Kinesiologist Rick Kaselj's Dual-System Approach Gains Traction Among Employers Addressing Musculoskelet…,2025-11-19T19:52:00+0000,GlobeNewswire,0,0,0,0,0,technology & ai,globenewswire,Unknown,2.0
https://press.un.org/en/2025/db251119.doc.htm,"Daily Press Briefing by the Office of the Spokesperson for the Secretary-General. The Secretary-General strongly condemns the overnight missile and drone attacks by the Russian Federation on several Ukrainian regions, which reportedly killed  at least 25 people, including children, in two residential areas in Ternopil in western Ukraine. A…",2025-11-19T19:52:15+0000,UN News,0,0,0,0,0,war & foreign policy,un_news,Russia,5.0
https://www.pbs.org/newshour/nation/mamdani-says-new-york-citys-current-police-commissioner-will-stay-on-the-job,"Mamdani says New York City’s current police commissioner will stay on the job. Mamdani praised Tisch for “cracking down on corruption in the upper echelons"" of the NYPD while also driving down crime in the city.",2025-11-19T19:52:18+0000,PBS,0,0,0,0,0,technology & ai,pbs,Unknown,1.0
https://punchng.com/virtual-currency-now-taxable-capital-market-gains-remain-tax-free-oyedele/,"Virtual currency now taxable, capital market gains remain tax-free —Oyedele. Nigeria’s Presidential Fiscal Policy Committee announces virtual currency is now subject to tax, while capital market gains remain tax-free to attract yout

Read More: https://punchng.com/virtual-currency-now-taxable-capital-market-gains-remain-tax-free-oyede…",2025-11-19T19:52:19+0000,The Punch,0,0,0,0,0,technology & ai,the_punch,Niger,1.0
https://www.calculatedriskblog.com/2025/11/lawler-early-read-on-existing-home.html,"Lawler: Early Read on Existing Home Sales in October; What is the “Market’s” Estimate of R*?. Today, in the Calculated Risk Real Estate Newsletter: Lawler: Early Read on Existing Home Sales in October  A brief excerpt: From housing ec...",2025-11-19T19:53:00+0000,Calculatedriskblog.com,0,0,0,0,0,housing,calculatedriskblog.com,Unknown,2.0
https://www.mccoveychronicles.com/san-francisco-giants-minor-leagues-prospects/102342/giants-prospect-rankings-blade-tidwell,2026 Willie McCovey Memorial Community Prospect List No. 10. Who is the 10th-best prospect on the farm?,2025-11-19T19:53:03+0000,McCovey Chronicles,0,0,0,0,0,culture & identity,mccovey_chronicles,Unknown,1.0
https://dailycaller.com/2025/11/19/summer-wordon-astronaut-space-crime-anna-mcclain/,Woman Who Accused Astronaut Wife Of First Space Crime Admits She Made It All Upp. A Kansas woman who once claimed her astronaut wife committed the “first crime in space” pleaded guilty Thursday to lying to federal agents.,2025-11-19T19:53:08+0000,The Daily Caller,0,0,0,0,0,technology & ai,the_daily_caller,Oman,1.0
https://uk.pcmag.com/advertising-content/161314/get-more-done-before-the-years-end-with-dell-pcs,Get More Done Before the Year’s End With Dell PCs. Meet your end-of-year goals with AI-powered performance and battery reliability that keeps pace with your plans.,2025-11-19T19:57:41+0000,PCMag.com,0,0,0,0,0,technology & ai,pcmag.com,Unknown,1.0
https://slashdot.org/firehose.pl?op=view&amp;id=180144539,"At least 25 killed in Russian attacks on war-torn Ukraine - Al Jazeera. At least 25 killed in Russian attacks on war-torn UkraineAl Jazeera Major Russian attack on western Ukraine hits apartment buildings, killing 25CNN Russian Missile Kills at Least 25 in Ukrainian Apartment BuildingThe New York Times Russia pummels Ukraine with…",2025-11-19T19:53:11+0000,Slashdot.org,0,0,0,0,0,war & foreign policy,slashdot.org,Russia,5.0
https://saintswire.usatoday.com/story/sports/nfl/saints/2025/11/19/new-orleans-saints-sign-tulane-wide-receiver-jhaquan-jackson/87356969007/,"Saints sign former Tulane, Titans returns specialist to add depth at wide receiver. Welcome back to New Orleans, Jha'Quan Jackson. The former Tulane Green Wave standout is signing with the Saints to add depth at wide receiver.",2025-11-19T19:53:43+0000,USA Today,0,0,0,0,0,technology & ai,usa_today,Unknown,1.0
http://longreads.com/2025/11/19/moscow-pizza-hut-ussr/,"Pizzastroika. ""In 1990, in the last breaths of the Cold War, a delicious act of American subversion unfolded in Moscow. It’s long been forgotten. It shouldn’t be.""",2025-11-19T19:53:48+0000,Longreads.com,0,0,0,0,0,war & foreign policy,longreads.com,America,4.0
https://biztoc.com/x/d02aa58b5f582e69,"AI-focused developers help fuel New York City life, city agency chief says.",2025-11-19T19:54:49+0000,Biztoc.com,0,0,0,0,0,technology & ai,biztoc.com,Unknown,1.0
https://www.newser.com/story/378994/its-a-sign-things-are-getting-worse-between-china-japan.html,"It's a Sign Things Are Getting Worse Between China, Japan. Japan in early November resumed exporting seafood to China—but those shipments look to be short-lived. As tensions rise between the two countries over new Japanese Prime Minister Sanae Takaichi's Nov. 7 comments about potential military action against China i…",2025-11-19T19:55:00+0000,Newser,0,0,0,0,0,war & foreign policy,newser,China,2.0
https://www.memeorandum.com/251119/p110,"After Shutdown, Labor Dept. Says Some Data Is Gone for Good (New York Times). New York Times:
After Shutdown, Labor Dept. Says Some Data Is Gone for Good  —  Surveys were delayed and some cannot be collected at all, officials said, further complicating the Federal Reserve's decision on interest rates next month.  —  The Bureau of Labor…",2025-11-19T19:55:00+0000,Memeorandum.com,0,0,0,0,0,technology & ai,memeorandum.com,Unknown,1.0
https://biztoc.com/x/fe868444666ba9e4,"As Arm Bets on AI Infrastructure with Nvidia, Should You Buy, Sell, or Hold ARM Stock?. is a British semiconductor and software design company renowned for its innovative microprocessor technology, powering billions of devices worldwide. The company specializes in designing energy-efficient processor architectures and intellectual property (IP) …",2025-11-19T19:55:09+0000,Biztoc.com,0,0,0,0,0,war & foreign policy,biztoc.com,Unknown,4.0
https://www.iphoneincanada.ca/2025/11/19/chatgpt-for-teachers-is-here-unless-youre-in-canada/,"ChatGPT for Teachers Is Here, Unless You’re in Canada. OpenAI is launching a new version of ChatGPT made specifically for teachers, and it’ll be free for verified U.S. K–12 educators until June 2027. Unfortunately, Canadian teachers can’t access it at launch. Teachers have been some of the earliest heavy users of…",2025-11-19T19:50:50+0000,iPhone in Canada,0,0,0,0,0,technology & ai,iphone_in_canada,Canada,1.0
https://bringatrailer.com/listing/1997-porsche-911-carrera-cabriolet-123/,"1997 Porsche 911 Carrera Cabriolet 6-Speed. This 1997 Porsche 911 Carrera cabriolet was purchased new by its owner, registered in California, and kept mostly off the road and in garaged storage after 2017. Finished in Arena Red Metallic over Cashmere leather upholstery, the car is powered by a 3.6-lite…",2025-11-19T19:50:19+0000,Bringatrailer.com,0,0,0,0,0,infrastructure & supply chain,bringatrailer.com,Unknown,1.0
https://biztoc.com/x/b11cd7984a212813,xAI deploys Grok in Saudi Arabia. xAI announced on Wednesday the nationwide deployment of its AI-powered tool Grok in Saudi Arabia through a landmark framework agreement with the kingdom and local artificial intelligence startup Humai...,2025-11-19T19:57:20+0000,Biztoc.com,0,0,0,0,0,technology & ai,biztoc.com,Saudi,1.0
https://www.globenewswire.com/news-release/2025/11/19/3191389/0/en/Azuria-Water-Solutions-Releases-2024-Sustainability-Report.html,Azuria Water Solutions Releases 2024 Sustainability Report. Azuria Water Solutions releases 2024 sustainability report.......,2025-11-19T20:00:00+0000,GlobeNewswire,0,0,0,0,0,technology & ai,globenewswire,Unknown,1.0
https://biztoc.com/x/365cc928b75862e7,Dollar Climbs Most in Three Weeks as Bets on Fed Rate Hold Rise.,2025-11-19T19:59:16+0000,Biztoc.com,0,0,0,0,0,economics,biztoc.com,Unknown,1.0
https://pypi.org/project/signalpilot-ai-internal/0.9.17/,signalpilot-ai-internal 0.9.17. SignalPilot Agent - Your Jupyter Notebook Assistant,2025-11-19T19:59:16+0000,Pypi.org,0,0,0,0,0,technology & ai,pypi.org,Unknown,1.0
https://biztoc.com/x/30c13f7e4fa9725d,Can Trump Take ABC Off Air? How US Broadcast Licenses Work.,2025-11-19T19:59:47+0000,Biztoc.com,0,0,0,0,0,technology & ai,biztoc.com,Unknown,1.0
https://www.rawstory.com/trump-economy-2674310459/,"'You’ve all felt that': Economist warns early signs of looming crisis blaring under Trump. President Donald Trump rolled back tariffs on a number of grocery staples, like beef, coffee, and bananas, late last week in what is being called a “sharp reversal” of his economic policy. He even admitted that tariffs do increase prices “in some cases,” but …",2025-11-19T19:59:55+0000,Raw Story,0,0,0,0,0,war & foreign policy,raw_story,Unknown,5.0
https://www.medicalnewstoday.com/articles/dash-diet-for-hypertension-may-also-prevent-diabetes-complications,"DASH diet may help with diabetes as well as hypertension. The DASH diet, originally designed to treat high blood pressure, could also offer an effective approach for preventing diabetes complications, evidence suggests.",2025-11-19T20:00:00+0000,Medical News Today,0,0,0,0,0,technology & ai,medical_news_today,Unknown,2.0
https://www.stampedeblue.com/indianapolis-colts-roster/118030/tyler-warren-josh-downs-food-insecurity-feeding-america,"Colts’ Tyler Warren, Josh Downs tackle food insecurity with Feeding America. The Colts are legitimate AFC contenders on the field, and Tyler Warren and Josh Downs are helping fight food insecurity off the field.",2025-11-19T20:00:00+0000,Stampede Blue,0,0,0,0,0,war & foreign policy,stampede_blue,America,4.0
https://radaronline.com/p/don-jr-jeffrey-epstein-hated-trump-leaked-emails/,"Daddy's Boy! Don Jr. Claims Epstein 'Hated' Trump and Wanted Him 'Impeached'... as Prez's Eldest Son Desperately Tries to 'Save' Father's Reputation. Donald Trump Jr. has claimed sex offender Jeffrey Epstein 'hated' his father, Donald Trump, and wanted him 'impeached.'",2025-11-19T20:00:00+0000,Radaronline.com,0,0,0,0,0,technology & ai,radaronline.com,Unknown,1.0
https://www.creativebloq.com/ai/ai-art/gen-z-loves-ai-slop-says-silent-hill-dev,"""Gen Z loves AI slop"" says Silent Hill dev. Younger consumers were born into it and don't care, the former Square Enix director thinks.",2025-11-19T20:00:00+0000,Creative Bloq,0,0,0,0,0,technology & ai,creative_bloq,Unknown,1.0
https://www.dw.com/en/german-interior-minister-my-migration-course-is-tough/a-74796372,"German Interior Minister: 'My migration course is tough'. In an interview with DW, German Interior Minister Alexander Dobrindt said he wanted but crack down harder on what he calls the ""abuse"" of asylum law.  Will this curb the success of the far-right AfD party?",2025-11-19T19:58:00+0000,DW (English),0,0,0,0,0,technology & ai,dw_(english),Unknown,1.0
https://techcrunch.com/2025/11/19/warner-music-settles-copyright-lawsuit-with-udio-signs-deal-for-ai-music-platform/,"Warner Music settles copyright lawsuit with Udio, signs deal for AI music platform | TechCrunch. The subscription service will allow users to make remixes, covers, and new songs using the voices of artists and compositions of songwriters who choose to participate.",2025-11-19T19:58:13+0000,TechCrunch,0,0,0,0,0,war & foreign policy,techcrunch,Unknown,4.0
https://oilprice.com/Energy/Energy-General/The-AI-Power-Surge-Could-End-Badly.html,"The AI Power Surge Could End Badly. Is AI in a bubble? When will the bubble burst? Are there signs? Well, we don’t have a crystal ball, but there are signs. On the markets, several prominent investors have spoken. Peter Thiel, one of the best-known tech investors, has sold his entire position i…",2025-11-19T20:00:00+0000,OilPrice.com,0,0,0,0,0,technology & ai,oilprice.com,Unknown,1.0
https://www.globenewswire.com/news-release/2025/11/19/3191388/0/en/White-House-Discussions-Signal-a-Bold-New-Vision-for-American-Power.html,White House Discussions Signal a Bold New Vision for American Power?. Former CIA officer Buck Sexton says recent meetings reflect a plan to restore the nation’s technological edge Former CIA officer Buck Sexton says recent meetings reflect a plan to restore the nation’s technological edge,2025-11-19T20:00:00+0000,GlobeNewswire,0,0,0,0,0,technology & ai,globenewswire,America,1.0
http://prospect.org/2025/11/19/trumps-new-best-friend-mbs/,"Trump’s New Best Friend. His one-sided deal with MBS throws Bibi under the bus and gets nothing for the United States other than more wealth for the Trump family.
The post Trump’s New Best Friend appeared first on The American Prospect.",2025-11-19T20:00:00+0000,The American Prospect,0,0,0,0,0,technology & ai,the_american_prospect,America,1.0
https://www.nzherald.co.nz/business/business-reports/sustainable-business-finance/sustainable-business-and-finance-focus-on-renewable-electricity-is-a-costly-distraction-from-real-energy-security/premium/LFB3PIT33BAQTLD3A3AACONME4/,Sustainable Business and Finance: Focus on renewable electricity is a costly distraction from real energy security. Opinion: Why chasing 100% renewable electricity makes little sense.,2025-11-19T20:00:00+0000,New Zealand Herald,0,0,0,0,0,technology & ai,new_zealand_herald,Unknown,1.0
https://www.denverpost.com/2025/11/19/five-weeknight-dishes-baked-chicken-drumsticks-harissa-shrimp-sheet-pan-mushroom-parm-and-more/,"Five Weeknight Dishes: Baked chicken drumsticks, harissa shrimp, sheet-pan mushroom parm and more. Here five weeknight dishes, including a simple baked chicken recipe that would pair well with just about any holiday side dish.",2025-11-19T20:00:02+0000,The Denver Post,0,0,0,0,0,technology & ai,the_denver_post,Unknown,1.0
https://www.databricks.com/blog/new-way-build-pipelines-databricks-introducing-ide-data-engineering,"The New Way to Build Pipelines on Databricks: Introducing the IDE for Data Engineering. At this year’s Data + AI Summit, we introduced the IDE for Data Engineering: a new...",2025-11-19T20:00:00+0000,Databricks.com,0,0,0,0,0,technology & ai,databricks.com,Unknown,1.0
https://www.theflightdeal.com/2025/11/19/united-san-francisco-orlando-florida-and-vice-versa-195-basic-economy-295-regular-economy-roundtrip-including-all-taxes-2/,"United: San Francisco – Orlando, Florida (and vice versa). $195 (Basic Economy) / $295 (Regular Economy). Roundtrip, including all Taxes. A good sale to / from Orlando.Matrix Airfare Search by ITA Software will price this at $295 (Regular Economy). Use those dates on United should reprice to $195 (Basic Economy) and $295 (Regular Ec",2025-11-19T19:55:45+0000,Theflightdeal.com,0,0,0,0,0,war & foreign policy,theflightdeal.com,Unknown,4.0
https://www.foxnews.com/politics/army-secretary-lands-kyiv-trumps-next-move-russia-ukraine-war,Army secretary lands in Kyiv with Trump's next move in Russia-Ukraine war. Army Secretary Dan Driscoll arrives in Kyiv on fact-finding mission as U.S. pushes new peace talks to end Russia-Ukraine war. Meeting with Zelenskyy planned.,2025-11-19T19:55:49+0000,Fox News,0,0,0,0,0,war & foreign policy,fox_news,Russia,4.0
https://biztoc.com/x/8779d92fdbb7c180,Rain Forecasts for Brazil Hammer Coffee Prices.,2025-11-19T19:55:49+0000,Biztoc.com,0,0,0,0,0,technology & ai,biztoc.com,Brazil,1.0
https://economictimes.indiatimes.com/news/elections/assembly-elections/bihar/bjp-jdu-in-final-round-of-talks-for-bihar-cabinet/articleshow/125419041.cms,BJP-JDU in final round of talks for Bihar cabinet. Intense discussions are underway in Delhi between the BJP and JDU regarding cabinet positions and portfolios for the upcoming Bihar government. Leaders met with Amit Shah and JP Nadda to finalize allocations. The BJP seeks key ministries like home and educati…,2025-11-18T18:34:32+0000,The Times of India,0,0,0,0,0,infrastructure & supply chain,the_times_of_india,Unknown,1.0
https://www.dazeddigital.com/fashion/article/69102/1/ludovic-de-saint-sernin-answers-the-da-zed-quiz-zara-ss26-couture?utm_source=Link&utm_medium=Link&utm_campaign=RSSFeed&utm_term=ludovic-de-saint-sernin-answers-the-da-zed-quiz,"Ludovic de Saint Sernin answers the dA-Zed quiz. As he launches a collection with Zara, the French designer reveals his favourite SS26 show and why he’d like to go to a couture house next",2025-11-18T17:12:00+0000,Dazed,0,0,0,0,0,technology & ai,dazed,Unknown,1.0
https://economictimes.indiatimes.com/markets/stocks/news/physicswallah-share-price-edtech-player-makes-strong-d-st-debut-lists-at-33-premium-over-ipo-price/articleshow/125401417.cms,"PhysicsWallah shares make a strong D-St debut, list at 33% premium over IPO price. PhysicsWallah share price: PhysicsWallah shares debuted with a significant premium on Tuesday, listing at 33% on the NSE and 31% on the BSE. The Rs 3,481 crore IPO saw strong QIB subscription, though NII participation was weak. The company aims to expand its …",2025-11-18T04:31:35+0000,The Times of India,0,0,0,0,0,technology & ai,the_times_of_india,Unknown,1.0
https://theconversation.com/a-global-publishing-scam-assisted-by-ai-has-targeted-australia-here-are-5-tips-to-avoid-scammers-269942,A global publishing scam assisted by AI has targeted Australia. Here are 5 tips to avoid scammers. Aspiring authors in Australia are among those who have been scammed by a network of publishing houses using cloned websites and AI tools.,2025-11-18T04:30:28+0000,The Conversation Africa,0,0,0,0,0,technology & ai,the_conversation_africa,Australia,1.0
https://www.globenewswire.com/news-release/2025/11/18/3190419/32719/en/PRMB-Stockholder-Notice-Shareholder-Rights-Law-Firm-Robbins-LLP-Reminds-Investors-of-the-Class-Action-Lawsuit-Against-Primo-Brands-Corporation.html,PRMB Stockholder Notice: Shareholder Rights Law Firm Robbins LLP Reminds Investors of the Class Action Lawsuit Against Primo Brands Corporation. Robbins LLP is Investigating Allegations that Defendants Mislead Investors Concerning the Merger between Primo Water Corporation and Blue Triton Brands...,2025-11-18T18:34:00+0000,GlobeNewswire,0,0,0,0,0,technology & ai,globenewswire,Unknown,2.0
https://newrepublic.com/post/203358/trump-red-carpet-saudi-leader-mbs-bin-salman-white-house,"Trump Rolls Out Literal Red Carpet for Bonesaw Saudi Leader MBS. President Trump gave a lavish welcome to Saudi Crown Prince Mohammed bin Salman on his visit to the U.S. Wednesday, complete with a red carpet reception at the White House. Bin Salman technically isn’t Saudi Arabia’s head of state, as that title belongs to hi…",2025-11-18T18:34:10+0000,The New Republic,0,0,0,0,0,technology & ai,the_new_republic,Saudi,1.0
https://www.breitbart.com/europe/2025/11/18/poland-says-ukrainian-citizens-working-for-russian-intelligence-responsible-for-rail-terror-attack/,"Poland Says Ukrainian Citizens Working For Russian Intelligence Responsible For Rail 'Terror Attack'. Poland's PM say security services identified two suspects they say are behind the attempted bombing of a freight train within NATO territory.
The post Poland Says Ukrainian Citizens Working For Russian Intelligence Responsible For Rail ‘Terror Attack’ appeare…",2025-11-18T18:34:18+0000,Breitbart News,0,0,0,0,0,war & foreign policy,breitbart_news,Poland,5.0
https://www.newser.com/story/378919/federal-judges-block-new-congressional-map-in-texas.html,"Federal Judges Block New Congressional Map in Texas. Texas cannot use a new congressional map drawn by Republicans in hopes of securing the party additional US House seats, a panel of three federal judges ruled Tuesday. The ruling is a blow to President Trump's efforts to have GOP lawmakers in multiple states r…",2025-11-18T18:34:29+0000,Newser,0,0,0,0,0,politics,newser,Unknown,1.0
https://slickdeals.net/f/18827434-16-ounce-stanley-cafe-to-go-travel-mug-3-colors-from-16-80-free-shipping-w-prime-or-on-35,"16-Ounce Stanley Cafe-to-Go Travel Mug (3 Colors) from $16.80 + Free Shipping w/ Prime or on $35+. Amazon [amazon.com] has *16-Ounce Stanley Cafe-to-Go Travel Mug (3 Colors) *from *$16.80*. Shipping is free w/ Prime or on $35+. 
 
Available Colors:[list][*]Black 2.0 [amazon.com] *$16.80*[*]Cream...",2025-11-18T18:34:39+0000,Slickdeals.net,0,0,0,0,0,technology & ai,slickdeals.net,Unknown,1.0
https://www.cbsnews.com/video/trump-increases-pressure-on-venezuela-with-heightened-military-presence-in-caribbean/,Trump increases pressure on Venezuela with heightened military presence in Caribbean. The U.S. continues to increase pressure on Venezuela as it builds up military presence in the Caribbean and Puerto Rico. CBS News national security correspondent Charlie D'Agata has more details.,2025-11-18T17:13:00+0000,CBS News,0,0,0,0,0,war & foreign policy,cbs_news,Venezuela,1.0
https://pypi.org/project/openhands/1.2.0/,openhands 1.2.0. OpenHands CLI - Terminal User Interface for OpenHands AI Agent,2025-11-18T18:34:51+0000,Pypi.org,0,0,0,0,0,technology & ai,pypi.org,Unknown,1.0
https://variety.com/2025/tv/news/microdramas-crisp-future-short-form-conference-seoul-1236583839/,"Microdramas and Short Form Media Take Center Stage at Crisp-Organized Content Conference in Seoul. The future couldn’t look more vertical than from the 76th floor of the Lotte Tower, the sixth tallest building in the world, where microdrama key stakeholders attended the conference Future Is Vertical: The Global Rise of Short Form Media. The splashy locatio…",2025-11-18T18:35:23+0000,Variety,0,0,0,0,0,media & journalism,variety,Unknown,1.0
https://radaronline.com/p/gavin-newsom-melania-trump-donald-sex-offender-jeffrey-epstein/,"Gavin Newsom Drags Melania Trump: California Governor Compares The Prez's Relationship with Sex Offender Epstein to His Marriage to The First Lady. Newsom has been relentless in his trolling of Trump, attacking the leader for his Epstein ties and raising more speculation that the president has dementia.",2025-11-18T18:35:26+0000,Radaronline.com,0,0,0,0,0,war & foreign policy,radaronline.com,Unknown,4.0
https://www.joblo.com/stranger-things-parade-float/,"Stranger Things float will bring a Demogorgon to the Macy’s Thanksgiving Day Parade. A Stranger Things float will be featured in this year's Macy's Thanksgiving Day Parade, complete with a Demogorgon
The post Stranger Things float will bring a Demogorgon to the Macy’s Thanksgiving Day Parade appeared first on JoBlo.",2025-11-18T18:35:37+0000,JoBlo.com,0,0,0,0,0,technology & ai,joblo.com,Unknown,1.0
https://economictimes.indiatimes.com/industry/cons-products/paints/akzo-nobel-buys-axalta-to-build-25-bn-paint-company/articleshow/125419074.cms,"Akzo Nobel buys Axalta to build $25 bn paint company. Akzo Nobel has agreed to acquire Axalta Coating Systems in a deal that will create a US-listed paint and coatings company with nearly $17 billion in annual revenue and an enterprise value of about $25 billion. Akzo Nobel will own 55% of the combined entity, w…",2025-11-18T18:35:38+0000,The Times of India,0,0,0,0,0,technology & ai,the_times_of_india,Unknown,1.0
https://dailycaller.com/2025/11/17/human-infected-new-strain-bird-flu-animals/,Human Infected With New Strain Of Bird Flu Previously Only Seen In Animals. Health officials in Washington have confirmed the state’s first human case of H5N5 bird flu — a strain previously detected only in animals.,2025-11-18T04:30:48+0000,The Daily Caller,0,0,0,0,0,technology & ai,the_daily_caller,Unknown,1.0
https://pypi.org/project/primfunctions/0.1.55/,primfunctions 0.1.55. Prim AI Functions,2025-11-18T18:34:07+0000,Pypi.org,0,0,0,0,0,technology & ai,pypi.org,Unknown,1.0
