id,text,created_at,author_id,like_count,reply_count,repost_count,quote_count,engagement,topic,source,country,intensity
https://biztoc.com/x/27859a4c7036daac,"Spain commits €615 million in military aid to Ukraine. Both US and European arms manufacturers stand to benefit from the pledge, which Spain intends to fulfil by using the EU's SAFE defence loans, and aligning some spending with an earlier NATO pledge",2025-11-18T19:16:42+0000,Biztoc.com,0,0,0,0,0,war & foreign policy,biztoc.com,Spain,1.0
https://www.cbc.ca/news/canada/edmonton/cold-lake-ob-closure-9.6983272,"No ob-gyn in northeastern Alberta city means expecting mothers must travel for routine care. Expecting mothers in Cold Lake, Alta., will have to leave the community for prenatal care and deliveries for the next few weeks as the city faces an obstetrician and gynecologist shortage.",2025-11-18T18:40:18+0000,CBC News,0,0,0,0,0,culture & identity,cbc_news,Unknown,1.0
https://economictimes.indiatimes.com/industry/services/education/bennett-university-to-host-3-day-global-ai-summit/articleshow/125419099.cms,"Bennett University to host 3-day global AI summit. Bennett University in Greater Noida is hosting the Global AI Summit 2025. Over 50 experts will discuss AI and emerging technologies. The event features 295 accepted research papers from 15 countries. This summit highlights the rapid growth of the AI market, e…",2025-11-18T18:36:31+0000,The Times of India,0,0,0,0,0,technology & ai,the_times_of_india,Unknown,1.0
https://www.huffpost.com/entry/donald-trump-epstein-republicans_n_691ca0b6e4b0414d84d79f4c,Donald Trump’s Grip On Republicans Is Slipping. His stunning about-face on releasing files related to Jeffrey Epstein came only after it became clear he was facing a jailbreak in the GOP-controlled House.,2025-11-18T18:37:43+0000,HuffPost,0,0,0,0,0,technology & ai,huffpost,Unknown,1.0
https://www.nbcnews.com/sports/soccer/cristiano-ronaldo-expected-white-house-coinciding-visit-saudi-crown-pr-rcna244644,"Cristiano Ronaldo expected at the White House, coinciding with the visit of Saudi Crown Prince Mohammed bin Salman. WASHINGTON — Cristiano Ronaldo is expected to be at the White House on Tuesday, coinciding with the visit of Saudi Crown Prince Mohammed bin Salman, according to a White House official",2025-11-18T18:31:30+0000,NBC News,0,0,0,0,0,government,nbc_news,Saudi,1.0
https://www.globenewswire.com/news-release/2025/11/18/3190394/28124/en/24-13-Bn-Organ-Transplant-Markets-Global-Industry-Size-Share-Trends-Opportunity-and-Forecast-2020-2030F.html,"$24.13 Bn Organ Transplant Markets - Global Industry Size, Share, Trends, Opportunity, and Forecast, 2020-2030F. The organ transplant market offers growth opportunities driven by rising organ failure cases, increased organ donations, and technological advancements. The demand for transplants is fueled by unhealthy lifestyles and chronic diseases. Innovations in bioprint…",2025-11-18T17:12:00+0000,GlobeNewswire,0,0,0,0,0,technology & ai,globenewswire,Unknown,1.0
https://slashdot.org/firehose.pl?op=view&amp;id=180125443,"Google CEO: If an AI bubble pops, no one is getting out clean. Sundar Pichai says no company is immune if AI bubble bursts, echoing dotcom fears.",2025-11-18T17:12:15+0000,Slashdot.org,0,0,0,0,0,technology & ai,slashdot.org,Unknown,1.0
https://www.thestar.com.my/news/nation/2025/11/18/anwar-says-disciplined-management-strengthens-ringgit-to-best-in-asia,"Anwar says disciplined management strengthens ringgit to best in Asia. KUALA LUMPUR: Disciplined fiscal management, improved governance and policy reforms strengthen the ringgit to the best performance in Asia this year, says Datuk Seri Anwar Ibrahim. Read full story",2025-11-18T04:30:00+0000,The Star Online,0,0,0,0,0,war & foreign policy,the_star_online,Uk,4.0
https://freerepublic.com/focus/f-chat/4353216/posts,"Obama’s Judge, Trump’s Nemesis: Why Congress Must Impeach Judge James Boasberg. The United States is in the middle of a constitutional stress test. Donald Trump won a second term on a promise to restore borders, disentangle the federal government from progressive social engineering, and return power to voters rather than bureaucrats. Tha…",2025-11-18T19:07:06+0000,Freerepublic.com,0,0,0,0,0,immigration,freerepublic.com,Unknown,1.0
https://slickdeals.net/f/18827554-adidas-men-s-lite-racer-adapt-4-0-shoes-core-black-cloud-white-20-more-free-shipping,"adidas Men's Lite Racer Adapt 4.0 Shoes (Core Black/Cloud White) $20 & More + Free Shipping. adidas_official via eBay [ebay.com] has *adidas Men's Lite Racer Adapt 4.0 Shoes* (Core Black/Cloud White) on sale for *$20. Shipping is free.* 
 
Also available: 
* Core Black/Core Black [ebay.com]...",2025-11-18T19:07:27+0000,Slickdeals.net,0,0,0,0,0,technology & ai,slickdeals.net,Unknown,1.0
https://www.independent.ie/business/money/levy-on-health-insurance-policies-to-rise-in-blow-to-consumers/a166939437.html,Levy on health insurance policies to rise in blow to consumers. The Government levy on health insurance premiums is to increase next year in a new blow to people who have private medical cover.,2025-11-18T16:24:36+0000,Independent.ie,0,0,0,0,0,healthcare & wellbeing,independent.ie,Unknown,1.0
https://bringatrailer.com/listing/2016-land-rover-lr4-104/,32k-Mile 2016 Land Rover LR4 HSE. This 2016 Land Rover LR4 HSE is finished in Indus Silver Metallic over beige leather and is powered by a supercharged 3.0-liter V6 linked to an eight-speed automatic transmission and a dual-range transfer case. The truck remained registered with the original …,2025-11-18T16:25:10+0000,Bringatrailer.com,0,0,0,0,0,technology & ai,bringatrailer.com,Unknown,1.0
https://www.sammobile.com/news/galaxy-s20-ultra-samsung-last-mongoose-custom-cpu/,"Galaxy S20 Ultra was wild and carried Samsung’s last Mongoose CPU core. Even more than five years after its debut, the Galaxy S20 Ultra remains one of Samsung's most intriguing phones of the past 10 years. At the very least, it's a key piece of mobile and Exynos history. Five years later, the S20 Ultra still stands out for one ra…",2025-11-18T16:25:10+0000,SamMobile,0,0,0,0,0,technology & ai,sammobile,Unknown,1.0
https://www.droidgamers.com/guides/deadly-delivery-classes-guide/,"Deadly Delivery Classes Guide. Find out about all the post apocalyptic jobs available in our Deadly Delivery classes guide, with all the upgrades.",2025-11-18T16:25:30+0000,DroidGamers,0,0,0,0,0,technology & ai,droidgamers,Unknown,4.0
https://economictimes.indiatimes.com/news/india/bipartisan-resolution-in-us-congress-calls-for-stronger-ties-with-india/articleshow/125415860.cms,"Bipartisan resolution in US Congress calls for stronger ties with India. A bipartisan resolution in the US House of Representatives calling for stronger India–US ties has gained wide support, raising expectations of faster progress on reducing high tariffs and finalising the first phase of the proposed bilateral trade deal.",2025-11-18T16:25:32+0000,The Times of India,0,0,0,0,0,technology & ai,the_times_of_india,India,1.0
https://news.samsung.com/global/samsung-equips-royal-caribbeans-star-of-the-seas-with-more-than-6000-hospitality-tvs-and-smart-signage,"Samsung Equips Royal Caribbean’s Star of the Seas With More Than 6,000 Hospitality TVs and Smart Signage. Samsung Electronics today announced that it has supplied more than 6,000 hospitality TVs and Smart Signage displays to Royal Caribbean`s Star of the Seas, the world’s best family vacation. The installation spans guest cabins, crew quarters and public areas — …",2025-11-18T16:25:35+0000,Samsung.com,0,0,0,0,0,healthcare & wellbeing,samsung.com,Unknown,1.0
https://wccftech.com/krafton-ceo-allegedly-asked-chatgpt-how-to-avoid-paying-subnautica-devs-bonus/,"CEO Of “AI First” Company Krafton Allegedly Asked ChatGPT If There Was A Way to Avoid Paying Subnautica Devs Their Bonus. Shortly after Krafton affirmed its commitment to becoming an ""AI-first"" company, the latest pre-trial document in the legal dispute between the co-founders of Subnautica developer Unknown Worlds alleges that Krafton's chief executive officer, Changham Kim, lo…",2025-11-18T16:25:52+0000,Wccftech,0,0,0,0,0,technology & ai,wccftech,Unknown,2.0
https://slashdot.org/firehose.pl?op=view&amp;id=180125441,Google unveils Gemini 3 AI model and AI-first IDE called Antigravity. Google's flagship AI model is getting its second major upgrade this year.,2025-11-18T17:12:04+0000,Slashdot.org,0,0,0,0,0,technology & ai,slashdot.org,Unknown,1.0
https://biztoc.com/x/3e806fb05a3dfb3a,Thanksgiving Air Travel May Be Less Hectic This Year. How the Shutdown Changed Things.,2025-11-18T18:31:29+0000,Biztoc.com,0,0,0,0,0,technology & ai,biztoc.com,Unknown,1.0
https://www.marca.com/en/nfl/cleveland-browns/2025/11/18/691cb47d268e3e87138b4597.html,"Who is Bryce Dunlap, the Bernie Kosar donor and Browns fan who saved his life?. The sudden passing of Bryce Dunlap, a 21-year-old resident of Ohio, has resonated deeply across the sports landscape, particularly within the passionate fan base of the Cleveland B",2025-11-18T19:16:35+0000,Marca,0,0,0,0,0,infrastructure & supply chain,marca,Unknown,1.0
https://www.globenewswire.com/news-release/2025/11/18/3190422/0/en/PMI-Foods-Dream-Center-Feed-Los-Angeles-Families-Impacted-by-Government-Shutdown.html,"PMI Foods & Dream Center Feed Los Angeles Families Impacted by Government Shutdown. Salt Lake City, Utah, Nov. 18, 2025 (GLOBE NEWSWIRE) -- Last week, Parker Migliorini International (PMI Foods) partnered with the Dream Center in Los Angeles to feed families who lost their SNAP benefits due to the government shutdown. PMI Foods donated over …",2025-11-18T18:36:00+0000,GlobeNewswire,0,0,0,0,0,government,globenewswire,Unknown,1.0
https://biztoc.com/x/831cbf48cb6ba216,Ecuador’s Noboa Shuffles Cabinet After Voters Reject Referendum.,2025-11-18T18:31:59+0000,Biztoc.com,0,0,0,0,0,politics,biztoc.com,Ecuador,1.0
https://slashdot.org/firehose.pl?op=view&amp;id=180126887,"Federal immigration agents will expand enforcement action in North Carolina to Raleigh, mayor says - AP News. Federal immigration agents will expand enforcement action in North Carolina to Raleigh, mayor saysAP News 'Heavy-handed': Border Patrol arrests 2 US citizens in Charlotte for allegedly warning others of operationWCNC Video: Border Patrol appears to point gun …",2025-11-18T18:32:38+0000,Slashdot.org,0,0,0,0,0,war & foreign policy,slashdot.org,Unknown,4.0
https://www.businessinsider.com/nvidia-q3-earnings-preview-nvda-stock-wall-street-estimates-ai-2025-11,"Wall Street analysts are still bullish on Nvidia heading into Q3 earnings, even as investors turn skittish. Analysts see demand for high-grade AI hardware from Nvidia increasing in the coming quarters, staying upbeat even as investors fret over the AI trade.",2025-11-18T18:33:06+0000,Business Insider,0,0,0,0,0,war & foreign policy,business_insider,Unknown,4.0
https://www.pbs.org/newshour/world/chinese-spies-are-trying-to-reach-uk-lawmakers-via-linkedin-mi5-warns,"Chinese spies are trying to reach UK lawmakers via LinkedIn, MI5 warns. Chinese spies are reaching out to U.K. lawmakers them recruitment headhunters or cover companies, Britain’s domestic intelligence agency has warned.",2025-11-18T19:16:50+0000,PBS,0,0,0,0,0,war & foreign policy,pbs,Britain,4.0
https://www.pbs.org/newshour/politics/federal-judges-block-texas-congressional-map-drawn-to-help-gop-in-2026-midterms,Federal judges block Texas congressional map drawn to help GOP in 2026 midterms. A panel of three federal judges has blocked Texas from using a new congressional map that Republicans drew in hopes of picking up five U.S. House seats.,2025-11-18T18:33:04+0000,PBS,0,0,0,0,0,politics,pbs,U.S.,1.0
https://economictimes.indiatimes.com/news/international/world-news/sheikh-hasinas-trial-full-of-flaws-since-beginning/articleshow/125418984.cms,Sheikh Hasina's trial full of flaws since beginning. The 1973 Act and amendments to it in 2008 were specifically intended to address crimes of genocide committed during the Liberation War of 1971.,2025-11-18T18:33:01+0000,The Times of India,0,0,0,0,0,war & foreign policy,the_times_of_india,Unknown,5.0
https://www.memeorandum.com/251117/p171,"Exclusive: Trump DHS Plans Immigration Raids on Churches Over Holidays (John Keough/This Week in Worcester). John Keough / This Week in Worcester:
Exclusive: Trump DHS Plans Immigration Raids on Churches Over Holidays  —  WORCESTER - Agencies within the U.S. Department of Homeland Security (DHS), including Immigration and Customs Enforcement (ICE) Enforcement and Re…",2025-11-18T04:25:01+0000,Memeorandum.com,0,0,0,0,0,technology & ai,memeorandum.com,U.S.,1.0
https://www.talkandroid.com/518311-whatsapp-ai-scam-spreads-fast/,"This WhatsApp AI scam is spreading fast here’s how to stay safe. If you use WhatsApp regularly, you’re far from alone. With nearly two billion users worldwide, it’s one of the most popular messaging apps on the planet — and",2025-11-18T04:30:00+0000,TalkAndroid,0,0,0,0,0,technology & ai,talkandroid,Unknown,1.0
https://nep123.com/ais-power-demand-boom-or-bubble/,AI’s Power Demand: Boom or Bubble?. The AI Boom and the Looming Energy Demand Crisis: Are Utilities Overestimating Needs? The rapid expansion of the AI economy is driving projections of electricity demand that could double or triple in just a few years. Utility companies are citing the needs of…,2025-11-18T04:30:24+0000,Nep123.com,0,0,0,0,0,terrorism & extremism,nep123.com,Unknown,4.0
https://biztoc.com/x/ee464ad9b6681495,"Stock Tumbles 40% In A Month Despite Earnings Beat, CEO Optimism. SoundHound AI Inc (NASDAQ:SOUN) shares are trading lower Tuesday morning, extending a sharp sell-off that has wiped out over 41% of the stock's value in the past month.
Hawkish comments from Federal Reserve officials have slashed hopes for a December rate cut…",2025-11-18T17:13:10+0000,Biztoc.com,0,0,0,0,0,technology & ai,biztoc.com,Unknown,1.0
https://biztoc.com/x/c3f87cebad64ff2c,"These Are the 3 Cheapest Big Tech AI Stocks: Time to Buy?. Quick Read
 
 
 Nvidia (NVDA) trades at a forward P/E of 27x with a PEG ratio of 0.8. 
 
 Oracle’s (ORCL) cloud revenue grew over 20% last quarter driven by AI demand for Gen2 cloud with Nvidia GPU clusters. 
 
 AMD (AMD) guides for $5B in AI chip sales this …",2025-11-18T18:31:55+0000,Biztoc.com,0,0,0,0,0,war & foreign policy,biztoc.com,Unknown,4.0
https://www.techpowerup.com/343028/mitac-computing-unveils-advanced-ai-cluster-and-cooling-solutions-at-sc2025,"(PR) MiTAC Computing Unveils Advanced AI Cluster and Cooling Solutions at SC2025. MiTAC Computing Technology, a global leader in high-performance and energy-efficient server solutions, is proud to announce its participation at the Supercomputing (SC) 2025 (November 18-20, St. Louis, Missouri), booth 3916. Under the theme ""AI Cluster Power …",2025-11-18T17:13:15+0000,Techpowerup.com,0,0,0,0,0,technology & ai,techpowerup.com,Unknown,1.0
https://biztoc.com/x/0001566597a982a9,"Saudi set to announce slew of Al deals with US firms. The Scoop
Saudi Arabia’s sovereign wealth fund-backed artificial intelligence company Humain is set to announce a slew of new deals with US firms tomorrow as the country looks to pour billions of dollars into a plan to become the world’s third largest country…",2025-11-18T17:13:19+0000,Biztoc.com,0,0,0,0,0,technology & ai,biztoc.com,Saudi,1.0
https://biztoc.com/x/206901ff7b93f06c,"AI Impact: What's Your AI Superpower?. Editor's note: This is AI Impact, Newsweek's weekly newsletter where each week, we will explore how business leaders are unlocking real value through artificial intelligence.
Inference Layer
By Gabriel Snyder
I was recently speaking with Mohamad Ali, senior v…",2025-11-18T18:31:36+0000,Biztoc.com,0,0,0,0,0,technology & ai,biztoc.com,Unknown,1.0
https://biztoc.com/x/2218590cdfee8bd7,CEO’s Arrest and a Bank Failure Shake Brazil’s Finance Industry.,2025-11-18T18:31:39+0000,Biztoc.com,0,0,0,0,0,technology & ai,biztoc.com,Brazil,1.0
https://www.forbes.com/sites/kellyphillipserb/2025/11/18/ex-treasury-secretary-will-step-away-from-some-commitments-after-epstein-emails/,"Ex-Treasury Secretary Will Step Away From Some Commitments After Epstein Emails. Summers, who served as the Secretary of the Treasury under Bill Clinton, has come under fire for his relationship with convicted sex offender Jeffrey Epstein.",2025-11-18T18:31:41+0000,Forbes,0,0,0,0,0,technology & ai,forbes,Unknown,1.0
https://biztoc.com/x/50846381c8a7e17f,"Veterans Granted Free Access To AI Tool - How To Find If You're Eligible. The advanced AI resources designed to assist with resume building, job interview practice, benefits navigation, and more.",2025-11-18T18:31:41+0000,Biztoc.com,0,0,0,0,0,technology & ai,biztoc.com,Unknown,1.0
https://www.livemint.com/companies/news/ceos-arrest-and-a-bank-failure-shake-brazil-s-finance-industry-11763490711149.html,"CEO’s Arrest and a Bank Failure Shake Brazil’s Finance Industry. On Monday, Daniel Vorcaro announced a last-ditch rescue deal that appeared to save his floundering Brazilian bank. Hours later, he was arrested at a Sao Paulo airport, where authorities say he was trying to flee the country.",2025-11-18T18:31:50+0000,Livemint,0,0,0,0,0,technology & ai,livemint,Brazil,1.0
https://www.huffpost.com/entry/texas-redistricting-court_n_691cb930e4b0414d84d7b979,Court Blocks Texas’ Trump-Ordered Gerrymander. A federal district court judge ruled that the map Texas adopted in August is an illegal racial gerrymander.,2025-11-18T18:31:28+0000,HuffPost,0,0,0,0,0,economics,huffpost,Unknown,1.0
https://www.news4jax.com/news/politics/2025/11/18/recreational-marijuana-amendment-headed-toward-review-by-florida-supreme-court/,"Recreational marijuana amendment headed toward review by Florida Supreme Court. State elections officials on Monday sent a proposed recreational-marijuana constitutional amendment to Attorney General James Uthmeier’s office, effectively putting an end to a lawsuit that backers of the measure filed to try to trigger a Florida Supreme Cour…",2025-11-18T18:31:22+0000,WJXT News4JAX,0,0,0,0,0,war & foreign policy,wjxt_news4jax,Unknown,4.0
https://biztoc.com/x/e96ff7006ceb9c22,Poe’s AI app now supports group chats across AI models. Quora's AI platform Poe now lets users engage in group chats with up to 200 people across AI models and bots.,2025-11-18T17:13:23+0000,Biztoc.com,0,0,0,0,0,technology & ai,biztoc.com,Unknown,1.0
https://www.usmagazine.com/celebrity-news/news/why-arent-dorothys-slippers-red-in-wicked-for-good-shoe-color-explained/#article,"Why Aren’t Dorothy's Slippers Red in 'Wicked: For Good'? Color Explained. Dorothy’s shimmering red slippers have become synonymous with The Wizard of Oz, but fans shouldn’t expect to see the character sporting the ruby footwear in Wicked: For Good. Viewers were given a glimpse of Dorothy from behind in 2024’s Wicked, directed by Jo…",2025-11-19T19:40:32+0000,Us Weekly,0,0,0,0,0,technology & ai,us_weekly,Unknown,1.0
https://freerepublic.com/focus/f-chat/4353224/posts,"Federal court blocks Texas from using new congressional gerrymander in 2026 midterms. Texas cannot use its new congressional map for the 2026 election and will instead need to stick with the lines passed in 2021, a three-judge panel ruled Tuesday. The decision is a major blow for Republicans, in Texas and nationally, who pushed through this un…",2025-11-18T19:18:15+0000,Freerepublic.com,0,0,0,0,0,politics,freerepublic.com,Unknown,1.0
https://audiophilestyle.com/ca/reviews/apos-x-community-rock-lobster-review-r1394/,"Apos x Community Rock Lobster Review. Audio: Listen to this article.



 



 



 



My first experience with Oakland-based retailer Apos came a few years ago, when I bought my trusty  Matrix X-SABRE Pro DAC. At the time, Apos’s appeal lay in its selection of Chinese hi-fi products paired with …",2025-11-18T18:31:00+0000,Audiophilestyle.com,0,0,0,0,0,technology & ai,audiophilestyle.com,Unknown,1.0
https://www.techradar.com/pro/black-friday-comes-early-grab-a-standout-deal-on-the-best-work-and-play-standing-desks,Black Friday comes early: grab a standout deal on the best work-and-play standing desks. Get ahead of Black Friday and save on the best desks for work and play.,2025-11-18T18:31:00+0000,TechRadar,0,0,0,0,0,race & ethnicity,techradar,Unknown,1.0
https://pypi.org/project/signalpilot-ai-internal/0.9.14/,signalpilot-ai-internal 0.9.14. SignalPilot Agent - Your Jupyter Notebook Assistant,2025-11-18T18:32:41+0000,Pypi.org,0,0,0,0,0,technology & ai,pypi.org,Unknown,1.0
https://www.globenewswire.com/news-release/2025/11/18/3190420/0/en/Ginkgo-Residential-Acquires-310-Unit-Kelston-Apartments-in-the-Charlotte-MSA.html,"Ginkgo Residential Acquires 310-Unit Kelston Apartments in the Charlotte MSA. Ginkgo Residential acquired the Kelston Apartments in East Charlotte, expanding its footprint and advancing its value-add, workforce-housing strategy.......",2025-11-18T18:34:00+0000,GlobeNewswire,0,0,0,0,0,housing,globenewswire,Unknown,1.0
https://wiki.php.net/rfc/stream_errors?rev=1763490838&do=diff,"stream_errors - created. <table><tr><th>2025/11/18 18:35</th><th>current</th></tr><tr><td>Line 1:</td>
<td>Line 1:</td>
</tr>
<tr><td> </td><td>+</td><td>====== PHP RFC: Stream Error Handling Improvements ======</td></tr>
<tr><td> </td><td>+</td><td>  * Version: 1.0</td></tr>
<tr><td…",2025-11-18T18:33:58+0000,Php.net,0,0,0,0,0,housing,php.net,Unknown,1.0
https://post.rlsbb.to/samurai-fury-2025-uhd-bluray-2160p-truehd-atmos-7-1-dv-hevc-remux-framestor/,"Samurai Fury 2025 UHD BluRay 2160p TrueHD Atmos 7 1 DV HEVC REMUX-FraMeSToR. Muromachi Burai (original title) Plot: In 15th century Kyoto before the Onin War, outlaw leader Hyoe uses his deadly swordsmanship to spearhead a rebellion against the corrupt Shogunate and its army, commanded by his former friend and now enemy Doken. Genre: …",2025-11-18T18:33:47+0000,Rlsbb.to,0,0,0,0,0,war & foreign policy,rlsbb.to,Unknown,5.0
https://freerepublic.com/focus/f-news/4353207/posts,"Mearsheimer: Europe’s Bleak Future. This address was delivered to the European Parliament in Brussels on November 11, 2025. Europe is in deep trouble today, mainly because of the Ukraine war, which has played a key role in undermining what had been a largely peaceful region. Unfortunately, the …",2025-11-18T18:39:17+0000,Freerepublic.com,0,0,0,0,0,war & foreign policy,freerepublic.com,Ukraine,4.0
https://www.borderlandbeat.com/2025/11/boxer-goran-gogics-20-ton-cocaine.html,"Boxer Goran Gogić's 20 Ton Cocaine Trafficking Case Adjourned Due to Juror Bribery Attempt. ""Socalj"" for Borderland Beat The Brooklyn federal trial revolving around one of the biggest cocaine busts in US history will reconvene in 30...",2025-11-18T19:18:00+0000,Borderlandbeat.com,0,0,0,0,0,technology & ai,borderlandbeat.com,Unknown,1.0
https://statetimes.in/vande-matram-the-soul-song-of-india/,"VANDE MATRAM, THE SOUL SONG OF INDIA. Puran Chand SharmaBACKGROUND AND ORIGIN:’ Vande Matrammeans ‘I bow to the Mother’. It is not just a song; it is a national Mantra of patriotism that inspired generations during the struggle for freedom, written originally in sanskritized Bengali in the 1870s,…",2025-11-18T18:39:36+0000,Statetimes.in,0,0,0,0,0,social unrest & protests,statetimes.in,India,3.0
https://financialpost.com/pmn/business-pmn/european-stocks-fall-most-since-august-as-global-risk-assets-hit,"European Stocks Fall Most Since August as Global Risk Assets Hit. European stocks fell the most since August, sliding for a fourth day, as investors avoided riskier assets ahead of pivotal earnings from Nvidia Corp. and the resumption of US data releases.",2025-11-18T18:39:55+0000,Financial Post,0,0,0,0,0,economics,financial_post,Unknown,2.0
https://www.ibtimes.com/future-ai-isnt-artificial-its-human-3790621,"The Future Of AI Isn't Artificial — It's Human. Today's AI doesn't understand people. It understands text patterns. It optimizes for ""what usually works"" across scraped internet data. However, for marketers, it can't tell why their audience really cares, or what motivates them to act.",2025-11-18T18:39:59+0000,International Business Times,0,0,0,0,0,technology & ai,international_business_times,Unknown,1.0
https://www.memeorandum.com/251118/p72,"Trump administration moves to deny green cards for those who use safety net programs (Rebecca Beitsch/The Hill). Rebecca Beitsch / The Hill:
Trump administration moves to deny green cards for those who use safety net programs  —  The Department of Homeland Security (DHS) moved late Monday to make it easier for immigration officers to deny green cards to those who use pu…",2025-11-18T18:40:00+0000,Memeorandum.com,0,0,0,0,0,crime & safety,memeorandum.com,Unknown,1.0
https://www.memeorandum.com/251118/p71,"Trump says he would only approve direct health care payment legislation (Ashleigh Fields/The Hill). Ashleigh Fields / The Hill:
Trump says he would only approve direct health care payment legislation  —  “THE ONLY HEALTHCARE I WILL SUPPORT OR APPROVE IS SENDING THE MONEY DIRECTLY BACK TO THE PEOPLE, WITH NOTHING GOING TO THE BIG, FAT, RICH INSURANCE COMPANI…",2025-11-18T18:40:00+0000,Memeorandum.com,0,0,0,0,0,technology & ai,memeorandum.com,Unknown,1.0
https://www.cbsnews.com/news/trump-mbs-jamal-khashoggi-killing/,"Trump says MBS ""knew nothing"" about journalist Jamal Khashoggi's killing. President Trump accused a journalist of trying to ""embarrass"" Saudi Crown Prince Mohammed bin Salman.",2025-11-18T18:40:11+0000,CBS News,0,0,0,0,0,politics,cbs_news,Saudi,1.0
