id,text,created_at,author_id,like_count,reply_count,repost_count,quote_count,engagement,topic,source,country,intensity
https://biztoc.com/x/8f0cd17901a6d707,"The Fed Is Split – And A December Rate Cut Moves Further Away. Federal Reserve officials are sharply divided on the future path of interest rates, casting significant doubt on the likelihood of a December rate cut and prompting a notable shift in market expectations.
The minutes from the Federal Open Market Committee (FO…",2025-11-19T20:20:04+0000,Biztoc.com,0,0,0,0,0,economics,biztoc.com,Unknown,1.0
https://bringatrailer.com/listing/2016-land-rover-range-rover-131/,"2016 Land Rover Range Rover HSE Td6 Diesel at No Reserve. This 2016 Land Rover Range Rover HSE Td6 Diesel is powered by a 3.0-liter turbodiesel V6 linked with an eight-speed automatic transmission and a two-speed electronically controlled transfer case, and it is finished in Corris Gray Metallic over Ebony leather. …",2025-11-19T20:20:07+0000,Bringatrailer.com,0,0,0,0,0,gender & sexuality,bringatrailer.com,Unknown,1.0
https://siliconangle.com/2025/11/19/horizon-delivers-ai-accelerated-supercomputing-sc25/,"Horizon’s 4,000-GPU engine: Science takes a 10x leap with AI supercomputing. As artificial intelligence transforms everything from climate models to drug discovery, AI-accelerated supercomputing is emerging as the new engine of open science — and Horizon is designed to sit at the center of that shift. The rollout of the Horizon system…",2025-11-19T20:20:17+0000,SiliconANGLE News,0,0,0,0,0,climate & environment,siliconangle_news,Unknown,1.0
https://biztoc.com/x/437a0e4af6a36070,Lloyd’s Probing Conduct of Ex-CEO Who Had Been Set to Join AIG.,2025-11-19T20:20:23+0000,Biztoc.com,0,0,0,0,0,technology & ai,biztoc.com,Unknown,1.0
https://siliconangle.com/2025/11/19/breaking-ai-memory-wall-weka-augmented-memory-grid-sc25/,"Weka targets AI memory bottlenecks as inference pushes past DRAM limits. Artificial intelligence is running headfirst into a new performance wall, and the pressure is landing squarely on AI memory. Models are ballooning, multi-turn interactions are piling up and agentic systems are now everyday infrastructure rather than research …",2025-11-19T20:20:23+0000,SiliconANGLE News,0,0,0,0,0,technology & ai,siliconangle_news,Unknown,1.0
https://biztoc.com/x/ef55bf57a222f415,"MBS’ visit heralds in tech deals. The News
A slew of tech deals are flying in this week, largely revolving around new AI facilities in Saudi Arabia. Elon Musk is working with Saudi state-backed AI firm HUMAIN on a new data center for xAI in the kingdom, powered by Nvidia chips, he said Wednes…",2025-11-19T20:18:11+0000,Biztoc.com,0,0,0,0,0,technology & ai,biztoc.com,Saudi,1.0
https://www.foxnews.com/media/marjorie-taylor-greene-learning-loyalty-one-way-street-trump-says-cnn-host-the-view,"Marjorie Taylor Greene learning loyalty is 'one-way street' with Trump, says CNN host on 'The View'. CNN host Abby Phillip discussed Marjorie Taylor Greene's falling out with President Trump on ""The View,"" and said the lawmaker was learning loyalty with the president is a ""one-way street.""",2025-11-19T20:18:01+0000,Fox News,0,0,0,0,0,technology & ai,fox_news,Unknown,1.0
https://biztoc.com/x/afa898282f86727e,"Zelensky: Only Trump has power to stop war. Ukrainian President Volodymyr Zelensky stated on Wednesday that ""only"" United States President Donald Trump and Washington have ""sufficient power"" to end the war in Ukraine.""We discussed in detail the...",2025-11-19T20:18:00+0000,Biztoc.com,0,0,0,0,0,war & foreign policy,biztoc.com,Ukraine,4.0
https://bringatrailer.com/listing/1987-buick-regal-turbo-t-12/,"Modified 1987 Buick Regal Limited Turbo T Package. This 1987 Buick Regal Limited was acquired by the owner in 2024 and is powered by a 274ci V6 that features a Precision Turbo TE-63 turbocharger, a billet crankshaft and connecting rods, JE pistons, a high-flow fuel system, a 70mm Kenne Bell throttle body, and…",2025-11-19T20:15:09+0000,Bringatrailer.com,0,0,0,0,0,energy & resources,bringatrailer.com,Unknown,1.0
https://variety.com/2025/music/news/varietys-chris-willman-cma-media-achievement-award-1236585963/,"Variety’s Chris Willman Honored With Country Music Association Media Achievement Award. Chris Willman, senior music writer and chief music critic for Variety, was honored with the Country Music Association’s Media Achievement Award on Tuesday. Shaboozey and Stephen Wilson Jr., both nominees and performers at this year’s CMA Awards ceremony in Na…",2025-11-19T20:13:54+0000,Variety,0,0,0,0,0,war & foreign policy,variety,Unknown,4.0
https://mypeoplesreview.com/2025/11/20/struggles-to-regain-tribhuvan-universitys-lost-lands/,"Struggles to regain Tribhuvan University’s lost lands. By Our Reporter Tribhuvan University, established in 1959 as Nepal’s first and largest higher education institution, was endowed with thousands […]
The post Struggles to regain Tribhuvan University’s lost lands appeared first on Peoples' Review.",2025-11-19T20:14:00+0000,Mypeoplesreview.com,0,0,0,0,0,technology & ai,mypeoplesreview.com,Nepal,1.0
https://nypost.com/2025/11/19/us-news/5th-person-dead-at-disney-world-resort-in-less-than-a-month-officials/,"5th person confirmed dead at Disney World resort in less than a month: officials. A fifth person has died at a Florida Disney World resort in a chilling string of deaths in less than a month that’s cast a dark shadow over the “Most Magical Place on Earth,” according to reports. The unidentified guest was reportedly pronounced dead at Disne…",2025-11-19T20:14:16+0000,New York Post,0,0,0,0,0,infrastructure & supply chain,new_york_post,Unknown,5.0
https://www.vanityfair.com/news/story/donald-trump-miss-piggy,"Donald Trump Calling Women Pigs and More: A Brief History. The president recently revisited one of his favorite insults for women he doesn’t like, snapping, “Quiet, piggy,” at a female reporter who dared to ask a question about Jeffrey Epstein.",2025-11-19T20:14:28+0000,Vanity Fair,0,0,0,0,0,technology & ai,vanity_fair,Unknown,1.0
https://www.dailysignal.com/2025/11/19/h-1b-visas-are-pushing-americans-out-of-job-market-experts-warn/,"H-1B Visas Are Pushing Americans Out of Job Market, Experts Warn. America’s H-1B visa program has affected few job markets more than the technology industry.   There have been over 500,000 layoffs in the tech industry since 2022 and recent computer science graduates face a... Read More
The post H-1B Visas Are Pushing Americ…",2025-11-19T20:14:54+0000,Daily Signal,0,0,0,0,0,war & foreign policy,daily_signal,America,4.0
https://www.planetary.org/articles/revisiting-nasa-funding-as-the-government-reopens,"Revisiting NASA funding as the government reopens. With the U.S. government reopened and funded through Jan. 30, Congress is back to work on deciding how much to invest in federal agencies for fiscal year (FY) 2026, including NASA. Here's where things stand, and what to expect.",2025-11-19T20:15:00+0000,The Planetary Society,0,0,0,0,0,politics,the_planetary_society,U.S.,1.0
https://biztoc.com/x/9d957dea64b5733a,"OpenAI is beating its own forecasts, adding more fuel to the AI investment supercycle, analysts say. OpenAI's DevDay conference in San Francisco
Alistair Barr/Business Insider
OpenAI revenue growth is surpassing its own forecasts, according to a deep dive by Barclays.
New revenue streams like advertising and AI agents could boost OpenAI's revenue.
These sign…",2025-11-19T20:15:06+0000,Biztoc.com,0,0,0,0,0,technology & ai,biztoc.com,Unknown,1.0
https://reason.com/2025/11/19/a-reporters-unwelcome-questions-provoke-yet-another-trump-threat-to-yank-broadcast-licenses/,A Reporter's Unwelcome Questions Provoke Yet Another Trump Threat To Yank Broadcast Licenses. The president thinks TV networks have a legal obligation to cover him the way he prefers. The FCC's chairman seems to agree.,2025-11-19T20:15:22+0000,Reason,0,0,0,0,0,technology & ai,reason,Unknown,3.0
https://biztoc.com/x/d9b3e55482ace364,Musk says all of Tesla depends on one tiny — but very expensive — proposition. Tesla CEO Elon Musk says the future of the company hinges on its next-generation microchips — but securing enough of them will be costly.,2025-11-19T20:17:58+0000,Biztoc.com,0,0,0,0,0,business & corporate,biztoc.com,Unknown,1.0
https://www.nextbigfuture.com/2025/11/nasa-reveal-highest-resolution-visible-light-and-infrared-3i-atlas-images.html,"NASA Reveal Highest Resolution Visible Light and Infrared 3I/Atlas Images. The 3I/ATLAS comet is only the third object ever identified as entering our solar system from elsewhere in the galaxy. While it poses no threat to Earth and will get no closer than 170 million miles to Earth, the comet flew within 19 million miles of Mars in …",2025-11-19T20:15:35+0000,Next Big Future,0,0,0,0,0,energy & resources,next_big_future,Unknown,3.0
https://www.yankodesign.com/2025/11/19/monocoque-drone-with-hubless-rotors-is-designed-to-withstand-any-extreme-flying-conditions/,"Monocoque Drone with Hubless Rotors is designed to withstand any extreme flying conditions. Monocoque Drone with Hubless Rotors is designed to withstand any extreme flying conditionsAsk any experienced drone pilot about their worst crash, and you’ll likely hear a story that ends with a collection of fragmented parts. The conventional...",2025-11-19T20:15:39+0000,Yanko Design,0,0,0,0,0,politics,yanko_design,Unknown,1.0
https://sports.yahoo.com/article/agreement-bar-conferences-schools-suing-201608170.html,"New agreement to bar conferences, schools from suing College Sports Commission over rules. For months, conferences and schools have been asking how the rules of college sports’ new era will actually be enforced and what the price of breaking them may be. On Wednesday, they finally got a look at some agreed-upon answers. The Power 4 conferences sent…",2025-11-19T20:16:08+0000,Yahoo Entertainment,0,0,0,0,0,infrastructure & supply chain,yahoo_entertainment,Unknown,1.0
https://financialpost.com/pmn/devil-in-the-details-on-alberta-ottawa-energy-accord-former-pipeline-executive,"‘Devil in the details’ on Alberta-Ottawa energy accord: former pipeline executive. CALGARY — A former energy executive says federal climate policy will have to be finessed in just the right way if Alberta’s push for a “grand bargain” on a new West Coast oilsands pipeline is to pan out. Dennis McConaghy, who retired from the company now know…",2025-11-19T20:17:11+0000,Financial Post,0,0,0,0,0,climate & environment,financial_post,Unknown,1.0
https://biztoc.com/x/4e0657a5fc93bb43,"Trust in AI higher for China, Brazil residents than for Americans. It may not matter if the US produces the best AI technology if Americans don’t use it. A new report by PR firm Edelman, which surveyed 5,000 individuals from various countries, found Chinese and Brazilian respondents significantly more open to using AI than p…",2025-11-19T20:17:43+0000,Biztoc.com,0,0,0,0,0,technology & ai,biztoc.com,Brazil,1.0
https://biztoc.com/x/2a484b0f53e88aaa,"Nvidia to report earnings amid market selloff and rising fears of AI crash. Company set to beat Wall Street expectations but analysts await projections for future demand for firm’s AI chips
All eyes are on Nvidia, the bellwether for the AI industry, as analysts and investors hope the chipmaker’s third-quarter earnings assuage concern…",2025-11-19T20:17:51+0000,Biztoc.com,0,0,0,0,0,technology & ai,biztoc.com,Unknown,2.0
https://biztoc.com/x/d3896f99268c580a,Nvidia Q3 updates: AI bubble fears in the spotlight.,2025-11-19T20:17:55+0000,Biztoc.com,0,0,0,0,0,technology & ai,biztoc.com,Unknown,1.0
https://github.com/rakeshmenon/packagelens-mcp,"Show HN: PackageLens MCP – search package registries across multiple ecosystems. Search package registries across multiple ecosystems (npm, PyPI, RubyGems, Crates.io, Packagist, Hex) and fetch package context (README, downloads, GitHub info, usage snippets). It features smart ecosystem auto-detection, so your AI can find packages without …",2025-11-19T20:20:26+0000,Github.com,0,0,0,0,0,technology & ai,github.com,Usa,1.0
https://www.nzherald.co.nz/business/companies/retail/my-food-bag-lifts-revenue-trims-debt-as-profit-dips-slightly/premium/PB7567MRHRDU7NXKB3XHAORYVA/,"My Food Bag lifts revenue, trims debt as profit dips slightly. Active customer numbers lifted to 61,300, up from 60,100 last year.",2025-11-19T20:20:31+0000,New Zealand Herald,0,0,0,0,0,business & corporate,new_zealand_herald,Unknown,1.0
https://biztoc.com/x/e9e7c301451d679c,Surprise Powerbroker Muddies Path of Chile’s Next Government.,2025-11-19T20:20:34+0000,Biztoc.com,0,0,0,0,0,government,biztoc.com,Chile,1.0
https://pypi.org/project/praisonaiwp/1.1.0/,praisonaiwp 1.1.0. AI-powered WordPress content management with PraisonAI integration and production-ready features,2025-11-19T20:27:03+0000,Pypi.org,0,0,0,0,0,technology & ai,pypi.org,Unknown,1.0
https://biztoc.com/x/6bcf7a4416320025,"Labor Department cancels full October jobs report due to the federal shutdown. The Labor Department said Wednesday that it will not be releasing a full jobs report for October because the 43-day federal government shutdown meant it couldn’t calculate the unemployment rate and some other key numbers.
Instead, it will release some of the …",2025-11-19T20:25:35+0000,Biztoc.com,0,0,0,0,0,technology & ai,biztoc.com,Unknown,1.0
https://www.usmagazine.com/celebrity-news/news/ashley-tisdale-french-reveals-new-name-change-after-marrying-her-husband/#article,"Ashley Tisdale French Reveals New Name Change After Marrying Her Husband. Ashley Tisdale French got candid about changing her last name after marrying her husband, Christopher French. “I finally launched By Ashley French,” the High School Musical alum, 40, shared in an Instagram video on Tuesday, November 18, referring to her updat…",2025-11-19T20:25:59+0000,Us Weekly,0,0,0,0,0,education,us_weekly,Unknown,1.0
http://commercialobserver.com/2025/11/capstone-59m-acquisition-loan-205-west-28th-street/,"Capstone Lands $59M Acquisition Loan for 205 West 28th Street. Joshua Zamir’s Capstone Equities has secured $58.5 million in acquisition financing to buy a boutique office building on 28th Street in Chelsea.  Savanna Asset Management and 1823 Partners provided the debt, while Newmark’s Jordan Roeschlaub, Daniel Fromm and…",2025-11-19T20:26:15+0000,Commercial Observer,0,0,0,0,0,business & corporate,commercial_observer,Jordan,1.0
https://www.lawyersgunsmoneyblog.com/2025/11/dont-give-up-the-ship,"Don’t Give Up The Ship. Six members of Congress: We have your backs.
The post Don’t Give Up The Ship appeared first on Lawyers, Guns & Money.",2025-11-19T20:26:38+0000,Lawyersgunsmoneyblog.com,0,0,0,0,0,technology & ai,lawyersgunsmoneyblog.com,Unknown,1.0
https://financialpost.com/globe-newswire/students-betrayed-bill-33-passes-with-majority-vote,"Students betrayed: Bill 33 passes with majority vote. TORONTO, ON, Nov. 19, 2025 (GLOBE NEWSWIRE) — The Canadian Federation of Students-Ontario condemns the passing of Bill 33 today at Queen’s Park; students will experience the continued impacts of a privatized and corporatized post-secondary education system at…",2025-11-19T20:26:43+0000,Financial Post,0,0,0,0,0,politics,financial_post,Unknown,1.0
https://www.androidheadlines.com/2025/11/google-tv-indoor-solar-powered-controller-reference-g32-epishine.html,Your Next Google TV Device Could Bring a Solar Power Controller. Google TV's new G32 solar remote reference aims to eliminates disposable batteries by using ambient indoor light to charge.,2025-11-19T20:26:54+0000,Android Headlines,0,0,0,0,0,technology & ai,android_headlines,Unknown,1.0
https://www.notebookcheck.net/Anker-s-4-port-140W-charger-with-digital-display-is-almost-half-price.1166521.0.html,Anker's 4-port 140W charger with digital display is almost half price. Deal | Newegg is now offering the Anker 140W 4-Port PD 3.1 Charger with USB-C cable at its lowest price to date. The compact adapter can power up to four devices simultaneously with a maximum 140W output. It also includes a built-in display for temps and powe…,2025-11-19T20:27:00+0000,Notebookcheck.net,0,0,0,0,0,infrastructure & supply chain,notebookcheck.net,Unknown,1.0
https://dailycaller.com/2025/11/19/cory-mills-stacey-plaskett-deal-nancy-mace-censure-vote-jeffrey-epstein-ralph-norman/,Republicans Keep Democrat Crazies Off The Hook — To Protect Their Own Swamp Creature. House Republicans are letting Democrat Delegate from the United States Virgin Islands' Stacey Plaskett off the hook to save Republican Florida Rep. Cory Mills.,2025-11-19T20:27:05+0000,The Daily Caller,0,0,0,0,0,politics,the_daily_caller,Unknown,1.0
https://www.memeorandum.com/251119/p112,"Trump on Fed Chair Powell: ""I'd love to fire his ass"" (Axios). Axios:
Trump on Fed Chair Powell: “I'd love to fire his ass”  —  President Trump repeated his desire to force Federal Reserve chair Jerome Powell out, telling the U.S.-Saudi Investment Forum on Wednesday that “I'd love to fire his ass ... grossly incompetent.”",2025-11-19T20:25:00+0000,Memeorandum.com,0,0,0,0,0,technology & ai,memeorandum.com,Saudi,1.0
https://www.tomshardware.com/tech-industry/artificial-intelligence/anthropic-signs-usd30-billion-deal-with-amazon-to-deploy-claude-on-aws-nvidia-and-microsoft-jointly-invest-usd15-billion-into-ai-firm-as-it-becomes-first-provider-across-azure-aws-and-google,"Anthropic signs $30 billion deal with Amazon to deploy Claude on AWS — Nvidia and Microsoft jointly invest $15 billion into AI firm as it becomes first provider across Azure, AWS and Google. Anthropic, Microsoft, and Nvidia have struck a joint partnership to run the Claude AI on Microsoft's Azure servers using Nvidia hardware. Anthropic will invest $30 billion in the move, as well as a guarantee to provide an additional gigawatt of compute perfor…",2025-11-19T20:28:19+0000,Tom's Hardware UK,0,0,0,0,0,war & foreign policy,tom's_hardware_uk,Unknown,4.0
https://thefly.com/permalinks/entry.php/id4243048/UBSFY-Ubisoft-to-report-earnings-before-opening-of-trading-on-November-,"Ubisoft to report earnings before opening of trading on November 21. See the rest of the story here.

thefly.com provides the latest financial news as it breaks. Known as a leader in market intelligence, The Fly's real-time, streaming news feed keeps individual investors, professional money managers, active traders, and corpor…",2025-11-19T20:28:33+0000,Thefly.com,0,0,0,0,0,infrastructure & supply chain,thefly.com,Unknown,1.0
https://biztoc.com/x/b51ef88c74ac76ef,"Crude Prices Tumble on Dollar Strength and Easing Geopolitical Risks. December WTI crude oil (CLZ25) on Wednesday closed down -1.30 (-2.14%), and December RBOB gasoline (RBZ25) closed down -0.0672 (-3.36%).
Crude oil and gasoline prices settled sharply lower on Wednesday, with gasoline falling to a 1.5-week low. Wednesday's ral…",2025-11-19T20:28:50+0000,Biztoc.com,0,0,0,0,0,energy & resources,biztoc.com,Unknown,2.0
https://biztoc.com/x/343c9cebf9ccf85b,"The AI traffic cliff is proving why revenue resilience matters. Tom Pachys, co-founder and CEO, EX.CO
Publishers don’t face small shifts in trends like other industries do. Instead, they’re weathering a relentless wave of changes: algorithm shifts, SEO overhauls, Google cookie deprecation, made-for-advertising sites, ad t…",2025-11-19T20:28:56+0000,Biztoc.com,0,0,0,0,0,climate & environment,biztoc.com,Unknown,1.0
https://www.globenewswire.com/news-release/2025/11/19/3191399/32716/en/Inspire-Medical-Systems-Inc-INSP-Faces-Investor-Suit-Over-Disastrous-Inspire-V-Launch-Hagens-Berman.html,"Inspire Medical Systems, Inc. (INSP) Faces Investor Suit Over Disastrous Inspire V Launch-- Hagens Berman. SAN FRANCISCO, Nov. 19, 2025 (GLOBE NEWSWIRE) -- Inspire Medical Systems, Inc. (NYSE: INSP) is now grappling with a proposed class-action lawsuit alleging the company misled investors about the commercial readiness and demand for its critical “next generation…",2025-11-19T20:29:00+0000,GlobeNewswire,0,0,0,0,0,technology & ai,globenewswire,Unknown,3.0
https://biztoc.com/x/15447675a7b0ebb1,"Home Depot, Lowe’s Profits Fall as Housing Market Slows in a Weak Economy. Home Depot and Lowe’s reported quarterly profit declines as customers continue to cut back on home renovation, repairs and DIY projects. The two retail chains have faced mounting financial pressure in recent months, weighed down by a sluggish housing market a…",2025-11-19T20:29:07+0000,Biztoc.com,0,0,0,0,0,technology & ai,biztoc.com,Unknown,1.0
https://football-italia.net/osimhen-intermediary-reveals-napoli-regret/,"Osimhen intermediary reveals Napoli regret at 75m Galatasaray deal. Transfer mediator George Gardi explains how he had to ‘convince’ Victor Osimhen to join Galatasaray, why Napoli got short-changed at €75m and clubs who offered €10-15m more than the release clause.",2025-11-19T20:29:11+0000,Football Italia,0,0,0,0,0,technology & ai,football_italia,Unknown,1.0
https://truthout.org/articles/over-600-were-fired-or-punished-as-white-house-whipped-up-charlie-kirk-crackdown/,"Over 600 Were Fired or Punished as White House Whipped Up Charlie Kirk Crackdown. Education workers were the most frequently punished, a new report finds.",2025-11-19T20:25:30+0000,Truthout,0,0,0,0,0,infrastructure & supply chain,truthout,Unknown,1.0
https://www.globenewswire.com/news-release/2025/11/19/3191398/32716/en/Telix-Pharmaceuticals-Limited-TLX-Faces-Securities-Class-Action-Amid-SEC-Subpoena-Complete-Response-Letter-Hagens-Berman.html,"Telix Pharmaceuticals Limited (TLX) Faces Securities Class Action Amid SEC Subpoena, Complete Response Letter -- Hagens Berman. SAN FRANCISCO, Nov. 19, 2025 (GLOBE NEWSWIRE) -- Telix Pharmaceuticals Limited (NASDAQ: TLX), a commercial-stage biopharmaceutical company focused on medical imaging and therapeutic radiopharmaceuticals, is now the target of a securities class action lawsuit,…",2025-11-19T20:25:00+0000,GlobeNewswire,0,0,0,0,0,healthcare & wellbeing,globenewswire,Unknown,1.0
https://biztoc.com/x/71572bb1a20ea90a,Block Expects Profit Growth to Accelerate Over Next Three Years.,2025-11-19T20:20:39+0000,Biztoc.com,0,0,0,0,0,business & corporate,biztoc.com,Unknown,1.0
https://www.globenewswire.com/news-release/2025/11/19/3191397/0/en/Students-betrayed-Bill-33-passes-with-majority-vote.html,"Students betrayed: Bill 33 passes with majority vote. TORONTO, ON, Nov. 19, 2025 (GLOBE NEWSWIRE) -- The Canadian Federation of Students-Ontario condemns the passing of Bill 33 today at Queen’s Park; students will experience the continued impacts of a privatized and corporatized post-secondary education system a…",2025-11-19T20:23:00+0000,GlobeNewswire,0,0,0,0,0,politics,globenewswire,Unknown,1.0
https://www.mediaite.com/media/tv/disgusting-display-son-of-9-11-victim-goes-off-on-trumps-cozy-meeting-with-saudi-arabia/,"‘Disgusting Display!’ Son of 9/11 Victim Goes OFF on Trump’s Cozy Meeting With Saudi Arabia. The son of a 9/11 victim sounded off about President Donald Trump's friendly relationship with the Saudi government on CNN Wednesday.
The post ‘Disgusting Display!’ Son of 9/11 Victim Goes OFF on Trump’s Cozy Meeting With Saudi Arabia first appeared on Mediai…",2025-11-19T20:21:21+0000,Mediaite,0,0,0,0,0,technology & ai,mediaite,Saudi,1.0
https://www.attackmagazine.com/news/polyverse-music-announces-black-friday-sale-on-key-plugins/,"Polyverse Music Announces Black Friday Sale on Key Plugins. <!-- wp:paragraph -->
Save across flagship plug‑ins, including Comet, Filterverse, Manipulator, and a bundle - limited time only
<!-- /wp:paragraph -->

<!-- wp:paragraph -->
Polyverse Music has announced that their Black Friday is now live! Up to 4 December …",2025-11-19T20:21:21+0000,Attackmagazine.com,0,0,0,0,0,race & ethnicity,attackmagazine.com,Unknown,1.0
https://freerepublic.com/focus/f-bloggers/4353430/posts,"What Is Wrong with Economics Education?. How many times does an undergraduate economics student hear the name “Hayek” in his or her courses? The answer, in most programs, is close to zero. This is surprising. Friedrich Hayek remains one of the most cited Nobel laureates in economics—second only to K…",2025-11-19T20:21:48+0000,Freerepublic.com,0,0,0,0,0,technology & ai,freerepublic.com,Unknown,1.0
https://www.artnews.com/art-news/news/padimai-art-tech-studio-singapore-olafur-eliasson-1234762360/,"Beeple Superfan ‘Metakovan’ to Launch Art & Tech Studio in Singapore. Singapore’s new Padimai Art & Tech Studio opens in November an Olafur Eliasson’s VR artwork exploring art, technology, and digital memory.",2025-11-19T20:22:07+0000,ARTnews,0,0,0,0,0,technology & ai,artnews,Singapore,1.0
https://punchng.com/kebbi-abduction-wont-become-another-chibok-says-senator/,"Kebbi abduction won’t become another Chibok, says Senator. Senator Garba Maidoki vows the recent Kebbi abduction of 25 schoolgirls will not become a repeat of Chibok, assuring a swift and safe return for the studen

Read More: https://punchng.com/kebbi-abduction-wont-become-another-chibok-says-senator/",2025-11-19T20:22:39+0000,The Punch,0,0,0,0,0,war & foreign policy,the_punch,Unknown,1.0
https://www.ai-cio.com/news/steyer-takes-leave-from-climate-fund-to-run-for-california-governor/,Steyer Takes Leave From Climate Fund to Run for California Governor. The billionaire co-chair of Galvanize Climate Solutions and founder of Farallon Capital will make a bid to succeed term-limited incumbent Gavin Newsom.,2025-11-19T20:22:41+0000,Ai-cio.com,0,0,0,0,0,climate & environment,ai-cio.com,Unknown,1.0
