id,text,created_at,author_id,like_count,reply_count,repost_count,quote_count,engagement,topic,source,country,intensity
https://www.globenewswire.com/news-release/2025/11/19/3191386/32716/en/F5-Inc-FFIV-Faces-Investor-Scrutiny-Amid-Cybersecurity-Incident-Impact-on-Company-s-Business-Shares-Slide-Again-Hagens-Berman.html,"F5, Inc. (FFIV) Faces Investor Scrutiny Amid Cybersecurity Incident Impact on Company’s Business, Shares Slide Again – Hagens Berman. SAN FRANCISCO, Nov. 19, 2025 (GLOBE NEWSWIRE) -- Investors in multi-cloud application services provider F5, Inc. (NASDAQ: FFIV) saw the price of their shares slide $22.83 (-7.8%) on October 28, 2025 after the company reported its Q4 2025 results but provided …",2025-11-19T19:59:00+0000,GlobeNewswire,0,0,0,0,0,technology & ai,globenewswire,Unknown,1.0
https://mjtsai.com/blog/2025/11/19/cloudflare-outage-cause-by-database-permissions/,"Cloudflare Outage Cause by Database Permissions. Matthew Prince (Hacker News): The issue was not caused, directly or indirectly, by a cyber attack or malicious activity of any kind. Instead, it was triggered by a change to one of our database systems' permissions which caused the database to output multiple…",2025-11-19T19:58:23+0000,Mjtsai.com,0,0,0,0,0,war & foreign policy,mjtsai.com,Unknown,4.0
https://www.coindesk.com/business/2025/11/18/societe-generale-s-sg-forge-issues-first-tokenized-bond-in-u-s,"Société Générale’s SG-FORGE Issues First Tokenized Bond in U.S.. The bond uses Broadridge Financial Solutions' tokenization technology and runs on the Canton Network, a privacy-enabled blockchain infrastructure.",2025-11-18T16:25:56+0000,CoinDesk,0,0,0,0,0,technology & ai,coindesk,U.S.,2.0
https://timesofindia.indiatimes.com/world/europe/german-chancellor-urges-ukraine-to-curb-male-refugee-numbers/articleshow/125415498.cms,German chancellor urges Ukraine to curb male refugee numbers. Europe News: German Chancellor Friedrich Merz has joined calls from the Christian Democratic Union (CDU) and its Bavarian sister party Christian Social Union (CSU).,2025-11-18T16:26:00+0000,The Times of India,0,0,0,0,0,war & foreign policy,the_times_of_india,Ukraine,1.0
https://www.globenewswire.com/news-release/2025/11/18/3190325/28124/en/1-92-BN-Phytosterols-Market-Share-Trends-Opportunities-and-Forecasts-2020-2024-2025-2030.html,"$1.92 BN Phytosterols Market Share, Trends, Opportunities, and Forecasts, 2020-2024 & 2025-2030. The Phytosterols Market presents opportunities in cosmetics, pharmaceuticals, and functional foods. Driven by the demand for plant-based, sustainable ingredients in personal care products and health-focused food options, phytosterols are leveraged for their s…",2025-11-18T16:26:00+0000,GlobeNewswire,0,0,0,0,0,technology & ai,globenewswire,Unknown,1.0
http://www.brownstoner.com/real-estate-market/condo-co-op-of-the-day/prospect-park-south-apartment-for-sale-1701-albemarle-top-floor/,"Prospect Park South One-Bedroom With Arches, Breakfast Nook Asks $575K. This top-floor Prospect Park South apartment offers some treetop views, a practical layout, and room for a new owner to make a few upgrades. Original 1930s details bring charm, including arched doorways, wood floors, a large foyer with a niche, and a kitchen …",2025-11-19T20:00:11+0000,Brownstoner.com,0,0,0,0,0,technology & ai,brownstoner.com,Unknown,1.0
https://punchng.com/nysc-disowns-safety-pamphlet-advising-corps-members-to-pay-ransom/,"NYSC disowns safety pamphlet advising corps members to pay ransom. The National Youth Service Corps (NYSC) has disowned a viral pamphlet advising corps members to pay ransom if kidnapped, calling it a fake document.

Read More: https://punchng.com/nysc-disowns-safety-pamphlet-advising-corps-members-to-pay-ransom/",2025-11-20T14:07:31+0000,The Punch,0,0,0,0,0,technology & ai,the_punch,Unknown,1.0
https://www.macrumors.com/2025/11/20/apple-canceled-chinese-iphone-17-pro-displays/,"Apple Reportedly Canceled Orders of Chinese iPhone 17 Pro Displays. Apple has reportedly reassigned BOE's planned OLED panel allocation for the iPhone 17 Pro to Samsung after the Chinese supplier failed to resolve reliability issues ahead of mass production, according to a new report from ZDNet Korea.





BOE was preparing t…",2025-11-20T14:06:58+0000,MacRumors,0,0,0,0,0,technology & ai,macrumors,Korea,2.0
https://www.whats-on-netflix.com/news/inside-left-handed-girl-shih-ching-tsou-on-tradition-taipei-and-her-solo-directing-breakthrough/,"Inside ‘Left-Handed Girl’: Shih-Ching Tsou On Tradition, Taipei And Her Solo Directing Breakthrough. Shih-Ching Tsou discusses the personal roots of Left-Handed Girl, exploring tradition, family secrets and the vibrant complexities of modern Taiwan.",2025-11-20T14:05:26+0000,What's on Netflix,0,0,0,0,0,technology & ai,what's_on_netflix,Taiwan,1.0
https://leicarumors.com/2025/11/20/leica-q3-monochrom-camera-officially-announced.aspx/,Leica Q3 Monochrom camera officially announced. The previously rumored Leica Q3 Monochrom camera is now officially announced and available for pre-order: Americas Europe Asia B&H Photo Leica Miami Tamarkin Camera Classic Connection Leica Lisse WEX Photo | RedDotCameras Calumet | Koch | Koster Rangefinder M…,2025-11-20T14:03:28+0000,Leicarumors.com,0,0,0,0,0,technology & ai,leicarumors.com,America,1.0
https://www.globenewswire.com/news-release/2025/11/20/3192008/0/en/Picus-Security-Recognized-as-Customers-Choice-in-Gartner-VOC-Report-on-Adversarial-Exposure-Validation.html,Picus Security Recognized as “Customers’ Choice” in Gartner VOC Report on Adversarial Exposure Validation. Picus Security was recognized as a Customers’ Choice vendor in the 2025 Gartner® Voice of the Customer for Adversarial Exposure Validation report.......,2025-11-20T14:03:00+0000,GlobeNewswire,0,0,0,0,0,infrastructure & supply chain,globenewswire,Unknown,1.0
https://www.globenewswire.com/news-release/2025/11/20/3192009/0/en/Keycard-Acquires-Runebook-to-Make-It-Easy-for-Enterprises-to-Build-and-Adopt-Trusted-MCP-Powered-AI-Agents.html,"Keycard Acquires Runebook to Make It Easy for Enterprises to Build and Adopt Trusted, MCP-Powered AI Agents. SAN FRANCISCO, Nov. 20, 2025 (GLOBE NEWSWIRE) -- Today at the AI Engineer Code Summit
, Keycard, the provider of the identity and access platform for AI agents, announced that it has acquired Runebook to expand its ecosystem of SDKs that let companies build …",2025-11-20T14:03:00+0000,GlobeNewswire,0,0,0,0,0,technology & ai,globenewswire,Unknown,1.0
https://www.globenewswire.com/news-release/2025/11/20/3192007/0/en/Anal-Cancer-Market-Dominated-by-Squamous-Cell-Carcinoma-at-80-23-Expected-6-68-CAGR-Growth-during-2025-2030-Reports-Mordor-Intelligence.html,"Anal Cancer Market: Dominated by Squamous Cell Carcinoma at 80.23%; Expected 6.68% CAGR Growth during 2025 - 2030, Reports Mordor Intelligence. The Anal Cancer Market is led by North America; the market is shaped by increasing R&D funding for HPV-Positive tumor immunotherapy and growing acceptance of chemoradiation organ-preservation protocols. The Anal Cancer Market is led by North America; the mark…",2025-11-20T14:03:00+0000,GlobeNewswire,0,0,0,0,0,healthcare & wellbeing,globenewswire,America,1.0
https://assetstore.unity.com/packages/3d/environments/urban/slum-house-variant-20-345872,"Slum House – Variant 20 by AAK Studios. ""Bring a gritty, urban edge to your project with Slum — a high-quality, stylized slum asset designed for real-time rendering. Fully compatible with Unity Built-in, URP, and HDRP.""SRP Compatibility: Works with Built-in, URP, and HDRP render pipelines.Ready-to-…",2025-11-20T14:02:17+0000,Unity.com,0,0,0,0,0,creative & design,unity.com,Unknown,1.0
https://www.rte.ie/news/courts/2025/1120/1544984-harassment-funico/,Woman jailed for 'campaign of terror' against ex-partner. A woman who carried out what was described as a narcissistic smear campaign of terror against her ex-girlfriend has been jailed for two years and three months at the Circuit Criminal Court.,2025-11-20T14:02:15+0000,RTE,0,0,0,0,0,technology & ai,rte,Oman,4.0
https://assetstore.unity.com/packages/3d/environments/urban/slum-house-variant-18-345866,"Slum House – Variant 18 by AAK Studios. ""Bring a gritty, urban edge to your project with Slum — a high-quality, stylized slum asset designed for real-time rendering. Fully compatible with Unity Built-in, URP, and HDRP.""SRP Compatibility: Works with Built-in, URP, and HDRP render pipelines.Ready-to-…",2025-11-20T14:02:13+0000,Unity.com,0,0,0,0,0,creative & design,unity.com,Unknown,1.0
https://assetstore.unity.com/packages/3d/environments/urban/slum-house-variant-17-345854,"Slum House – Variant 17 by AAK Studios. ""Bring a gritty, urban edge to your project with Slum — a high-quality, stylized slum asset designed for real-time rendering. Fully compatible with Unity Built-in, URP, and HDRP.""SRP Compatibility: Works with Built-in, URP, and HDRP render pipelines.Ready-to-…",2025-11-20T14:02:08+0000,Unity.com,0,0,0,0,0,creative & design,unity.com,Unknown,1.0
https://www.businessinsider.com/first-nyc-fall-things-that-surprised-me,"I had never experienced fall until I moved from Florida to New York City. These 8 things surprised me the most.. After moving from Florida, fall in New York City came with many surprises, from breathtaking foliage views to unfamiliar weather patterns.",2025-11-20T14:02:01+0000,Business Insider,0,0,0,0,0,climate & environment,business_insider,Unknown,1.0
https://comicbookmovie.com/fantasy/does-wicked-for-good-have-a-post-credits-scene-heres-your-spoiler-free-answer-a224997,"Does WICKED: FOR GOOD Have A Post-Credits Scene? Here's Your Spoiler-Free Answer!. There's a lot of excitement surrounding Wicked: For Good, and with so much chatter about possible spin-offs, should you be on the lookout for any surprises when the credits roll? Here's your answer...",2025-11-20T14:02:00+0000,CBM (Comic Book Movie),0,0,0,0,0,energy & resources,cbm_(comic_book_movie),Unknown,1.0
https://www.globenewswire.com/news-release/2025/11/20/3192006/28124/en/United-Kingdom-Embedded-Finance-Business-Report-2025-2030-Competitive-Intensity-Is-Rising-as-Incumbents-Fintechs-and-Platforms-Expand-Embedded-Offerings.html,"United Kingdom Embedded Finance Business Report 2025-2030: Competitive Intensity Is Rising as Incumbents, Fintechs, and Platforms Expand Embedded Offerings. The UK embedded finance market is set to grow significantly, driven by open banking, platform integration, and focus on ESG and financial inclusion. Opportunities lie in SME lending, embedded insurance, and Big Tech’s deepening financial integration. Regulato…",2025-11-20T14:02:00+0000,GlobeNewswire,0,0,0,0,0,technology & ai,globenewswire,United Kingdom,1.0
https://assetstore.unity.com/packages/3d/environments/urban/slum-house-variant-14-345838,"Slum House – Variant 14 by AAK Studios. ""Bring a gritty, urban edge to your project with Slum — a high-quality, stylized slum asset designed for real-time rendering. Fully compatible with Unity Built-in, URP, and HDRP.""SRP Compatibility: Works with Built-in, URP, and HDRP render pipelines.Ready-to-…",2025-11-20T14:01:59+0000,Unity.com,0,0,0,0,0,creative & design,unity.com,Unknown,1.0
https://assetstore.unity.com/packages/3d/environments/urban/slum-house-variant-10-345824,"Slum House – Variant 10 by AAK Studios. ""Bring a gritty, urban edge to your project with Slum — a high-quality, stylized slum asset designed for real-time rendering. Fully compatible with Unity Built-in, URP, and HDRP.""SRP Compatibility: Works with Built-in, URP, and HDRP render pipelines.Ready-to-…",2025-11-20T14:01:52+0000,Unity.com,0,0,0,0,0,creative & design,unity.com,Unknown,1.0
https://freerepublic.com/focus/f-news/4353571/posts,"U.S. Rep. Cherfilus-McCormick indicted on charges of stealing $5M in disaster funds. MIAMI — U.S. Rep. Sheila Cherfilus-McCormick of Florida has been indicted on charges accusing her of stealing $5 million in federal disaster funds and using some of the money to aid her 2021 campaign, the Justice Department said Wednesday. The Democrat is acc…",2025-11-20T14:01:10+0000,Freerepublic.com,0,0,0,0,0,technology & ai,freerepublic.com,U.S.,4.0
https://www.gsmarena.com/apple_iphone_17_pro_vs_iphone_17_pro_max_review_battery_camera_price_compared-news-69875.php,"Apple iPhone 17 Pro vs. iPhone 17 Pro Max. The iPhone 17 Pros bring a relatively significant number of changes to the lineup compared to the previous generation, ushering in a new design and build, some camera improvements, and the usual chipset upgrade. Between the two sizes, the differences aren't a…",2025-11-20T14:01:03+0000,GSMArena.com,0,0,0,0,0,technology & ai,gsmarena.com,Unknown,1.0
https://decrypt.co/349321/record-financial-pushes-real-time-royalties-modernize-music-payments,"Record Financial Pushes Real-Time Royalties on Avalanche to Modernize Music Payments. Record Financial’s push for on-chain royalties is gaining traction among labels and artists seeking faster, more transparent payouts.",2025-11-20T14:01:02+0000,Decrypt,0,0,0,0,0,technology & ai,decrypt,Unknown,1.0
https://www.globenewswire.com/news-release/2025/11/20/3192005/0/en/OwlTing-OWLS-Unveils-Invisible-Rails-Strategy-Building-Compliant-Settlement-Layer-for-AI-Economy.html,"OwlTing (OWLS) Unveils “Invisible Rails” Strategy, Building Compliant Settlement Layer for AI Economy. OwlTing (OWLS) unveils its global strategy to position itself as next-generation infrastructure provider for Stablecoin and tokenized-asset settlement.......",2025-11-20T14:01:00+0000,GlobeNewswire,0,0,0,0,0,technology & ai,globenewswire,Unknown,1.0
https://slashdot.org/story/25/11/20/0733244/who-is-openais-auditor,"Who is OpenAI's Auditor?. OpenAI won't say who audits its books. The company, which projects to hit an ARR of $20 billion this year and is valued at $500 billion, has committed to spending about $1.4 trillion on data centers over the next decade. It accounts for roughly two-thirds of …",2025-11-20T14:01:00+0000,Slashdot.org,0,0,0,0,0,technology & ai,slashdot.org,Unknown,1.0
https://www.rt.com/india/628071-air-india-chinese-airspace/,Air India keen to use Chinese restricted airspace – Reuters. Air India reportedly wants to fly over Xinjiang to lessen the financial toll from a ban on flying over Pakistan Read Full Article at RT.com,2025-11-20T14:00:48+0000,RT,0,0,0,0,0,technology & ai,rt,India,1.0
https://gizmodo.com/yet-another-study-shows-that-most-companies-arent-making-any-money-off-ai-2000688655,Yet Another Study Shows That Most Companies Aren’t Making Any Money Off AI. Further proof has arrived that the ROI on AI is essentially non-existent.,2025-11-20T14:00:38+0000,Gizmodo.com,0,0,0,0,0,technology & ai,gizmodo.com,Unknown,1.0
https://siliconangle.com/2025/11/20/ai-agent-identity-startup-keycard-acquires-runebook-empower-mcp-connectivity/,"AI agent identity startup Keycard acquires Runebook to empower MCP connectivity. Keycard Labs Inc., a startup that builds software to manage identity and access security for artificial intelligence agents, today announced it has acquired Runebook to assist companies in safely adopting AI agents and tools. Keycard’s platform offers access …",2025-11-20T14:00:25+0000,SiliconANGLE News,0,0,0,0,0,war & foreign policy,siliconangle_news,Unknown,4.0
https://macdailynews.com/2025/11/20/real-madrid-working-with-apple-to-create-2026-immersive-documentary/,"Real Madrid working with Apple to create 2026 immersive documentary. Real Madrid president Florentino Pérez has confirmed that the club is collaborating with Apple on an immersive documentary set for release…
The post Real Madrid working with Apple to create 2026 immersive documentary appeared first on MacDailyNews.",2025-11-20T14:00:24+0000,Macdailynews.com,0,0,0,0,0,technology & ai,macdailynews.com,Unknown,1.0
https://freerepublic.com/focus/f-chat/4353570/posts,"Climate choices. As climate change threatens our planet, AP climate choices reporter Caleigh Wells is explaining what readers can do. Here’s what she said: Climate change stories can be devastating — frustrating policy fights, environmental destruction, public health disaster…",2025-11-20T14:00:12+0000,Freerepublic.com,0,0,0,0,0,climate & environment,freerepublic.com,Unknown,4.0
https://blog.google/products/google-cloud/westinghouse/,How Westinghouse is reenergizing nuclear power with — and for — AI. Westinghouse has partnered with Google Cloud to develop a custom AI-powered platform.,2025-11-20T14:00:00+0000,Blog.google,0,0,0,0,0,nuclear & wmd threats,blog.google,Unknown,4.0
https://www.kpbs.org/news/public-safety/2025/11/20/san-diego-county-police-agencies-access-many-private-license-plate-readers-with-minimal-oversight,"San Diego County police agencies access many private license plate readers with minimal oversight. Dozens of businesses and homeowners associations around San Diego allow law enforcement to search through data from their license plate reader, including Home Depot, Lowe's, and local malls.",2025-11-20T14:00:00+0000,KPBS,0,0,0,0,0,crime & safety,kpbs,Unknown,1.0
http://www.popsci.com/science/how-induction-stoves-work-better/,"Are induction stoves better? These chefs think so.. They're faster, more efficient, cheaper, and better for you and your family.
The post Are induction stoves better? These chefs think so. appeared first on Popular Science.",2025-11-20T14:00:00+0000,Popular Science,0,0,0,0,0,technology & ai,popular_science,Unknown,1.0
https://www.globenewswire.com/news-release/2025/11/20/3191954/0/en/Portnoy-Law-Firm-Announces-Class-Action-on-Behalf-of-Skye-Bioscience-Inc-Investors.html,"Portnoy Law Firm Announces Class Action on Behalf of Skye Bioscience, Inc. Investors. LOS ANGELES, Nov. 20, 2025 (GLOBE NEWSWIRE) -- The Portnoy Law Firm
 advises Skye Bioscience, Inc., (“Skye” or the ""Company"") (NASDAQ: SKYE) investors off a class action on behalf of investors that bought securities between November 4, 2024 and October 3, 20…",2025-11-20T14:00:00+0000,GlobeNewswire,0,0,0,0,0,infrastructure & supply chain,globenewswire,Unknown,1.0
https://www.cbc.ca/news/canada/edmonton/edmonton-alberta-daycare-sexual-assault-law-regulations-9.6985760,"Parents urge province to tighten rules after alleged sexual assaults at Edmonton daycare. Families say they were left in the dark for months about the serious nature of the complaint at Willowbrae Academy Mill Creek, but according to existing rules, the daycare provider and licensing body did nothing wrong.",2025-11-20T14:00:00+0000,CBC News,0,0,0,0,0,technology & ai,cbc_news,Unknown,1.0
http://robbreport.com/shelter/homes-for-sale/port-antigua-islamorada-beach-house-1237368566/,"An Architectural Oasis in the Florida Keys Just Listed for $14.9 Million. Set on a private stretch of sand in Port Antigua, the turnkey home features sweeping ocean and canal views, a beachfront gym, a private dock, and a pool.",2025-11-20T14:00:00+0000,Robb Report,0,0,0,0,0,infrastructure & supply chain,robb_report,Unknown,1.0
https://www.thephinsider.com/general/111666/five-things-i-think-i-think-about-the-miami-dolphins-week-11,Five Things I Think I Think About the Miami Dolphins – Week 11. fluky (adj) - coming or happening by good luck especially unexpectedly,2025-11-20T14:00:00+0000,The Phinsider,0,0,0,0,0,technology & ai,the_phinsider,Uk,1.0
http://deadline.com/2025/11/whisper-launches-america-hub-sale-brady-and-the-blues-1236624474/,"Whisper Launches U.S. Hub As ‘Brady & The Blues’ Producer Revs Up For A Sale. EXCLUSIVE: Whisper, the Sony-backed UK producer behind Amazon’s Tom Brady documentary, has opened a U.S. hub as it draws close to completing a sale. Executives from the company, which was founded 15 years ago by Sunil Patel, UK broadcaster Jake Humphrey and F…",2025-11-20T14:00:00+0000,Deadline,0,0,0,0,0,infrastructure & supply chain,deadline,U.S.,1.0
https://oilprice.com/Latest-Energy-News/World-News/Controversial-5-Billion-EACOP-Project-Is-Now-Three-Quarters-Complete.html,"Controversial $5 Billion EACOP Project Is Now Three-Quarters Complete. The $5-billion East African Crude Oil Pipeline (EACOP), which is planned to export crude oil from Uganda via a port in Tanzania, is now 75% complete, moving landlocked Uganda a step closer to becoming an oil exporter.  EACOP, a controversial pipeline project …",2025-11-20T14:00:00+0000,OilPrice.com,0,0,0,0,0,energy & resources,oilprice.com,Tanzania,1.0
https://www.globenewswire.com/news-release/2025/11/20/3191959/0/en/Astro-Malaysia-Ensures-99-99-Uptime-for-Critical-SAP-and-Oracle-Operations-with-SIOS-High-Availability-Solution.html,Astro Malaysia Ensures 99.99% Uptime for Critical SAP and Oracle Operations with SIOS High Availability Solution. SIOS LifeKeeper for Linux Delivers Cloud-Based Resilience and Confidence on AWS SIOS LifeKeeper for Linux Delivers Cloud-Based Resilience and Confidence on AWS,2025-11-20T14:00:00+0000,GlobeNewswire,0,0,0,0,0,technology & ai,globenewswire,Malaysia,3.0
https://www.globenewswire.com/news-release/2025/11/20/3191958/0/en/Sealing-and-Strapping-Packaging-Tapes-Market-Size-Trends-and-Regional-Data-2025-2035.html,"Sealing and Strapping Packaging Tapes Market Size, Trends and Regional Data (2025-2035). As reported by Towards Packaging experts, the global sealing and strapping packaging tapes market is anticipated to rise from USD 27.37 billion in 2026 to approximately USD 40.58 billion by 2034, with a CAGR of 4.81% from 2025 to 2034. As reported by Towards …",2025-11-20T14:00:00+0000,GlobeNewswire,0,0,0,0,0,war & foreign policy,globenewswire,Unknown,4.0
https://www.snopes.com//fact-check/trump-spiritual-adviser-arrest/,"Unpacking claim Trump's 'spiritual adviser' was arrested on child molestation charge. Morris once served on Trump's evangelical advisory board, but the White House denied claims that he was the president's current spiritual adviser.",2025-11-20T14:00:00+0000,Snopes.com,0,0,0,0,0,technology & ai,snopes.com,Unknown,1.0
https://newsroom.cisco.com/c/r/newsroom/en/us/a/y2025/m11/cisco-invests-in-spatial-intelligence-pioneer-world-labs.html,"Cisco Invests in Spatial Intelligence Pioneer World Labs. Cisco today announced that Cisco Investments, its venture capital arm, is investing in World Labs Technologies, Inc., a spatial intelligence AI startup. More RSS Feeds: https://newsroom.cisco.com/c/r/newsroom/en/us/rss-feeds.html",2025-11-20T14:00:00+0000,Cisco.com,0,0,0,0,0,technology & ai,cisco.com,Unknown,1.0
https://www.kpbs.org/news/environment/2025/11/20/residents-say-jacumbas-special-charm-threatened-by-solar-project,Residents say Jacumba’s special charm threatened by solar project. The solar energy project planned for Jacumba Hot Springs highlights the tension between the need for renewable energy and preserving a community.,2025-11-20T14:00:00+0000,KPBS,0,0,0,0,0,energy & resources,kpbs,Unknown,3.0
https://www.globenewswire.com/news-release/2025/11/20/3191951/0/en/Portnoy-Law-Firm-Announces-Class-Action-on-Behalf-of-Primo-Brands-Corporation-Investors.html,"Portnoy Law Firm Announces Class Action on Behalf of Primo Brands Corporation Investors. LOS ANGELES, Nov. 20, 2025 (GLOBE NEWSWIRE) -- The Portnoy Law Firm
 advises Primo Brands Corporation, (“Primo” or the ""Company"") (NYSE: PMRB) investors off a class action on behalf of investors that bought securities between June 17, 2024 and November 6, 20…",2025-11-20T14:00:00+0000,GlobeNewswire,0,0,0,0,0,infrastructure & supply chain,globenewswire,Unknown,1.0
https://www.globenewswire.com/news-release/2025/11/20/3191956/0/en/Portnoy-Law-Firm-Announces-Class-Action-on-Behalf-of-Telix-Pharmaceuticals-Limited-Investors.html,"Portnoy Law Firm Announces Class Action on Behalf of Telix Pharmaceuticals Limited Investors. LOS ANGELES, Nov. 20, 2025 (GLOBE NEWSWIRE) -- The Portnoy Law Firm advises Telix Pharmaceuticals Limited, (“Telix” or the ""Company"") (NASDAQ: TLX) investors off a class action on behalf of investors that bought securities between February 21, 2025 and August…",2025-11-20T14:00:00+0000,GlobeNewswire,0,0,0,0,0,infrastructure & supply chain,globenewswire,Unknown,1.0
https://www.globenewswire.com/news-release/2025/11/20/3191957/0/en/FormAssembly-Appoints-Bryan-O-Neill-as-Chief-Technology-Officer.html,FormAssembly Appoints Bryan O’Neill as Chief Technology Officer. Former VP of Engineering steps into new role focused on technical leadership and innovation Former VP of Engineering steps into new role focused on technical leadership and innovation,2025-11-20T14:00:00+0000,GlobeNewswire,0,0,0,0,0,technology & ai,globenewswire,Unknown,1.0
https://www.jalopnik.com/2031551/2026-subaru-outback-redesign-first-drive-review/,"2026 Subaru Outback Refines A Proven Formula. This is a car that fixes some of the issues we've had with Subies of the past, but it's not some giant leap forward - it doesn't need to be.",2025-11-20T14:00:00+0000,Jalopnik,0,0,0,0,0,war & foreign policy,jalopnik,Unknown,4.0
https://www.mentalfloss.com/holidays/thanksgiving/first-character-balloon-macys-thanksgiving-day-parade,The First Character Balloon in the Macy’s Thanksgiving Day Parade—And What Happened to It. Spoiler alert: The balloon was not deflated after the parade.,2025-11-20T14:00:00+0000,Mental Floss,0,0,0,0,0,technology & ai,mental_floss,Unknown,1.0
https://variety.com/2025/shopping/news/disney-tik-tok-shop-f1-collection-shop-online-1236586656/,"Disney Store Launches on TikTok Shop, Debuting With F1 Capsule Collection (EXCLUSIVE). Disney Store will debut its first-ever TikTok Shop on Thursday morning, opening up a new channel for fans to shop the brand’s merchandise directly from their feeds. To mark the debut, TikTok Shop will feature an exclusive Disney Store x F1 capsule that includ…",2025-11-20T14:00:00+0000,Variety,0,0,0,0,0,branding & advertising,variety,Unknown,1.0
