id,text,created_at,author_id,like_count,reply_count,repost_count,quote_count,engagement,topic,source,country,intensity
https://www.rawstory.com/trump-affordability-2674315620/,"'So stunning': Biden economics adviser bewildered by Trump's latest self-destructive reply. Donald Trump's response to the affordability crisis is ""stunning"" for its failure to account for political risks, according to an economics expert.Gene Sperling, a senior Biden adviser who also led the National Economic Council in the Obama and Clinton admini…",2025-11-21T02:16:14+0000,Raw Story,0,0,0,0,0,terrorism & extremism,raw_story,Unknown,4.0
https://english.khabarhub.com/2025/21/506990/,"Economic Digest: Nepal’s Business News in a Snap. KATHMANDU: Economic Digest offers a concise yet comprehensive overview of significant business happenings in Nepal, presented in easily digestible summaries. Nepal’s economic landscape reflects mixed financial momentum, with the NEPSE index posting only a mar…",2025-11-21T02:15:29+0000,Khabarhub.com,0,0,0,0,0,technology & ai,khabarhub.com,Nepal,1.0
https://slashdot.org/firehose.pl?op=view&amp;id=180159017,"Scoop: Mike Johnson wants changes after being outflanked on Epstein files - Axios. Scoop: Mike Johnson wants changes after being outflanked on Epstein filesAxios Live updates: Dick Cheney funeral service, Trump and Epstein latest news | CNN PoliticsCNN Congressman Ro Khanna warns officials not to impede Epstein files release: ‘They will be …",2025-11-21T02:13:24+0000,Slashdot.org,0,0,0,0,0,war & foreign policy,slashdot.org,Unknown,4.0
https://www.nzherald.co.nz/nz/politics/greens-target-pig-mating-regulations-say-minister-is-indulging-pork-industry-in-ignoring-advice/N5II4MKU4VHKNFWZSL7I5CPXSY/,"Greens target pig mating regulations, say minister is indulging pork industry in ignoring advice. The minister says a 10-year span for changing mating practices is realistic for farmers.",2025-11-21T02:13:14+0000,New Zealand Herald,0,0,0,0,0,government,new_zealand_herald,Unknown,1.0
https://sports.yahoo.com/article/former-head-uclas-football-nil-021312282.html,"Former head of UCLA's football NIL collective denies wrongdoing alleged in report. James Washington, who recently was the head of UCLA's NIL collective, denies any impropriety tied to funds being funneled through a non-profit he runs.",2025-11-21T02:13:12+0000,Yahoo Entertainment,0,0,0,0,0,infrastructure & supply chain,yahoo_entertainment,Unknown,1.0
https://mypeoplesreview.com/2025/11/21/real-estate-transactions-decline-revenue-collection-falls/,"Real estate transactions decline, revenue collection falls. Kathmandu. Real estate transactions across the country have continued to drop. As deals shrink, revenue collection has also slipped. Data […]
The post Real estate transactions decline, revenue collection falls appeared first on Peoples' Review.",2025-11-21T02:12:46+0000,Mypeoplesreview.com,0,0,0,0,0,technology & ai,mypeoplesreview.com,Unknown,1.0
https://slashdot.org/firehose.pl?op=view&amp;id=180159009,Breaking News: Newly-Discovered Sideways Lines Might Trace the Release of Smaller Objects by - Avi Loeb – Medium. Breaking News: Newly-Discovered Sideways Lines Might Trace the Release of Smaller Objects byAvi Loeb – Medium NASA Releases Images of Comet 3I/ATLAS: It ‘Doesn’t Look Like a Spacecraft’The New York Times NASA releases close-up images of interstellar comet mak…,2025-11-21T02:12:43+0000,Slashdot.org,0,0,0,0,0,race & ethnicity,slashdot.org,Unknown,1.0
https://dailycaller.com/2025/11/20/house-republicans-strike-back-against-crippling-biden-era-energy-schemes/,House Republicans Strike Back Against Crippling Biden-Era Energy Schemes. The House passed two energy bills Thursday night that would support domestic refineries and protect American liquefied natural gas (LNG) projects.,2025-11-21T02:11:18+0000,The Daily Caller,0,0,0,0,0,technology & ai,the_daily_caller,America,3.0
https://biztoc.com/x/3936a527387ca9e4,$1 million saved for retirement ‘ain’t what it used to be’.,2025-11-21T02:10:49+0000,Biztoc.com,0,0,0,0,0,technology & ai,biztoc.com,Unknown,1.0
https://biztoc.com/x/566ccacabe5c869d,"Safety lapses, weak oversight: How children die from Indian cough syrup.",2025-11-21T02:10:49+0000,Biztoc.com,0,0,0,0,0,crime & safety,biztoc.com,India,1.0
https://www.pymnts.com/artificial-intelligence-2/2025/ai-splits-growth-from-labor-in-global-logistics/,"AI Splits Growth From Labor in Global Logistics. Artificial intelligence (AI) is breaking down the traditional constraint of global logistics: the need for additional labor as business scales. Logistics has always been a business of scale, with the more containers that are moved, the lower per-unit cost. Hi…",2025-11-21T02:10:43+0000,pymnts.com,0,0,0,0,0,technology & ai,pymnts.com,Unknown,1.0
https://biztoc.com/x/ea5e653786423f64,"SoftBank Prices ¥46 Billion in Bonds, Extending Record Issuance.",2025-11-21T02:10:31+0000,Biztoc.com,0,0,0,0,0,economics,biztoc.com,Unknown,1.0
https://mmajunkie.usatoday.com/story/sports/ufc/2025/11/20/kamaru-usman-reacts-dana-white-francis-ngannou-altercation/87383457007/,Kamaru Usman skeptical of Dana White's story about Francis Ngannou. Kamaru Usman isn't buying the story of Francis Ngannou pushing Dana White back into his office.,2025-11-21T02:10:26+0000,USA Today,0,0,0,0,0,politics,usa_today,Unknown,1.0
https://economictimes.indiatimes.com/news/international/us/trump-labels-democrats-message-to-troops-amounts-to-seditious-behavior-punishable-by-death-white-house-spokesperson-karoline-leavitt-slams-democrats-for-inciting-violence/articleshow/125475252.cms,"Trump labels Democrats’ message to troops amounts to 'Seditious Behavior, Punishable by Death'; White House spokesperson Karoline Leavitt slams Democrats for inciting violence. US President Donald Trump accused Democratic lawmakers of seditious behavior, demanding their arrest and trial for urging the military to refuse unlawful orders. He stated their actions were 'punishable by death', sparking swift condemnation from Democrats. T…",2025-11-21T02:10:22+0000,The Times of India,0,0,0,0,0,war & foreign policy,the_times_of_india,Unknown,4.0
https://www.abc.net.au/news/2025-11-21/the-china-japan-diplomatic-row/106031582,"Japan's PM said the quiet part out loud and unleashed Beijing's fury. China was already wary about Japan's new Prime Minister, Sanae Takaichi, a renowned Beijing hawk, before she weighed in on one of its most sensitive issues: Taiwan. Now it's unleashing economic pain.",2025-11-21T02:10:14+0000,ABC News (AU),0,0,0,0,0,war & foreign policy,abc_news_(au),China,4.0
https://financialpost.com/pmn/what-to-know-about-this-weekends-g20-summit-in-south-africa-that-trump-is-boycotting,What to know about this weekend’s G20 summit in South Africa that Trump is boycotting. JOHANNESBURG (AP) — Leaders from the Group of 20 countries will meet for a summit in South Africa this weekend without any U.S. representatives after President Donald Trump announced a boycott over his widely rejected claims that the host country is persecuti…,2025-11-21T02:09:44+0000,Financial Post,0,0,0,0,0,technology & ai,financial_post,South Africa,1.0
https://pypi.org/project/iflow-mcp-mcp-pa-ai-agent/0.1.0/,iflow-mcp_mcp-pa-ai-agent 0.1.0. A personal assistant AI agent built with the Model Context Protocol (MCP),2025-11-21T02:09:28+0000,Pypi.org,0,0,0,0,0,technology & ai,pypi.org,Unknown,1.0
https://pypi.org/project/iflow-mcp-mcp-pa-ai-agent/,iflow-mcp_mcp-pa-ai-agent added to PyPI. A personal assistant AI agent built with the Model Context Protocol (MCP),2025-11-21T02:09:28+0000,Pypi.org,0,0,0,0,0,technology & ai,pypi.org,Unknown,1.0
https://economictimes.indiatimes.com/tech/newsletters/morning-dispatch/jamtaras-everywhere-tcs-tpgs-data-centre-jv/articleshow/125475190.cms,Jamtaras everywhere; TCS-TPG’s data centre JV. Mule account fraud is spreading its tentacles beyond traditional hubs. This and more in today’s ETtech Morning Dispatch.,2025-11-21T02:09:24+0000,The Times of India,0,0,0,0,0,technology & ai,the_times_of_india,Unknown,1.0
https://www.euractiv.com/interview/eu-can-learn-from-greek-road-concession-model-says-motorway-chief/,"EU can learn from Greek road concession model, says motorway chief. The Greek model demonstrates how smart concessions deliver safer roads with impact on public finances",2025-11-21T02:09:00+0000,EURACTIV,0,0,0,0,0,infrastructure & supply chain,euractiv,Unknown,1.0
https://economictimes.indiatimes.com/news/international/global-trends/us-lawmakers-target-chinese-chipmaking-equipment-imports-by-chips-act-grant-recipients/articleshow/125475268.cms,US lawmakers target Chinese chipmaking equipment imports by CHIPS Act grant recipients. American lawmakers are pushing a new bill. It aims to stop companies receiving CHIPS Act funds from buying Chinese chipmaking tools. This ban would last for a decade. The legislation targets equipment from China and other nations of concern. Exceptions exist …,2025-11-21T02:07:04+0000,The Times of India,0,0,0,0,0,technology & ai,the_times_of_india,China,2.0
https://economictimes.indiatimes.com/news/international/global-trends/trump-plans-massive-expansion-of-offshore-oil-drilling/articleshow/125475259.cms,"Trump plans massive expansion of offshore oil drilling. President Donald Trump's administration is planning to open up millions of square miles (kilometers) of US coastal waters to oil and gas drilling, it said Thursday, in a step that could lead to a massive expansion of fossil fuel extraction. But the plans anno…",2025-11-21T02:06:17+0000,The Times of India,0,0,0,0,0,technology & ai,the_times_of_india,Unknown,1.0
https://www.mediaite.com/media/tv/democrat-deemed-treasonous-by-trump-says-capitol-police-told-her-were-gonna-put-you-on-24-7-security/,"Democrat Deemed Treasonous by Trump Says Capitol Police Told Her, ‘We’re Gonna Put You on 24/7 Security’. Sen. Elissa Slotkin (D-MI) said Capitol Police informed her that she would be getting round-the-clock security after President Donald Trump accused her of treason.
The post Democrat Deemed Treasonous by Trump Says Capitol Police Told Her, ‘We’re Gonna Put You…",2025-11-21T02:05:47+0000,Mediaite,0,0,0,0,0,technology & ai,mediaite,Unknown,1.0
https://www.channelnewsasia.com/asia/asia-tech-stocks-tumble-ai-bubble-fears-5481656,Asia tech stocks tumble on AI bubble fears. The downturn comes a day after a region-wide rally fuelled by an earnings report from AI bellwether Nvidia.,2025-11-21T02:05:00+0000,CNA,0,0,0,0,0,technology & ai,cna,Unknown,1.0
https://economictimes.indiatimes.com/industry/services/property-/-cstruction/japans-nishitetsu-runwal-enterprises-partner-for-rs-2000-crore-mumbai-office-development/articleshow/125475235.cms,"Japan’s Nishitetsu, Runwal Enterprises partner for Rs 2,000-crore Mumbai office development. According to industry experts, for Runwal Enterprises, the partnership underscores its intent to attract institutional capital and strengthen its position in Mumbai’s premium commercial real estate segment. The company has expanded from its initial focus on a…",2025-11-21T02:03:30+0000,The Times of India,0,0,0,0,0,technology & ai,the_times_of_india,Japan,1.0
https://financialpost.com/globe-newswire/the-north-west-company-inc-announces-renewal-of-its-normal-course-issuer-bid-4,"The North West Company Inc. Announces Renewal of its Normal Course Issuer Bid. WINNIPEG, Manitoba, Nov. 20, 2025 (GLOBE NEWSWIRE) — (TSX: NWC): The North West Company Inc. (the “Company” or “North West”) announced today that the Toronto Stock Exchange (the “TSX”) has accepted notice of the Company’s intention to make a normal course iss…",2025-11-21T02:03:20+0000,Financial Post,0,0,0,0,0,business & corporate,financial_post,Unknown,2.0
https://financialpost.com/globe-newswire/gac-accelerates-european-ev-strategy-with-magna-vehicle-assembly-program,"GAC Accelerates European EV Strategy with Magna Vehicle Assembly Program. GUANGZHOU, China and AURORA, Ontario, Nov. 20, 2025 (GLOBE NEWSWIRE) — Today, GAC and Magna announced a vehicle assembly program to accelerate electric mobility and expand localized EV production in Europe. The collaboration underscores GAC’s regional commitm…",2025-11-21T02:03:16+0000,Financial Post,0,0,0,0,0,labor & work,financial_post,China,1.0
https://www.ozbargain.com.au/node/935029,"LG 48"" OLED B5 AI UHD 4K Smart TV OLED48B5PSA $999.99 Delivered @ Costco (Membership Required). 120Hz TV Review at https://www.rtings.com/tv/reviews/lg/b5-oled In the US these sometimes have sale prices of $800-900 (AUD) So $999 is still a bit high, but it is the lowest price I have seen in …",2025-11-21T02:02:00+0000,Ozbargain.com.au,0,0,0,0,0,technology & ai,ozbargain.com.au,Unknown,1.0
https://consent.yahoo.com/v2/collectConsent?sessionId=1_cc-session_c0a6e670-bde5-495b-ab68-b08376754825,Louisville and Cincinnati bring old rivalry energy back to center stage. The 101st ever meeting!,2025-11-21T02:01:39+0000,Yahoo Entertainment,0,0,0,0,0,energy & resources,yahoo_entertainment,Unknown,1.0
https://www.sportingnews.com/us/mlb/new-york-yankees/news/brian-cashman-sets-yankees-spring-showdown-two-prospects-fight-one-job/a6a1e7d673cab417cb7741a1,Brian Cashman sets up Yankees spring showdown as two prospects fight for one job. Brian Cashman’s latest comments confirm the Yankees will enter spring training with a rare prospect vs. prospect battle for their lone open outfield spot.,2025-11-21T02:01:21+0000,Sporting News,0,0,0,0,0,technology & ai,sporting_news,Unknown,1.0
https://siliconangle.com/2025/11/20/jeff-bezos-backed-physical-intelligence-raises-600m-improve-ai-robot-brains/,"Jeff Bezos-backed Physical Intelligence raises $600M to improve its AI robot brains. Robotics software startup Physical Intelligence has reportedly closed on a fresh, $600 million round of funding that brings its valuation to a lofty $5.6 billion. The company has not officially disclosed the latest round, but reports by The Information and Bl…",2025-11-21T02:00:56+0000,SiliconANGLE News,0,0,0,0,0,war & foreign policy,siliconangle_news,Unknown,4.0
https://freerepublic.com/focus/f-news/4353748/posts,"Miss Palestine’s connection to convicted terrorist leader revealed ahead of Miss Universe pageant. TEL AVIV — The first-ever Miss Palestine contestant in the Miss Universe pageant married the son of Hamas’ most-wanted prisoner, Marwan Barghouti, and even named a child after him, The Post has learned. Nadeen Ayoub — who claims to be a 27-year-old US and Can…",2025-11-21T02:00:44+0000,Freerepublic.com,0,0,0,0,0,terrorism & extremism,freerepublic.com,Palestine,4.0
https://legalinsurrection.com/2025/11/japan-scrambles-jets-after-china-flies-drone-near-island-close-to-taiwan/,"Japan Scrambles Jets After China Flies Drone Near Island Close to Taiwan. Prime Minister Sanae Takaichi's remarks about a response about defending Taiwan sparks Chinese outrage and seafood boycotts. Meanwhile, Japan seems tired of Chinese antics in Asia.
The post Japan Scrambles Jets After China Flies Drone Near Island Close to Tai…",2025-11-21T02:00:40+0000,Legalinsurrection.com,0,0,0,0,0,technology & ai,legalinsurrection.com,China,1.0
https://www.memeorandum.com/251120/p107,"Interior Launches Expansive 11th National Offshore Leasing Program to Advance U.S. Energy Dominance (U.S. Department of the Interior). U.S. Department of the Interior:
Interior Launches Expansive 11th National Offshore Leasing Program to Advance U.S. Energy Dominance  —  SECRETARY SIGNS ORDER TO UNLEASH AMERICAN OFFSHORE ENERGY  —  WASHINGTON — The Department of the Interior today announced …",2025-11-21T02:00:27+0000,Memeorandum.com,0,0,0,0,0,energy & resources,memeorandum.com,U.S.,1.0
https://www.memeorandum.com/251120/p108,"Nydia Velázquez, a New York Trailblazer in Congress, to Retire Next Year (Maya King/New York Times). Maya King / New York Times:
Nydia Velázquez, a New York Trailblazer in Congress, to Retire Next Year  —  Ms. Velázquez, 72, a 16-term congresswoman, said it was time for a new generation of Democrats to step forward.  —  Representative Nydia M. Velázquez, a D…",2025-11-21T02:00:27+0000,Memeorandum.com,0,0,0,0,0,war & foreign policy,memeorandum.com,Oman,4.0
https://wattsupwiththat.com/2025/11/20/rip-viv-forbes-climate-warrior-engineer-and-thorn-in-the-side-of-the-aussie-green-revolution/,"RIP Viv Forbes: Climate Warrior, Engineer, and Thorn in the Side of the Aussie Green Revolution. Viv Forbes was a tireless campaigner for energy sanity.",2025-11-21T02:00:00+0000,Wattsupwiththat.com,0,0,0,0,0,war & foreign policy,wattsupwiththat.com,Unknown,4.0
https://www.globenewswire.com/news-release/2025/11/21/3192495/0/en/GAC-Accelerates-European-EV-Strategy-with-Magna-Vehicle-Assembly-Program.html,"GAC Accelerates European EV Strategy with Magna Vehicle Assembly Program. GUANGZHOU, China and AURORA, Ontario, Nov. 20, 2025 (GLOBE NEWSWIRE) -- Today, GAC and Magna announced a vehicle assembly program to accelerate electric mobility and expand localized EV production in Europe. The collaboration underscores GAC’s regional commit…",2025-11-21T02:00:00+0000,GlobeNewswire,0,0,0,0,0,labor & work,globenewswire,China,1.0
https://www.globenewswire.com/news-release/2025/11/21/3192493/0/en/The-North-West-Company-Inc-Announces-Renewal-of-its-Normal-Course-Issuer-Bid.html,"The North West Company Inc. Announces Renewal of its Normal Course Issuer Bid. WINNIPEG, Manitoba, Nov. 20, 2025 (GLOBE NEWSWIRE) -- (TSX: NWC): The North West Company Inc. (the “Company” or “North West”) announced today that the Toronto Stock Exchange (the “TSX”) has accepted notice of the Company’s intention to make a normal course is…",2025-11-21T02:00:00+0000,GlobeNewswire,0,0,0,0,0,business & corporate,globenewswire,Unknown,2.0
https://www.nzherald.co.nz/business/companies/tourism/intrepid-nz-outpaces-global-growth-as-travel-firm-eyes-a1b-milestone/premium/H5BOKMQNNJE5JHFHXI53V2BAEQ/,"Intrepid NZ outpaces global growth as travel firm eyes $1.15b milestone. The company plans to carry more than 10,000 Kiwi travellers this year.",2025-11-21T02:00:00+0000,New Zealand Herald,0,0,0,0,0,business & corporate,new_zealand_herald,Unknown,1.0
http://deadline.com/2025/11/paramount-netflix-comcast-submit-wbd-bids-1236625396/,"And So It Begins: Paramount, Netflix And Comcast Formally Submit Bids For Warner Bros. Discovery. Paramount, Comcast and Netflix have submitted bids to acquire all or part of Warner Bros. Discovery, ushering in a dramatic period of evolution for the media business. Multiple sources confirmed the bidding to Deadline, with the word coming as a deadline for …",2025-11-21T01:59:58+0000,Deadline,0,0,0,0,0,war & foreign policy,deadline,Unknown,5.0
https://biztoc.com/x/b87f9577a1949719,"Asia tech stocks tumble on AI bubble fears. Japanese and South Korean tech stocks plummeted on Friday, with tech investor SoftBank plunging more than 10% as fears over an AI bubble weighed on the market.
The selling followed a downbeat session on Wall Street after U.S. jobs data clouded hopes of furthe…",2025-11-21T01:59:43+0000,Biztoc.com,0,0,0,0,0,technology & ai,biztoc.com,Japan,1.0
https://biztoc.com/x/ee88d6ca188518b8,Plunder Charge Sought Against Marcos Cousin in Philippine Corruption Scandal.,2025-11-21T01:59:41+0000,Biztoc.com,0,0,0,0,0,technology & ai,biztoc.com,Unknown,1.0
https://biztoc.com/x/512bd16a4947b880,"Federal Judge Issues Fiery Dissent From Ruling Striking Down Texas Redistricting. Federal Judge Issues Fiery Dissent From Ruling Striking Down Texas Redistricting
 
Authored by Matthew Vadum via The Epoch Times (emphasis ours),
A federal judge who was outvoted in a judicial panel’s decision to strike down a redrawn election map in Texas is…",2025-11-21T01:59:30+0000,Biztoc.com,0,0,0,0,0,social unrest & protests,biztoc.com,Unknown,3.0
https://biztoc.com/x/53614c0b07c3eaaf,"CNBC Daily Open: From AI enthusiasm to bubble worries in one day. Nvidia CEO Jensen Huang's rejection of the AI bubble narrative seemed to reassured investors initially, but their concerns couldn't be repressed for long.",2025-11-21T01:59:16+0000,Biztoc.com,0,0,0,0,0,technology & ai,biztoc.com,Unknown,2.0
https://www.aljazeera.com/news/2025/11/21/lebanon-arrests-alleged-drug-kingpin-sanctioned-by-us-state-department,"Lebanon arrests alleged drug kingpin sanctioned by US State Department. Noah Zaitar allegedly ran a drug empire, producing and exporting narcotics, including the synthetic stimulant captagon.",2025-11-21T01:58:58+0000,Al Jazeera English,0,0,0,0,0,technology & ai,al_jazeera_english,Lebanon,1.0
https://www.foxnews.com/politics/trump-admin-gives-10k-bonuses-air-traffic-controllers-perfect-attendance-government-shutdown,"Trump admin gives $10k bonuses to air traffic controllers with perfect attendance during government shutdown. Trump administration awards $10,000 bonuses to 776 air traffic controllers who worked during the 44-day government shutdown with perfect attendance.",2025-11-21T01:57:46+0000,Fox News,0,0,0,0,0,war & foreign policy,fox_news,Unknown,4.0
https://pypi.org/project/syncline-mcp-server/1.0.32/,syncline-mcp-server 1.0.32. Model Context Protocol server for Syncline - AI-powered meeting scheduling,2025-11-21T01:57:26+0000,Pypi.org,0,0,0,0,0,technology & ai,pypi.org,Unknown,1.0
https://balloon-juice.com/2025/11/20/open-thread-state-of-the-epstein-files/,"Open Thread: State of the Epstein Files. GOP senators warn Bondi not to slow-walk release of Epstein files #TheHill [image or embed] — #TuckFrump (@realtuckfrumper.bsky.social) November 20, 2025 at 6:02 AM Per The Hill, top Republicans are washing their hands of this mess: … The calls come amid spec…",2025-11-21T01:56:53+0000,Balloon-juice.com,0,0,0,0,0,war & foreign policy,balloon-juice.com,Unknown,4.0
https://freerepublic.com/focus/f-religion/4353746/posts,[Catholic Caucus] Bishop Martin dispenses illegal immigrants from Sunday Mass obligation in Charlotte. [Catholic Caucus] Bishop Martin dispenses illegal immigrants from Sunday Mass obligation in CharlotteMartin’s dispensation is especially shocking since it suggests that escaping the consequences of a reasonable law takes precedence over the obligation to wors…,2025-11-21T01:56:34+0000,Freerepublic.com,0,0,0,0,0,immigration,freerepublic.com,Unknown,1.0
https://www.cbsnews.com/colorado/news/tacolorado-bleach-denver-health-inspection-food/,Denver health inspectors sometimes pour bleach on food when a vendor's operation is deemed unsafe. Find out why.. Denver Health inspectors took CBS Colorado through a food truck inspection this week to show how they enforce safety rules after video of bleach being poured on a street vendor's food sparked backlash.,2025-11-21T01:55:33+0000,CBS News,0,0,0,0,0,crime & safety,cbs_news,Unknown,1.0
https://washingtonpost.com/sports/2025/11/19/college-ads-college-football-trump/,"College ads, a staple of sports TV, shift tone in response to Trump. CORRECTION: An earlier version of this article incorrectly said that Research for a Stronger America coordinated the universities’ ads. Originally moved Nov. 19. - - -Subscribe to The Post Most newsletter for the most important and interesting stories from Th…",2025-11-21T01:55:24+0000,The Washington Post,0,0,0,0,0,technology & ai,the_washington_post,America,1.0
https://www.foxnews.com/media/white-house-press-corps-becoming-kremlin-esque-former-press-sec-jen-psaki-claims,"White House press corps becoming 'Kremlin-esque,' former press sec Jen Psaki claims. Former White House press secretary Jen Psaki criticized the Trump administration's press corps as ""Kremlin-esque,"" claiming it's now filled with ""sycophants.""",2025-11-21T01:55:16+0000,Fox News,0,0,0,0,0,technology & ai,fox_news,Unknown,1.0
https://slashdot.org/firehose.pl?op=view&amp;id=180158925,"Trump: Democrats' message to troops seditious behavior, punishable by death - BBC. Trump: Democrats' message to troops seditious behavior, punishable by deathBBC Slotkin gets security detail in wake of Trump death penalty remarks, threatsThe Detroit News Democratic Lawmakers Tell Military to Refuse Illegal OrdersThe New York Times Democrati…",2025-11-21T01:52:58+0000,Slashdot.org,0,0,0,0,0,war & foreign policy,slashdot.org,Unknown,4.0
https://www.cnbc.com/2025/11/21/cnbc-daily-open-from-ai-enthusiasm-to-bubble-worries-in-one-day.html,"CNBC Daily Open: From AI enthusiasm to bubble worries in one day. Nvidia CEO Jensen Huang's rejection of the AI bubble narrative seemed to reassured investors initially, but their concerns couldn't be repressed for long.",2025-11-21T01:52:22+0000,CNBC,0,0,0,0,0,technology & ai,cnbc,Unknown,2.0
https://www.bbc.com/news/articles/ceq0q3e2j17o,"At least 41 dead as relentless rains flood Vietnam. The coastal cities of Hoi An and Nha Trang, and a key coffee-producing belt, are among the worst-hit.",2025-11-21T01:50:48+0000,BBC News,0,0,0,0,0,climate & environment,bbc_news,Vietnam,4.0
https://newsonjapan.com/article/147679.php,"Japan’s Core Consumer Prices Rise 3.0% in October. Japan’s nationwide consumer price index excluding fresh food rose 3.0 percent in October compared with the same month a year earlier, according to data released by the Ministry of Internal Affairs and Communications, extending the streak of price increases to…",2025-11-21T01:50:44+0000,Newsonjapan.com,0,0,0,0,0,technology & ai,newsonjapan.com,Japan,1.0
https://nep123.com/tinauchule-where-nature-and-culture-meet/,"Tinauchule: Where Nature and Culture Meet. Discover the Untouched Beauty of Teenchule: A Himalayan Paradise in Nepal Nestled amidst dense forests, atop a majestic hill, Teenchule offers breathtaking panoramic views of the Himalayas. Located on the border of Mangala Rural Municipality-5 in Myagdi and T…",2025-11-21T01:50:18+0000,Nep123.com,0,0,0,0,0,immigration,nep123.com,Nepal,1.0
